"","site","date","waypoint","plant_field_name","revised_plant_name","height","count_method","total_flowers","flower_unit","flower_count1","flower_count2","flower_count3","flower_count4","flower_count5","hummingbird","activity","comment","picture","X","hummingbird_species","X.1","X.2","X.3","X.4","X__1","taxize_plant_name","Month","Year","final_plant_name","lon","lat","ele","time","timestamp"
"1","Alaspungo_disturbed","43116","1181",NA,NA,NA,NA,NA,NA,NA,NA,NA,NA,NA,"Coeligena lutetiae",NA,NA,NA,NA,NA,NA,NA,NA,NA,NA,NA,NA,NA,NA,NA,NA,NA,NA,NA
"2","Alaspungo_disturbed","43116","1209","Meriania sp.","Blakea sp.","4","DC",24,NA,NA,NA,NA,NA,NA,"Heliangelus strophianus",NA,NA,NA,NA,NA,NA,NA,NA,NA,NA,"Blakea sp",NA,NA,"Blakea sp",NA,NA,NA,NA,NA
"3","Alaspungo_disturbed","43116","1228",NA,NA,NA,NA,NA,NA,NA,NA,NA,NA,NA,"Coeligena lutetiae",NA,NA,NA,NA,NA,NA,NA,NA,NA,NA,NA,NA,NA,NA,NA,NA,NA,NA,NA
"4","Alaspungo_disturbed","43116","1231",NA,NA,NA,NA,NA,NA,NA,NA,NA,NA,NA,"Coeligena lutetiae",NA,NA,NA,NA,NA,NA,NA,NA,NA,NA,NA,NA,NA,NA,NA,NA,NA,NA,NA
"5","Alaspungo_disturbed","43172","378","Disterigma noyesiae","Disterigma noyesiae","3","DC",14,NA,NA,NA,NA,NA,NA,"Metallura tyrianthina",NA,NA,NA,NA,NA,NA,NA,NA,NA,NA,"Disterigma noyesiae",NA,NA,"Disterigma noyesiae",NA,NA,NA,NA,NA
"6","Alaspungo_disturbed","43172","384","Passiflora sp.","Passiflora coactilis","3","DC",2,NA,NA,NA,NA,NA,NA,"Metallura tyrianthina, Conirostrum cinereum",NA,NA,NA,NA,NA,NA,NA,NA,NA,NA,"Passiflora coactilis",NA,NA,"Passiflora coactilis",NA,NA,NA,NA,NA
"7","Alaspungo_disturbed","43172","401",NA,NA,NA,NA,NA,NA,NA,NA,NA,NA,NA,"Coeligena lutetiae",NA,NA,NA,NA,NA,NA,NA,NA,NA,NA,NA,NA,NA,NA,NA,NA,NA,NA,NA
"8","Alaspungo_disturbed","43172","461",NA,NA,NA,NA,NA,NA,NA,NA,NA,NA,NA,"Coeligena torquata",NA,NA,NA,NA,NA,NA,NA,NA,NA,NA,NA,NA,NA,NA,NA,NA,NA,NA,NA
"9","Alaspungo_disturbed","43227","741","Fuchsia silvatica","Fuchsia sylvatica","1","DC",10,NA,NA,NA,NA,NA,NA,"Coeligena lutetiae",NA,NA,NA,NA,NA,NA,NA,NA,NA,NA,"Fuchsia sylvatica",NA,NA,"Fuchsia sylvatica",NA,NA,NA,NA,NA
"10","Alaspungo_disturbed","43290","29","Palicourea amethystina","Palicourea amethystina","3","DC",32,NA,NA,NA,NA,NA,NA,"Eriocnemis luciani",NA,NA,NA,NA,NA,NA,NA,NA,NA,NA,"Palicourea amethystina",NA,NA,"Palicourea amethystina",NA,NA,NA,NA,NA
"11","Alaspungo_disturbed","43290","39","Palicourea amethystina","Palicourea amethystina","3","DC",7,NA,NA,NA,NA,NA,NA,"Coeligena lutetiae",NA,NA,NA,NA,NA,NA,NA,NA,NA,NA,"Palicourea amethystina",NA,NA,"Palicourea amethystina",NA,NA,NA,NA,NA
"12","Alaspungo_disturbed","43290","42","Racinea tetrantha","Racinaea tetrantha","4","DC",12,NA,NA,NA,NA,NA,NA,"Metallura tyrianthina",NA,NA,NA,NA,NA,NA,NA,NA,NA,NA,"Racinaea tetrantha",NA,NA,"Racinaea tetrantha",NA,NA,NA,NA,NA
"13","Alaspungo_disturbed","43290","55","Palicourea amethystina","Palicourea amethystina","2","DC",8,NA,NA,NA,NA,NA,NA,"Metallura tyrianthina",NA,NA,NA,NA,NA,NA,NA,NA,NA,NA,"Palicourea amethystina",NA,NA,"Palicourea amethystina",NA,NA,NA,NA,NA
"14","Alaspungo_disturbed","43290","63",NA,NA,NA,"DC",NA,NA,NA,NA,NA,NA,NA,"Metallura tyrianthina",NA,NA,NA,NA,NA,NA,NA,NA,NA,NA,NA,NA,NA,NA,NA,NA,NA,NA,NA
"15","Alaspungo_disturbed","43290","76",NA,NA,NA,"DC",NA,NA,NA,NA,NA,NA,NA,"Coeligena torquata",NA,NA,NA,NA,NA,NA,NA,NA,NA,NA,NA,NA,NA,NA,NA,NA,NA,NA,NA
"16","Alaspungo_disturbed","43353","186","Burmeistera consultar","Burmeistera resupinata","3","DC",2,NA,NA,NA,NA,NA,NA,"Coeligena lutetiae",NA,"PHOTO",NA,NA,NA,NA,NA,NA,NA,NA,"Burmeistera resupinata",NA,NA,"Burmeistera resupinata",NA,NA,NA,NA,NA
"17","Alaspungo_disturbed","43353","215","Palicourea amethystina","Palicourea amethystina","2","DC",4,NA,NA,NA,NA,NA,NA,"Metallura tyrianthina",NA,"PHOTO",NA,NA,NA,NA,NA,NA,NA,NA,"Palicourea amethystina",NA,NA,"Palicourea amethystina",NA,NA,NA,NA,NA
"18","Alaspungo_disturbed","43353","218",NA,NA,NA,"DC",NA,NA,NA,NA,NA,NA,NA,"Coeligena lutetiae",NA,NA,NA,NA,NA,NA,NA,NA,NA,NA,NA,NA,NA,NA,NA,NA,NA,NA,NA
"19","Alaspungo_disturbed","43353","234","Bomarea patacocensis","Bomarea patacocensis","4","DC",48,NA,NA,NA,NA,NA,NA,"Metallura tyrianthina",NA,NA,NA,NA,NA,NA,NA,NA,NA,NA,"Bomarea patacocensis",NA,NA,"Bomarea patacocensis",NA,NA,NA,NA,NA
"20","Alaspungo_disturbed","43353","237",NA,NA,NA,"DC",NA,NA,NA,NA,NA,NA,NA,"Coeligena lutetiae",NA,NA,NA,NA,NA,NA,NA,NA,NA,NA,NA,NA,NA,NA,NA,NA,NA,NA,NA
"21","Alaspungo_disturbed","43409","592","Cestrum sp.2","Cestrum sp.2","3","DC",65,NA,NA,NA,NA,NA,NA,"Metallura tyrianthina",NA,NA,NA,NA,NA,NA,NA,NA,NA,NA,"Cestrum sp2",NA,NA,"Cestrum sp2",NA,NA,NA,NA,NA
"22","Alaspungo_disturbed","43409","609","Burmeistera consultar","Burmeistera resupinata","4","DC",8,NA,NA,NA,NA,NA,NA,"Coeligena lutetiae",NA,NA,NA,NA,NA,NA,NA,NA,NA,NA,"Burmeistera resupinata",NA,NA,"Burmeistera resupinata",NA,NA,NA,NA,NA
"23","Alaspungo_disturbed","43409","617","Meriania sp.","Blakea sp.","4","DC",6,NA,NA,NA,NA,NA,NA,"Coeligena lutetiae",NA,NA,NA,NA,NA,NA,NA,NA,NA,NA,"Blakea sp",NA,NA,"Blakea sp",NA,NA,NA,NA,NA
"24","Alaspungo_disturbed","43409","617","Cestrum sp.2","Cestrum sp.2","4","DC",644,"94","550",NA,NA,NA,NA,"Coeligena lutetiae",NA,NA,NA,NA,NA,NA,NA,NA,NA,NA,"Cestrum sp2",NA,NA,"Cestrum sp2",NA,NA,NA,NA,NA
"25","Alaspungo_disturbed","43409","637","Bomarea patacocensis","Bomarea patacocensis","4","DC",35,NA,NA,NA,NA,NA,NA,"Coeligena lutetiae",NA,NA,NA,NA,NA,NA,NA,NA,NA,NA,"Bomarea patacocensis",NA,NA,"Bomarea patacocensis",NA,NA,NA,NA,NA
"26","Alaspungo_disturbed","43409","648",NA,NA,NA,"DC",NA,NA,NA,NA,NA,NA,NA,"Coeligena lutetiae",NA,NA,NA,NA,NA,NA,NA,NA,NA,NA,NA,NA,NA,NA,NA,NA,NA,NA,NA
"27","Alaspungo_disturbed","43409","653","Meriania sp.","Blakea sp.","2","DC",3,NA,NA,NA,NA,NA,NA,"Coeligena lutetiae",NA,NA,NA,NA,NA,NA,NA,NA,NA,NA,"Blakea sp",NA,NA,"Blakea sp",NA,NA,NA,NA,NA
"28","Alaspungo_disturbed","43409","654","Meriania sp.","Blakea sp.","2","DC",7,NA,NA,NA,NA,NA,NA,"Coeligena lutetiae",NA,NA,NA,NA,NA,NA,NA,NA,NA,NA,"Blakea sp",NA,NA,"Blakea sp",NA,NA,NA,NA,NA
"29","Alaspungo_disturbed","43409","665","Bomarea patacocensis","Bomarea patacocensis","3","DC",36,NA,NA,NA,NA,NA,NA,"Coeligena torquata",NA,NA,NA,NA,NA,NA,NA,NA,NA,NA,"Bomarea patacocensis",NA,NA,"Bomarea patacocensis",NA,NA,NA,NA,NA
"30","Alaspungo_disturbed","43479","277","Disterigma noyesiae","Disterigma noyesiae","2","DC",24,NA,NA,NA,NA,NA,NA,"Metallura tyrianthina","feeding",NA,NA,NA,NA,NA,NA,NA,NA,NA,"Disterigma noyesiae",NA,NA,"Disterigma noyesiae",NA,NA,NA,NA,NA
"31","Alaspungo_disturbed","43479","288","Blakea sp.","Blakea sp.","3","DC",6,NA,NA,NA,NA,NA,NA,"Coeligena lutetiae","feeding",NA,NA,NA,NA,NA,NA,NA,NA,NA,"Blakea sp",NA,NA,"Blakea sp",NA,NA,NA,NA,NA
"32","Alaspungo_disturbed","43479","316",NA,NA,NA,NA,NA,NA,NA,NA,NA,NA,NA,"Coeligena lutetiae","vocalization",NA,NA,NA,NA,NA,NA,NA,NA,NA,NA,NA,NA,NA,NA,NA,NA,NA,NA
"33","Alaspungo_disturbed","43479","326",NA,NA,NA,NA,NA,NA,NA,NA,NA,NA,NA,"Coeligena lutetiae","Perching",NA,NA,NA,NA,NA,NA,NA,NA,NA,NA,NA,NA,NA,NA,NA,NA,NA,NA
"34","Alaspungo_disturbed","43479","326","Burmeistera sodiroana","Burmeistera sodiroana","1","DC",2,NA,NA,NA,NA,NA,NA,"Coeligena lutetiae","feeding, hovering",NA,NA,NA,NA,NA,NA,NA,NA,NA,"Burmeistera sodiroana",NA,NA,"Burmeistera sodiroana",NA,NA,NA,NA,NA
"35","Alaspungo_disturbed","43479","338","Palicourea amethystina","Palicourea amethystina","3","DC",35,NA,NA,NA,NA,NA,NA,"Metallura tyrianthina","feeding",NA,NA,NA,NA,NA,NA,NA,NA,NA,"Palicourea amethystina",NA,NA,"Palicourea amethystina",NA,NA,NA,NA,NA
"36","Alaspungo_disturbed","11/03/2019","293","Disterigma noyesiae","Disterigma noyesiae","4","DC",25,NA,NA,NA,NA,NA,NA,"Metallura tyrianthina","feeding",NA,NA,NA,NA,NA,NA,NA,NA,NA,"Disterigma noyesiae","March","2019","Disterigma noyesiae",NA,NA,NA,NA,NA
"37","Alaspungo_disturbed","11/03/2019","325","Columnea strigosa","Columnea strigosa","1","DC",3,NA,NA,NA,NA,NA,NA,"Metallura tyrianthina",NA,NA,NA,NA,NA,NA,NA,NA,NA,NA,"Columnea strigosa","March","2019","Columnea strigosa",NA,NA,NA,NA,NA
"38","Alaspungo_disturbed","11/03/2019","336","Blakea sp.","Blakea sp.","3","DC",1,NA,NA,NA,NA,NA,NA,"Metallura tyrianthina",NA,NA,NA,NA,NA,NA,NA,NA,NA,NA,"Blakea sp","March","2019","Blakea sp",NA,NA,NA,NA,NA
"39","Alaspungo","16/01/2018","2152",NA,NA,NA,NA,NA,NA,NA,NA,NA,NA,NA,"Metallura tyrianthina","heard",NA,NA,NA,NA,NA,NA,NA,NA,NA,NA,"January","2018",NA,-78.628215,-0.004472,"2879.433","2018-01-16T13:46:08Z",2018-01-16 13:46:08
"40","Alaspungo","16/01/2018","2152",NA,NA,NA,NA,NA,NA,NA,NA,NA,NA,NA,"Coeligena lutetiae","heard",NA,NA,NA,NA,NA,NA,NA,NA,NA,NA,"January","2018",NA,-78.628215,-0.004472,"2879.433","2018-01-16T13:46:08Z",2018-01-16 13:46:08
"41","Alaspungo","16/01/2018","2170",NA,NA,NA,NA,NA,NA,NA,NA,NA,NA,NA,"Metallura tyrianthina","heard",NA,NA,NA,NA,NA,NA,NA,NA,NA,NA,"January","2018",NA,-78.629052,-0.002762,"2926.758","2018-01-16T14:36:44Z",2018-01-16 14:36:44
"42","Alaspungo","16/01/2018","2179",NA,NA,NA,NA,NA,NA,NA,NA,NA,NA,NA,"Heliangelus strophianus","perching","female",NA,NA,NA,NA,NA,NA,NA,NA,NA,"January","2018",NA,-78.629612,-0.001597,"2915.125","2018-01-16T14:58:19Z",2018-01-16 14:58:19
"43","Alaspungo","16/01/2018","2189","Elleanthus amethystinus","Elleanthus amethystinus","7","DC",30,NA,NA,NA,NA,NA,NA,"Heliangelus strophianus","feeding","male",NA,NA,NA,NA,NA,NA,NA,NA,"Elleanthus amethystinus","January","2018","Elleanthus amethystinus",-78.630086,-0.000501,"2889.441","2018-01-16T15:36:32Z",2018-01-16 15:36:32
"44","Alaspungo","16/01/2018","2191","Elleanthus amethystinus","Elleanthus amethystinus","7","DC",4,NA,NA,NA,NA,NA,NA,"Metallura tyrianthina","feeding","female",NA,NA,NA,NA,NA,NA,NA,NA,"Elleanthus amethystinus","January","2018","Elleanthus amethystinus",-78.630014,-0.00032,"2884.914","2018-01-16T15:45:51Z",2018-01-16 15:45:51
"45","Alaspungo","16/01/2018","2191","Sphyrospermum sp2","Sphyrospermum grandifolium","7","DC",6,NA,NA,NA,NA,NA,NA,"Metallura tyrianthina","feeding",NA,NA,NA,NA,NA,NA,NA,NA,NA,"Sphyrospermum grandifolium","January","2018","Sphyrospermum grandifolium",-78.630014,-0.00032,"2884.914","2018-01-16T15:45:51Z",2018-01-16 15:45:51
"46","Alaspungo","16/01/2018","2223","Meriania sp.","Blakea sp1","3","DC",1,NA,NA,NA,NA,NA,NA,"Heliangelus strophianus","feeding","male",NA,NA,NA,NA,NA,NA,NA,NA,"Blakea sp1","January","2018","Blakea sp1",-78.631884,0.003202,"2838.891","2018-01-16T17:13:43Z",2018-01-16 17:13:43
"47","Alaspungo","16/01/2018","2251",NA,NA,NA,NA,NA,NA,NA,NA,NA,NA,NA,"Heliangelus strophianus","perching","male",NA,NA,NA,NA,NA,NA,NA,NA,NA,"January","2018",NA,-78.634618,0.005604,"2713.636","2018-01-16T18:27:26Z",2018-01-16 18:27:26
"48","Alaspungo","13/02/2018","1658",NA,NA,NA,NA,NA,NA,NA,NA,NA,NA,NA,"Coeligena lutetiae","fly",NA,NA,NA,NA,NA,NA,NA,NA,NA,NA,"February","2018",NA,-78.628637,-0.003952,"2896.785156","2018-02-13T13:50:49Z",2018-02-13 13:50:49
"49","Alaspungo","13/02/2018","1662",NA,NA,NA,NA,NA,NA,NA,NA,NA,NA,NA,"Heliangelus strophianus","fly",NA,NA,NA,NA,NA,NA,NA,NA,NA,NA,"February","2018",NA,-78.628709,-0.003855,"2921.581055","2018-02-13T14:08:56Z",2018-02-13 14:08:56
"50","Alaspungo","13/02/2018","1726",NA,NA,NA,NA,2,NA,NA,NA,NA,NA,NA,"Metallura tyrianthina","fly",NA,NA,NA,NA,NA,NA,NA,NA,NA,NA,"February","2018",NA,-78.630893,0.001123,"2854.332764","2018-02-13T16:51:49Z",2018-02-13 16:51:49
"51","Alaspungo","13/02/2018","1726",NA,NA,NA,NA,2,NA,NA,NA,NA,NA,NA,"Heliangelus strophianus","fly",NA,NA,NA,NA,NA,NA,NA,NA,NA,NA,"February","2018",NA,-78.630893,0.001123,"2854.332764","2018-02-13T16:51:49Z",2018-02-13 16:51:49
"52","Alaspungo","13/03/2018","280",NA,NA,NA,NA,NA,NA,NA,NA,NA,NA,NA,"Coeligena lutetiae","fly",NA,NA,NA,NA,NA,NA,NA,NA,NA,NA,"March","2018",NA,-78.628418,-0.004205,"2853.958984","2018-03-13T14:48:48Z",2018-03-13 14:48:48
"53","Alaspungo","13/03/2018","285",NA,NA,NA,NA,NA,NA,NA,NA,NA,NA,NA,"Coeligena torquata","perch and fly",NA,NA,NA,NA,NA,NA,NA,NA,NA,NA,"March","2018",NA,-78.628835,-0.00349,"2864.315918","2018-03-13T14:57:24Z",2018-03-13 14:57:24
"54","Alaspungo","10/04/2018","431","Centropogon sp3","Centropogon sp3","2","DC",7,NA,NA,NA,NA,NA,NA,"Adelomyia melanogenys","fly",NA,NA,NA,NA,NA,NA,NA,NA,NA,"Centropogon sp3","April","2018","Centropogon sp3",-78.628194,-0.004502,"2850.847168","2018-04-10T13:20:38Z",2018-04-10 13:20:38
"55","Alaspungo","10/04/2018","465",NA,NA,NA,NA,2,NA,NA,NA,NA,NA,NA,"Coeligena torquata","p,v",NA,NA,NA,NA,NA,NA,NA,NA,NA,NA,"April","2018",NA,-78.629574,-0.002022,"2917.015381","2018-04-10T14:45:43Z",2018-04-10 14:45:43
"56","Alaspungo","10/04/2018","479",NA,NA,NA,NA,2,NA,NA,NA,NA,NA,NA,"Heliangelus strophianus","p",NA,NA,NA,NA,NA,NA,NA,NA,NA,NA,"April","2018",NA,-78.630666,0.000359,"2856.966309","2018-04-10T15:17:21Z",2018-04-10 15:17:21
"57","Alaspungo","10/04/2018","494",NA,NA,NA,NA,NA,NA,NA,NA,NA,NA,NA,"Metallura tyrianthina","p",NA,NA,NA,NA,NA,NA,NA,NA,NA,NA,"April","2018",NA,-78.632427,0.003401,"2819.456299","2018-04-10T15:54:55Z",2018-04-10 15:54:55
"58","Alaspungo","07/5/2018","956",NA,NA,NA,NA,NA,NA,NA,NA,NA,NA,NA,"Heliangelus strophianus","p",NA,NA,NA,NA,NA,NA,NA,NA,NA,NA,"May","2018",NA,-78.631816,0.00308,"2842.875488","2018-05-07T16:29:25Z",2018-05-07 16:29:25
"59","Alaspungo","11/06/2018","2045",NA,NA,NA,NA,2,NA,NA,NA,NA,NA,NA,"Coeligena lutetiae","h",NA,NA,NA,NA,NA,NA,NA,NA,NA,NA,"June","2018",NA,-78.628373,-0.00406,"2954.661377","2018-06-11T15:15:26Z",2018-06-11 15:15:26
"60","Alaspungo","10/09/2018","2737",NA,NA,NA,NA,NA,NA,NA,NA,NA,NA,NA,"Coeligena lutetiae","hovering",NA,NA,NA,NA,NA,NA,NA,NA,NA,NA,"September","2018",NA,-78.628376,-0.004317,"2957.011719","2018-09-10T14:16:04Z",2018-09-10 14:16:04
"61","Alaspungo","10/09/2018","2766",NA,NA,NA,NA,NA,NA,NA,NA,NA,NA,NA,"Coeligena torquata","perch",NA,NA,NA,NA,NA,NA,NA,NA,NA,NA,"September","2018",NA,-78.629503,-0.002178,"2934.823486","2018-09-10T14:59:36Z",2018-09-10 14:59:36
"62","Alaspungo","10/09/2018","2768","Meriania sp.","Blakea sp1","3","DC",7,NA,NA,NA,NA,NA,NA,"Heliangelus strophianus","hovering",NA,NA,NA,NA,NA,NA,NA,NA,NA,"Blakea sp1","September","2018","Blakea sp1",-78.629638,-0.001705,"2929.484619","2018-09-10T15:06:24Z",2018-09-10 15:06:24
"63","Alaspungo","10/12/2018","488",NA,NA,NA,NA,NA,NA,NA,NA,NA,NA,NA,"Heliangelus strophianus","perch and fly",NA,NA,NA,NA,NA,NA,NA,NA,NA,NA,"December","2018",NA,-78.628771,-0.00365,"2878.817627","2018-12-10T15:04:55Z",2018-12-10 15:04:55
"64","Alaspungo","10/12/2018","520",NA,NA,NA,NA,NA,NA,NA,NA,NA,NA,NA,"Coeligena lutetiae","fly",NA,NA,NA,NA,NA,NA,NA,NA,NA,NA,"December","2018",NA,-78.629786,-0.001301,"2906.482910","2018-12-10T16:00:47Z",2018-12-10 16:00:47
"65","Alaspungo","10/12/2018","532",NA,NA,NA,NA,NA,NA,NA,NA,NA,NA,NA,"Coeligena torquata","perch and fly",NA,NA,NA,NA,NA,NA,NA,NA,NA,NA,"December","2018",NA,-78.630875,0.001252,"2857.919678","2018-12-10T16:30:04Z",2018-12-10 16:30:04
"66","Alaspungo","04/02/2019","935",NA,NA,NA,NA,NA,NA,NA,NA,NA,NA,NA,"Adelomyia melanogenys","perch and fly",NA,NA,NA,NA,NA,NA,NA,NA,NA,NA,"February","2019",NA,-78.629823,-0.001374,"2917.313","2019-02-04T15:21:32Z",2019-02-04 15:21:32
"67","Alaspungo","04/02/2019","937",NA,NA,NA,NA,NA,NA,NA,NA,NA,NA,NA,"Heliangelus strophianus","perch",NA,NA,NA,NA,NA,NA,NA,NA,NA,NA,"February","2019",NA,-78.629854,-0.000987,"2913.938","2019-02-04T15:31:29Z",2019-02-04 15:31:29
"68","Amagusa","2018-03-06","236","Cavendishia venosa","Cavendishia venosa","3","DC",5,NA,NA,NA,NA,NA,NA,"Ocreatus underwoodii",NA,NA,NA,NA,NA,NA,NA,NA,NA,NA,"Cavendishia venosa",NA,NA,"Cavendishia venosa",NA,NA,NA,NA,NA
"69","Amagusa","2018-03-06","266",NA,NA,NA,NA,NA,NA,NA,NA,NA,NA,NA,"Ocreatus underwoodii",NA,NA,NA,NA,NA,NA,NA,NA,NA,NA,NA,NA,NA,NA,NA,NA,NA,NA,NA
"70","Amagusa","2018-07-25","187",NA,NA,NA,NA,NA,NA,NA,NA,NA,NA,NA,"Heliodoxa imperatrix",NA,NA,NA,NA,NA,NA,NA,NA,NA,NA,NA,NA,NA,NA,NA,NA,NA,NA,NA
"71","Amagusa","2018-11-19","747","Anthopterus ecuadorensis","Anthopterus ecuadorensis","5","DC",16,NA,NA,NA,NA,NA,NA,"Ochreatus underwoodi, Urosticte benjamini","hovering, no piercing",NA,NA,NA,NA,NA,NA,NA,NA,NA,"Anthopterus ecuadorensis",NA,NA,"Anthopterus ecuadorensis",NA,NA,NA,NA,NA
"72","Amagusa","2018-11-19","748","Psammisia sp.","Psammisia caloneura","2","DC",13,NA,NA,NA,NA,NA,NA,"Doryfera ludovicae","hovering, no piercing",NA,NA,NA,NA,NA,NA,NA,NA,NA,"Psammisia caloneura",NA,NA,"Psammisia caloneura",NA,NA,NA,NA,NA
"73","Amagusa","2018-11-19","749",NA,NA,NA,"DC",NA,NA,NA,NA,NA,NA,NA,"Urosticte benjamini",NA,NA,NA,NA,NA,NA,NA,NA,NA,NA,NA,NA,NA,NA,NA,NA,NA,NA,NA
"74","Amagusa","2018-11-19","758","Palicourea sodiroi","Palicourea sodiroi","4","DC",30,NA,NA,NA,NA,NA,NA,"Doryfera ludovicae","hovering, no piercing",NA,NA,NA,NA,NA,NA,NA,NA,NA,"Palicourea sodiroi",NA,NA,"Palicourea sodiroi",NA,NA,NA,NA,NA
"75","Cambugan","15/02/2017","294",NA,NA,NA,NA,NA,NA,NA,NA,NA,NA,NA,"Adelomyia melanogenys",NA,NA,"Adelomyia melanogenys",NA,NA,NA,NA,NA,NA,NA,NA,"February","2017",NA,NA,NA,NA,NA,NA
"76","Cambugan","15/02/2017","314","Aphelandra acanthea",NA,"2",NA,1,NA,NA,NA,NA,NA,NA,"Adelomyia melanogenys",NA,NA,"Adelomyia melanogenys",NA,NA,NA,NA,NA,NA,NA,"Aphelandra acanthus","February","2017","Aphelandra acanthus",NA,NA,NA,NA,NA
"77","Cambugan","15/02/2017","367","Columnea strigosa",NA,"2",NA,65,NA,NA,NA,NA,NA,NA,"Coeligena torquata","Male",NA,NA,NA,NA,NA,NA,NA,NA,NA,"Columnea strigosa","February","2017","Columnea strigosa",NA,NA,NA,NA,NA
"78","Cambugan","15/02/2017","367",NA,NA,NA,NA,NA,NA,NA,NA,NA,NA,NA,"Coeligena torquata","female",NA,NA,NA,NA,NA,NA,NA,NA,NA,NA,"February","2017",NA,NA,NA,NA,NA,NA
"79","Cambugan","14/03/2017","415","sp1",NA,NA,NA,NA,NA,NA,NA,NA,NA,NA,"Metallura tyrianthina","male",NA,NA,NA,NA,NA,NA,NA,NA,NA,"Sp1","March","2017","Sp1",NA,NA,NA,NA,NA
"80","LasGralarias","25/09/2018","743","Burmeistera cyclostigmata","Burmeistera cyclostigmata","1","DC",1,NA,NA,NA,NA,NA,NA,"Aglaiocercus coelestis","f",NA,NA,NA,NA,NA,NA,NA,NA,NA,"Burmeistera cyclostigmata","September","2018","Burmeistera cyclostigmata",-78.734614,-0.008725,"1988.090210","2018-09-25T14:00:09Z",2018-09-25 14:00:09
"81","LasGralarias","25/09/2018","749","Burmeistera cyclostigmata","Burmeistera cyclostigmata","3","DC",34,NA,NA,NA,NA,NA,NA,"Aglaiocercus coelestis","f",NA,NA,NA,NA,NA,NA,NA,NA,NA,"Burmeistera cyclostigmata","September","2018","Burmeistera cyclostigmata",-78.734636,-0.008177,"1978.880371","2018-09-25T14:16:24Z",2018-09-25 14:16:24
"82","LasGralarias","16/03/2017","32","Cavendishia grandifolia","Cavendishia grandifolia","6","DC",1,NA,NA,NA,NA,NA,NA,"Phaethornis yaruqui",NA,NA,"pictures\plants\Ericaceae\Cavendishia grandiflora",NA,NA,NA,NA,NA,NA,NA,"Cavendishia grandifolia","March","2017","Cavendishia grandifolia",-78.734866,-0.007899,"1957.433","2017-03-16T15:01:58Z",2017-03-16 15:01:58
"83","LasGralarias","22/05/2018","113","Columnea aff. picta","Columnea aff. picta","2","DC",7,NA,NA,NA,NA,NA,NA,"Aglaiocercus coelestis","f",NA,NA,NA,NA,NA,NA,NA,NA,NA,"Columnea aff picta","May","2018","Columnea aff picta",-78.730786,-0.010586,"2055.572021","2018-05-22T15:13:28Z",2018-05-22 15:13:28
"84","LasGralarias","19/02/2019","1106","Columnea sp8","Columnea ciliata","4","DC",5,NA,NA,NA,NA,NA,NA,"Aglaiocercus coelestis",NA,NA,NA,NA,NA,NA,NA,NA,NA,NA,"Columnea ciliata","February","2019","Columnea ciliata",-78.73282,-0.011015,"2037.313965","2019-02-19T13:51:11Z",2019-02-19 13:51:11
"85","LasGralarias","20/02/2018","137","Columnea sp8","Columnea ciliata","6","DC",47,NA,NA,NA,NA,NA,NA,"Boissonneaua jardini","f",NA,NA,NA,NA,NA,NA,NA,NA,NA,"Columnea ciliata","February","2018","Columnea ciliata",-78.734551,-0.010168,"2032.531494","2018-02-20T14:16:26Z",2018-02-20 14:16:26
"86","LasGralarias","22/05/2018","69","Drymonia collegarum","Drymonia collegarum","5","DC",6,NA,NA,NA,NA,NA,NA,"Adelomyia melanogenys","2 fighting",NA,NA,NA,NA,NA,NA,NA,NA,NA,"Drymonia collegarum","May","2018","Drymonia collegarum",-78.730786,-0.010586,"2055.572021","2018-05-22T12:46:57Z",2018-05-22 12:46:57
"87","LasGralarias","13/11/2017","1923","Gastera","Gasteranthus glaber","1.5","DC",5,NA,NA,NA,NA,NA,NA,"Heliodoxa rubinoides","h",NA,NA,NA,NA,NA,NA,NA,NA,NA,"Gasteranthus glaber","November","2017","Gasteranthus glaber",-78.733238,-0.010943,"2048.235840","2017-11-13T14:09:08Z",2017-11-13 14:09:08
"88","LasGralarias","16/03/2017","11","Gasteranthus lateralis","Gasteranthus lateralis",NA,"DC",NA,NA,NA,NA,NA,NA,NA,"Heliodoxa rubinoides","p",NA,NA,NA,NA,NA,NA,NA,NA,NA,"Gasteranthus lateralis","March","2017","Gasteranthus lateralis",-78.732777,-0.011094,"2054.019","2017-03-16T12:32:42Z",2017-03-16 12:32:42
"89","LasGralarias","16/03/2017","12","Gasteranthus lateralis","Gasteranthus lateralis","2","DC",2,NA,NA,NA,NA,NA,NA,"Aglaiocercus coelestis",NA,NA,"pictures\plants\Onagraceae\Fuchsia gigante - Fuchsia marostygma - REVISAR",NA,NA,NA,NA,NA,NA,NA,"Gasteranthus lateralis","March","2017","Gasteranthus lateralis",-78.73297,-0.010964,"2052.318","2017-03-16T12:36:59Z",2017-03-16 12:36:59
"90","LasGralarias","13/11/2017","1951","Gasteranthus sp4","Gasteranthus ternatus","1","DC",2,NA,NA,NA,NA,NA,NA,"Heliodoxa rubinoides","h",NA,NA,NA,NA,NA,NA,NA,NA,NA,"Gasteranthus ternatus","November","2017","Gasteranthus ternatus",-78.735754,-0.007387,"1934.155396","2017-11-13T15:36:40Z",2017-11-13 15:36:40
"91","LasGralarias","16/03/2017","28","Guzmania squarrosa","Guzmania gloriosa","4","DC",2,NA,NA,NA,NA,NA,NA,"Aglaiocercus coelestis",NA,NA,"pictures\plants\Bromeliaceae\Bromelia bracteas largas",NA,NA,NA,NA,NA,NA,NA,"Guzmania gloriosa","March","2017","Guzmania gloriosa",-78.734556,-0.008509,"1978.429","2017-03-16T14:35:05Z",2017-03-16 14:35:05
"92","LasGralarias","25/09/2018","746","Guzmania jaramilloi","Guzmania jaramilloi","4","DC",4,NA,NA,NA,NA,NA,NA,"Aglaiocercus coelestis","f",NA,NA,NA,NA,NA,NA,NA,NA,NA,"Guzmania jaramilloi","September","2018","Guzmania jaramilloi",-78.734585,-0.008346,"1980.709351","2018-09-25T14:12:29Z",2018-09-25 14:12:29
"93","LasGralarias","16/03/2017","7","Mezobromelia capituligera","Mezobromelia danielii","7","DC",4,NA,NA,NA,NA,NA,NA,"Boissonneaua flavescens",NA,NA,"pictures\plants\Bromeliaceae\Mezobromelia sp1",NA,NA,NA,NA,NA,NA,NA,"Mezobromelia danielii","March","2017","Mezobromelia danielii",-78.732216,-0.011509,"2054.622","2017-03-16T12:03:34Z",2017-03-16 12:03:34
"94","LasGralarias","20/02/2018","134","Mezobromelia aff. capituligera","Mezobromelia danielii","6","DC",1,NA,NA,NA,NA,NA,NA,"Coeligena wilsoni","f",NA,NA,NA,NA,NA,NA,NA,NA,NA,"Mezobromelia danielii","February","2018","Mezobromelia danielii",-78.734121,-0.010651,"2050.654785","2018-02-20T14:03:58Z",2018-02-20 14:03:58
"95","LasGralarias","22/05/2018","68","Mezobromelia capituligena","Mezobromelia danielii","9","DC",1,NA,NA,NA,NA,NA,NA,"Adelomyia melanogenys","f",NA,NA,NA,NA,NA,NA,NA,NA,NA,"Mezobromelia danielii","May","2018","Mezobromelia danielii",-78.730786,-0.010586,"2055.572021","2018-05-22T12:25:43Z",2018-05-22 12:25:43
"96","LasGralarias","11/05/2017","556","Palicourea demissa","Palicourea anderssoniana","2","DC",3,NA,NA,NA,NA,NA,NA,"Aglaiocercus coelestis","f",NA,NA,NA,NA,NA,NA,NA,NA,NA,"Palicourea anderssoniana","May","2017","Palicourea anderssoniana",-78.733624,-0.010942,"2055.232","2017-05-11T15:16:51Z",2017-05-11 15:16:51
"97","LasGralarias","24/04/2018","893","Palicourea demissa","Palicourea anderssoniana","2","DC",1,NA,NA,NA,NA,NA,NA,"Aglaiocercus coelestis",NA,NA,NA,NA,NA,NA,NA,NA,NA,NA,"Palicourea anderssoniana","April","2018","Palicourea anderssoniana",-78.734702,-0.007999,"1962.812012","2018-04-24T13:28:07Z",2018-04-24 13:28:07
"98","LasGralarias","16/03/2017","16","Palicourea sp3","Palicourea asplundii","2","DC",1,NA,NA,NA,NA,NA,NA,"Aglaiocercus coelestis",NA,NA,"pictures\plants\Rubiaceae\Palicourea amarilla-roja",NA,NA,NA,NA,NA,NA,NA,"Palicourea asplundii","March","2017","Palicourea asplundii",-78.733357,-0.010909,"2054.950","2017-03-16T12:57:35Z",2017-03-16 12:57:35
"99","LasGralarias","16/06/2017","669","Palicourea acetosoides","Palicourea sodiroi","3","DC",21,NA,NA,NA,NA,NA,NA,"Aglaiocercus coelestis","f","Feeding while hovering for 30'",NA,NA,NA,NA,NA,NA,NA,NA,"Palicourea sodiroi","June","2017","Palicourea sodiroi",-78.732199,-0.011536,"1998.948730","2017-06-16T12:27:53Z",2017-06-16 12:27:53
"100","LasGralarias","19/09/2017","38","Palicourea acetosoides","Palicourea sodiroi","1","DC",7,NA,NA,NA,NA,NA,NA,"Aglaiocercus coelestis","h","Visita ileg√≠tima",NA,NA,NA,NA,NA,NA,NA,NA,"Palicourea sodiroi","September","2017","Palicourea sodiroi",-78.733563,-0.010995,"2042.934570","2017-09-19T13:20:58Z",2017-09-19 13:20:58
"101","LasGralarias","25/09/2018","742","Psammisia abberans","Psammisia abberans","4","DC",61,NA,NA,NA,NA,NA,NA,"Coeligena wilsoni","f",NA,NA,NA,NA,NA,NA,NA,NA,NA,"Psammisia aberrans","September","2018","Psammisia aberrans",-78.734634,-0.008827,"1992.131348","2018-09-25T13:57:46Z",2018-09-25 13:57:46
"102","LasGralarias","13/11/2017","1932","Psammisia ecuadorensis","Psammisia ecuadorensis","3","DC",20,NA,NA,NA,NA,NA,NA,"Heliodoxa rubinoides","h",NA,NA,NA,NA,NA,NA,NA,NA,NA,"Psammisia ecuadorensis","November","2017","Psammisia ecuadorensis",-78.734417,-0.010206,"2042.366943","2017-11-13T14:43:11Z",2017-11-13 14:43:11
"103","LasGralarias","24/07/2018","380","Thibaudia inflata","Thibaudia inflata","1","DC",40,NA,NA,NA,NA,NA,NA,"Coeligena wilsoni","f",NA,NA,NA,NA,NA,NA,NA,NA,NA,"Thibaudia inflata","July","2018","Thibaudia inflata",-78.734571,-0.008378,"1973.904663","2018-07-24T15:13:02Z",2018-07-24 15:13:02
"104","LasGralarias","25/09/2018","743","Thibaudia inflata","Thibaudia inflata","2","DC",17,NA,NA,NA,NA,NA,NA,"Aglaiocercus coelestis","f",NA,NA,NA,NA,NA,NA,NA,NA,NA,"Thibaudia inflata","September","2018","Thibaudia inflata",-78.734614,-0.008725,"1988.090210","2018-09-25T14:00:09Z",2018-09-25 14:00:09
"105","LasGralarias","16/06/2017","724","Tillandsia complanata","Tillandsia complanata","6","DC",1,NA,NA,NA,NA,NA,NA,"Boissonneaua jardini","f",NA,NA,NA,NA,NA,NA,NA,NA,NA,"Tillandsia complanata","June","2017","Tillandsia complanata",-78.732815,-0.011035,"2046.984009","2017-06-16T17:42:49Z",2017-06-16 17:42:49
"106","LasGralarias","11/05/2017","541",NA,NA,NA,NA,NA,NA,NA,NA,NA,NA,NA,"Adelomyia melanogenys","p",NA,NA,NA,NA,NA,NA,NA,NA,NA,NA,"May","2017",NA,-78.732613,-0.011531,"1969.271","2017-05-11T14:08:19Z",2017-05-11 14:08:19
"107","LasGralarias","16/06/2017","693",NA,NA,NA,NA,NA,NA,NA,NA,NA,NA,NA,"Haplophaedia lugens",NA,"Flying over",NA,NA,NA,NA,NA,NA,NA,NA,NA,"June","2017",NA,-78.734612,-0.008798,"1989.688354","2017-06-16T14:58:39Z",2017-06-16 14:58:39
"108","LasGralarias","16/06/2017","699",NA,NA,NA,NA,NA,NA,NA,NA,NA,NA,NA,"Coeligena wilsoni","h",NA,NA,NA,NA,NA,NA,NA,NA,NA,NA,"June","2017",NA,-78.734978,-0.007866,"1955.835083","2017-06-16T15:37:07Z",2017-06-16 15:37:07
"109","LasGralarias","19/02/2019","1168",NA,NA,NA,NA,NA,NA,NA,NA,NA,NA,NA,"Boissonneaua jardini","p",NA,NA,NA,NA,NA,NA,NA,NA,NA,NA,"February","2019",NA,-78.736392,-0.00711,"1904.368530","2019-02-19T16:17:14Z",2019-02-19 16:17:14
"110","LasGralarias","19/09/2017","41",NA,NA,NA,NA,NA,NA,NA,NA,NA,NA,NA,"Heliodoxa rubinoides","h",NA,NA,NA,NA,NA,NA,NA,NA,NA,NA,"September","2017",NA,-78.733563,-0.010995,"2042.934570","2017-09-19T13:43:22Z",2017-09-19 13:43:22
"111","LasGralarias","19/09/2017","52",NA,NA,NA,"DC",NA,NA,NA,NA,NA,NA,NA,"Heliodoxa rubinoides","h",NA,NA,NA,NA,NA,NA,NA,NA,NA,NA,"September","2017",NA,-78.733563,-0.010995,"2042.934570","2017-09-19T15:46:08Z",2017-09-19 15:46:08
"112","LasGralarias","22/01/2019","215",NA,NA,NA,NA,NA,NA,NA,NA,NA,NA,NA,"Coeligena wilsoni","f",NA,NA,NA,NA,NA,NA,NA,NA,NA,NA,"January","2019",NA,-78.732972,-0.010941,"2048.998291","2019-01-22T13:21:03Z",2019-01-22 13:21:03
"113","LasGralarias","22/10/2018","216",NA,NA,NA,"DC",NA,NA,NA,NA,NA,NA,NA,"Heliodoxa jacula","p",NA,NA,NA,NA,NA,NA,NA,NA,NA,NA,"October","2018",NA,NA,NA,NA,NA,NA
"114","LasGralarias","22/10/2018","221",NA,NA,NA,"DC",NA,NA,NA,NA,NA,NA,NA,"Heliodoxa jacula","h",NA,NA,NA,NA,NA,NA,NA,NA,NA,NA,"October","2018",NA,-78.732537,-0.011283,"1981.891968","2018-10-22T15:00:10Z",2018-10-22 15:00:10
"115","LasGralarias","24/07/2018","383",NA,NA,NA,"DC",NA,NA,NA,NA,NA,NA,NA,"Coeligena wilsoni","h",NA,NA,NA,NA,NA,NA,NA,NA,NA,NA,"July","2018",NA,-78.734617,-0.008226,"1969.725464","2018-07-24T15:24:12Z",2018-07-24 15:24:12
"116","LasGralarias","26/06/2018","129",NA,NA,NA,"DC",NA,NA,NA,NA,NA,NA,NA,"Aglaiocercus coelestis","p",NA,NA,NA,NA,NA,NA,NA,NA,NA,NA,"June","2018",NA,-78.733856,-0.010819,"2055.388","2018-06-26T13:33:05Z",2018-06-26 13:33:05
"117","LasGralarias","43550","314",NA,NA,NA,NA,NA,NA,NA,NA,NA,NA,NA,"Aglaiocercus coelestis","Fly",NA,NA,NA,NA,NA,NA,NA,NA,NA,NA,NA,NA,NA,NA,NA,NA,NA,NA
"118","Maquipucuna","27/01/2017","787"," ",NA,NA,NA,NA,NA,NA,NA,NA,NA,NA,"Ocreatus underwoodii","","","","",NA,NA,NA,NA,NA,NA," ","January","2017"," ",-78.628936,0.103403,"1708.149414","2018-01-16T15:11:15Z",2018-01-16 15:11:15
"119","Maquipucuna","27/01/2017","790"," ",NA,NA,NA,NA,NA,NA,NA,NA,NA,NA,"Ocreatus underwoodii","","","","",NA,NA,NA,NA,NA,NA," ","January","2017"," ",-78.629251,0.107407,"1580.734375","2017-01-27T13:21:37Z",2017-01-27 13:21:37
"120","Maquipucuna","27/01/2017","794"," ",NA,NA,NA,NA,NA,NA,NA,NA,NA,NA,"Ocreatus underwoodii","","","","",NA,NA,NA,NA,NA,NA," ","January","2017"," ",-78.629671,0.107171,"1589.069702","2017-01-27T13:28:28Z",2017-01-27 13:28:28
"121","Maquipucuna","27/01/2017","794"," ",NA,NA,NA,NA,NA,NA,NA,NA,NA,NA,"Ocreatus underwoodii","","","","",NA,NA,NA,NA,NA,NA," ","January","2017"," ",-78.629671,0.107171,"1589.069702","2017-01-27T13:28:28Z",2017-01-27 13:28:28
"122","Maquipucuna","27/01/2017","805"," ",NA,NA,NA,NA,NA,NA,NA,NA,NA,NA,"Heliodoxa jacula","","","","",NA,NA,NA,NA,NA,NA," ","January","2017"," ",-78.628523,0.107013,"1611.787720","2017-01-27T13:49:36Z",2017-01-27 13:49:36
"123","Maquipucuna","27/01/2017","807"," ",NA,NA,NA,NA,NA,NA,NA,NA,NA,NA,"Ocreatus underwoodii","","","","",NA,NA,NA,NA,NA,NA," ","January","2017"," ",-78.628457,0.106805,"1617.754272","2017-01-27T13:52:47Z",2017-01-27 13:52:47
"124","Maquipucuna","27/01/2017","812"," ",NA,NA,NA,NA,NA,NA,NA,NA,NA,NA,"Coeligena wilsoni","","","","",NA,NA,NA,NA,NA,NA," ","January","2017"," ",-78.628873,0.106431,"1637.157593","2017-01-27T14:01:38Z",2017-01-27 14:01:38
"125","Maquipucuna","27/01/2017","814"," ",NA,NA,NA,NA,NA,NA,NA,NA,NA,NA,"Ocreatus underwoodii","","","","",NA,NA,NA,NA,NA,NA," ","January","2017"," ",-78.629039,0.106398,"1643.576904","2017-01-27T14:05:26Z",2017-01-27 14:05:26
"126","Maquipucuna","27/01/2017","815","Renealmia sessilifolia","Renealmia sessilifolia","2",NA,2,NA,NA,NA,NA,NA,NA,"Ocreatus underwoodii","Male","","","",NA,NA,NA,NA,NA,NA,"Renealmia sessilifolia","January","2017","Renealmia sessilifolia",-78.629144,0.106411,"1644.421265","2017-01-27T14:06:56Z",2017-01-27 14:06:56
"127","Maquipucuna","27/01/2017","815","Palicourea demissa","Palicourea demissa","4",NA,2,NA,NA,NA,NA,NA,NA,"Ocreatus underwoodii","male","","","",NA,NA,NA,NA,NA,NA,"Palicourea demissa","January","2017","Palicourea demissa",-78.629144,0.106411,"1644.421265","2017-01-27T14:06:56Z",2017-01-27 14:06:56
"128","Maquipucuna","27/01/2017","817"," ",NA,NA,NA,NA,NA,NA,NA,NA,NA,NA,"Ocreatus underwoodii","","","","",NA,NA,NA,NA,NA,NA," ","January","2017"," ",-78.629362,0.10627,"1648.444824","2017-01-27T14:12:46Z",2017-01-27 14:12:46
"129","Maquipucuna","27/01/2017","819"," ",NA,NA,NA,NA,NA,NA,NA,NA,NA,NA,"Ocreatus underwoodii"," perched 8mtrs (15)","female","","",NA,NA,NA,NA,NA,NA," ","January","2017"," ",-78.629409,0.106155,"1649.675781","2017-01-27T14:14:27Z",2017-01-27 14:14:27
"130","Maquipucuna","27/01/2017","827"," ",NA,NA,NA,NA,NA,NA,NA,NA,NA,NA,"Ocreatus underwoodii","","","","",NA,NA,NA,NA,NA,NA," ","January","2017"," ",-78.629636,0.105703,"1658.218750","2017-01-27T14:25:52Z",2017-01-27 14:25:52
"131","Maquipucuna","27/01/2017","827"," ",NA,NA,NA,NA,NA,NA,NA,NA,NA,NA,"Ocreatus underwoodii","","","","",NA,NA,NA,NA,NA,NA," ","January","2017"," ",-78.629636,0.105703,"1658.218750","2017-01-27T14:25:52Z",2017-01-27 14:25:52
"132","Maquipucuna","27/01/2017","832"," ",NA,NA,NA,NA,NA,NA,NA,NA,NA,NA,"Ocreatus underwoodii","","","","",NA,NA,NA,NA,NA,NA," ","January","2017"," ",-78.629404,0.105238,"1666.068970","2017-01-27T14:32:30Z",2017-01-27 14:32:30
"133","Maquipucuna","27/01/2017","832"," ",NA,NA,NA,NA,NA,NA,NA,NA,NA,NA,"Ocreatus underwoodii","","","","",NA,NA,NA,NA,NA,NA," ","January","2017"," ",-78.629404,0.105238,"1666.068970","2017-01-27T14:32:30Z",2017-01-27 14:32:30
"134","Maquipucuna","27/01/2017","832"," ",NA,NA,NA,NA,NA,NA,NA,NA,NA,NA,"Coeligena wilsoni","Perched (60)","","","",NA,NA,NA,NA,NA,NA," ","January","2017"," ",-78.629404,0.105238,"1666.068970","2017-01-27T14:32:30Z",2017-01-27 14:32:30
"135","Maquipucuna","27/01/2017","834"," ",NA,NA,NA,NA,NA,NA,NA,NA,NA,NA,"Coeligena wilsoni","","","","",NA,NA,NA,NA,NA,NA," ","January","2017"," ",-78.629366,0.104831,"1671.762329","2017-01-27T14:37:12Z",2017-01-27 14:37:12
"136","Maquipucuna","27/01/2017","834"," ",NA,NA,NA,NA,NA,NA,NA,NA,NA,NA,"Ocreatus underwoodii","","","","",NA,NA,NA,NA,NA,NA," ","January","2017"," ",-78.629366,0.104831,"1671.762329","2017-01-27T14:37:12Z",2017-01-27 14:37:12
"137","Maquipucuna","27/01/2017","839"," ",NA,NA,NA,NA,NA,NA,NA,NA,NA,NA,"Ocreatus underwoodii","","","","",NA,NA,NA,NA,NA,NA," ","January","2017"," ",-78.629043,0.104276,"1687.985718","2017-01-27T14:44:56Z",2017-01-27 14:44:56
"138","Maquipucuna","27/01/2017","843"," ",NA,NA,NA,NA,NA,NA,NA,NA,NA,NA,"Aglaiocercus coelestis","","","","",NA,NA,NA,NA,NA,NA," ","January","2017"," ",-78.628951,0.10409,"1693.528931","2017-01-27T14:48:49Z",2017-01-27 14:48:49
"139","Maquipucuna","27/01/2017","843"," ",NA,NA,NA,NA,NA,NA,NA,NA,NA,NA,"Aglaiocercus coelestis","","","","",NA,NA,NA,NA,NA,NA," ","January","2017"," ",-78.628951,0.10409,"1693.528931","2017-01-27T14:48:49Z",2017-01-27 14:48:49
"140","Maquipucuna","27/01/2017","844"," ",NA,NA,NA,NA,NA,NA,NA,NA,NA,NA,"Ocreatus underwoodii","","","","",NA,NA,NA,NA,NA,NA," ","January","2017"," ",-78.628988,0.104071,"1694.435669","2017-01-27T14:49:36Z",2017-01-27 14:49:36
"141","Maquipucuna","27/01/2017","845"," ",NA,NA,NA,NA,NA,NA,NA,NA,NA,NA,"Heliodoxa imperatrix","","","","",NA,NA,NA,NA,NA,NA," ","January","2017"," ",-78.629023,0.104013,"1695.754517","2017-01-27T14:50:25Z",2017-01-27 14:50:25
"142","Maquipucuna","27/01/2017","846"," ",NA,NA,NA,NA,NA,NA,NA,NA,NA,NA,"Ocreatus underwoodii","","","","",NA,NA,NA,NA,NA,NA," ","January","2017"," ",-78.628997,0.103923,"1696.306030","2017-01-27T14:50:54Z",2017-01-27 14:50:54
"143","Maquipucuna","27/01/2017","847"," ",NA,NA,NA,NA,NA,NA,NA,NA,NA,NA,"Coeligena wilsoni","","","","",NA,NA,NA,NA,NA,NA," ","January","2017"," ",-78.629001,0.103915,"1697.046143","2017-01-27T14:51:28Z",2017-01-27 14:51:28
"144","Maquipucuna","27/01/2017","852"," ",NA,NA,NA,NA,NA,NA,NA,NA,NA,NA,"Ocreatus underwoodii","","","","",NA,NA,NA,NA,NA,NA," ","January","2017"," ",-78.628998,0.103555,"1704.165405","2017-01-27T14:57:00Z",2017-01-27 14:57:00
"145","Maquipucuna","27/01/2017","857","Palicourea demissa","Palicourea demissa","6",NA,12,NA,NA,NA,NA,NA,NA,"Ocreatus underwoodii"," feeding (10)","female","","",NA,NA,NA,NA,NA,NA,"Palicourea demissa","January","2017","Palicourea demissa",-78.62897,0.103214,"1710.865234","2017-01-27T15:02:07Z",2017-01-27 15:02:07
"146","Maquipucuna","27/01/2017","858"," ",NA,NA,NA,NA,NA,NA,NA,NA,NA,NA,"Aglaiocercus coelestis","","","","",NA,NA,NA,NA,NA,NA," ","January","2017"," ",-78.629009,0.103137,"1716.297485","2017-01-27T15:04:40Z",2017-01-27 15:04:40
"147","Maquipucuna","27/01/2017","859"," ",NA,NA,NA,NA,NA,NA,NA,NA,NA,NA,"Aglaiocercus coelestis","","","","",NA,NA,NA,NA,NA,NA," ","January","2017"," ",-78.628921,0.102949,"1720.935791","2017-01-27T15:07:10Z",2017-01-27 15:07:10
"148","Maquipucuna","27/01/2017","868"," ",NA,NA,NA,NA,NA,NA,NA,NA,NA,NA,"Coeligena wilsoni","","","","",NA,NA,NA,NA,NA,NA," ","January","2017"," ",-78.628258,0.102238,"1734.898315","2017-01-27T15:18:21Z",2017-01-27 15:18:21
"149","Maquipucuna","27/01/2017","870"," ",NA,NA,NA,NA,NA,NA,NA,NA,NA,NA,"Coeligena wilsoni","","","","",NA,NA,NA,NA,NA,NA," ","January","2017"," ",-78.628141,0.102223,"1733.705200","2017-01-27T15:20:20Z",2017-01-27 15:20:20
"150","Maquipucuna","27/01/2017","871"," ",NA,NA,NA,NA,NA,NA,NA,NA,NA,NA,"Ocreatus underwoodii"," perched 1mtrs (3)","juvenile male","","",NA,NA,NA,NA,NA,NA," ","January","2017"," ",-78.628111,0.102253,"1732.601074","2017-01-27T15:21:14Z",2017-01-27 15:21:14
"151","Maquipucuna","27/01/2017","874"," ",NA,NA,NA,NA,NA,NA,NA,NA,NA,NA,"Coeligena wilsoni","","","","",NA,NA,NA,NA,NA,NA," ","January","2017"," ",-78.627965,0.102318,"1724.569702","2017-01-27T15:24:28Z",2017-01-27 15:24:28
"152","Maquipucuna","25/02/2017","1306"," ",NA,NA,NA,NA,NA,NA,NA,NA,NA,NA,"Ocreatus underwoodii","","","","",NA,NA,NA,NA,NA,NA," ","February","2017"," ",-78.62856,0.108916,"1544.724365","2017-02-25T13:05:56Z",2017-02-25 13:05:56
"153","Maquipucuna","25/02/2017","1309"," ",NA,NA,NA,NA,NA,NA,NA,NA,NA,NA,"Heliodoxa jacula","","","","",NA,NA,NA,NA,NA,NA," ","February","2017"," ",-78.628546,0.10872,"1547.792725","2017-02-25T13:09:27Z",2017-02-25 13:09:27
"154","Maquipucuna","25/02/2017","1316"," ",NA,NA,NA,NA,NA,NA,NA,NA,NA,NA,"Ocreatus underwoodii","","","","",NA,NA,NA,NA,NA,NA," ","February","2017"," ",-78.628944,0.108139,"1559.937622","2017-02-25T13:19:24Z",2017-02-25 13:19:24
"155","Maquipucuna","25/02/2017","1322"," ",NA,NA,NA,NA,NA,NA,NA,NA,NA,NA,"Ocreatus underwoodii","","","","",NA,NA,NA,NA,NA,NA," ","February","2017"," ",-78.628706,0.107759,"1570.301880","2017-02-25T13:27:34Z",2017-02-25 13:27:34
"156","Maquipucuna","25/02/2017","1327"," ",NA,NA,NA,NA,NA,NA,NA,NA,NA,NA,"Ocreatus underwoodii","","","","",NA,NA,NA,NA,NA,NA," ","February","2017"," ",-78.629116,0.107565,"1577.745483","2017-02-25T13:34:58Z",2017-02-25 13:34:58
"157","Maquipucuna","25/02/2017","1332"," ",NA,NA,NA,NA,NA,NA,NA,NA,NA,NA,"Ocreatus underwoodii","","","","",NA,NA,NA,NA,NA,NA," ","February","2017"," ",-78.629444,0.107253,"1584.380493","2017-02-25T13:40:50Z",2017-02-25 13:40:50
"158","Maquipucuna","25/02/2017","1335","Palicourea demissa","Palicourea demissa","6",NA,2,NA,NA,NA,NA,NA,NA,"Ocreatus underwoodii"," feeding (2)","female","","",NA,NA,NA,NA,NA,NA,"Palicourea demissa","February","2017","Palicourea demissa",-78.629721,0.106875,"1590.808716","2017-02-25T13:45:32Z",2017-02-25 13:45:32
"159","Maquipucuna","25/02/2017","1338"," ",NA,NA,NA,NA,NA,NA,NA,NA,NA,NA,"Ocreatus underwoodii","","","","",NA,NA,NA,NA,NA,NA," ","February","2017"," ",-78.62945,0.106923,"1596.125000","2017-02-25T13:49:17Z",2017-02-25 13:49:17
"160","Maquipucuna","25/02/2017","1346"," ",NA,NA,NA,NA,NA,NA,NA,NA,NA,NA,"Ocreatus underwoodii","","","","",NA,NA,NA,NA,NA,NA," ","February","2017"," ",-78.628518,0.10675,"1619.648438","2017-02-25T14:06:05Z",2017-02-25 14:06:05
"161","Maquipucuna","25/02/2017","1347"," ",NA,NA,NA,NA,NA,NA,NA,NA,NA,NA,"Coeligena wilsoni","","","","",NA,NA,NA,NA,NA,NA," ","February","2017"," ",-78.628591,0.106686,"1622.018555","2017-02-25T14:07:28Z",2017-02-25 14:07:28
"162","Maquipucuna","25/02/2017","1351"," ",NA,NA,NA,NA,NA,NA,NA,NA,NA,NA,"Ocreatus underwoodii","","","","",NA,NA,NA,NA,NA,NA," ","February","2017"," ",-78.628718,0.106485,"1630.637573","2017-02-25T14:12:39Z",2017-02-25 14:12:39
"163","Maquipucuna","25/02/2017","1351"," ",NA,NA,NA,NA,NA,NA,NA,NA,NA,NA,"Urosticte benjamini","","","","",NA,NA,NA,NA,NA,NA," ","February","2017"," ",-78.628718,0.106485,"1630.637573","2017-02-25T14:12:39Z",2017-02-25 14:12:39
"164","Maquipucuna","25/02/2017","1356"," ",NA,NA,NA,NA,NA,NA,NA,NA,NA,NA,"Ocreatus underwoodii"," perched 5mtrs (2)","female","","",NA,NA,NA,NA,NA,NA," ","February","2017"," ",-78.629028,0.106374,"1642.580933","2017-02-25T14:26:47Z",2017-02-25 14:26:47
"165","Maquipucuna","25/02/2017","1357"," ",NA,NA,NA,NA,NA,NA,NA,NA,NA,NA,"Urosticte benjamini"," flying (2)","male","","",NA,NA,NA,NA,NA,NA," ","February","2017"," ",-78.629143,0.106404,"1644.137573","2017-02-25T14:27:49Z",2017-02-25 14:27:49
"166","Maquipucuna","25/02/2017","1362"," ",NA,NA,NA,NA,NA,NA,NA,NA,NA,NA,"Coeligena wilsoni","Flying (2)","","","",NA,NA,NA,NA,NA,NA," ","February","2017"," ",-78.629464,0.106079,"1649.131714","2017-02-25T14:34:55Z",2017-02-25 14:34:55
"167","Maquipucuna","25/02/2017","1364"," ",NA,NA,NA,NA,NA,NA,NA,NA,NA,NA,"Ocreatus underwoodii","","","","",NA,NA,NA,NA,NA,NA," ","February","2017"," ",-78.629555,0.105948,"1649.869751","2017-02-25T14:37:29Z",2017-02-25 14:37:29
"168","Maquipucuna","25/02/2017","1366"," ",NA,NA,NA,NA,NA,NA,NA,NA,NA,NA,"Ocreatus underwoodii","","","","",NA,NA,NA,NA,NA,NA," ","February","2017"," ",-78.629666,0.105899,"1651.853760","2017-02-25T14:40:20Z",2017-02-25 14:40:20
"169","Maquipucuna","25/02/2017","1372"," ",NA,NA,NA,NA,NA,NA,NA,NA,NA,NA,"Coeligena wilsoni","","","","",NA,NA,NA,NA,NA,NA," ","February","2017"," ",-78.629404,0.105124,"1664.392822","2017-02-25T14:55:18Z",2017-02-25 14:55:18
"170","Maquipucuna","25/02/2017","1374"," ",NA,NA,NA,NA,NA,NA,NA,NA,NA,NA,"Ocreatus underwoodii","","","","",NA,NA,NA,NA,NA,NA," ","February","2017"," ",-78.629359,0.104898,"1667.579834","2017-02-25T14:58:33Z",2017-02-25 14:58:33
"171","Maquipucuna","25/02/2017","1374"," ",NA,NA,NA,NA,NA,NA,NA,NA,NA,NA,"Urosticte benjamini","Flying (3)","","","",NA,NA,NA,NA,NA,NA," ","February","2017"," ",-78.629359,0.104898,"1667.579834","2017-02-25T14:58:33Z",2017-02-25 14:58:33
"172","Maquipucuna","25/02/2017","1377"," ",NA,NA,NA,NA,NA,NA,NA,NA,NA,NA,"Ocreatus underwoodii","","","","",NA,NA,NA,NA,NA,NA," ","February","2017"," ",-78.629008,0.104411,"1683.857544","2017-02-25T15:06:27Z",2017-02-25 15:06:27
"173","Maquipucuna","25/02/2017","1379"," ",NA,NA,NA,NA,NA,NA,NA,NA,NA,NA,"Coeligena wilsoni","","","","",NA,NA,NA,NA,NA,NA," ","February","2017"," ",-78.628999,0.104249,"1686.474365","2017-02-25T15:08:24Z",2017-02-25 15:08:24
"174","Maquipucuna","25/02/2017","1380"," ",NA,NA,NA,NA,NA,NA,NA,NA,NA,NA,"Aglaiocercus coelestis","","","","",NA,NA,NA,NA,NA,NA," ","February","2017"," ",-78.629082,0.104238,"1688.597778","2017-02-25T15:09:11Z",2017-02-25 15:09:11
"175","Maquipucuna","25/02/2017","1380"," ",NA,NA,NA,NA,NA,NA,NA,NA,NA,NA,"Ocreatus underwoodii","","","","",NA,NA,NA,NA,NA,NA," ","February","2017"," ",-78.629082,0.104238,"1688.597778","2017-02-25T15:09:11Z",2017-02-25 15:09:11
"176","Maquipucuna","25/02/2017","1382"," ",NA,NA,NA,NA,NA,NA,NA,NA,NA,NA,"Ocreatus underwoodii","","","","",NA,NA,NA,NA,NA,NA," ","February","2017"," ",-78.628989,0.103943,"1694.152222","2017-02-25T15:12:28Z",2017-02-25 15:12:28
"177","Maquipucuna","25/02/2017","1383"," ",NA,NA,NA,NA,NA,NA,NA,NA,NA,NA,"Aglaiocercus coelestis","","","","",NA,NA,NA,NA,NA,NA," ","February","2017"," ",-78.629007,0.103895,"1696.130249","2017-02-25T15:13:40Z",2017-02-25 15:13:40
"178","Maquipucuna","25/02/2017","1386"," ",NA,NA,NA,NA,NA,NA,NA,NA,NA,NA,"Ocreatus underwoodii"," perched 3mtrs (5)","female","","",NA,NA,NA,NA,NA,NA," ","February","2017"," ",-78.629002,0.103758,"1699.401123","2017-02-25T15:16:50Z",2017-02-25 15:16:50
"179","Maquipucuna","25/02/2017","1386"," ",NA,NA,NA,NA,NA,NA,NA,NA,NA,NA,"Ocreatus underwoodii"," perched 3mtrs (5)","female","","",NA,NA,NA,NA,NA,NA," ","February","2017"," ",-78.629002,0.103758,"1699.401123","2017-02-25T15:16:50Z",2017-02-25 15:16:50
"180","Maquipucuna","25/02/2017","1388"," ",NA,NA,NA,NA,NA,NA,NA,NA,NA,NA,"Ocreatus underwoodii","","","","",NA,NA,NA,NA,NA,NA," ","February","2017"," ",-78.629017,0.103617,"1700.174927","2017-02-25T15:18:23Z",2017-02-25 15:18:23
"181","Maquipucuna","25/02/2017","1391"," ",NA,NA,NA,NA,NA,NA,NA,NA,NA,NA,"Phaethornis syrmatophorus","","","","",NA,NA,NA,NA,NA,NA," ","February","2017"," ",-78.628953,0.103424,"1705.125977","2017-02-25T15:21:21Z",2017-02-25 15:21:21
"182","Maquipucuna","25/02/2017","1394"," ",NA,NA,NA,NA,NA,NA,NA,NA,NA,NA,"Ocreatus underwoodii","","","","",NA,NA,NA,NA,NA,NA," ","February","2017"," ",-78.629044,0.103174,"1712.159424","2017-02-25T15:25:32Z",2017-02-25 15:25:32
"183","Maquipucuna","25/02/2017","1396"," ",NA,NA,NA,NA,NA,NA,NA,NA,NA,NA,"Aglaiocercus coelestis"," perched 5mtrs (18)","male (possibly juvenile)","","",NA,NA,NA,NA,NA,NA," ","February","2017"," ",-78.628932,0.103128,"1716.465942","2017-02-25T15:28:06Z",2017-02-25 15:28:06
"184","Maquipucuna","25/02/2017","1399"," ",NA,NA,NA,NA,NA,NA,NA,NA,NA,NA,"Ocreatus underwoodii","","","","",NA,NA,NA,NA,NA,NA," ","February","2017"," ",-78.628765,0.102868,"1716.872559","2017-02-25T15:31:53Z",2017-02-25 15:31:53
"185","Maquipucuna","25/02/2017","1410"," ",NA,NA,NA,NA,NA,NA,NA,NA,NA,NA,"Ocreatus underwoodii","","","","",NA,NA,NA,NA,NA,NA," ","February","2017"," ",-78.628039,0.102335,"1728.585205","2017-02-25T15:51:22Z",2017-02-25 15:51:22
"186","Maquipucuna","25/02/2017","1412"," ",NA,NA,NA,NA,NA,NA,NA,NA,NA,NA,"Aglaiocercus coelestis","","","","",NA,NA,NA,NA,NA,NA," ","February","2017"," ",-78.627903,0.102336,"1719.323120","2017-02-25T15:53:52Z",2017-02-25 15:53:52
"187","Maquipucuna","25/02/2017","1413"," ",NA,NA,NA,NA,NA,NA,NA,NA,NA,NA,"Ocreatus underwoodii","","","","",NA,NA,NA,NA,NA,NA," ","February","2017"," ",-78.627772,0.102395,"1716.338501","2017-02-25T15:55:22Z",2017-02-25 15:55:22
"188","Maquipucuna","18/03/2017","1495","Macleania recumbens",NA,"5",NA,14,NA,NA,NA,NA,NA,NA,"Coeligena wilsoni","Feeding (3)","","","",NA,NA,NA,NA,NA,NA,"Macleania recumbens","March","2017","Macleania recumbens",-78.62893,0.108101,"1557.326172","2018-03-21T13:06:27Z",2018-03-21 13:06:27
"189","Maquipucuna","18/03/2017","1503"," ",NA,NA,NA,NA,NA,NA,NA,NA,NA,NA,"Aglaiocercus coelestis","","","","",NA,NA,NA,NA,NA,NA," ","March","2017"," ",-78.629799,0.106929,"1591.859375","2018-03-21T13:34:12Z",2018-03-21 13:34:12
"190","Maquipucuna","18/03/2017","1504"," ",NA,NA,NA,NA,NA,NA,NA,NA,NA,NA,"Heliodoxa jacula","","","","",NA,NA,NA,NA,NA,NA," ","March","2017"," ",-78.629629,0.106939,"1594.545776","2018-03-21T13:35:36Z",2018-03-21 13:35:36
"191","Maquipucuna","18/03/2017","1514"," ",NA,NA,NA,NA,NA,NA,NA,NA,NA,NA,"Phaethornis yaruqui","","","","",NA,NA,NA,NA,NA,NA," ","March","2017"," ",-78.629409,0.106248,"1644.961304","2018-03-21T14:07:53Z",2018-03-21 14:07:53
"192","Maquipucuna","18/03/2017","1519"," ",NA,NA,NA,NA,NA,NA,NA,NA,NA,NA,"Ocreatus underwoodii","","","","",NA,NA,NA,NA,NA,NA," ","March","2017"," ",-78.629448,0.105394,"1658.254272","2018-03-21T14:16:35Z",2018-03-21 14:16:35
"193","Maquipucuna","18/03/2017","1523","Macleania recumbens",NA,"2",NA,15,NA,NA,NA,NA,NA,NA,"Ocreatus underwoodii","female","","","",NA,NA,NA,NA,NA,NA,"Macleania recumbens","March","2017","Macleania recumbens",-78.629029,0.104437,"1683.514648","2018-03-21T14:28:19Z",2018-03-21 14:28:19
"194","Maquipucuna","18/03/2017","1530"," ",NA,NA,NA,NA,NA,NA,NA,NA,NA,NA,"Coeligena wilsoni","","","","",NA,NA,NA,NA,NA,NA," ","March","2017"," ",-78.628976,0.103212,"1708.289307","2018-03-21T14:43:38Z",2018-03-21 14:43:38
"195","Maquipucuna","18/03/2017","1536"," ",NA,NA,NA,NA,NA,NA,NA,NA,NA,NA,"Aglaiocercus coelestis","","","","",NA,NA,NA,NA,NA,NA," ","March","2017"," ",-78.628401,0.102382,"1727.599365","2018-03-21T14:54:42Z",2018-03-21 14:54:42
"196","Maquipucuna","18/03/2017","1537"," ",NA,NA,NA,NA,NA,NA,NA,NA,NA,NA,"Ocreatus underwoodii","","","","",NA,NA,NA,NA,NA,NA," ","March","2017"," ",-78.628368,0.10236,"1728.312622","2018-03-21T14:55:05Z",2018-03-21 14:55:05
"197","Maquipucuna","18/03/2017","1550"," ",NA,NA,NA,NA,NA,NA,NA,NA,NA,NA,"Ocreatus underwoodii","","","","",NA,NA,NA,NA,NA,NA," ","March","2017"," ",-78.635336,0.117926,"1371.440674","2018-03-24T12:29:25Z",2018-03-24 12:29:25
"198","Maquipucuna","18/03/2017","1552"," ",NA,NA,NA,NA,NA,NA,NA,NA,NA,NA,"Ocreatus underwoodii","","","","",NA,NA,NA,NA,NA,NA," ","March","2017"," ",-78.635346,0.117864,"1370.227661","2018-03-24T12:30:50Z",2018-03-24 12:30:50
"199","Maquipucuna","18/03/2017","1553"," ",NA,NA,NA,NA,NA,NA,NA,NA,NA,NA,"Heliodoxa jacula","perched 5mtrs(2)","","","",NA,NA,NA,NA,NA,NA," ","March","2017"," ",-78.635367,0.117782,"1369.800537","2018-03-24T12:31:25Z",2018-03-24 12:31:25
"200","Maquipucuna","18/03/2017","1558"," ",NA,NA,NA,NA,NA,NA,NA,NA,NA,NA,"Aglaiocercus coelestis","","","","",NA,NA,NA,NA,NA,NA," ","March","2017"," ",-78.635293,0.117231,"1366.270020","2018-03-24T12:37:07Z",2018-03-24 12:37:07
"201","Maquipucuna","18/03/2017","1559"," ",NA,NA,NA,NA,NA,NA,NA,NA,NA,NA,"Aglaiocercus coelestis","","","","",NA,NA,NA,NA,NA,NA," ","March","2017"," ",-78.635233,0.117189,"1366.292725","2018-03-24T12:37:36Z",2018-03-24 12:37:36
"202","Maquipucuna","18/03/2017","1559"," ",NA,NA,NA,NA,NA,NA,NA,NA,NA,NA,"Aglaiocercus coelestis","","","","",NA,NA,NA,NA,NA,NA," ","March","2017"," ",-78.635233,0.117189,"1366.292725","2018-03-24T12:37:36Z",2018-03-24 12:37:36
"203","Maquipucuna","18/03/2017","1566"," ",NA,NA,NA,NA,NA,NA,NA,NA,NA,NA,"Ocreatus underwoodii","","","","",NA,NA,NA,NA,NA,NA," ","March","2017"," ",-78.634601,0.116149,"1374.752197","2018-03-24T12:50:50Z",2018-03-24 12:50:50
"204","Maquipucuna","18/03/2017","1571"," ",NA,NA,NA,NA,NA,NA,NA,NA,NA,NA,"Ocreatus underwoodii","","","","",NA,NA,NA,NA,NA,NA," ","March","2017"," ",-78.634005,0.115534,"1372.313721","2018-03-24T12:57:01Z",2018-03-24 12:57:01
"205","Maquipucuna","18/03/2017","1558","Columnea kucyniakii","Columnea kucyniakii","5",NA,3,NA,NA,NA,NA,NA,NA,"Ocreatus underwoodii","","","","",NA,NA,NA,NA,NA,NA,"Columnea kucyniakii","March","2017","Columnea kucyniakii",-78.635293,0.117231,"1366.270020","2018-03-24T12:37:07Z",2018-03-24 12:37:07
"206","Maquipucuna","5/4/17","1847"," ",NA,NA,NA,NA,NA,NA,NA,NA,NA,NA,"Phaethornis yaruqui","","","","",NA,NA,NA,NA,NA,NA," ","April","17"," ",-78.628671,0.108464,"1537.425415","2017-04-05T12:33:47Z",2017-04-05 12:33:47
"207","Maquipucuna","5/4/17","1856","Columnea ciliata","Columnea ciliata","2",NA,1,NA,NA,NA,NA,NA,NA,"Phaethornis syrmatophorus","Flying / hovering (15)","","","",NA,NA,NA,NA,NA,NA,"Columnea ciliata","April","17","Columnea ciliata",-78.628718,0.107563,"1567.341553","2017-04-05T12:53:44Z",2017-04-05 12:53:44
"208","Maquipucuna","5/4/17","1863"," ",NA,NA,NA,NA,NA,NA,NA,NA,NA,NA,"Ocreatus underwoodii","","","","",NA,NA,NA,NA,NA,NA," ","April","17"," ",-78.62934,0.107394,"1576.817139","2017-04-05T13:07:44Z",2017-04-05 13:07:44
"209","Maquipucuna","5/4/17","1871"," ",NA,NA,NA,NA,NA,NA,NA,NA,NA,NA,"Ocreatus underwoodii","","","","",NA,NA,NA,NA,NA,NA," ","April","17"," ",-78.628944,0.106893,"1602.531494","2017-04-05T13:24:57Z",2017-04-05 13:24:57
"210","Maquipucuna","5/4/17","1872"," ",NA,NA,NA,NA,NA,NA,NA,NA,NA,NA,"Ocreatus underwoodii","","","","",NA,NA,NA,NA,NA,NA," ","April","17"," ",-78.628742,0.106926,"1604.526123","2017-04-05T13:27:08Z",2017-04-05 13:27:08
"211","Maquipucuna","5/4/17","1874"," ",NA,NA,NA,NA,NA,NA,NA,NA,NA,NA,"Ocreatus underwoodii","","","","",NA,NA,NA,NA,NA,NA," ","April","17"," ",-78.628901,0.106366,"1632.237915","2017-04-05T13:39:30Z",2017-04-05 13:39:30
"212","Maquipucuna","5/4/17","1876"," ",NA,NA,NA,NA,NA,NA,NA,NA,NA,NA,"Ocreatus underwoodii","male","","","",NA,NA,NA,NA,NA,NA," ","April","17"," ",-78.629257,0.106378,"1638.674438","2017-04-05T13:43:54Z",2017-04-05 13:43:54
"213","Maquipucuna","5/4/17","1876"," ",NA,NA,NA,NA,NA,NA,NA,NA,NA,NA,"Ocreatus underwoodii","","","","",NA,NA,NA,NA,NA,NA," ","April","17"," ",-78.629257,0.106378,"1638.674438","2017-04-05T13:43:54Z",2017-04-05 13:43:54
"214","Maquipucuna","5/4/17","1891"," ",NA,NA,NA,NA,NA,NA,NA,NA,NA,NA,"Coeligena wilsoni","","","","",NA,NA,NA,NA,NA,NA," ","April","17"," ",-78.629302,0.104688,"1666.055908","2017-04-05T14:08:36Z",2017-04-05 14:08:36
"215","Maquipucuna","5/4/17","1894","Palicourea demissa","Palicourea demissa","5",NA,9,NA,NA,NA,NA,NA,NA,"Ocreatus underwoodii","male","","","",NA,NA,NA,NA,NA,NA,"Palicourea demissa","April","17","Palicourea demissa",-78.629007,0.104465,"1678.967041","2017-04-05T14:14:02Z",2017-04-05 14:14:02
"216","Maquipucuna","5/4/17","1898"," ",NA,NA,NA,NA,NA,NA,NA,NA,NA,NA,"Coeligena wilsoni","","","","",NA,NA,NA,NA,NA,NA," ","April","17"," ",-78.629026,0.104031,"1690.042236","2017-04-05T14:18:41Z",2017-04-05 14:18:41
"217","Maquipucuna","5/4/17","1899"," ",NA,NA,NA,NA,NA,NA,NA,NA,NA,NA,"Aglaiocercus coelestis","","","","",NA,NA,NA,NA,NA,NA," ","April","17"," ",-78.628958,0.104009,"1692.923950","2017-04-05T14:24:19Z",2017-04-05 14:24:19
"218","Maquipucuna","5/4/17","1911","Palicourea demissa","Palicourea demissa","4",NA,5,NA,NA,NA,NA,NA,NA,"aglaiocercus coelestis","","","","",NA,NA,NA,NA,NA,NA,"Palicourea demissa","April","17","Palicourea demissa",-78.628684,0.102853,"1717.025513","2017-04-05T14:41:03Z",2017-04-05 14:41:03
"219","Maquipucuna","11/5/17","509","Palicourea demissa","Palicourea demissa","6",NA,24,NA,NA,NA,NA,NA,NA,"Ocreatus underwoodii","female","","","",NA,NA,NA,NA,NA,NA,"Palicourea demissa","May","17","Palicourea demissa",-78.628737,0.108345,"1530.546875","2017-05-11T13:02:19Z",2017-05-11 13:02:19
"220","Maquipucuna","11/5/17","519","",NA,NA,NA,NA,NA,NA,NA,NA,NA,NA,"Phaethornis yaruqui","","heard only","","",NA,NA,NA,NA,NA,NA,"","May","17","",-78.628993,0.107464,"1567.194458","2017-05-11T13:23:35Z",2017-05-11 13:23:35
"221","Maquipucuna","11/5/17","522","Palicourea demissa","Palicourea demissa","5",NA,1,NA,NA,NA,NA,NA,NA,"Ocreatus underwoodii"," feeding (1)","male","","",NA,NA,NA,NA,NA,NA,"Palicourea demissa","May","17","Palicourea demissa",-78.62945,0.107325,"1574.102539","2017-05-11T13:28:13Z",2017-05-11 13:28:13
"222","Maquipucuna","11/5/17","528","",NA,NA,NA,NA,NA,NA,NA,NA,NA,NA,"Ocreatus underwoodii","","heard only","","",NA,NA,NA,NA,NA,NA,"","May","17","",-78.628935,0.106802,"1603.356567","2017-05-11T13:46:49Z",2017-05-11 13:46:49
"223","Maquipucuna","11/5/17","537","",NA,NA,NA,NA,NA,NA,NA,NA,NA,NA,"Phaethornis syrmatophorus","Hovering (8)","  flying (2)","","",NA,NA,NA,NA,NA,NA,"","May","17","",-78.628626,0.10653,"1624.991577","2017-05-11T14:05:43Z",2017-05-11 14:05:43
"224","Maquipucuna","11/5/17","539","",NA,NA,NA,NA,NA,NA,NA,NA,NA,NA,"Phaethornis yaruqui","","heard only","","",NA,NA,NA,NA,NA,NA,"","May","17","",-78.629031,0.106341,"1638.025513","2017-05-11T14:11:54Z",2017-05-11 14:11:54
"225","Maquipucuna","11/5/17","543","",NA,NA,NA,NA,NA,NA,NA,NA,NA,NA,"Ocreatus underwoodii","","heard only","","",NA,NA,NA,NA,NA,NA,"","May","17","",-78.629354,0.106218,"1642.082275","2017-05-11T14:16:51Z",2017-05-11 14:16:51
"226","Maquipucuna","11/5/17","548","",NA,NA,NA,NA,NA,NA,NA,NA,NA,NA,"Aglaiocercus coelestis","","heard only","","",NA,NA,NA,NA,NA,NA,"","May","17","",-78.629648,0.105818,"1648.424194","2017-05-11T14:22:29Z",2017-05-11 14:22:29
"227","Maquipucuna","11/5/17","554","",NA,NA,NA,NA,NA,NA,NA,NA,NA,NA,"Urosticte benjamini"," perched 4mtrs (5)","  flying (2)","female","",NA,NA,NA,NA,NA,NA,"","May","17","",-78.629434,0.105254,"1661.008301","2017-05-11T14:34:51Z",2017-05-11 14:34:51
"228","Maquipucuna","11/5/17","558","",NA,NA,NA,NA,NA,NA,NA,NA,NA,NA,"Aglaiocercus coelestis","","heard only","","",NA,NA,NA,NA,NA,NA,"","May","17","",-78.629005,0.104283,"1684.250610","2017-05-11T14:44:42Z",2017-05-11 14:44:42
"229","Maquipucuna","11/5/17","565","",NA,NA,NA,NA,NA,NA,NA,NA,NA,NA,"Coeligena wilsoni","","heard only","","",NA,NA,NA,NA,NA,NA,"","May","17","",-78.628627,0.102719,"1716.905762","2017-05-11T15:01:47Z",2017-05-11 15:01:47
"230","Maquipucuna","11/5/17","571","",NA,NA,NA,NA,NA,NA,NA,NA,NA,NA,"Coeligena wilsoni","Flying (2)","","","",NA,NA,NA,NA,NA,NA,"","May","17","",-78.627806,0.102387,"1712.042114","2017-05-11T15:15:21Z",2017-05-11 15:15:21
"231","Maquipucuna","9/6/17","624","",NA,NA,NA,NA,NA,NA,NA,NA,NA,NA,"Ocreatus underwoodii","","heard only","","",NA,NA,NA,NA,NA,NA,"","June","17","",-78.628762,0.108341,"1485.924927","2017-06-09T13:41:39Z",2017-06-09 13:41:39
"232","Maquipucuna","9/6/17","625","",NA,NA,NA,NA,NA,NA,NA,NA,NA,NA,"Ocreatus underwoodii","","heard only","","",NA,NA,NA,NA,NA,NA,"","June","17","",-78.62887,0.108257,"1494.085205","2017-06-09T13:43:37Z",2017-06-09 13:43:37
"233","Maquipucuna","9/6/17","632","",NA,NA,NA,NA,NA,NA,NA,NA,NA,NA,"Heliodoxa jacula","","heard only","","",NA,NA,NA,NA,NA,NA,"","June","17","",-78.628813,0.107816,"1534.105469","2017-06-09T13:59:34Z",2017-06-09 13:59:34
"234","Maquipucuna","9/6/17","634","",NA,NA,NA,NA,NA,NA,NA,NA,NA,NA,"Ocreatus underwoodii","","heard only","","",NA,NA,NA,NA,NA,NA,"","June","17","",-78.628724,0.107602,"1541.582520","2017-06-09T14:03:13Z",2017-06-09 14:03:13
"235","Maquipucuna","9/6/17","638","",NA,NA,NA,NA,NA,NA,NA,NA,NA,NA,"Ocreatus underwoodii","","heard only","","",NA,NA,NA,NA,NA,NA,"","June","17","",-78.62927,0.107348,"1558.262085","2017-06-09T14:10:59Z",2017-06-09 14:10:59
"236","Maquipucuna","9/6/17","640","",NA,NA,NA,NA,NA,NA,NA,NA,NA,NA,"Phaethornis striigularis","hovering/flying (25)","  perched 2mtrs (5)"," flying (2)","",NA,NA,NA,NA,NA,NA,"","June","17","",-78.629411,0.107261,"1562.493408","2017-06-09T14:13:47Z",2017-06-09 14:13:47
"237","Maquipucuna","9/6/17","642","Palicourea demissa","Palicourea demissa","4",NA,4,NA,NA,NA,NA,NA,NA,"Ocreatus underwoodii","female","","","",NA,NA,NA,NA,NA,NA,"Palicourea demissa","June","17","Palicourea demissa",-78.629631,0.107073,"1569.611084","2017-06-09T14:16:47Z",2017-06-09 14:16:47
"238","Maquipucuna","9/6/17","646","",NA,NA,NA,NA,NA,NA,NA,NA,NA,NA,"Ocreatus underwoodii","","heard only","","",NA,NA,NA,NA,NA,NA,"","June","17","",-78.629533,0.106945,"1579.882935","2017-06-09T14:21:43Z",2017-06-09 14:21:43
"239","Maquipucuna","9/6/17","648","Palicourea demissa","Palicourea demissa","4",NA,18,NA,NA,NA,NA,NA,NA,"Aglaiocercus coelestis"," feeding (45)","female","","",NA,NA,NA,NA,NA,NA,"Palicourea demissa","June","17","Palicourea demissa",-78.629414,0.107024,"1584.925049","2017-06-09T14:24:32Z",2017-06-09 14:24:32
"240","Maquipucuna","9/6/17","648","",NA,NA,NA,NA,NA,NA,NA,NA,NA,NA,"Schistes geoffroyi","piercing closed flowers of W. Ferox (10)","  flying (1) ","","",NA,NA,NA,NA,NA,NA,"","June","17","",-78.629414,0.107024,"1584.925049","2017-06-09T14:24:32Z",2017-06-09 14:24:32
"241","Maquipucuna","9/6/17","650","",NA,NA,NA,NA,NA,NA,NA,NA,NA,NA,"Phaethornis yaruqui","","heard only","","",NA,NA,NA,NA,NA,NA,"","June","17","",-78.629222,0.107006,"1589.349854","2017-06-09T14:27:22Z",2017-06-09 14:27:22
"242","Maquipucuna","9/6/17","655","",NA,NA,NA,NA,NA,NA,NA,NA,NA,NA,"Ocreatus underwoodii","","heard only","","",NA,NA,NA,NA,NA,NA,"","June","17","",-78.628453,0.106798,"1607.144043","2017-06-09T14:39:00Z",2017-06-09 14:39:00
"243","Maquipucuna","9/6/17","662","",NA,NA,NA,NA,NA,NA,NA,NA,NA,NA,"Ocreatus underwoodii","","heard only","","",NA,NA,NA,NA,NA,NA,"","June","17","",-78.628821,0.106444,"1630.819092","2017-06-09T14:55:23Z",2017-06-09 14:55:23
"244","Maquipucuna","9/6/17","689","",NA,NA,NA,NA,NA,NA,NA,NA,NA,NA,"Ocreatus underwoodii","","heard only","","",NA,NA,NA,NA,NA,NA,"","June","17","",-78.628939,0.103392,"1707.576904","2017-06-09T15:47:45Z",2017-06-09 15:47:45
"245","Maquipucuna","9/6/17","695","",NA,NA,NA,NA,NA,NA,NA,NA,NA,NA,"Coeligena wilsoni","","heard only","","",NA,NA,NA,NA,NA,NA,"","June","17","",-78.628597,0.102799,"1721.245972","2017-06-09T15:56:12Z",2017-06-09 15:56:12
"246","Maquipucuna","9/6/17","695","",NA,NA,NA,NA,NA,NA,NA,NA,NA,NA,"Aglaiocercus coelestis","","heard only","","",NA,NA,NA,NA,NA,NA,"","June","17","",-78.628597,0.102799,"1721.245972","2017-06-09T15:56:12Z",2017-06-09 15:56:12
"247","Maquipucuna","9/6/17","696","",NA,NA,NA,NA,NA,NA,NA,NA,NA,NA,"Colibri delphinae","","heard only","","",NA,NA,NA,NA,NA,NA,"","June","17","",-78.628472,0.102499,"1727.145752","2017-06-09T16:00:54Z",2017-06-09 16:00:54
"248","Maquipucuna","9/6/17","699","",NA,NA,NA,NA,NA,NA,NA,NA,NA,NA,"Coeligena wilsoni","","heard only","","",NA,NA,NA,NA,NA,NA,"","June","17","",-78.628264,0.10226,"1733.476440","2017-06-09T16:04:11Z",2017-06-09 16:04:11
"249","Maquipucuna","9/6/17","703","",NA,NA,NA,NA,NA,NA,NA,NA,NA,NA,"Ocreatus underwoodii","","heard only","","",NA,NA,NA,NA,NA,NA,"","June","17","",-78.627838,0.102426,"1718.509766","2017-06-09T16:10:59Z",2017-06-09 16:10:59
"250","Maquipucuna","13/07/2017","1499","",NA,NA,NA,NA,NA,NA,NA,NA,NA,NA,"Ocreatus underwoodii","","heard only","","",NA,NA,NA,NA,NA,NA,"","July","2017","",-78.62848,0.108777,"1524.242554","2017-07-13T12:24:50Z",2017-07-13 12:24:50
"251","Maquipucuna","13/07/2017","1499","",NA,NA,NA,NA,NA,NA,NA,NA,NA,NA,"Phaethornis yaruqui","","heard only","","",NA,NA,NA,NA,NA,NA,"","July","2017","",-78.62848,0.108777,"1524.242554","2017-07-13T12:24:50Z",2017-07-13 12:24:50
"252","Maquipucuna","13/07/2017","1500","Palicourea demissa","Palicourea demissa","5",NA,28,NA,NA,NA,NA,NA,NA,"Colibri delphinae","Feeding (60)","","","",NA,NA,NA,NA,NA,NA,"Palicourea demissa","July","2017","Palicourea demissa",-78.628546,0.108765,"1527.015991","2017-07-13T12:26:23Z",2017-07-13 12:26:23
"253","Maquipucuna","13/07/2017","1505","",NA,NA,NA,NA,NA,NA,NA,NA,NA,NA,"Ocreatus underwoodii","","heard only","","",NA,NA,NA,NA,NA,NA,"","July","2017","",-78.628648,0.108409,"1537.551025","2017-07-13T12:37:47Z",2017-07-13 12:37:47
"254","Maquipucuna","13/07/2017","1508","Palicourea demissa","Palicourea demissa","5",NA,2,NA,NA,NA,NA,NA,NA,"Phaethornis yaruqui","","heard only","","",NA,NA,NA,NA,NA,NA,"Palicourea demissa","July","2017","Palicourea demissa",-78.628906,0.10815,"1545.340820","2017-07-13T12:41:53Z",2017-07-13 12:41:53
"255","Maquipucuna","13/07/2017","1522","",NA,NA,NA,NA,NA,NA,NA,NA,NA,NA,"Ocreatus underwoodii","","heard only","","",NA,NA,NA,NA,NA,NA,"","July","2017","",-78.629415,0.107319,"1574.925415","2017-07-13T13:07:58Z",2017-07-13 13:07:58
"256","Maquipucuna","13/07/2017","1529","",NA,NA,NA,NA,NA,NA,NA,NA,NA,NA,"Aglaiocercus coelestis","","heard only","","",NA,NA,NA,NA,NA,NA,"","July","2017","",-78.629308,0.106998,"1593.798218","2017-07-13T13:18:54Z",2017-07-13 13:18:54
"257","Maquipucuna","13/07/2017","1532","",NA,NA,NA,NA,NA,NA,NA,NA,NA,NA,"Coeligena wilsoni","","heard only","","",NA,NA,NA,NA,NA,NA,"","July","2017","",-78.628931,0.106918,"1601.439087","2017-07-13T13:22:56Z",2017-07-13 13:22:56
"258","Maquipucuna","13/07/2017","1533","",NA,NA,NA,NA,NA,NA,NA,NA,NA,NA,"Ocreatus underwoodii","","heard only","","",NA,NA,NA,NA,NA,NA,"","July","2017","",-78.628722,0.106993,"1602.900024","2017-07-13T13:24:46Z",2017-07-13 13:24:46
"259","Maquipucuna","13/07/2017","1536","",NA,NA,NA,NA,NA,NA,NA,NA,NA,NA,"Ocreatus underwoodii","","heard only","","",NA,NA,NA,NA,NA,NA,"","July","2017","",-78.628505,0.107,"1604.451904","2017-07-13T13:29:01Z",2017-07-13 13:29:01
"260","Maquipucuna","13/07/2017","1538","",NA,NA,NA,NA,NA,NA,NA,NA,NA,NA,"Ocreatus underwoodii","","heard only","","",NA,NA,NA,NA,NA,NA,"","July","2017","",-78.628574,0.106917,"1613.131958","2017-07-13T13:31:55Z",2017-07-13 13:31:55
"261","Maquipucuna","13/07/2017","1539","",NA,NA,NA,NA,NA,NA,NA,NA,NA,NA,"Colibri delphinae","","heard only","","",NA,NA,NA,NA,NA,NA,"","July","2017","",-78.628563,0.106705,"1617.239136","2017-07-13T13:33:54Z",2017-07-13 13:33:54
"262","Maquipucuna","13/07/2017","1547","",NA,NA,NA,NA,NA,NA,NA,NA,NA,NA,"Ocreatus underwoodii","","heard only","","",NA,NA,NA,NA,NA,NA,"","July","2017","",-78.62885,0.1065,"1630.348877","2017-07-13T13:45:21Z",2017-07-13 13:45:21
"263","Maquipucuna","13/07/2017","1563","Palicourea demissa","Palicourea demissa","5",NA,6,NA,NA,NA,NA,NA,NA,"Ocreatus underwoodii"," Feeding (3)"," flying (2)","male","",NA,NA,NA,NA,NA,NA,"Palicourea demissa","July","2017","Palicourea demissa",-78.629437,0.10515,"1657.333984","2017-07-13T14:11:56Z",2017-07-13 14:11:56
"264","Maquipucuna","13/07/2017","1566","",NA,NA,NA,NA,NA,NA,NA,NA,NA,NA,"Ocreatus underwoodii","","heard only","","",NA,NA,NA,NA,NA,NA,"","July","2017","",-78.629372,0.10495,"1662.849609","2017-07-13T14:19:19Z",2017-07-13 14:19:19
"265","Maquipucuna","13/07/2017","1582","",NA,NA,NA,NA,NA,NA,NA,NA,NA,NA,"Colibri delphinae","","heard only","","",NA,NA,NA,NA,NA,NA,"","July","2017","",-78.628974,0.103009,"1714.193481","2017-07-13T14:49:28Z",2017-07-13 14:49:28
"266","Maquipucuna","13/07/2017","1582","",NA,NA,NA,NA,NA,NA,NA,NA,NA,NA,"Ocreatus underwoodii","","heard only","","",NA,NA,NA,NA,NA,NA,"","July","2017","",-78.628974,0.103009,"1714.193481","2017-07-13T14:49:28Z",2017-07-13 14:49:28
"267","Maquipucuna","13/07/2017","1583","",NA,NA,NA,NA,NA,NA,NA,NA,NA,NA,"Aglaiocercus coelestis","","heard only","","",NA,NA,NA,NA,NA,NA,"","July","2017","",-78.628904,0.102936,"1713.808838","2017-07-13T14:50:46Z",2017-07-13 14:50:46
"268","Maquipucuna","13/07/2017","1583","",NA,NA,NA,NA,NA,NA,NA,NA,NA,NA,"Ocreatus underwoodii","","heard only","","",NA,NA,NA,NA,NA,NA,"","July","2017","",-78.628904,0.102936,"1713.808838","2017-07-13T14:50:46Z",2017-07-13 14:50:46
"269","Maquipucuna","13/07/2017","1591","",NA,NA,NA,NA,NA,NA,NA,NA,NA,NA,"Ocreatus underwoodii","","heard only","","",NA,NA,NA,NA,NA,NA,"","July","2017","",-78.628026,0.102259,"1719.145996","2017-07-13T15:01:13Z",2017-07-13 15:01:13
"270","Maquipucuna","13/08/2017","1657","Columnea mastersonii","Columnea eburnea","5",NA,4,NA,NA,NA,NA,NA,NA,"Phaethornis syrmatophorus","Feeding (4)","  flying (1)","","",NA,NA,NA,NA,NA,NA,"Columnea eburnea","August","2017","Columnea eburnea",-78.628552,0.106761,"1616.791626","2018-08-22T14:00:01Z",2018-08-22 14:00:01
"271","Maquipucuna","13/08/2017","1660","Heliconia virginalis","Heliconia virginalis","3",NA,2,NA,NA,NA,NA,NA,NA,"Thalurania fannyi","Feeding (2)"," flying (3)","male","",NA,NA,NA,NA,NA,NA,"Heliconia virginalis","August","2017","Heliconia virginalis",-78.628861,0.106404,"1632.626831","2018-08-22T14:05:21Z",2018-08-22 14:05:21
"272","Maquipucuna","13/08/2017","1663","",NA,NA,NA,NA,NA,NA,NA,NA,NA,NA,"Phaethornis yaruqui","","heard only","","",NA,NA,NA,NA,NA,NA,"","August","2017","",-78.629351,0.106294,"1640.864258","2018-08-22T14:08:48Z",2018-08-22 14:08:48
"273","Maquipucuna","13/08/2017","1663","",NA,NA,NA,NA,NA,NA,NA,NA,NA,NA,"Ocreatus underwoodii","","heard only","","",NA,NA,NA,NA,NA,NA,"","August","2017","",-78.629351,0.106294,"1640.864258","2018-08-22T14:08:48Z",2018-08-22 14:08:48
"274","Maquipucuna","13/08/2017","1665","",NA,NA,NA,NA,NA,NA,NA,NA,NA,NA,"Phaethornis syrmatophorus","Hoverflying (10)","  flying (1)","","",NA,NA,NA,NA,NA,NA,"","August","2017","",-78.629512,0.106038,"1646.243408","2018-08-22T14:10:56Z",2018-08-22 14:10:56
"275","Maquipucuna","13/08/2017","1669","",NA,NA,NA,NA,NA,NA,NA,NA,NA,NA,"Aglaiocercus coelestis","","heard only","","",NA,NA,NA,NA,NA,NA,"","August","2017","",-78.629586,0.105635,"1653.396484","2018-08-22T14:14:39Z",2018-08-22 14:14:39
"276","Maquipucuna","13/08/2017","1674","",NA,NA,NA,NA,NA,NA,NA,NA,NA,NA,"Ocreatus underwoodii","","heard only","","",NA,NA,NA,NA,NA,NA,"","August","2017","",-78.629194,0.104398,"1680.400513","2018-08-22T14:36:13Z",2018-08-22 14:36:13
"277","Maquipucuna","13/08/2017","1691","",NA,NA,NA,NA,NA,NA,NA,NA,NA,NA,"Ocreatus underwoodii","","heard only","","",NA,NA,NA,NA,NA,NA,"","August","2017","",-78.627818,0.102269,"1713.964600","2018-08-22T15:09:24Z",2018-08-22 15:09:24
"278","Maquipucuna","13/08/2017","1694","Columnea picta",NA,"5",NA,2,NA,NA,NA,NA,NA,NA,"Phaethornis syrmatophorus","Flying (1)","  Feeding (2)"," Hovering (3)","  flying (2)",NA,NA,NA,NA,NA,NA,"Columnea picta","August","2017","Columnea picta",-78.627559,0.102274,"1711.939331","2018-08-22T15:12:20Z",2018-08-22 15:12:20
"279","Maquipucuna","13/08/2017","1697","",NA,NA,NA,NA,NA,NA,NA,NA,NA,NA,"Ocreatus underwoodii","Flying (3)","male","","",NA,NA,NA,NA,NA,NA,"","August","2017","",-78.635188,0.11858,"1378.795166","2018-08-25T12:55:48Z",2018-08-25 12:55:48
"280","Maquipucuna","13/08/2017","1702","",NA,NA,NA,NA,NA,NA,NA,NA,NA,NA,"Ocreatus underwoodii","","heard only","","",NA,NA,NA,NA,NA,NA,"","August","2017","",-78.635324,0.118125,"1377.887695","2018-08-25T13:01:02Z",2018-08-25 13:01:02
"281","Maquipucuna","13/08/2017","1704","",NA,NA,NA,NA,NA,NA,NA,NA,NA,NA,"Ocreatus underwoodii","Flying (3)","female","","",NA,NA,NA,NA,NA,NA,"","August","2017","",-78.635374,0.11792,"1376.413696","2018-08-25T13:02:29Z",2018-08-25 13:02:29
"282","Maquipucuna","13/08/2017","1706","Palicourea demissa","Palicourea demissa","6",NA,17,NA,NA,NA,NA,NA,NA,"Ocreatus underwoodii","Feeding (5)","female","","",NA,NA,NA,NA,NA,NA,"Palicourea demissa","August","2017","Palicourea demissa",-78.63527,0.117188,"1369.342285","2018-08-25T13:07:47Z",2018-08-25 13:07:47
"283","Maquipucuna","13/08/2017","1742","",NA,NA,NA,NA,NA,NA,NA,NA,NA,NA,"Ocreatus underwoodii","","heard only","","",NA,NA,NA,NA,NA,NA,"","August","2017","",-78.627886,0.102288,"1718.756348","2017-08-13T15:31:04Z",2017-08-13 15:31:04
"284","Maquipucuna","13/08/2017","1743","Palicourea demissa","Palicourea demissa","4",NA,3,NA,NA,NA,NA,NA,NA,"Ocreatus underwoodii","Feeding (2)","female","","",NA,NA,NA,NA,NA,NA,"Palicourea demissa","August","2017","Palicourea demissa",-78.627857,0.102361,"1716.212402","2017-08-13T15:32:15Z",2017-08-13 15:32:15
"285","Maquipucuna","13/09/2017","135","",NA,NA,NA,NA,NA,NA,NA,NA,NA,NA,"Ocreatus underwoodii","","heard only","","",NA,NA,NA,NA,NA,NA,"","September","2017","",-78.628556,0.108528,"1545.913086","2017-09-13T12:25:25Z",2017-09-13 12:25:25
"286","Maquipucuna","13/09/2017","144","",NA,NA,NA,NA,NA,NA,NA,NA,NA,NA,"Ocreatus underwoodii","","heard only","","",NA,NA,NA,NA,NA,NA,"","September","2017","",-78.628793,0.107801,"1566.850342","2017-09-13T12:42:38Z",2017-09-13 12:42:38
"287","Maquipucuna","13/09/2017","158","",NA,NA,NA,NA,NA,NA,NA,NA,NA,NA,"Colibri delphinae","perched 6mtrs (60)","","","",NA,NA,NA,NA,NA,NA,"","September","2017","",-78.629249,0.107365,"1579.691650","2017-09-13T12:59:02Z",2017-09-13 12:59:02
"288","Maquipucuna","13/09/2017","160","",NA,NA,NA,NA,NA,NA,NA,NA,NA,NA,"Ocreatus underwoodii","","heard only","","",NA,NA,NA,NA,NA,NA,"","September","2017","",-78.629482,0.107284,"1582.266724","2017-09-13T13:01:50Z",2017-09-13 13:01:50
"289","Maquipucuna","13/09/2017","162","",NA,NA,NA,NA,NA,NA,NA,NA,NA,NA,"Ocreatus underwoodii","","heard only","","",NA,NA,NA,NA,NA,NA,"","September","2017","",-78.629747,0.10691,"1589.165161","2017-09-13T13:06:05Z",2017-09-13 13:06:05
"290","Maquipucuna","13/09/2017","172","",NA,NA,NA,NA,NA,NA,NA,NA,NA,NA,"Colibri delphinae","","heard only","","",NA,NA,NA,NA,NA,NA,"","September","2017","",-78.628538,0.106749,"1619.570068","2017-09-13T13:26:41Z",2017-09-13 13:26:41
"291","Maquipucuna","13/09/2017","177","",NA,NA,NA,NA,NA,NA,NA,NA,NA,NA,"Coeligena wilsoni","","heard only","","",NA,NA,NA,NA,NA,NA,"","September","2017","",-78.628824,0.106439,"1633.950195","2017-09-13T13:36:03Z",2017-09-13 13:36:03
"292","Maquipucuna","13/09/2017","177","",NA,NA,NA,NA,NA,NA,NA,NA,NA,NA,"Ocreatus underwoodii","","heard only","","",NA,NA,NA,NA,NA,NA,"","September","2017","",-78.628824,0.106439,"1633.950195","2017-09-13T13:36:03Z",2017-09-13 13:36:03
"293","Maquipucuna","13/09/2017","187","",NA,NA,NA,NA,NA,NA,NA,NA,NA,NA,"Ocreatus underwoodii","","heard only","","",NA,NA,NA,NA,NA,NA,"","September","2017","",-78.629587,0.105578,"1653.612549","2017-09-13T13:50:11Z",2017-09-13 13:50:11
"294","Maquipucuna","13/09/2017","187","",NA,NA,NA,NA,NA,NA,NA,NA,NA,NA,"Ocreatus underwoodii","","heard only","","",NA,NA,NA,NA,NA,NA,"","September","2017","",-78.629587,0.105578,"1653.612549","2017-09-13T13:50:11Z",2017-09-13 13:50:11
"295","Maquipucuna","13/09/2017","188","",NA,NA,NA,NA,NA,NA,NA,NA,NA,NA,"Coeligena wilsoni","","heard only","","",NA,NA,NA,NA,NA,NA,"","September","2017","",-78.629448,0.105173,"1657.505737","2017-09-13T13:52:59Z",2017-09-13 13:52:59
"296","Maquipucuna","13/09/2017","189","",NA,NA,NA,NA,NA,NA,NA,NA,NA,NA,"Ocreatus underwoodii","","heard only","","",NA,NA,NA,NA,NA,NA,"","September","2017","",-78.629378,0.104914,"1662.235474","2017-09-13T13:55:54Z",2017-09-13 13:55:54
"297","Maquipucuna","13/09/2017","189","",NA,NA,NA,NA,NA,NA,NA,NA,NA,NA,"Colibri delphinae","","heard only","","",NA,NA,NA,NA,NA,NA,"","September","2017","",-78.629378,0.104914,"1662.235474","2017-09-13T13:55:54Z",2017-09-13 13:55:54
"298","Maquipucuna","13/09/2017","193","",NA,NA,NA,NA,NA,NA,NA,NA,NA,NA,"Colibri delphinae","","heard only","","",NA,NA,NA,NA,NA,NA,"","September","2017","",-78.629023,0.104249,"1682.823975","2017-09-13T14:03:34Z",2017-09-13 14:03:34
"299","Maquipucuna","8/10/17","603","",NA,NA,NA,NA,NA,NA,NA,NA,NA,NA,"Aglaiocercus coelestis","","heard only","","",NA,NA,NA,NA,NA,NA,"","October","17","",-78.628637,0.109006,"1533.497314","2017-10-08T12:37:47Z",2017-10-08 12:37:47
"300","Maquipucuna","8/10/17","604","",NA,NA,NA,NA,NA,NA,NA,NA,NA,NA,"Ocreatus underwoodii","","heard only","","",NA,NA,NA,NA,NA,NA,"","October","17","",-78.628599,0.108972,"1534.193115","2017-10-08T12:38:12Z",2017-10-08 12:38:12
"301","Maquipucuna","8/10/17","608","",NA,NA,NA,NA,NA,NA,NA,NA,NA,NA,"Ocreatus underwoodii","","heard only","","",NA,NA,NA,NA,NA,NA,"","October","17","",-78.628598,0.108732,"1537.763062","2017-10-08T12:42:01Z",2017-10-08 12:42:01
"302","Maquipucuna","8/10/17","613","",NA,NA,NA,NA,NA,NA,NA,NA,NA,NA,"Colibri delphinae","","heard only","","",NA,NA,NA,NA,NA,NA,"","October","17","",-78.628888,0.108197,"1553.576660","2017-10-08T12:52:19Z",2017-10-08 12:52:19
"303","Maquipucuna","8/10/17","615","",NA,NA,NA,NA,NA,NA,NA,NA,NA,NA,"Ocreatus underwoodii","","heard only","","",NA,NA,NA,NA,NA,NA,"","October","17","",-78.628933,0.108088,"1555.365967","2017-10-08T12:53:39Z",2017-10-08 12:53:39
"304","Maquipucuna","8/10/17","626","",NA,NA,NA,NA,NA,NA,NA,NA,NA,NA,"Ocreatus underwoodii","","heard only","","",NA,NA,NA,NA,NA,NA,"","October","17","",-78.628709,0.107719,"1568.912231","2017-10-08T13:06:31Z",2017-10-08 13:06:31
"305","Maquipucuna","8/10/17","635","",NA,NA,NA,NA,NA,NA,NA,NA,NA,NA,"Ocreatus underwoodii","","heard only","","",NA,NA,NA,NA,NA,NA,"","October","17","",-78.628952,0.10759,"1580.475952","2017-10-08T13:20:21Z",2017-10-08 13:20:21
"306","Maquipucuna","8/10/17","636","",NA,NA,NA,NA,NA,NA,NA,NA,NA,NA,"Phaethornis syrmatophorus","flying  hovering (2) flying (1)","","","",NA,NA,NA,NA,NA,NA,"","October","17","",-78.628988,0.107591,"1582.119629","2017-10-08T13:25:21Z",2017-10-08 13:25:21
"307","Maquipucuna","8/10/17","639","",NA,NA,NA,NA,NA,NA,NA,NA,NA,NA,"Phaethornis striigularis","approaching several B. Multiflora","","","",NA,NA,NA,NA,NA,NA,"","October","17","",-78.629253,0.107501,"1585.938965","2017-10-08T13:28:24Z",2017-10-08 13:28:24
"308","Maquipucuna","8/10/17","641","",NA,NA,NA,NA,NA,NA,NA,NA,NA,NA,"Ocreatus underwoodii"," flying in treetops (15)","female"," There was lots of Ericaceae leaves","",NA,NA,NA,NA,NA,NA,"","October","17","",-78.629244,0.107521,"1586.543457","2017-10-08T13:29:37Z",2017-10-08 13:29:37
"309","Maquipucuna","8/10/17","646","",NA,NA,NA,NA,NA,NA,NA,NA,NA,NA,"Colibri coruscans","","heard only","","",NA,NA,NA,NA,NA,NA,"","October","17","",-78.62956,0.107218,"1592.234375","2017-10-08T13:34:57Z",2017-10-08 13:34:57
"310","Maquipucuna","8/10/17","654","",NA,NA,NA,NA,NA,NA,NA,NA,NA,NA,"Colibri coruscans","","heard only","","",NA,NA,NA,NA,NA,NA,"","October","17","",-78.629369,0.107048,"1603.377075","2017-10-08T13:43:35Z",2017-10-08 13:43:35
"311","Maquipucuna","8/10/17","654","",NA,NA,NA,NA,NA,NA,NA,NA,NA,NA,"Colibri coruscans","","heard only","","",NA,NA,NA,NA,NA,NA,"","October","17","",-78.629369,0.107048,"1603.377075","2017-10-08T13:43:35Z",2017-10-08 13:43:35
"312","Maquipucuna","8/10/17","665","",NA,NA,NA,NA,NA,NA,NA,NA,NA,NA,"Ocreatus underwoodii"," perched 3mtrs (5)","  flying (1)","female","",NA,NA,NA,NA,NA,NA,"","October","17","",-78.628655,0.106728,"1629.007080","2017-10-08T13:58:53Z",2017-10-08 13:58:53
"313","Maquipucuna","8/10/17","671","",NA,NA,NA,NA,NA,NA,NA,NA,NA,NA,"Ocreatus underwoodii","","female","","",NA,NA,NA,NA,NA,NA,"","October","17","",-78.629372,0.106252,"1648.922241","2017-10-08T14:12:57Z",2017-10-08 14:12:57
"314","Maquipucuna","8/10/17","672","",NA,NA,NA,NA,NA,NA,NA,NA,NA,NA,"Coeligena wilsoni","","heard only","","",NA,NA,NA,NA,NA,NA,"","October","17","",-78.629427,0.106189,"1649.917847","2017-10-08T14:14:33Z",2017-10-08 14:14:33
"315","Maquipucuna","8/10/17","673","Besleria solanoides","Besleria solanoides","4",NA,7,NA,NA,NA,NA,NA,NA,"Ocreatus underwoodii"," feeding (20)","female","","",NA,NA,NA,NA,NA,NA,"Besleria solanoides","October","17","Besleria solanoides",-78.629474,0.106065,"1651.482666","2017-10-08T14:16:12Z",2017-10-08 14:16:12
"316","Maquipucuna","8/10/17","678","",NA,NA,NA,NA,NA,NA,NA,NA,NA,NA,"Ocreatus underwoodii","","heard only","","",NA,NA,NA,NA,NA,NA,"","October","17","",-78.629523,0.105475,"1660.375366","2017-10-08T14:24:21Z",2017-10-08 14:24:21
"317","Maquipucuna","8/10/17","682","",NA,NA,NA,NA,NA,NA,NA,NA,NA,NA,"Colibri coruscans","","heard only","","",NA,NA,NA,NA,NA,NA,"","October","17","",-78.629353,0.104943,"1668.923950","2017-10-08T14:31:56Z",2017-10-08 14:31:56
"318","Maquipucuna","8/10/17","691","",NA,NA,NA,NA,NA,NA,NA,NA,NA,NA,"Ocreatus underwoodii","","heard only","","",NA,NA,NA,NA,NA,NA,"","October","17","",-78.629264,0.104494,"1679.160400","2017-10-08T14:37:51Z",2017-10-08 14:37:51
"319","Maquipucuna","8/10/17","694","",NA,NA,NA,NA,NA,NA,NA,NA,NA,NA,"Colibri coruscans","","heard only","","",NA,NA,NA,NA,NA,NA,"","October","17","",-78.629012,0.104461,"1686.182861","2017-10-08T14:40:54Z",2017-10-08 14:40:54
"320","Maquipucuna","8/10/17","695","Besleria solanoides","Besleria solanoides","4",NA,7,NA,NA,NA,NA,NA,NA,"Ocreatus underwoodii"," feeding","female","","",NA,NA,NA,NA,NA,NA,"Besleria solanoides","October","17","Besleria solanoides",-78.629138,0.104221,"1691.611572","2017-10-08T14:44:07Z",2017-10-08 14:44:07
"321","Maquipucuna","8/10/17","713","",NA,NA,NA,NA,NA,NA,NA,NA,NA,NA,"Coeligena wilsoni","Flying (2)","","","",NA,NA,NA,NA,NA,NA,"","October","17","",-78.628573,0.10262,"1724.622437","2017-10-08T15:16:50Z",2017-10-08 15:16:50
"322","Maquipucuna","19/11/2017","1596","",NA,NA,NA,NA,NA,NA,NA,NA,NA,NA,"Colibri coruscans","","heard only","","",NA,NA,NA,NA,NA,NA,"","November","2017","",-78.628579,0.108548,"1546.424683","2017-11-19T12:40:16Z",2017-11-19 12:40:16
"323","Maquipucuna","19/11/2017","1599","",NA,NA,NA,NA,NA,NA,NA,NA,NA,NA,"Aglaiocercus coelestis","","heard only","","",NA,NA,NA,NA,NA,NA,"","November","2017","",-78.628864,0.108305,"1554.303955","2017-11-19T12:45:02Z",2017-11-19 12:45:02
"324","Maquipucuna","19/11/2017","1618","",NA,NA,NA,NA,NA,NA,NA,NA,NA,NA,"Colibri coruscans","","heard only","","",NA,NA,NA,NA,NA,NA,"","November","2017","",-78.628838,0.107604,"1574.233276","2017-11-19T13:13:12Z",2017-11-19 13:13:12
"325","Maquipucuna","19/11/2017","1618","",NA,NA,NA,NA,NA,NA,NA,NA,NA,NA,"Ocreatus underwoodii","","heard only","","",NA,NA,NA,NA,NA,NA,"","November","2017","",-78.628838,0.107604,"1574.233276","2017-11-19T13:13:12Z",2017-11-19 13:13:12
"326","Maquipucuna","19/11/2017","1626","",NA,NA,NA,NA,NA,NA,NA,NA,NA,NA,"Ocreatus underwoodii","","heard only","","",NA,NA,NA,NA,NA,NA,"","November","2017","",-78.629288,0.107348,"1579.708130","2017-11-19T13:19:15Z",2017-11-19 13:19:15
"327","Maquipucuna","19/11/2017","1627","",NA,NA,NA,NA,NA,NA,NA,NA,NA,NA,"Heliodoxa jacula","","heard only","","",NA,NA,NA,NA,NA,NA,"","November","2017","",-78.629267,0.107321,"1578.584229","2017-11-19T13:20:21Z",2017-11-19 13:20:21
"328","Maquipucuna","19/11/2017","1629","",NA,NA,NA,NA,NA,NA,NA,NA,NA,NA,"Ocreatus underwoodii","","heard only","","",NA,NA,NA,NA,NA,NA,"","November","2017","",-78.629471,0.107243,"1581.735474","2017-11-19T13:22:42Z",2017-11-19 13:22:42
"329","Maquipucuna","19/11/2017","1635","",NA,NA,NA,NA,NA,NA,NA,NA,NA,NA,"Ocreatus underwoodii","","heard only","","",NA,NA,NA,NA,NA,NA,"","November","2017","",-78.629726,0.106909,"1587.702637","2017-11-19T13:26:35Z",2017-11-19 13:26:35
"330","Maquipucuna","19/11/2017","1636","",NA,NA,NA,NA,NA,NA,NA,NA,NA,NA,"Coeligena wilsoni","","heard only","","",NA,NA,NA,NA,NA,NA,"","November","2017","",-78.629716,0.106873,"1589.315918","2017-11-19T13:27:27Z",2017-11-19 13:27:27
"331","Maquipucuna","19/11/2017","1639","Psamisia aberrans","Psammisia aberrans","7",NA,107,NA,NA,NA,NA,NA,NA,"Ocreatus underwoodii","Feeding (60)","female","","",NA,NA,NA,NA,NA,NA,"Psammisia aberrans","November","2017","Psammisia aberrans",-78.629568,0.106948,"1592.823486","2017-11-19T13:29:53Z",2017-11-19 13:29:53
"332","Maquipucuna","19/11/2017","1642","",NA,NA,NA,NA,NA,NA,NA,NA,NA,NA,"Coeligena wilsoni","","heard only","","",NA,NA,NA,NA,NA,NA,"","November","2017","",-78.629214,0.106897,"1599.566406","2017-11-19T13:33:46Z",2017-11-19 13:33:46
"333","Maquipucuna","19/11/2017","1647","",NA,NA,NA,NA,NA,NA,NA,NA,NA,NA,"Coeligena wilsoni","Flying (2)","","","",NA,NA,NA,NA,NA,NA,"","November","2017","",-78.628831,0.106945,"1606.031738","2017-11-19T13:37:53Z",2017-11-19 13:37:53
"334","Maquipucuna","19/11/2017","1661","",NA,NA,NA,NA,NA,NA,NA,NA,NA,NA,"Coeligena wilsoni","","heard only","","",NA,NA,NA,NA,NA,NA,"","November","2017","",-78.628818,0.106482,"1633.118896","2017-11-19T13:59:25Z",2017-11-19 13:59:25
"335","Maquipucuna","19/11/2017","1661","",NA,NA,NA,NA,NA,NA,NA,NA,NA,NA,"Ocreatus underwoodii","","heard only","","",NA,NA,NA,NA,NA,NA,"","November","2017","",-78.628818,0.106482,"1633.118896","2017-11-19T13:59:25Z",2017-11-19 13:59:25
"336","Maquipucuna","19/11/2017","1670","Psamisia aberrans","Psammisia aberrans","4",NA,60,NA,NA,NA,NA,NA,NA,"Ocreatus underwoodii","feeding","female","","",NA,NA,NA,NA,NA,NA,"Psammisia aberrans","November","2017","Psammisia aberrans",-78.62935,0.106269,"1644.282715","2017-11-19T14:13:46Z",2017-11-19 14:13:46
"337","Maquipucuna","19/11/2017","1671","",NA,NA,NA,NA,NA,NA,NA,NA,NA,NA,"Ocreatus underwoodii","","heard only","","",NA,NA,NA,NA,NA,NA,"","November","2017","",-78.629397,0.106198,"1644.925049","2017-11-19T14:15:07Z",2017-11-19 14:15:07
"338","Maquipucuna","19/11/2017","1672","",NA,NA,NA,NA,NA,NA,NA,NA,NA,NA,"Colibri coruscans","","heard only","","",NA,NA,NA,NA,NA,NA,"","November","2017","",-78.629445,0.106106,"1646.332031","2017-11-19T14:15:56Z",2017-11-19 14:15:56
"339","Maquipucuna","19/11/2017","1673","",NA,NA,NA,NA,NA,NA,NA,NA,NA,NA,"Urosticte benjamini","","heard only","","",NA,NA,NA,NA,NA,NA,"","November","2017","",-78.629457,0.106078,"1646.812988","2017-11-19T14:17:06Z",2017-11-19 14:17:06
"340","Maquipucuna","19/11/2017","1674","Psamisia aberrans","Psammisia aberrans","5",NA,124,NA,NA,NA,NA,NA,NA,"Ocreatus underwoodii","feeding","female","","",NA,NA,NA,NA,NA,NA,"Psammisia aberrans","November","2017","Psammisia aberrans",-78.629455,0.106134,"1647.470215","2017-11-19T14:17:41Z",2017-11-19 14:17:41
"341","Maquipucuna","19/11/2017","1684","",NA,NA,NA,NA,NA,NA,NA,NA,NA,NA,"Coeligena wilsoni","","heard only","","",NA,NA,NA,NA,NA,NA,"","November","2017","",-78.629451,0.105351,"1659.059326","2017-11-19T14:24:57Z",2017-11-19 14:24:57
"342","Maquipucuna","19/11/2017","1691","",NA,NA,NA,NA,NA,NA,NA,NA,NA,NA,"Ocreatus underwoodii","","heard only","","",NA,NA,NA,NA,NA,NA,"","November","2017","",-78.629401,0.10485,"1667.496460","2017-11-19T14:36:22Z",2017-11-19 14:36:22
"343","Maquipucuna","19/11/2017","1706","",NA,NA,NA,NA,NA,NA,NA,NA,NA,NA,"Aglaiocercus coelestis","","heard only","","",NA,NA,NA,NA,NA,NA,"","November","2017","",-78.629009,0.103912,"1695.012207","2017-11-19T14:46:02Z",2017-11-19 14:46:02
"344","Maquipucuna","19/11/2017","1708","Cuatresia exiguiflora","Cuatresia riparia","4",NA,6,NA,NA,NA,NA,NA,NA,"Ocreatus underwoodii","feeding","female","","",NA,NA,NA,NA,NA,NA,"Cuatresia riparia","November","2017","Cuatresia riparia",-78.628952,0.103672,"1698.949829","2017-11-19T14:48:20Z",2017-11-19 14:48:20
"345","Maquipucuna","19/11/2017","1713","",NA,NA,NA,NA,NA,NA,NA,NA,NA,NA,"Ocreatus underwoodii","","heard only","","",NA,NA,NA,NA,NA,NA,"","November","2017","",-78.628974,0.103329,"1705.101562","2017-11-19T14:53:54Z",2017-11-19 14:53:54
"346","Maquipucuna","19/11/2017","1715","",NA,NA,NA,NA,NA,NA,NA,NA,NA,NA,"Coeligena wilsoni","","heard only","","",NA,NA,NA,NA,NA,NA,"","November","2017","",-78.628995,0.103196,"1712.383423","2017-11-19T14:59:27Z",2017-11-19 14:59:27
"347","Maquipucuna","19/11/2017","1720","",NA,NA,NA,NA,NA,NA,NA,NA,NA,NA,"Ocreatus underwoodii","Flying (2)","female","","",NA,NA,NA,NA,NA,NA,"","November","2017","",-78.628605,0.10267,"1719.844360","2017-11-19T15:05:38Z",2017-11-19 15:05:38
"348","Maquipucuna","19/11/2017","1721","",NA,NA,NA,NA,NA,NA,NA,NA,NA,NA,"Coeligena wilsoni","","heard only","","",NA,NA,NA,NA,NA,NA,"","November","2017","",-78.628482,0.102528,"1723.060303","2017-11-19T15:10:20Z",2017-11-19 15:10:20
"349","Maquipucuna","19/11/2017","1723","",NA,NA,NA,NA,NA,NA,NA,NA,NA,NA,"Aglaiocercus coelestis","","heard only","","",NA,NA,NA,NA,NA,NA,"","November","2017","",-78.627778,0.102308,"1713.357788","2017-11-19T15:17:49Z",2017-11-19 15:17:49
"350","Maquipucuna","10/12/17","1781","",NA,NA,NA,NA,NA,NA,NA,NA,NA,NA,"Phaethornis syrmatophorus","","heard only","","",NA,NA,NA,NA,NA,NA,"","December","17","",-78.628748,0.108434,"1550.718628","2017-12-10T12:59:32Z",2017-12-10 12:59:32
"351","Maquipucuna","10/12/17","1783","",NA,NA,NA,NA,NA,NA,NA,NA,NA,NA,"Ocreatus underwoodii","","heard only","","",NA,NA,NA,NA,NA,NA,"","December","17","",-78.628918,0.108135,"1556.062378","2017-12-10T13:03:01Z",2017-12-10 13:03:01
"352","Maquipucuna","10/12/17","1833","",NA,NA,NA,NA,NA,NA,NA,NA,NA,NA,"Ocreatus underwoodii","","heard only","","",NA,NA,NA,NA,NA,NA,"","December","17","",-78.62864,0.106729,"1630.149902","2017-12-10T13:59:27Z",2017-12-10 13:59:27
"353","Maquipucuna","10/12/17","1844","",NA,NA,NA,NA,NA,NA,NA,NA,NA,NA,"Ocreatus underwoodii","","heard only","","",NA,NA,NA,NA,NA,NA,"","December","17","",-78.629271,0.106351,"1646.627441","2017-12-10T14:17:08Z",2017-12-10 14:17:08
"354","Maquipucuna","10/12/17","1848","",NA,NA,NA,NA,NA,NA,NA,NA,NA,NA,"Coeligena wilsoni","","heard only","","",NA,NA,NA,NA,NA,NA,"","December","17","",-78.629372,0.106241,"1648.782349","2017-12-10T14:23:06Z",2017-12-10 14:23:06
"355","Maquipucuna","10/12/17","1856","",NA,NA,NA,NA,NA,NA,NA,NA,NA,NA,"Ocreatus underwoodii","Flying (2)","","","",NA,NA,NA,NA,NA,NA,"","December","17","",-78.629642,0.105714,"1657.953003","2017-12-10T14:30:46Z",2017-12-10 14:30:46
"356","Maquipucuna","10/12/17","1864","",NA,NA,NA,NA,NA,NA,NA,NA,NA,NA,"Ocreatus underwoodii","","heard only","","",NA,NA,NA,NA,NA,NA,"","December","17","",-78.629421,0.105113,"1666.420410","2017-12-10T14:36:45Z",2017-12-10 14:36:45
"357","Maquipucuna","10/12/17","1871","",NA,NA,NA,NA,NA,NA,NA,NA,NA,NA,"Ocreatus underwoodii","","heard only","","",NA,NA,NA,NA,NA,NA,"","December","17","",-78.629264,0.104466,"1680.951050","2017-12-10T14:44:34Z",2017-12-10 14:44:34
"358","Maquipucuna","10/12/17","1885","",NA,NA,NA,NA,NA,NA,NA,NA,NA,NA,"Ocreatus underwoodii","","heard only","","",NA,NA,NA,NA,NA,NA,"","December","17","",-78.628988,0.103439,"1706.936646","2017-12-10T14:58:28Z",2017-12-10 14:58:28
"359","Maquipucuna","10/12/17","1890","",NA,NA,NA,NA,NA,NA,NA,NA,NA,NA,"Coeligena wilsoni","","heard only","","",NA,NA,NA,NA,NA,NA,"","December","17","",-78.629019,0.103005,"1719.077637","2017-12-10T15:02:41Z",2017-12-10 15:02:41
"360","Maquipucuna","10/12/17","1890","",NA,NA,NA,NA,NA,NA,NA,NA,NA,NA,"Aglaiocercus coelestis","","heard only","","",NA,NA,NA,NA,NA,NA,"","December","17","",-78.629019,0.103005,"1719.077637","2017-12-10T15:02:41Z",2017-12-10 15:02:41
"361","Maquipucuna","10/12/17","1891","",NA,NA,NA,NA,NA,NA,NA,NA,NA,NA,"Phaethornis syrmatophorus","Flying (2)","","","",NA,NA,NA,NA,NA,NA,"","December","17","",-78.628981,0.103011,"1718.826538","2017-12-10T15:03:38Z",2017-12-10 15:03:38
"362","Maquipucuna","10/12/17","1895","",NA,NA,NA,NA,NA,NA,NA,NA,NA,NA,"Ocreatus underwoodii","flying around in P. Demissa in which I didn't see any flowers.","female","","",NA,NA,NA,NA,NA,NA,"","December","17","",-78.628702,0.102844,"1718.620117","2017-12-10T15:06:34Z",2017-12-10 15:06:34
"363","Maquipucuna","10/12/17","1901","",NA,NA,NA,NA,NA,NA,NA,NA,NA,NA,"Coeligena wilsoni","","heard only","","",NA,NA,NA,NA,NA,NA,"","December","17","",-78.628514,0.102571,"1723.758179","2017-12-10T15:11:10Z",2017-12-10 15:11:10
"364","Maquipucuna","10/12/17","1908","",NA,NA,NA,NA,NA,NA,NA,NA,NA,NA,"Coeligena wilsoni","","heard only","","",NA,NA,NA,NA,NA,NA,"","December","17","",-78.628171,0.102189,"1732.641113","2017-12-10T15:17:36Z",2017-12-10 15:17:36
"365","Maquipucuna","12/1/18","662","",NA,NA,NA,NA,NA,NA,NA,NA,NA,NA,"Aglaiocercus coelestis","flying","female","","",NA,NA,NA,NA,NA,NA,"","January","18","",-78.628897,0.107606,"1575.952759","2018-01-12T13:29:27Z",2018-01-12 13:29:27
"366","Maquipucuna","12/1/18","673","",NA,NA,NA,NA,NA,NA,NA,NA,NA,NA,"Ocreatus underwoodii","","heard only","","",NA,NA,NA,NA,NA,NA,"","January","18","",-78.629673,0.107045,"1589.060913","2018-01-12T13:39:04Z",2018-01-12 13:39:04
"367","Maquipucuna","12/1/18","694","",NA,NA,NA,NA,NA,NA,NA,NA,NA,NA,"Coeligena wilsoni","","heard only","","",NA,NA,NA,NA,NA,NA,"","January","18","",-78.629636,0.105915,"1650.376343","2018-01-12T14:14:09Z",2018-01-12 14:14:09
"368","Maquipucuna","12/1/18","714","",NA,NA,NA,NA,NA,NA,NA,NA,NA,NA,"Ocreatus underwoodii","","heard only","","",NA,NA,NA,NA,NA,NA,"","January","18","",-78.629059,0.103638,"1697.115601","2018-01-12T14:42:31Z",2018-01-12 14:42:31
"369","Maquipucuna","12/1/18","720","",NA,NA,NA,NA,NA,NA,NA,NA,NA,NA,"Ocreatus underwoodii","","heard only","","",NA,NA,NA,NA,NA,NA,"","January","18","",-78.629009,0.103093,"1710.153687","2018-01-12T14:47:34Z",2018-01-12 14:47:34
"370","Maquipucuna","12/1/18","720","Columnea mastersonii","Columnea eburnea","4",NA,2,NA,NA,NA,NA,NA,NA,"Aglaiocercus coelestis","","heard only","","",NA,NA,NA,NA,NA,NA,"Columnea eburnea","January","18","Columnea eburnea",-78.629009,0.103093,"1710.153687","2018-01-12T14:47:34Z",2018-01-12 14:47:34
"371","Maquipucuna","12/1/18","721","",NA,NA,NA,NA,NA,NA,NA,NA,NA,NA,"Ocreatus underwoodii","","heard only","","",NA,NA,NA,NA,NA,NA,"","January","18","",-78.628707,0.102829,"1713.882324","2018-01-12T14:50:43Z",2018-01-12 14:50:43
"372","Maquipucuna","9/2/18","791","",NA,NA,NA,NA,NA,NA,NA,NA,NA,NA,"Phaethornis yaruqui","","heard only","","",NA,NA,NA,NA,NA,NA,"","February","18","",-78.62809,0.108623,"1449.771973","2018-02-09T13:19:15Z",2018-02-09 13:19:15
"373","Maquipucuna","9/2/18","796","",NA,NA,NA,NA,NA,NA,NA,NA,NA,NA,"Ocreatus underwoodii","","heard only","","",NA,NA,NA,NA,NA,NA,"","February","18","",-78.628558,0.108639,"1538.296631","2018-02-09T13:30:18Z",2018-02-09 13:30:18
"374","Maquipucuna","9/2/18","808","Columnea ciliata","Columnea ciliata","5",NA,2,NA,NA,NA,NA,NA,NA,"Phaethornis syrmatophorus","feeding","","","",NA,NA,NA,NA,NA,NA,"Columnea ciliata","February","18","Columnea ciliata",-78.629199,0.107489,"1574.810547","2018-02-09T13:51:46Z",2018-02-09 13:51:46
"375","Maquipucuna","9/2/18","811","",NA,NA,NA,NA,NA,NA,NA,NA,NA,NA,"Ocreatus underwoodii","","heard only","","",NA,NA,NA,NA,NA,NA,"","February","18","",-78.629339,0.107417,"1576.138184","2018-02-09T13:53:32Z",2018-02-09 13:53:32
"376","Maquipucuna","9/2/18","814","Wercklea ferox","Wercklea ferox","2",NA,5,NA,NA,NA,NA,NA,NA,"Schistes geoffroyi","feeding","","","",NA,NA,NA,NA,NA,NA,"Wercklea ferox","February","18","Wercklea ferox",-78.629379,0.106939,"1596.394043","2018-02-09T14:05:41Z",2018-02-09 14:05:41
"377","Maquipucuna","9/2/18","826","",NA,NA,NA,NA,NA,NA,NA,NA,NA,NA,"Ocreatus underwoodii","flying ","male","","",NA,NA,NA,NA,NA,NA,"","February","18","",-78.628988,0.106327,"1640.546753","2018-02-09T14:36:29Z",2018-02-09 14:36:29
"378","Maquipucuna","9/2/18","826","",NA,NA,NA,NA,NA,NA,NA,NA,NA,NA,"Coeligena wilsoni","","heard only","","",NA,NA,NA,NA,NA,NA,"","February","18","",-78.628988,0.106327,"1640.546753","2018-02-09T14:36:29Z",2018-02-09 14:36:29
"379","Maquipucuna","9/2/18","853","",NA,NA,NA,NA,NA,NA,NA,NA,NA,NA,"Ocreatus underwoodii","","heard only","","",NA,NA,NA,NA,NA,NA,"","February","18","",-78.629024,0.103221,"1708.167480","2018-02-09T15:33:32Z",2018-02-09 15:33:32
"380","Maquipucuna","9/2/18","860","Mezobromelia capituligera","Mezobromelia capituligera","5",NA,3,NA,NA,NA,NA,NA,NA,"Heliodoxa rubinoides","feeding","","","",NA,NA,NA,NA,NA,NA,"Mezobromelia capituligera","February","18","Mezobromelia capituligera",-78.628611,0.10259,"1719.983521","2018-02-09T15:45:14Z",2018-02-09 15:45:14
"381","Maquipucuna","9/2/18","862","",NA,NA,NA,NA,NA,NA,NA,NA,NA,NA,"Coeligena wilsoni","","heard only","","",NA,NA,NA,NA,NA,NA,"","February","18","",-78.628498,0.102499,"1724.094971","2018-02-09T15:46:30Z",2018-02-09 15:46:30
"382","Maquipucuna","21/03/2018","1494","",NA,NA,NA,NA,NA,NA,NA,NA,NA,NA,"Phaethornis syrmatophorus","","heard only","","",NA,NA,NA,NA,NA,NA,"","March","2018","",-78.628932,0.1083,"1553.025391","2018-03-21T13:04:57Z",2018-03-21 13:04:57
"383","Maquipucuna","21/03/2018","1503","",NA,NA,NA,NA,NA,NA,NA,NA,NA,NA,"Ocreatus underwoodii","","heard only","","",NA,NA,NA,NA,NA,NA,"","March","2018","",-78.629799,0.106929,"1591.859375","2018-03-21T13:34:12Z",2018-03-21 13:34:12
"384","Maquipucuna","21/03/2018","1504","",NA,NA,NA,NA,NA,NA,NA,NA,NA,NA,"Coeligena wilsoni","","heard only","","",NA,NA,NA,NA,NA,NA,"","March","2018","",-78.629629,0.106939,"1594.545776","2018-03-21T13:35:36Z",2018-03-21 13:35:36
"385","Maquipucuna","21/03/2018","1507","",NA,NA,NA,NA,NA,NA,NA,NA,NA,NA,"Coeligena wilsoni","flying","","","",NA,NA,NA,NA,NA,NA,"","March","2018","",-78.62922,0.106844,"1600.418701","2018-03-21T13:38:29Z",2018-03-21 13:38:29
"386","Maquipucuna","21/03/2018","1508","",NA,NA,NA,NA,NA,NA,NA,NA,NA,NA,"Phaethornis striigularis","flying","","","",NA,NA,NA,NA,NA,NA,"","March","2018","",-78.628608,0.107021,"1609.446777","2018-03-21T13:48:53Z",2018-03-21 13:48:53
"387","Maquipucuna","21/03/2018","1514","",NA,NA,NA,NA,NA,NA,NA,NA,NA,NA,"Ocreatus underwoodii","","heard only","","",NA,NA,NA,NA,NA,NA,"","March","2018","",-78.629409,0.106248,"1644.961304","2018-03-21T14:07:53Z",2018-03-21 14:07:53
"388","Maquipucuna","21/03/2018","1539","",NA,NA,NA,NA,NA,NA,NA,NA,NA,NA,"Ocreatus underwoodii","","heard only","","",NA,NA,NA,NA,NA,NA,"","March","2018","",-78.628148,0.102224,"1735.711182","2018-03-21T15:13:31Z",2018-03-21 15:13:31
"389","Maquipucuna","24/04/2018","1925","Palicourea demissa","Palicourea demissa","4",NA,22,NA,NA,NA,NA,NA,NA,"Phaethornis yaruqui","feeding","","","",NA,NA,NA,NA,NA,NA,"Palicourea demissa","April","2018","Palicourea demissa",-78.628583,0.108738,"1555.699219","2018-04-24T12:32:03Z",2018-04-24 12:32:03
"390","Maquipucuna","24/04/2018","1926","",NA,NA,NA,NA,NA,NA,NA,NA,NA,NA,"Ocreatus underwoodii","","heard only","","",NA,NA,NA,NA,NA,NA,"","April","2018","",-78.62859,0.108653,"1556.440063","2018-04-24T12:32:59Z",2018-04-24 12:32:59
"391","Maquipucuna","24/04/2018","1930","",NA,NA,NA,NA,NA,NA,NA,NA,NA,NA,"Ocreatus underwoodii","","heard only","","",NA,NA,NA,NA,NA,NA,"","April","2018","",-78.628938,0.108177,"1565.202515","2018-04-24T12:38:54Z",2018-04-24 12:38:54
"392","Maquipucuna","24/04/2018","1931","",NA,NA,NA,NA,NA,NA,NA,NA,NA,NA,"Phaethornis yaruqui","","heard only","","",NA,NA,NA,NA,NA,NA,"","April","2018","",-78.628917,0.108114,"1566.123169","2018-04-24T12:39:28Z",2018-04-24 12:39:28
"393","Maquipucuna","24/04/2018","1935","Palicourea demissa","Palicourea demissa","5",NA,18,NA,NA,NA,NA,NA,NA,"Ocreatus underwoodii","feeding","female","","",NA,NA,NA,NA,NA,NA,"Palicourea demissa","April","2018","Palicourea demissa",-78.628692,0.107688,"1575.249268","2018-04-24T12:47:43Z",2018-04-24 12:47:43
"394","Maquipucuna","24/04/2018","1938","",NA,NA,NA,NA,NA,NA,NA,NA,NA,NA,"Phaethornis yaruqui","","heard only","","",NA,NA,NA,NA,NA,NA,"","April","2018","",-78.628733,0.107593,"1577.337646","2018-04-24T12:57:02Z",2018-04-24 12:57:02
"395","Maquipucuna","24/04/2018","1939","",NA,NA,NA,NA,NA,NA,NA,NA,NA,NA,"Ocreatus underwoodii","","heard only","","",NA,NA,NA,NA,NA,NA,"","April","2018","",-78.62883,0.107552,"1579.207275","2018-04-24T12:58:53Z",2018-04-24 12:58:53
"396","Maquipucuna","24/04/2018","1940","Palicourea demissa","Palicourea demissa","4",NA,25,NA,NA,NA,NA,NA,NA,"Doryfera ludovicae","feeding","Can you believe it??","","",NA,NA,NA,NA,NA,NA,"Palicourea demissa","April","2018","Palicourea demissa",-78.628952,0.107574,"1579.687988","2018-04-24T13:00:27Z",2018-04-24 13:00:27
"397","Maquipucuna","24/04/2018","1941","",NA,NA,NA,NA,NA,NA,NA,NA,NA,NA,"Ocreatus underwoodii","","heard only","","",NA,NA,NA,NA,NA,NA,"","April","2018","",-78.62902,0.107557,"1580.360107","2018-04-24T13:01:10Z",2018-04-24 13:01:10
"398","Maquipucuna","24/04/2018","1944","",NA,NA,NA,NA,NA,NA,NA,NA,NA,NA,"Colibri coruscans","","heard only"," way out of season","",NA,NA,NA,NA,NA,NA,"","April","2018","",-78.629697,0.10698,"1590.906372","2018-04-24T13:09:31Z",2018-04-24 13:09:31
"399","Maquipucuna","24/04/2018","1945","",NA,NA,NA,NA,NA,NA,NA,NA,NA,NA,"Coeligena wilsoni","","heard only","","",NA,NA,NA,NA,NA,NA,"","April","2018","",-78.629742,0.106909,"1591.728394","2018-04-24T13:10:18Z",2018-04-24 13:10:18
"400","Maquipucuna","24/04/2018","1946","",NA,NA,NA,NA,NA,NA,NA,NA,NA,NA,"Colibri coruscans","","heard only"," way out of season","",NA,NA,NA,NA,NA,NA,"","April","2018","",-78.629347,0.106941,"1599.677124","2018-04-24T13:13:47Z",2018-04-24 13:13:47
"401","Maquipucuna","24/04/2018","1946","",NA,NA,NA,NA,NA,NA,NA,NA,NA,NA,"Ocreatus underwoodii","","heard only","","",NA,NA,NA,NA,NA,NA,"","April","2018","",-78.629347,0.106941,"1599.677124","2018-04-24T13:13:47Z",2018-04-24 13:13:47
"402","Maquipucuna","24/04/2018","1949","",NA,NA,NA,NA,NA,NA,NA,NA,NA,NA,"Coeligena wilsoni","","heard only","","",NA,NA,NA,NA,NA,NA,"","April","2018","",-78.629159,0.106892,"1601.517456","2018-04-24T13:16:09Z",2018-04-24 13:16:09
"403","Maquipucuna","24/04/2018","1955","",NA,NA,NA,NA,NA,NA,NA,NA,NA,NA,"Ocreatus underwoodii","flying","female","","",NA,NA,NA,NA,NA,NA,"","April","2018","",-78.62864,0.106563,"1630.597656","2018-04-24T13:39:45Z",2018-04-24 13:39:45
"404","Maquipucuna","24/04/2018","1955","",NA,NA,NA,NA,NA,NA,NA,NA,NA,NA,"Coeligena wilsoni","perched","","","",NA,NA,NA,NA,NA,NA,"","April","2018","",-78.62864,0.106563,"1630.597656","2018-04-24T13:39:45Z",2018-04-24 13:39:45
"405","Maquipucuna","24/04/2018","1956","Palicourea demissa","Palicourea demissa","5",NA,31,NA,NA,NA,NA,NA,NA,"Coeligena wilsoni","feeding","","","",NA,NA,NA,NA,NA,NA,"Palicourea demissa","April","2018","Palicourea demissa",-78.628624,0.106489,"1632.546509","2018-04-24T13:40:32Z",2018-04-24 13:40:32
"406","Maquipucuna","24/04/2018","1958","",NA,NA,NA,NA,NA,NA,NA,NA,NA,NA,"Ocreatus underwoodii","","heard only","","",NA,NA,NA,NA,NA,NA,"","April","2018","",-78.628797,0.106513,"1636.163574","2018-04-24T13:42:08Z",2018-04-24 13:42:08
"407","Maquipucuna","24/04/2018","1959","Palicourea demissa","Palicourea demissa","4",NA,15,NA,NA,NA,NA,NA,NA,"Urosticte benjamini","feeding","","","",NA,NA,NA,NA,NA,NA,"Palicourea demissa","April","2018","Palicourea demissa",-78.628873,0.106367,"1638.416382","2018-04-24T13:43:43Z",2018-04-24 13:43:43
"408","Maquipucuna","24/04/2018","1964","",NA,NA,NA,NA,NA,NA,NA,NA,NA,NA,"Coeligena wilsoni","","heard only","","",NA,NA,NA,NA,NA,NA,"","April","2018","",-78.629372,0.106225,"1647.291016","2018-04-24T13:54:26Z",2018-04-24 13:54:26
"409","Maquipucuna","24/04/2018","1970","",NA,NA,NA,NA,NA,NA,NA,NA,NA,NA,"Ocreatus underwoodii","","heard only","","",NA,NA,NA,NA,NA,NA,"","April","2018","",-78.629594,0.105659,"1655.453979","2018-04-24T14:03:51Z",2018-04-24 14:03:51
"410","Maquipucuna","24/04/2018","1973","",NA,NA,NA,NA,NA,NA,NA,NA,NA,NA,"Coeligena wilsoni","","heard only","","",NA,NA,NA,NA,NA,NA,"","April","2018","",-78.629406,0.105139,"1662.589966","2018-04-24T14:15:01Z",2018-04-24 14:15:01
"411","Maquipucuna","24/04/2018","1982","Palicourea demissa","Palicourea demissa","4",NA,5,NA,NA,NA,NA,NA,NA,"Ocreatus underwoodii","feeding","female","","",NA,NA,NA,NA,NA,NA,"Palicourea demissa","April","2018","Palicourea demissa",-78.629027,0.103523,"1699.055176","2018-04-24T14:32:37Z",2018-04-24 14:32:37
"412","Maquipucuna","24/04/2018","1987","Palicourea demissa","Palicourea demissa","5",NA,27,NA,NA,NA,NA,NA,NA,"Aglaiocercus coelestis","feeding","male","","",NA,NA,NA,NA,NA,NA,"Palicourea demissa","April","2018","Palicourea demissa",-78.628943,0.103016,"1713.923584","2018-04-24T14:37:49Z",2018-04-24 14:37:49
"413","Maquipucuna","24/04/2018","1988","",NA,NA,NA,NA,NA,NA,NA,NA,NA,NA,"Ocreatus underwoodii","","heard only","","",NA,NA,NA,NA,NA,NA,"","April","2018","",-78.62882,0.10294,"1712.885132","2018-04-24T14:39:41Z",2018-04-24 14:39:41
"414","Maquipucuna","24/04/2018","1989","",NA,NA,NA,NA,NA,NA,NA,NA,NA,NA,"Coeligena wilsoni","","heard only","","",NA,NA,NA,NA,NA,NA,"","April","2018","",-78.628804,0.102872,"1712.915649","2018-04-24T14:40:00Z",2018-04-24 14:40:00
"415","Maquipucuna","21/05/2018","322","",NA,NA,NA,NA,NA,NA,NA,NA,NA,NA,"Phaethornis yaruqui","flying","","","",NA,NA,NA,NA,NA,NA,"","May","2018","",-78.62853,0.108919,"1457.518799","2018-05-21T13:22:59Z",2018-05-21 13:22:59
"416","Maquipucuna","21/05/2018","337","",NA,NA,NA,NA,NA,NA,NA,NA,NA,NA,"Phaethornis yaruqui","","heard only","","",NA,NA,NA,NA,NA,NA,"","May","2018","",-78.628852,0.108214,"1513.984985","2018-05-21T13:36:02Z",2018-05-21 13:36:02
"417","Maquipucuna","21/05/2018","338","Palicourea demissa","Palicourea demissa","6",NA,76,NA,NA,NA,NA,NA,NA,"Florisuga mellivora","feeding","male","  I don't think I've ever seen one that deep inside of the forest","",NA,NA,NA,NA,NA,NA,"Palicourea demissa","May","2018","Palicourea demissa",-78.629014,0.107796,"1525.733643","2018-05-21T13:40:36Z",2018-05-21 13:40:36
"418","Maquipucuna","21/05/2018","342","",NA,NA,NA,NA,NA,NA,NA,NA,NA,NA,"Phaethornis yaruqui","","heard only","","",NA,NA,NA,NA,NA,NA,"","May","2018","",-78.628784,0.107795,"1532.925293","2018-05-21T13:46:39Z",2018-05-21 13:46:39
"419","Maquipucuna","21/05/2018","343","",NA,NA,NA,NA,NA,NA,NA,NA,NA,NA,"Ocreatus underwoodii","","heard only","","",NA,NA,NA,NA,NA,NA,"","May","2018","",-78.628724,0.10772,"1534.385864","2018-05-21T13:47:30Z",2018-05-21 13:47:30
"420","Maquipucuna","21/05/2018","351","",NA,NA,NA,NA,NA,NA,NA,NA,NA,NA,"Aglaiocercus coelestis","flying","female","","",NA,NA,NA,NA,NA,NA,"","May","2018","",-78.629209,0.107463,"1553.108643","2018-05-21T13:55:54Z",2018-05-21 13:55:54
"421","Maquipucuna","21/05/2018","359","",NA,NA,NA,NA,NA,NA,NA,NA,NA,NA,"Ocreatus underwoodii","","heard only","","",NA,NA,NA,NA,NA,NA,"","May","2018","",-78.629475,0.107026,"1577.668579","2018-05-21T14:05:36Z",2018-05-21 14:05:36
"422","Maquipucuna","21/05/2018","361","",NA,NA,NA,NA,NA,NA,NA,NA,NA,NA,"Phaethornis yaruqui","","heard only","","",NA,NA,NA,NA,NA,NA,"","May","2018","",-78.629388,0.106986,"1580.540161","2018-05-21T14:07:39Z",2018-05-21 14:07:39
"423","Maquipucuna","21/05/2018","369","",NA,NA,NA,NA,NA,NA,NA,NA,NA,NA,"Ocreatus underwoodii","","heard only","","",NA,NA,NA,NA,NA,NA,"","May","2018","",-78.628598,0.107012,"1598.180176","2018-05-21T14:18:55Z",2018-05-21 14:18:55
"424","Maquipucuna","21/05/2018","372","",NA,NA,NA,NA,NA,NA,NA,NA,NA,NA,"Phaethornis syrmatophorus","","heard only","","",NA,NA,NA,NA,NA,NA,"","May","2018","",-78.628441,0.106804,"1603.442505","2018-05-21T14:22:09Z",2018-05-21 14:22:09
"425","Maquipucuna","21/05/2018","376","",NA,NA,NA,NA,NA,NA,NA,NA,NA,NA,"Ocreatus underwoodii","","heard only","","",NA,NA,NA,NA,NA,NA,"","May","2018","",-78.628607,0.106711,"1613.243164","2018-05-21T14:25:55Z",2018-05-21 14:25:55
"426","Maquipucuna","21/05/2018","376","",NA,NA,NA,NA,NA,NA,NA,NA,NA,NA,"Ocreatus underwoodii","","heard only","","",NA,NA,NA,NA,NA,NA,"","May","2018","",-78.628607,0.106711,"1613.243164","2018-05-21T14:25:55Z",2018-05-21 14:25:55
"427","Maquipucuna","21/05/2018","376","",NA,NA,NA,NA,NA,NA,NA,NA,NA,NA,"Phaethornis syrmatophorus","","heard only","","",NA,NA,NA,NA,NA,NA,"","May","2018","",-78.628607,0.106711,"1613.243164","2018-05-21T14:25:55Z",2018-05-21 14:25:55
"428","Maquipucuna","21/05/2018","381","",NA,NA,NA,NA,NA,NA,NA,NA,NA,NA,"Ocreatus underwoodii","","heard only","","",NA,NA,NA,NA,NA,NA,"","May","2018","",-78.628983,0.106335,"1627.889893","2018-05-21T14:31:46Z",2018-05-21 14:31:46
"429","Maquipucuna","21/05/2018","393","",NA,NA,NA,NA,NA,NA,NA,NA,NA,NA,"Urosticte benjamini","flying","male","","",NA,NA,NA,NA,NA,NA,"","May","2018","",-78.629626,0.105677,"1647.790283","2018-05-21T14:45:37Z",2018-05-21 14:45:37
"430","Maquipucuna","21/05/2018","395","",NA,NA,NA,NA,NA,NA,NA,NA,NA,NA,"Coeligena wilsoni","","heard only","","",NA,NA,NA,NA,NA,NA,"","May","2018","",-78.629486,0.105417,"1652.252808","2018-05-21T14:47:51Z",2018-05-21 14:47:51
"431","Maquipucuna","21/05/2018","398","",NA,NA,NA,NA,NA,NA,NA,NA,NA,NA,"Ocreatus underwoodii","","heard only","","",NA,NA,NA,NA,NA,NA,"","May","2018","",-78.629397,0.105023,"1659.435181","2018-05-21T14:51:37Z",2018-05-21 14:51:37
"432","Maquipucuna","21/05/2018","398","",NA,NA,NA,NA,NA,NA,NA,NA,NA,NA,"Ocreatus underwoodii","","heard only","","",NA,NA,NA,NA,NA,NA,"","May","2018","",-78.629397,0.105023,"1659.435181","2018-05-21T14:51:37Z",2018-05-21 14:51:37
"433","Maquipucuna","21/05/2018","405","",NA,NA,NA,NA,NA,NA,NA,NA,NA,NA,"Aglaiocercus coelestis","","heard only","","",NA,NA,NA,NA,NA,NA,"","May","2018","",-78.629042,0.103781,"1693.791626","2018-05-21T15:09:23Z",2018-05-21 15:09:23
"434","Maquipucuna","21/05/2018","406","",NA,NA,NA,NA,NA,NA,NA,NA,NA,NA,"Ocreatus underwoodii","","heard only","","",NA,NA,NA,NA,NA,NA,"","May","2018","",-78.629,0.103609,"1695.316406","2018-05-21T15:11:16Z",2018-05-21 15:11:16
"435","Maquipucuna","21/05/2018","408","Palicourea demissa","Palicourea demissa","5",NA,16,NA,NA,NA,NA,NA,NA,"Ocreatus underwoodii","feeding","female","","",NA,NA,NA,NA,NA,NA,"Palicourea demissa","May","2018","Palicourea demissa",-78.628988,0.103455,"1698.332031","2018-05-21T15:12:45Z",2018-05-21 15:12:45
"436","Maquipucuna","21/05/2018","412","",NA,NA,NA,NA,NA,NA,NA,NA,NA,NA,"Urosticte benjamini","","heard only","","",NA,NA,NA,NA,NA,NA,"","May","2018","",-78.628816,0.102891,"1713.150391","2018-05-21T15:25:59Z",2018-05-21 15:25:59
"437","Maquipucuna","21/05/2018","412","",NA,NA,NA,NA,NA,NA,NA,NA,NA,NA,"Phaethornis syrmatophorus","","heard only","","",NA,NA,NA,NA,NA,NA,"","May","2018","",-78.628816,0.102891,"1713.150391","2018-05-21T15:25:59Z",2018-05-21 15:25:59
"438","Maquipucuna","21/05/2018","418","",NA,NA,NA,NA,NA,NA,NA,NA,NA,NA,"Urosticte benjamini","","heard only","","",NA,NA,NA,NA,NA,NA,"","May","2018","",-78.628497,0.102536,"1718.956543","2018-05-21T15:30:57Z",2018-05-21 15:30:57
"439","Maquipucuna","16/06/2018","496","",NA,NA,NA,NA,NA,NA,NA,NA,NA,NA,"Phaethornis yaruqui","flying","","","",NA,NA,NA,NA,NA,NA,"","June","2018","",-78.628757,0.107742,"1523.279297","2018-06-16T13:10:34Z",2018-06-16 13:10:34
"440","Maquipucuna","16/06/2018","497","",NA,NA,NA,NA,NA,NA,NA,NA,NA,NA,"Schistes geoffroyi","perched","","","",NA,NA,NA,NA,NA,NA,"","June","2018","",-78.628711,0.107765,"1532.478760","2018-06-16T13:16:22Z",2018-06-16 13:16:22
"441","Maquipucuna","16/06/2018","499","",NA,NA,NA,NA,NA,NA,NA,NA,NA,NA,"Ocreatus underwoodii","","heard only","","",NA,NA,NA,NA,NA,NA,"","June","2018","",-78.628719,0.107555,"1540.531250","2018-06-16T13:19:56Z",2018-06-16 13:19:56
"442","Maquipucuna","16/06/2018","502","",NA,NA,NA,NA,NA,NA,NA,NA,NA,NA,"Ocreatus underwoodii","","heard only","","",NA,NA,NA,NA,NA,NA,"","June","2018","",-78.629329,0.107323,"1554.483765","2018-06-16T13:26:32Z",2018-06-16 13:26:32
"443","Maquipucuna","16/06/2018","503","",NA,NA,NA,NA,NA,NA,NA,NA,NA,NA,"Urosticte benjamini","","heard only","","",NA,NA,NA,NA,NA,NA,"","June","2018","",-78.629465,0.107321,"1564.159180","2018-06-16T13:32:50Z",2018-06-16 13:32:50
"444","Maquipucuna","16/06/2018","504","",NA,NA,NA,NA,NA,NA,NA,NA,NA,NA,"Schistes geoffroyi","hovering","","","",NA,NA,NA,NA,NA,NA,"","June","2018","",-78.629469,0.107329,"1564.406006","2018-06-16T13:33:08Z",2018-06-16 13:33:08
"445","Maquipucuna","16/06/2018","508","",NA,NA,NA,NA,NA,NA,NA,NA,NA,NA,"Phaethornis striigularis","","heard only","","",NA,NA,NA,NA,NA,NA,"","June","2018","",-78.629443,0.107005,"1581.650269","2018-06-16T13:39:06Z",2018-06-16 13:39:06
"446","Maquipucuna","16/06/2018","513","",NA,NA,NA,NA,NA,NA,NA,NA,NA,NA,"Ocreatus underwoodii","","heard only","","",NA,NA,NA,NA,NA,NA,"","June","2018","",-78.628556,0.106717,"1607.385132","2018-06-16T13:49:54Z",2018-06-16 13:49:54
"447","Maquipucuna","16/06/2018","513","",NA,NA,NA,NA,NA,NA,NA,NA,NA,NA,"Coeligena wilsoni","","heard only","","",NA,NA,NA,NA,NA,NA,"","June","2018","",-78.628556,0.106717,"1607.385132","2018-06-16T13:49:54Z",2018-06-16 13:49:54
"448","Maquipucuna","16/06/2018","522","",NA,NA,NA,NA,NA,NA,NA,NA,NA,NA,"Ocreatus underwoodii","","heard only","","",NA,NA,NA,NA,NA,NA,"","June","2018","",-78.629155,0.106381,"1631.070435","2018-06-16T14:03:30Z",2018-06-16 14:03:30
"449","Maquipucuna","16/06/2018","526","",NA,NA,NA,NA,NA,NA,NA,NA,NA,NA,"Aglaiocercus coelestis","","heard only","","",NA,NA,NA,NA,NA,NA,"","June","2018","",-78.629371,0.106177,"1637.296631","2018-06-16T14:10:06Z",2018-06-16 14:10:06
"450","Maquipucuna","16/06/2018","527","",NA,NA,NA,NA,NA,NA,NA,NA,NA,NA,"Ocreatus underwoodii","","heard only","","",NA,NA,NA,NA,NA,NA,"","June","2018","",-78.629401,0.106147,"1638.363403","2018-06-16T14:10:56Z",2018-06-16 14:10:56
"451","Maquipucuna","16/06/2018","542","",NA,NA,NA,NA,NA,NA,NA,NA,NA,NA,"Ocreatus underwoodii","","heard only","","",NA,NA,NA,NA,NA,NA,"","June","2018","",-78.629075,0.103832,"1694.952026","2018-06-16T14:35:08Z",2018-06-16 14:35:08
"452","Maquipucuna","16/06/2018","544","",NA,NA,NA,NA,NA,NA,NA,NA,NA,NA,"Coeligena wilsoni","flying","","","",NA,NA,NA,NA,NA,NA,"","June","2018","",-78.629045,0.103568,"1698.505493","2018-06-16T14:37:46Z",2018-06-16 14:37:46
"453","Maquipucuna","16/06/2018","548","Palicourea demissa","Palicourea demissa","6",NA,14,NA,NA,NA,NA,NA,NA,"Ocreatus underwoodii","feeding","female","","",NA,NA,NA,NA,NA,NA,"Palicourea demissa","June","2018","Palicourea demissa",-78.628941,0.102964,"1713.926392","2018-06-16T14:43:11Z",2018-06-16 14:43:11
"454","Maquipucuna","16/06/2018","551","",NA,NA,NA,NA,NA,NA,NA,NA,NA,NA,"Coeligena wilsoni","","heard only","","",NA,NA,NA,NA,NA,NA,"","June","2018","",-78.628623,0.102742,"1716.532471","2018-06-16T14:46:40Z",2018-06-16 14:46:40
"455","Maquipucuna","16/06/2018","556","",NA,NA,NA,NA,NA,NA,NA,NA,NA,NA,"Aglaiocercus coelestis","flying","female","","",NA,NA,NA,NA,NA,NA,"","June","2018","",-78.628477,0.102441,"1723.594482","2018-06-16T14:51:01Z",2018-06-16 14:51:01
"456","Maquipucuna","16/06/2018","560","",NA,NA,NA,NA,NA,NA,NA,NA,NA,NA,"Aglaiocercus coelestis","","heard only","","",NA,NA,NA,NA,NA,NA,"","June","2018","",-78.627781,0.102376,"1712.297729","2018-06-16T14:59:03Z",2018-06-16 14:59:03
"457","Maquipucuna","16/06/2018","562","",NA,NA,NA,NA,NA,NA,NA,NA,NA,NA,"Coeligena wilsoni","","heard only","","",NA,NA,NA,NA,NA,NA,"","June","2018","",-78.627732,0.10224,"1709.711548","2018-06-16T15:00:23Z",2018-06-16 15:00:23
"458","Maquipucuna","24/07/2018","1182","",NA,NA,NA,NA,NA,NA,NA,NA,NA,NA,"Ocreatus underwoodii","","heard only","","",NA,NA,NA,NA,NA,NA,"","July","2018","",-78.628561,0.109028,"1531.271606","2018-07-24T12:31:34Z",2018-07-24 12:31:34
"459","Maquipucuna","24/07/2018","1185","",NA,NA,NA,NA,NA,NA,NA,NA,NA,NA,"Ocreatus underwoodii","","heard only","","",NA,NA,NA,NA,NA,NA,"","July","2018","",-78.628543,0.108835,"1535.309937","2018-07-24T12:34:24Z",2018-07-24 12:34:24
"460","Maquipucuna","24/07/2018","1192","",NA,NA,NA,NA,NA,NA,NA,NA,NA,NA,"Phaethornis yaruqui","","heard only","","",NA,NA,NA,NA,NA,NA,"","July","2018","",-78.628763,0.108363,"1546.704712","2018-07-24T12:46:11Z",2018-07-24 12:46:11
"461","Maquipucuna","24/07/2018","1194","",NA,NA,NA,NA,NA,NA,NA,NA,NA,NA,"Ocreatus underwoodii","","heard only","","",NA,NA,NA,NA,NA,NA,"","July","2018","",-78.628967,0.107768,"1559.314453","2018-07-24T12:52:34Z",2018-07-24 12:52:34
"462","Maquipucuna","24/07/2018","1199","",NA,NA,NA,NA,NA,NA,NA,NA,NA,NA,"Coeligena wilsoni","","heard only","","",NA,NA,NA,NA,NA,NA,"","July","2018","",-78.628697,0.107569,"1567.489258","2018-07-24T12:57:49Z",2018-07-24 12:57:49
"463","Maquipucuna","24/07/2018","1206","",NA,NA,NA,NA,NA,NA,NA,NA,NA,NA,"Ocreatus underwoodii","picking some from underside of Cecropia leaves","female","","",NA,NA,NA,NA,NA,NA,"","July","2018","",-78.628961,0.10683,"1600.118774","2018-07-24T13:14:59Z",2018-07-24 13:14:59
"464","Maquipucuna","24/07/2018","1219","",NA,NA,NA,NA,NA,NA,NA,NA,NA,NA,"Ocreatus underwoodii","","heard only","","",NA,NA,NA,NA,NA,NA,"","July","2018","",-78.628967,0.106337,"1634.273682","2018-07-24T13:33:55Z",2018-07-24 13:33:55
"465","Maquipucuna","24/07/2018","1223","",NA,NA,NA,NA,NA,NA,NA,NA,NA,NA,"Colibri delphinae","","heard only","","",NA,NA,NA,NA,NA,NA,"","July","2018","",-78.629351,0.106239,"1640.103882","2018-07-24T13:37:33Z",2018-07-24 13:37:33
"466","Maquipucuna","24/07/2018","1224","",NA,NA,NA,NA,NA,NA,NA,NA,NA,NA,"Ocreatus underwoodii","","heard only","","",NA,NA,NA,NA,NA,NA,"","July","2018","",-78.62943,0.106155,"1642.446533","2018-07-24T13:39:17Z",2018-07-24 13:39:17
"467","Maquipucuna","24/07/2018","1231","",NA,NA,NA,NA,NA,NA,NA,NA,NA,NA,"Ocreatus underwoodii","","heard only","","",NA,NA,NA,NA,NA,NA,"","July","2018","",-78.629479,0.105522,"1654.745850","2018-07-24T13:49:31Z",2018-07-24 13:49:31
"468","Maquipucuna","24/07/2018","1232","",NA,NA,NA,NA,NA,NA,NA,NA,NA,NA,"Colibri coruscans","","heard only","","",NA,NA,NA,NA,NA,NA,"","July","2018","",-78.629421,0.105403,"1656.480225","2018-07-24T13:51:26Z",2018-07-24 13:51:26
"469","Maquipucuna","24/07/2018","1236","",NA,NA,NA,NA,NA,NA,NA,NA,NA,NA,"Colibri delphinae","","heard only","","",NA,NA,NA,NA,NA,NA,"","July","2018","",-78.629217,0.104383,"1676.441650","2018-07-24T13:59:06Z",2018-07-24 13:59:06
"470","Maquipucuna","24/07/2018","1245","",NA,NA,NA,NA,NA,NA,NA,NA,NA,NA,"Aglaiocercus coelestis","","heard only","","",NA,NA,NA,NA,NA,NA,"","July","2018","",-78.629102,0.103833,"1693.144775","2018-07-24T14:11:20Z",2018-07-24 14:11:20
"471","Maquipucuna","24/07/2018","1249","",NA,NA,NA,NA,NA,NA,NA,NA,NA,NA,"Ocreatus underwoodii","","heard only","","",NA,NA,NA,NA,NA,NA,"","July","2018","",-78.628957,0.103303,"1701.300659","2018-07-24T14:15:52Z",2018-07-24 14:15:52
"472","Maquipucuna","24/07/2018","1251","",NA,NA,NA,NA,NA,NA,NA,NA,NA,NA,"Ocreatus underwoodii","","heard only","","",NA,NA,NA,NA,NA,NA,"","July","2018","",-78.62902,0.103184,"1707.516235","2018-07-24T14:17:34Z",2018-07-24 14:17:34
"473","Maquipucuna","24/07/2018","1253","",NA,NA,NA,NA,NA,NA,NA,NA,NA,NA,"Colibri coruscans","","heard only","","",NA,NA,NA,NA,NA,NA,"","July","2018","",-78.628818,0.102914,"1710.768921","2018-07-24T14:19:52Z",2018-07-24 14:19:52
"474","Maquipucuna","24/07/2018","1255","Palicourea demissa","Palicourea demissa","5",NA,42,NA,NA,NA,NA,NA,NA,"Colibri coruscans","feeding","","","",NA,NA,NA,NA,NA,NA,"Palicourea demissa","July","2018","Palicourea demissa",-78.628639,0.102829,"1712.946411","2018-07-24T14:21:57Z",2018-07-24 14:21:57
"475","Maquipucuna","24/07/2018","1259","",NA,NA,NA,NA,NA,NA,NA,NA,NA,NA,"Aglaiocercus coelestis","","heard only","","",NA,NA,NA,NA,NA,NA,"","July","2018","",-78.628198,0.102189,"1726.824707","2018-07-24T14:27:18Z",2018-07-24 14:27:18
"476","Maquipucuna","22/08/2018","1639","Columnea mastersonii","Columnea eburnea","4",NA,4,NA,NA,NA,NA,NA,NA,"Phaethornis syrmatophorus","feeding","","","",NA,NA,NA,NA,NA,NA,"Columnea eburnea","August","2018","Columnea eburnea",-78.628823,0.107555,"1570.044678","2018-08-22T13:30:58Z",2018-08-22 13:30:58
"477","Maquipucuna","22/08/2018","1642","Columnea mastersonii","Columnea eburnea","5",NA,12,NA,NA,NA,NA,NA,NA,"Phaethornis syrmatophorus","feeding","","","",NA,NA,NA,NA,NA,NA,"Columnea eburnea","August","2018","Columnea eburnea",-78.629673,0.10695,"1585.478149","2018-08-22T13:40:35Z",2018-08-22 13:40:35
"478","Maquipucuna","22/08/2018","1643","",NA,NA,NA,NA,NA,NA,NA,NA,NA,NA,"Ocreatus underwoodii","","heard only","","",NA,NA,NA,NA,NA,NA,"","August","2018","",-78.629737,0.106912,"1586.549438","2018-08-22T13:41:22Z",2018-08-22 13:41:22
"479","Maquipucuna","22/08/2018","1645","",NA,NA,NA,NA,NA,NA,NA,NA,NA,NA,"Colibri coruscans","","heard only","","",NA,NA,NA,NA,NA,NA,"","August","2018","",-78.629387,0.106983,"1594.062134","2018-08-22T13:44:54Z",2018-08-22 13:44:54
"480","Maquipucuna","22/08/2018","1660","",NA,NA,NA,NA,NA,NA,NA,NA,NA,NA,"Coeligena wilsoni","","heard only","","",NA,NA,NA,NA,NA,NA,"","August","2018","",-78.628861,0.106404,"1632.626831","2018-08-22T14:05:21Z",2018-08-22 14:05:21
"481","Maquipucuna","22/08/2018","1663","",NA,NA,NA,NA,NA,NA,NA,NA,NA,NA,"Colibri coruscans","","heard only","","",NA,NA,NA,NA,NA,NA,"","August","2018","",-78.629351,0.106294,"1640.864258","2018-08-22T14:08:48Z",2018-08-22 14:08:48
"482","Maquipucuna","22/08/2018","1670","",NA,NA,NA,NA,NA,NA,NA,NA,NA,NA,"Colibri coruscans","","heard only","","",NA,NA,NA,NA,NA,NA,"","August","2018","",-78.629421,0.10513,"1660.318115","2018-08-22T14:17:19Z",2018-08-22 14:17:19
"483","Maquipucuna","22/08/2018","1691","",NA,NA,NA,NA,NA,NA,NA,NA,NA,NA,"Aglaiocercus coelestis","drinking water from a leaf?","male","","",NA,NA,NA,NA,NA,NA,"","August","2018","",-78.627818,0.102269,"1713.964600","2018-08-22T15:09:24Z",2018-08-22 15:09:24
"484","Maquipucuna","22/08/2018","1692","Burmeistera multiflora","Burmeistera multiflora","2",NA,8,NA,NA,NA,NA,NA,NA,"Aglaiocercus coelestis","feeding","male","","",NA,NA,NA,NA,NA,NA,"Burmeistera multiflora","August","2018","Burmeistera multiflora",-78.627792,0.102254,"1713.148193","2018-08-22T15:10:28Z",2018-08-22 15:10:28
"485","Maquipucuna","24/09/2018","1988","",NA,NA,NA,NA,NA,NA,NA,NA,NA,NA,"Ocreatus underwoodii","","heard only","","",NA,NA,NA,NA,NA,NA,"","September","2018","",-78.628924,0.108295,"1542.500000","2018-09-24T12:55:44Z",2018-09-24 12:55:44
"486","Maquipucuna","24/09/2018","1989","",NA,NA,NA,NA,NA,NA,NA,NA,NA,NA,"Phaethornis yaruqui","","heard only","","",NA,NA,NA,NA,NA,NA,"","September","2018","",-78.629011,0.108131,"1545.794678","2018-09-24T12:57:16Z",2018-09-24 12:57:16
"487","Maquipucuna","24/09/2018","2000","",NA,NA,NA,NA,NA,NA,NA,NA,NA,NA,"Colibri coruscans","","heard only","","",NA,NA,NA,NA,NA,NA,"","September","2018","",-78.629218,0.107469,"1572.431885","2018-09-24T13:15:22Z",2018-09-24 13:15:22
"488","Maquipucuna","24/09/2018","1","",NA,NA,NA,NA,NA,NA,NA,NA,NA,NA,"Coeligena wilsoni","","heard only","","",NA,NA,NA,NA,NA,NA,"","September","2018","",-78.629447,0.107294,"1575.468750","2018-09-24T13:20:09Z",2018-09-24 13:20:09
"489","Maquipucuna","24/09/2018","7","",NA,NA,NA,NA,NA,NA,NA,NA,NA,NA,"Colibri coruscans","","heard only","","",NA,NA,NA,NA,NA,NA,"","September","2018","",-78.629582,0.106898,"1588.345947","2018-09-24T13:25:11Z",2018-09-24 13:25:11
"490","Maquipucuna","24/09/2018","9","Norantea anomala","Norantea anomala","7",NA,450,NA,NA,NA,NA,NA,NA,"Colibri coruscans","feeding","","","",NA,NA,NA,NA,NA,NA,"Norantea anomala","September","2018","Norantea anomala",-78.629387,0.10703,"1592.434448","2018-09-24T13:27:14Z",2018-09-24 13:27:14
"491","Maquipucuna","24/09/2018","11","",NA,NA,NA,NA,NA,NA,NA,NA,NA,NA,"Ocreatus underwoodii","","heard only","","",NA,NA,NA,NA,NA,NA,"","September","2018","",-78.629245,0.106923,"1594.745728","2018-09-24T13:29:11Z",2018-09-24 13:29:11
"492","Maquipucuna","24/09/2018","14","",NA,NA,NA,NA,NA,NA,NA,NA,NA,NA,"Coeligena wilsoni","","heard only","","",NA,NA,NA,NA,NA,NA,"","September","2018","",-78.628705,0.107011,"1603.291870","2018-09-24T13:33:09Z",2018-09-24 13:33:09
"493","Maquipucuna","24/09/2018","16","",NA,NA,NA,NA,NA,NA,NA,NA,NA,NA,"Ocreatus underwoodii","flying","female","","",NA,NA,NA,NA,NA,NA,"","September","2018","",-78.628575,0.107002,"1604.351318","2018-09-24T13:34:17Z",2018-09-24 13:34:17
"494","Maquipucuna","24/09/2018","16","",NA,NA,NA,NA,NA,NA,NA,NA,NA,NA,"Ocreatus underwoodii","perched","female","","",NA,NA,NA,NA,NA,NA,"","September","2018","",-78.628575,0.107002,"1604.351318","2018-09-24T13:34:17Z",2018-09-24 13:34:17
"495","Maquipucuna","24/09/2018","18","Glossoloma purpureum","Glossoloma purpureum","4",NA,6,NA,NA,NA,NA,NA,NA,"Phaethornis syrmatophorus","feeding","","","",NA,NA,NA,NA,NA,NA,"Glossoloma purpureum","September","2018","Glossoloma purpureum",-78.628538,0.106984,"1604.028564","2018-09-24T13:39:33Z",2018-09-24 13:39:33
"496","Maquipucuna","24/09/2018","19","",NA,NA,NA,NA,NA,NA,NA,NA,NA,NA,"Ocreatus underwoodii","","heard only","","",NA,NA,NA,NA,NA,NA,"","September","2018","",-78.62895,0.106373,"1630.691284","2018-09-24T13:47:48Z",2018-09-24 13:47:48
"497","Maquipucuna","24/09/2018","19","",NA,NA,NA,NA,NA,NA,NA,NA,NA,NA,"Colibri coruscans","","heard only","","",NA,NA,NA,NA,NA,NA,"","September","2018","",-78.62895,0.106373,"1630.691284","2018-09-24T13:47:48Z",2018-09-24 13:47:48
"498","Maquipucuna","24/09/2018","20","",NA,NA,NA,NA,NA,NA,NA,NA,NA,NA,"Coeligena wilsoni","","heard only","","",NA,NA,NA,NA,NA,NA,"","September","2018","",-78.628892,0.106327,"1631.356689","2018-09-24T13:48:46Z",2018-09-24 13:48:46
"499","Maquipucuna","24/09/2018","22","",NA,NA,NA,NA,NA,NA,NA,NA,NA,NA,"Thalurania fannyi","´flying","male","","",NA,NA,NA,NA,NA,NA,"","September","2018","",-78.629062,0.106354,"1633.459961","2018-09-24T13:49:48Z",2018-09-24 13:49:48
"500","Maquipucuna","24/09/2018","30","",NA,NA,NA,NA,NA,NA,NA,NA,NA,NA,"Colibri coruscans","","heard only","","",NA,NA,NA,NA,NA,NA,"","September","2018","",-78.629586,0.105585,"1650.515625","2018-09-24T14:05:20Z",2018-09-24 14:05:20
"501","Maquipucuna","24/09/2018","30","",NA,NA,NA,NA,NA,NA,NA,NA,NA,NA,"Ocreatus underwoodii","","heard only","","",NA,NA,NA,NA,NA,NA,"","September","2018","",-78.629586,0.105585,"1650.515625","2018-09-24T14:05:20Z",2018-09-24 14:05:20
"502","Maquipucuna","24/09/2018","48","Besleria solanoides","Besleria solanoides","4",NA,11,NA,NA,NA,NA,NA,NA,"Ocreatus underwoodii","feeding","female","","",NA,NA,NA,NA,NA,NA,"Besleria solanoides","September","2018","Besleria solanoides",-78.629005,0.103676,"1694.652588","2018-09-24T14:28:50Z",2018-09-24 14:28:50
"503","Maquipucuna","24/09/2018","51","Norantea anomala","Norantea anomala","11",NA,2700,NA,NA,NA,NA,NA,NA,"Colibri coruscans","feeding","number of flowers is no joke!","","",NA,NA,NA,NA,NA,NA,"Norantea anomala","September","2018","Norantea anomala",-78.628715,0.10288,"1714.511230","2018-09-24T14:38:22Z",2018-09-24 14:38:22
"504","Maquipucuna","24/10/2018","395","",NA,NA,NA,NA,NA,NA,NA,NA,NA,NA,"Ocreatus underwoodii","","heard only","","",NA,NA,NA,NA,NA,NA,"","October","2018","",-78.629,0.107908,"1544.577881","2018-10-24T13:08:51Z",2018-10-24 13:08:51
"505","Maquipucuna","24/10/2018","400","",NA,NA,NA,NA,NA,NA,NA,NA,NA,NA,"Phaethornis yaruqui","","heard only","","",NA,NA,NA,NA,NA,NA,"","October","2018","",-78.628752,0.107563,"1558.322021","2018-10-24T13:15:00Z",2018-10-24 13:15:00
"506","Maquipucuna","24/10/2018","404","",NA,NA,NA,NA,NA,NA,NA,NA,NA,NA,"Ocreatus underwoodii","","heard only","","",NA,NA,NA,NA,NA,NA,"","October","2018","",-78.62937,0.10727,"1572.595581","2018-10-24T13:25:58Z",2018-10-24 13:25:58
"507","Maquipucuna","24/10/2018","404","",NA,NA,NA,NA,NA,NA,NA,NA,NA,NA,"Phaethornis yaruqui","","heard only","","",NA,NA,NA,NA,NA,NA,"","October","2018","",-78.62937,0.10727,"1572.595581","2018-10-24T13:25:58Z",2018-10-24 13:25:58
"508","Maquipucuna","24/10/2018","406","",NA,NA,NA,NA,NA,NA,NA,NA,NA,NA,"Colibri coruscans","","heard only","","",NA,NA,NA,NA,NA,NA,"","October","2018","",-78.62961,0.107148,"1578.291748","2018-10-24T13:28:09Z",2018-10-24 13:28:09
"509","Maquipucuna","24/10/2018","407","",NA,NA,NA,NA,NA,NA,NA,NA,NA,NA,"Ocreatus underwoodii","","heard only","","",NA,NA,NA,NA,NA,NA,"","October","2018","",-78.629753,0.106935,"1582.598999","2018-10-24T13:30:32Z",2018-10-24 13:30:32
"510","Maquipucuna","24/10/2018","410","",NA,NA,NA,NA,NA,NA,NA,NA,NA,NA,"Colibri coruscans","","heard only","","",NA,NA,NA,NA,NA,NA,"","October","2018","",-78.628516,0.108167,"1578.432129","2018-10-24T13:41:14Z",2018-10-24 13:41:14
"511","Maquipucuna","24/10/2018","411","",NA,NA,NA,NA,NA,NA,NA,NA,NA,NA,"Ocreatus underwoodii","","heard only","","",NA,NA,NA,NA,NA,NA,"","October","2018","",-78.628995,0.108654,"1578.429199","2018-10-24T13:41:19Z",2018-10-24 13:41:19
"512","Maquipucuna","24/10/2018","411","",NA,NA,NA,NA,NA,NA,NA,NA,NA,NA,"Aglaiocercus coelestis","","heard only","","",NA,NA,NA,NA,NA,NA,"","October","2018","",-78.628995,0.108654,"1578.429199","2018-10-24T13:41:19Z",2018-10-24 13:41:19
"513","Maquipucuna","24/10/2018","423","",NA,NA,NA,NA,NA,NA,NA,NA,NA,NA,"Ocreatus underwoodii","","heard only","","",NA,NA,NA,NA,NA,NA,"","October","2018","",-78.62957,0.105667,"1638.459717","2018-10-24T14:04:49Z",2018-10-24 14:04:49
"514","Maquipucuna","24/10/2018","424","Besleria solanoides","Besleria solanoides","3",NA,2,NA,NA,NA,NA,NA,NA,"Ocreatus underwoodii","","heard only","","",NA,NA,NA,NA,NA,NA,"Besleria solanoides","October","2018","Besleria solanoides",-78.629529,0.105564,"1640.793335","2018-10-24T14:05:46Z",2018-10-24 14:05:46
"515","Maquipucuna","24/10/2018","430","",NA,NA,NA,NA,NA,NA,NA,NA,NA,NA,"Ocreatus underwoodii","","heard only","","",NA,NA,NA,NA,NA,NA,"","October","2018","",-78.629041,0.104226,"1678.672119","2018-10-24T14:25:11Z",2018-10-24 14:25:11
"516","Maquipucuna","24/10/2018","434","",NA,NA,NA,NA,NA,NA,NA,NA,NA,NA,"Ocreatus underwoodii","","heard only","","",NA,NA,NA,NA,NA,NA,"","October","2018","",-78.628974,0.103447,"1700.260742","2018-10-24T14:41:27Z",2018-10-24 14:41:27
"517","Maquipucuna","24/10/2018","435","",NA,NA,NA,NA,NA,NA,NA,NA,NA,NA,"Ocreatus underwoodii","","heard only","","",NA,NA,NA,NA,NA,NA,"","October","2018","",-78.628943,0.103181,"1703.153076","2018-10-24T14:43:01Z",2018-10-24 14:43:01
"518","Maquipucuna","24/10/2018","435","",NA,NA,NA,NA,NA,NA,NA,NA,NA,NA,"Thalurania fannyi","","heard only","","",NA,NA,NA,NA,NA,NA,"","October","2018","",-78.628943,0.103181,"1703.153076","2018-10-24T14:43:01Z",2018-10-24 14:43:01
"519","Maquipucuna","24/10/2018","436","",NA,NA,NA,NA,NA,NA,NA,NA,NA,NA,"Ocreatus underwoodii","perched","female","","",NA,NA,NA,NA,NA,NA,"","October","2018","",-78.628983,0.103224,"1704.011597","2018-10-24T14:43:53Z",2018-10-24 14:43:53
"520","Maquipucuna","24/10/2018","437","",NA,NA,NA,NA,NA,NA,NA,NA,NA,NA,"Colibri coruscans","","heard only","","",NA,NA,NA,NA,NA,NA,"","October","2018","",-78.628985,0.103155,"1708.934937","2018-10-24T14:44:51Z",2018-10-24 14:44:51
"521","Maquipucuna","24/10/2018","438","",NA,NA,NA,NA,NA,NA,NA,NA,NA,NA,"Thalurania fannyi","perched","male","","",NA,NA,NA,NA,NA,NA,"","October","2018","",-78.628988,0.103015,"1712.342285","2018-10-24T14:46:32Z",2018-10-24 14:46:32
"522","Maquipucuna","24/10/2018","440","",NA,NA,NA,NA,NA,NA,NA,NA,NA,NA,"Aglaiocercus coelestis","","heard only","","",NA,NA,NA,NA,NA,NA,"","October","2018","",-78.628872,0.102939,"1714.019897","2018-10-24T14:47:57Z",2018-10-24 14:47:57
"523","Maquipucuna","24/10/2018","441","",NA,NA,NA,NA,NA,NA,NA,NA,NA,NA,"Colibri coruscans","","heard only","","",NA,NA,NA,NA,NA,NA,"","October","2018","",-78.628695,0.102874,"1714.198730","2018-10-24T14:49:35Z",2018-10-24 14:49:35
"524","Maquipucuna","20/11/2018","769","",NA,NA,NA,NA,NA,NA,NA,NA,NA,NA,"Heliodoxa imperatrix","","heard only","","",NA,NA,NA,NA,NA,NA,"","November","2018","",-78.628803,0.108251,"1559.286011","2018-11-20T13:23:37Z",2018-11-20 13:23:37
"525","Maquipucuna","20/11/2018","777","",NA,NA,NA,NA,NA,NA,NA,NA,NA,NA,"Aglaiocercus coelestis","flying","male","","",NA,NA,NA,NA,NA,NA,"","November","2018","",-78.628817,0.107808,"1572.580811","2018-11-20T13:31:11Z",2018-11-20 13:31:11
"526","Maquipucuna","20/11/2018","780","",NA,NA,NA,NA,NA,NA,NA,NA,NA,NA,"Ocreatus underwoodii","","heard only","","",NA,NA,NA,NA,NA,NA,"","November","2018","",-78.628657,0.107662,"1574.824219","2018-11-20T13:34:10Z",2018-11-20 13:34:10
"527","Maquipucuna","20/11/2018","783","",NA,NA,NA,NA,NA,NA,NA,NA,NA,NA,"Aglaiocercus coelestis","flying","female","","",NA,NA,NA,NA,NA,NA,"","November","2018","",-78.628672,0.107546,"1575.641235","2018-11-20T13:37:09Z",2018-11-20 13:37:09
"528","Maquipucuna","20/11/2018","783","",NA,NA,NA,NA,NA,NA,NA,NA,NA,NA,"Ocreatus underwoodii","","heard only","","",NA,NA,NA,NA,NA,NA,"","November","2018","",-78.628672,0.107546,"1575.641235","2018-11-20T13:37:09Z",2018-11-20 13:37:09
"529","Maquipucuna","20/11/2018","786","",NA,NA,NA,NA,NA,NA,NA,NA,NA,NA,"Aglaiocercus coelestis","","heard only","","",NA,NA,NA,NA,NA,NA,"","November","2018","",-78.629128,0.107516,"1583.261230","2018-11-20T13:41:58Z",2018-11-20 13:41:58
"530","Maquipucuna","20/11/2018","794","",NA,NA,NA,NA,NA,NA,NA,NA,NA,NA,"Coeligena wilsoni","","heard only","","",NA,NA,NA,NA,NA,NA,"","November","2018","",-78.629614,0.106909,"1598.598633","2018-11-20T13:51:48Z",2018-11-20 13:51:48
"531","Maquipucuna","20/11/2018","796","Psamisia aberrans",NA,"7",NA,19,NA,NA,NA,NA,NA,NA,"Doryfera ludovicae","feeding","","","",NA,NA,NA,NA,NA,NA,"Psammisia aberrans","November","2018","Psammisia aberrans",-78.629582,0.106972,"1599.415161","2018-11-20T13:53:13Z",2018-11-20 13:53:13
"532","Maquipucuna","20/11/2018","800","",NA,NA,NA,NA,NA,NA,NA,NA,NA,NA,"Aglaiocercus coelestis","","heard only","","",NA,NA,NA,NA,NA,NA,"","November","2018","",-78.629165,0.106924,"1604.802856","2018-11-20T13:56:37Z",2018-11-20 13:56:37
"533","Maquipucuna","20/11/2018","805","",NA,NA,NA,NA,NA,NA,NA,NA,NA,NA,"Aglaiocercus coelestis","","heard only","","",NA,NA,NA,NA,NA,NA,"","November","2018","",-78.62884,0.106904,"1611.705688","2018-11-20T13:59:39Z",2018-11-20 13:59:39
"534","Maquipucuna","20/11/2018","808","Columnea eburnea",NA,"6",NA,3,NA,NA,NA,NA,NA,NA,"Phaethornis syrmatophorus","feeding","","","",NA,NA,NA,NA,NA,NA,"Columnea eburnea","November","2018","Columnea eburnea",-78.628577,0.107006,"1612.092896","2018-11-20T14:06:31Z",2018-11-20 14:06:31
"535","Maquipucuna","20/11/2018","809","",NA,NA,NA,NA,NA,NA,NA,NA,NA,NA,"Ocreatus underwoodii","","heard only","","",NA,NA,NA,NA,NA,NA,"","November","2018","",-78.628445,0.106876,"1614.810059","2018-11-20T14:08:58Z",2018-11-20 14:08:58
"536","Maquipucuna","20/11/2018","814","",NA,NA,NA,NA,NA,NA,NA,NA,NA,NA,"Phaethornis syrmatophorus","flying","","","",NA,NA,NA,NA,NA,NA,"","November","2018","",-78.628942,0.10631,"1640.223999","2018-11-20T14:21:40Z",2018-11-20 14:21:40
"537","Maquipucuna","20/11/2018","822","",NA,NA,NA,NA,NA,NA,NA,NA,NA,NA,"Ocreatus underwoodii","","heard only","","",NA,NA,NA,NA,NA,NA,"","November","2018","",-78.629475,0.106045,"1649.075317","2018-11-20T14:31:36Z",2018-11-20 14:31:36
"538","Maquipucuna","20/11/2018","823","",NA,NA,NA,NA,NA,NA,NA,NA,NA,NA,"Aglaiocercus coelestis","","heard only","","",NA,NA,NA,NA,NA,NA,"","November","2018","",-78.629542,0.105982,"1650.444946","2018-11-20T14:32:20Z",2018-11-20 14:32:20
"539","Maquipucuna","20/11/2018","831","",NA,NA,NA,NA,NA,NA,NA,NA,NA,NA,"Ocreatus underwoodii","","heard only","","",NA,NA,NA,NA,NA,NA,"","November","2018","",-78.629562,0.105662,"1655.971802","2018-11-20T14:36:29Z",2018-11-20 14:36:29
"540","Maquipucuna","20/11/2018","841","",NA,NA,NA,NA,NA,NA,NA,NA,NA,NA,"Ocreatus underwoodii","","heard only","","",NA,NA,NA,NA,NA,NA,"","November","2018","",-78.629234,0.104371,"1680.004272","2018-11-20T14:48:34Z",2018-11-20 14:48:34
"541","Maquipucuna","20/11/2018","842","",NA,NA,NA,NA,NA,NA,NA,NA,NA,NA,"Aglaiocercus coelestis","","heard only","","",NA,NA,NA,NA,NA,NA,"","November","2018","",-78.62911,0.104452,"1682.442383","2018-11-20T14:52:51Z",2018-11-20 14:52:51
"542","Maquipucuna","20/11/2018","844","",NA,NA,NA,NA,NA,NA,NA,NA,NA,NA,"Aglaiocercus coelestis","","heard only","","",NA,NA,NA,NA,NA,NA,"","November","2018","",-78.628989,0.104325,"1686.803711","2018-11-20T14:55:18Z",2018-11-20 14:55:18
"543","Maquipucuna","20/11/2018","847","",NA,NA,NA,NA,NA,NA,NA,NA,NA,NA,"Heliodoxa imperatrix","","heard only","","",NA,NA,NA,NA,NA,NA,"","November","2018","",-78.629041,0.104074,"1692.795532","2018-11-20T14:58:08Z",2018-11-20 14:58:08
"544","Maquipucuna","20/11/2018","847","",NA,NA,NA,NA,NA,NA,NA,NA,NA,NA,"Ocreatus underwoodii","","heard only","","",NA,NA,NA,NA,NA,NA,"","November","2018","",-78.629041,0.104074,"1692.795532","2018-11-20T14:58:08Z",2018-11-20 14:58:08
"545","Maquipucuna","20/11/2018","859","",NA,NA,NA,NA,NA,NA,NA,NA,NA,NA,"Aglaiocercus coelestis","","heard only","","",NA,NA,NA,NA,NA,NA,"","November","2018","",-78.628934,0.103034,"1718.067139","2018-11-20T15:10:34Z",2018-11-20 15:10:34
"546","Maquipucuna","20/11/2018","863","",NA,NA,NA,NA,NA,NA,NA,NA,NA,NA,"Heliodoxa imperatrix","","heard only","","",NA,NA,NA,NA,NA,NA,"","November","2018","",-78.628671,0.102809,"1717.727295","2018-11-20T15:13:11Z",2018-11-20 15:13:11
"547","Maquipucuna","20/11/2018","869","",NA,NA,NA,NA,NA,NA,NA,NA,NA,NA,"Ocreatus underwoodii","perched","","","",NA,NA,NA,NA,NA,NA,"","November","2018","",-78.628238,0.102216,"1731.126221","2018-11-20T15:25:56Z",2018-11-20 15:25:56
"548","Maquipucuna","20/11/2018","870","",NA,NA,NA,NA,NA,NA,NA,NA,NA,NA,"Coeligena wilsoni","","heard only","","",NA,NA,NA,NA,NA,NA,"","November","2018","",-78.62811,0.102244,"1728.430420","2018-11-20T15:26:29Z",2018-11-20 15:26:29
"549","Maquipucuna","23/12/2018","1244","",NA,NA,NA,NA,NA,NA,NA,NA,NA,NA,"Ocreatus underwoodii","","heard only","","",NA,NA,NA,NA,NA,NA,"","December","2018","",-78.62874,0.107766,"1540.095825","2018-12-23T13:15:22Z",2018-12-23 13:15:22
"550","Maquipucuna","23/12/2018","1247","",NA,NA,NA,NA,NA,NA,NA,NA,NA,NA,"Ocreatus underwoodii","","heard only","","",NA,NA,NA,NA,NA,NA,"","December","2018","",-78.628774,0.107606,"1544.555908","2018-12-23T13:17:10Z",2018-12-23 13:17:10
"551","Maquipucuna","23/12/2018","1250","",NA,NA,NA,NA,NA,NA,NA,NA,NA,NA,"Coeligena wilsoni","","heard only","","",NA,NA,NA,NA,NA,NA,"","December","2018","",-78.629029,0.107546,"1549.832153","2018-12-23T13:19:23Z",2018-12-23 13:19:23
"552","Maquipucuna","23/12/2018","1255","",NA,NA,NA,NA,NA,NA,NA,NA,NA,NA,"Ocreatus underwoodii","","heard only","","",NA,NA,NA,NA,NA,NA,"","December","2018","",-78.62958,0.107162,"1566.260254","2018-12-23T13:27:49Z",2018-12-23 13:27:49
"553","Maquipucuna","23/12/2018","1259","",NA,NA,NA,NA,NA,NA,NA,NA,NA,NA,"Ocreatus underwoodii","","heard only","","",NA,NA,NA,NA,NA,NA,"","December","2018","",-78.629774,0.10695,"1576.141113","2018-12-23T13:35:19Z",2018-12-23 13:35:19
"554","Maquipucuna","23/12/2018","1262","",NA,NA,NA,NA,NA,NA,NA,NA,NA,NA,"Heliodoxa imperatrix","","heard only","","",NA,NA,NA,NA,NA,NA,"","December","2018","",-78.629631,0.10694,"1579.632935","2018-12-23T13:36:29Z",2018-12-23 13:36:29
"555","Maquipucuna","23/12/2018","1269","",NA,NA,NA,NA,NA,NA,NA,NA,NA,NA,"Coeligena wilsoni","","heard only","","",NA,NA,NA,NA,NA,NA,"","December","2018","",-78.628489,0.106923,"1601.992676","2018-12-23T13:48:04Z",2018-12-23 13:48:04
"556","Maquipucuna","23/12/2018","1274","",NA,NA,NA,NA,NA,NA,NA,NA,NA,NA,"Ocreatus underwoodii","","heard only","","",NA,NA,NA,NA,NA,NA,"","December","2018","",-78.628718,0.106496,"1624.013306","2018-12-23T14:00:52Z",2018-12-23 14:00:52
"557","Maquipucuna","23/12/2018","1277","",NA,NA,NA,NA,NA,NA,NA,NA,NA,NA,"Ocreatus underwoodii","flying","female","","",NA,NA,NA,NA,NA,NA,"","December","2018","",-78.629217,0.106406,"1636.315796","2018-12-23T14:06:43Z",2018-12-23 14:06:43
"558","Maquipucuna","23/12/2018","1278","Macleania smithiana",NA,"2",NA,1,NA,NA,NA,NA,NA,NA,"Ocreatus underwoodii","feeding","female","","",NA,NA,NA,NA,NA,NA,"Macleania smithiana","December","2018","Macleania smithiana",-78.629293,0.106384,"1637.282227","2018-12-23T14:07:27Z",2018-12-23 14:07:27
"559","Maquipucuna","23/12/2018","1282","",NA,NA,NA,NA,NA,NA,NA,NA,NA,NA,"Coeligena wilsoni","","heard only","","",NA,NA,NA,NA,NA,NA,"","December","2018","",-78.629439,0.106127,"1648.217407","2018-12-23T14:24:31Z",2018-12-23 14:24:31
"560","Maquipucuna","23/12/2018","1283","",NA,NA,NA,NA,NA,NA,NA,NA,NA,NA,"Ocreatus underwoodii","perched","female","","",NA,NA,NA,NA,NA,NA,"","December","2018","",-78.629542,0.106014,"1649.967529","2018-12-23T14:25:17Z",2018-12-23 14:25:17
"561","Maquipucuna","23/12/2018","1289","",NA,NA,NA,NA,NA,NA,NA,NA,NA,NA,"Aglaiocercus coelestis","","heard only","","",NA,NA,NA,NA,NA,NA,"","December","2018","",-78.629463,0.105352,"1661.860596","2018-12-23T14:31:41Z",2018-12-23 14:31:41
"562","Maquipucuna","23/12/2018","1295","",NA,NA,NA,NA,NA,NA,NA,NA,NA,NA,"Aglaiocercus coelestis","","heard only","","",NA,NA,NA,NA,NA,NA,"","December","2018","",-78.62914,0.104461,"1684.395996","2018-12-23T14:38:31Z",2018-12-23 14:38:31
"563","Maquipucuna","23/12/2018","1300","",NA,NA,NA,NA,NA,NA,NA,NA,NA,NA,"Coeligena wilsoni","","heard only","","",NA,NA,NA,NA,NA,NA,"","December","2018","",-78.628959,0.103971,"1698.220703","2018-12-23T14:45:25Z",2018-12-23 14:45:25
"564","Maquipucuna","23/12/2018","1304","",NA,NA,NA,NA,NA,NA,NA,NA,NA,NA,"Ocreatus underwoodii","","heard only","","",NA,NA,NA,NA,NA,NA,"","December","2018","",-78.629062,0.103349,"1709.186157","2018-12-23T14:52:21Z",2018-12-23 14:52:21
"565","Maquipucuna","23/12/2018","1305","",NA,NA,NA,NA,NA,NA,NA,NA,NA,NA,"Coeligena wilsoni","","heard only","","",NA,NA,NA,NA,NA,NA,"","December","2018","",-78.629065,0.103046,"1718.975342","2018-12-23T14:54:35Z",2018-12-23 14:54:35
"566","Maquipucuna","23/12/2018","1309","",NA,NA,NA,NA,NA,NA,NA,NA,NA,NA,"Ocreatus underwoodii","perched","female","","",NA,NA,NA,NA,NA,NA,"","December","2018","",-78.627761,0.102262,"1717.909546","2018-12-23T15:06:38Z",2018-12-23 15:06:38
"567","Maquipucuna","13/01/2019","1686","",NA,NA,NA,NA,NA,NA,NA,NA,NA,NA,"Phaethornis syrmatophorus","","heard only","","",NA,NA,NA,NA,NA,NA,"","January","2019","",-78.628708,0.107567,"1498.724976","2019-01-13T12:37:46Z",2019-01-13 12:37:46
"568","Maquipucuna","13/01/2019","1701","",NA,NA,NA,NA,NA,NA,NA,NA,NA,NA,"Ocreatus underwoodii","","heard only","","",NA,NA,NA,NA,NA,NA,"","January","2019","",-78.628971,0.106864,"1580.732910","2019-01-13T13:06:25Z",2019-01-13 13:06:25
"569","Maquipucuna","13/01/2019","1709","",NA,NA,NA,NA,NA,NA,NA,NA,NA,NA,"Coeligena wilsoni","","heard only","","",NA,NA,NA,NA,NA,NA,"","January","2019","",-78.629165,0.106378,"1624.789795","2019-01-13T13:18:54Z",2019-01-13 13:18:54
"570","Maquipucuna","13/01/2019","1714","",NA,NA,NA,NA,NA,NA,NA,NA,NA,NA,"Urosticte benjamini","flying","male","","",NA,NA,NA,NA,NA,NA,"","January","2019","",-78.629476,0.105429,"1645.770142","2019-01-13T13:29:55Z",2019-01-13 13:29:55
"571","Maquipucuna","13/01/2019","1724","",NA,NA,NA,NA,NA,NA,NA,NA,NA,NA,"Aglaiocercus coelestis","","heard only","","",NA,NA,NA,NA,NA,NA,"","January","2019","",-78.629012,0.103916,"1688.607666","2019-01-13T13:47:40Z",2019-01-13 13:47:40
"572","Maquipucuna","13/01/2019","1725","Cuatresia riparia",NA,"4",NA,17,NA,NA,NA,NA,NA,NA,"Ocreatus underwoodii","feeding","female","","",NA,NA,NA,NA,NA,NA,"Cuatresia riparia","January","2019","Cuatresia riparia",-78.628935,0.103688,"1692.479858","2019-01-13T13:49:10Z",2019-01-13 13:49:10
"573","Maquipucuna","13/01/2019","1728","",NA,NA,NA,NA,NA,NA,NA,NA,NA,NA,"Ocreatus underwoodii","","heard only","","",NA,NA,NA,NA,NA,NA,"","January","2019","",-78.628999,0.103553,"1696.153320","2019-01-13T13:51:45Z",2019-01-13 13:51:45
"574","Maquipucuna","13/01/2019","1731","",NA,NA,NA,NA,NA,NA,NA,NA,NA,NA,"Coeligena wilsoni","","heard only","","",NA,NA,NA,NA,NA,NA,"","January","2019","",-78.62901,0.103319,"1700.621826","2019-01-13T13:54:26Z",2019-01-13 13:54:26
"575","Maquipucuna","13/01/2019","1732","",NA,NA,NA,NA,NA,NA,NA,NA,NA,NA,"Aglaiocercus coelestis","","heard only","","",NA,NA,NA,NA,NA,NA,"","January","2019","",-78.628981,0.103138,"1708.816528","2019-01-13T13:56:26Z",2019-01-13 13:56:26
"576","Maquipucuna","13/01/2019","1736","",NA,NA,NA,NA,NA,NA,NA,NA,NA,NA,"Ocreatus underwoodii","","heard only","","",NA,NA,NA,NA,NA,NA,"","January","2019","",-78.62823,0.102169,"1729.527954","2019-01-13T14:07:11Z",2019-01-13 14:07:11
"577","Maquipucuna","01/02/2019","1797","",NA,NA,NA,NA,NA,NA,NA,NA,NA,NA,"Phaethornis yaruqui","flying","","","",NA,NA,NA,NA,NA,NA,"","February","2019","",-78.62862,0.109,"1434.122070","2019-02-01T12:33:23Z",2019-02-01 12:33:23
"578","Maquipucuna","01/02/2019","1801","",NA,NA,NA,NA,NA,NA,NA,NA,NA,NA,"Phaethornis syrmatophorus","flying","","","",NA,NA,NA,NA,NA,NA,"","February","2019","",-78.628898,0.108074,"1558.280884","2019-02-01T12:43:55Z",2019-02-01 12:43:55
"579","Maquipucuna","01/02/2019","1814","",NA,NA,NA,NA,NA,NA,NA,NA,NA,NA,"Ocreatus underwoodii","","heard only","","",NA,NA,NA,NA,NA,NA,"","February","2019","",-78.629733,0.107053,"1590.437744","2019-02-01T13:09:41Z",2019-02-01 13:09:41
"580","Maquipucuna","01/02/2019","1831","",NA,NA,NA,NA,NA,NA,NA,NA,NA,NA,"Coeligena wilsoni","","heard only","","",NA,NA,NA,NA,NA,NA,"","February","2019","",-78.628713,0.106521,"1632.452881","2019-02-01T13:27:00Z",2019-02-01 13:27:00
"581","Maquipucuna","01/02/2019","1836","",NA,NA,NA,NA,NA,NA,NA,NA,NA,NA,"Ocreatus underwoodii","","heard only","","",NA,NA,NA,NA,NA,NA,"","February","2019","",-78.629383,0.106191,"1645.423218","2019-02-01T13:36:20Z",2019-02-01 13:36:20
"582","Maquipucuna","01/02/2019","1840","",NA,NA,NA,NA,NA,NA,NA,NA,NA,NA,"Urosticte benjamini","","heard only","","",NA,NA,NA,NA,NA,NA,"","February","2019","",-78.629502,0.105485,"1657.532471","2019-02-01T13:43:51Z",2019-02-01 13:43:51
"583","Maquipucuna","01/02/2019","1841","",NA,NA,NA,NA,NA,NA,NA,NA,NA,NA,"Ocreatus underwoodii","","heard only","","",NA,NA,NA,NA,NA,NA,"","February","2019","",-78.62937,0.105121,"1663.101440","2019-02-01T13:46:20Z",2019-02-01 13:46:20
"584","Maquipucuna","01/02/2019","1848","",NA,NA,NA,NA,NA,NA,NA,NA,NA,NA,"Aglaiocercus coelestis","","heard only","","",NA,NA,NA,NA,NA,NA,"","February","2019","",-78.628944,0.103893,"1697.171875","2019-02-01T14:05:51Z",2019-02-01 14:05:51
"585","Maquipucuna","01/02/2019","1849","",NA,NA,NA,NA,NA,NA,NA,NA,NA,NA,"Coeligena wilsoni","","heard only","","",NA,NA,NA,NA,NA,NA,"","February","2019","",-78.628994,0.103642,"1701.425659","2019-02-01T14:07:58Z",2019-02-01 14:07:58
"586","Maquipucuna","01/02/2019","1852","",NA,NA,NA,NA,NA,NA,NA,NA,NA,NA,"Ocreatus underwoodii","","","","",NA,NA,NA,NA,NA,NA,"","February","2019","",-78.629016,0.103358,"1706.084351","2019-02-01T14:11:05Z",2019-02-01 14:11:05
"587","Maquipucuna","01/02/2019","1855","",NA,NA,NA,NA,NA,NA,NA,NA,NA,NA,"Aglaiocercus coelestis","","heard only","","",NA,NA,NA,NA,NA,NA,"","February","2019","",-78.628756,0.102872,"1718.121582","2019-02-01T14:22:21Z",2019-02-01 14:22:21
"588","Maquipucuna","06/03/2019","231","",NA,NA,NA,NA,NA,NA,NA,NA,NA,NA,"Ocreatus underwoodii","","heard only","","",NA,NA,NA,NA,NA,NA,"","March","2019","",-78.629077,0.107872,"1563.786987","2019-03-06T13:19:31Z",2019-03-06 13:19:31
"589","Maquipucuna","06/03/2019","232","",NA,NA,NA,NA,NA,NA,NA,NA,NA,NA,"Phaethornis yaruqui","flying","","","",NA,NA,NA,NA,NA,NA,"","March","2019","",-78.628879,0.107796,"1567.528931","2019-03-06T13:21:05Z",2019-03-06 13:21:05
"590","Maquipucuna","06/03/2019","233","Columnea kucyniakii",NA,"2",NA,1,NA,NA,NA,NA,NA,NA,"Phaethornis yaruqui","feeding","","","",NA,NA,NA,NA,NA,NA,"Columnea kucyniakii","March","2019","Columnea kucyniakii",-78.628753,0.107743,"1568.201050","2019-03-06T13:21:56Z",2019-03-06 13:21:56
"591","Maquipucuna","06/03/2019","243","",NA,NA,NA,NA,NA,NA,NA,NA,NA,NA,"Coeligena wilsoni","","heard only","","",NA,NA,NA,NA,NA,NA,"","March","2019","",-78.629682,0.107073,"1588.564575","2019-03-06T13:45:26Z",2019-03-06 13:45:26
"592","Maquipucuna","06/03/2019","244","",NA,NA,NA,NA,NA,NA,NA,NA,NA,NA,"Ocreatus underwoodii","","heard only","","",NA,NA,NA,NA,NA,NA,"","March","2019","",-78.629708,0.106999,"1590.234375","2019-03-06T13:46:13Z",2019-03-06 13:46:13
"593","Maquipucuna","06/03/2019","247","",NA,NA,NA,NA,NA,NA,NA,NA,NA,NA,"Ocreatus underwoodii","","heard only","","",NA,NA,NA,NA,NA,NA,"","March","2019","",-78.6292,0.106841,"1602.040161","2019-03-06T13:50:45Z",2019-03-06 13:50:45
"594","Maquipucuna","06/03/2019","249","",NA,NA,NA,NA,NA,NA,NA,NA,NA,NA,"Ocreatus underwoodii","","heard only","","",NA,NA,NA,NA,NA,NA,"","March","2019","",-78.628696,0.106506,"1628.995605","2019-03-06T14:04:23Z",2019-03-06 14:04:23
"595","Maquipucuna","06/03/2019","260","",NA,NA,NA,NA,NA,NA,NA,NA,NA,NA,"Aglaiocercus coelestis","","heard only","","",NA,NA,NA,NA,NA,NA,"","March","2019","",-78.629383,0.104919,"1664.081055","2019-03-06T14:26:46Z",2019-03-06 14:26:46
"596","Maquipucuna","06/03/2019","263","",NA,NA,NA,NA,NA,NA,NA,NA,NA,NA,"Coeligena wilsoni","","heard only","","",NA,NA,NA,NA,NA,NA,"","March","2019","",-78.629014,0.10441,"1679.477173","2019-03-06T14:32:04Z",2019-03-06 14:32:04
"597","Maquipucuna","06/03/2019","266","",NA,NA,NA,NA,NA,NA,NA,NA,NA,NA,"Aglaiocercus coelestis","","heard only","","",NA,NA,NA,NA,NA,NA,"","March","2019","",-78.629048,0.104034,"1690.141846","2019-03-06T14:42:14Z",2019-03-06 14:42:14
"598","Maquipucuna","06/03/2019","269","",NA,NA,NA,NA,NA,NA,NA,NA,NA,NA,"Ocreatus underwoodii","","heard only","","",NA,NA,NA,NA,NA,NA,"","March","2019","",-78.629072,0.103777,"1695.429932","2019-03-06T14:44:35Z",2019-03-06 14:44:35
"599","Maquipucuna","06/03/2019","274","",NA,NA,NA,NA,NA,NA,NA,NA,NA,NA,"Coeligena wilsoni","","heard only","","",NA,NA,NA,NA,NA,NA,"","March","2019","",-78.62776,0.102297,"1709.310303","2019-03-06T15:06:14Z",2019-03-06 15:06:14
"600","Maquipucuna","23/04/2019","790","Palicourea demissa",NA,"6",NA,6,NA,NA,NA,NA,NA,NA,"Ocreatus underwoodii","feeding","female","","",NA,NA,NA,NA,NA,NA,"Palicourea demissa","April","2019","Palicourea demissa",NA,NA,NA,NA,NA
"601","Maquipucuna","23/04/2019","793","",NA,NA,NA,NA,NA,NA,NA,NA,NA,NA,"Phaethornis syrmatophorus","flying","","","",NA,NA,NA,NA,NA,NA,"","April","2019","",NA,NA,NA,NA,NA
"602","Maquipucuna","23/04/2019","803","",NA,NA,NA,NA,NA,NA,NA,NA,NA,NA,"Phaethornis syrmatophorus","flying","","","",NA,NA,NA,NA,NA,NA,"","April","2019","",NA,NA,NA,NA,NA
"603","Maquipucuna","23/04/2019","806","",NA,NA,NA,NA,NA,NA,NA,NA,NA,NA,"Phaethornis syrmatophorus","perched","","","",NA,NA,NA,NA,NA,NA,"","April","2019","",NA,NA,NA,NA,NA
"604","Maquipucuna","23/04/2019","806","",NA,NA,NA,NA,NA,NA,NA,NA,NA,NA,"Phaethornis striigularis","flying","","","",NA,NA,NA,NA,NA,NA,"","April","2019","",NA,NA,NA,NA,NA
"605","Maquipucuna","23/04/2019","807","Wercklea ferox",NA,"3",NA,3,NA,NA,NA,NA,NA,NA,"Schistes geoffroyi","piercing","","","",NA,NA,NA,NA,NA,NA,"Wercklea ferox","April","2019","Wercklea ferox",NA,NA,NA,NA,NA
"606","Maquipucuna","23/04/2019","814","",NA,NA,NA,NA,NA,NA,NA,NA,NA,NA,"Coeligena wilsoni","","heard only","","",NA,NA,NA,NA,NA,NA,"","April","2019","",NA,NA,NA,NA,NA
"607","Maquipucuna","23/04/2019","818","",NA,NA,NA,NA,NA,NA,NA,NA,NA,NA,"Ocreatus underwoodii","","heard only","","",NA,NA,NA,NA,NA,NA,"","April","2019","",NA,NA,NA,NA,NA
"608","Maquipucuna","23/04/2019","821","",NA,NA,NA,NA,NA,NA,NA,NA,NA,NA,"Coeligena wilsoni","","heard only","","",NA,NA,NA,NA,NA,NA,"","April","2019","",NA,NA,NA,NA,NA
"609","Maquipucuna","23/04/2019","822","",NA,NA,NA,NA,NA,NA,NA,NA,NA,NA,"Phaethornis syrmatophorus","","heard only","","",NA,NA,NA,NA,NA,NA,"","April","2019","",NA,NA,NA,NA,NA
"610","MashpiCapuchin","12/04/2017","16",NA,NA,NA,NA,NA,NA,NA,NA,NA,NA,NA,"Phaethornis yaruqui","Volando 5""",NA,NA,NA,NA,NA,NA,NA,NA,NA,NA,"April","2017",NA,-78.878083,0.159954,"908.161","2017-04-12T14:50:41Z",2017-04-12 14:50:41
"611","MashpiCapuchin","12/04/2017","18",NA,NA,NA,NA,NA,NA,NA,NA,NA,NA,NA,"Phaethornis yaruqui","Volando 2""",NA,NA,NA,NA,NA,NA,NA,NA,NA,NA,"April","2017",NA,-78.878673,0.159628,"892.954","2017-04-12T15:09:55Z",2017-04-12 15:09:55
"612","MashpiCapuchin","12/04/2017","27",NA,NA,NA,NA,NA,NA,NA,NA,NA,NA,NA,"Phaethornis yaruqui","Volando 2""",NA,NA,NA,NA,NA,NA,NA,NA,NA,NA,"April","2017",NA,-78.88084,0.158276,"863.294","2017-04-12T15:53:28Z",2017-04-12 15:53:28
"613","MashpiCapuchin","12/04/2017","282",NA,NA,NA,NA,NA,NA,NA,NA,NA,NA,NA,"Phaethornis yaruqui",NA,"Hoverig por 1 segundo Puntos tomados con GPS AN",NA,NA,NA,NA,NA,NA,NA,NA,NA,"April","2017",NA,-78.879756,0.158734,"899.866","2017-04-12T16:31:32Z",2017-04-12 16:31:32
"614","MashpiCapuchin","12/04/2017","286",NA,NA,NA,NA,NA,NA,NA,NA,NA,NA,NA,"Urosticte benjamini",NA,"Puntos tomados con GPS AN. Perchado durante 50 segundos. Comportamiento: sally-hawking. Fotos C√°mara AN.","desde 100-0087 hasta 0094",NA,NA,NA,NA,NA,NA,NA,NA,"April","2017",NA,-78.880568,0.158401,"875.716","2017-04-12T17:03:04Z",2017-04-12 17:03:04
"615","MashpiCapuchin","13/05/2017","74","Bromelia sp2-Bromelia paniculata","Guzmania¬†harlingii","8",NA,2,NA,NA,NA,NA,NA,NA,"Androdon aequatorialis","aliment√°ndose & perching",NA,"pictures\plants\Bromeliaceae\Bromelia paniculata - Bromelia sp2",NA,NA,NA,NA,NA,NA,NA,"Guzmania¬†harlingii","May","2017","Guzmania¬†harlingii",-78.877551,0.160268,"932.712","2017-05-13T15:00:03Z",2017-05-13 15:00:03
"616","MashpiCapuchin","14/11/2017","223",NA,NA,NA,NA,NA,NA,NA,NA,NA,NA,NA,"Phaethornis yaruqui","fly",NA,NA,NA,NA,NA,NA,NA,NA,NA,NA,"November","2017",NA,-78.877001,0.160816,"961.312988","2017-11-14T13:07:31Z",2017-11-14 13:07:31
"617","MashpiCapuchin","18/02/2019","151",NA,NA,NA,NA,NA,NA,NA,NA,NA,NA,NA,"Coeligena torquata","perched",NA,NA,NA,NA,NA,NA,NA,NA,NA,NA,"February","2019",NA,-78.875071,0.161745,"979.806213","2019-02-18T15:15:16Z",2019-02-18 15:15:16
"618","MashpiCapuchin","18/08/2017","995",NA,NA,NA,NA,NA,NA,NA,NA,NA,NA,NA,"Boissonneaua jardini","perch",NA,NA,NA,NA,NA,NA,NA,NA,NA,NA,"August","2017",NA,-78.881943,0.158593,"838.986755","2017-08-18T15:59:17Z",2017-08-18 15:59:17
"619","MashpiCapuchin","19/07/2017","254",NA,NA,NA,NA,NA,NA,NA,NA,NA,NA,NA,"Phaethornis yaruqui","fly",NA,NA,NA,NA,NA,NA,NA,NA,NA,NA,"July","2017",NA,-78.880835,0.158284,"864.059631","2017-07-19T15:11:07Z",2017-07-19 15:11:07
"620","MashpiCapuchin","19/10/2017","560",NA,NA,NA,NA,NA,NA,NA,NA,NA,NA,NA,"Amazilia rosenbergi","perch",NA,NA,NA,NA,NA,NA,NA,NA,NA,NA,"October","2017",NA,-78.87509,0.161703,"1009.047058","2017-10-19T13:57:12Z",2017-10-19 13:57:12
"621","MashpiCapuchin","20/06/2017","383",NA,NA,NA,NA,NA,NA,NA,NA,NA,NA,NA,"Phaethornis yaruqui","fly",NA,NA,NA,NA,NA,NA,NA,NA,NA,NA,"June","2017",NA,-78.873846,0.163375,"1043.523804","2017-06-20T12:52:00Z",2017-06-20 12:52:00
"622","MashpiCapuchin","20/06/2017","389","Psamissia aberrans","Psammisia pauciflora","5","DC",7,NA,NA,NA,NA,NA,NA,"Phaethornis yaruqui","perch and fly",NA,NA,NA,NA,NA,NA,NA,NA,NA,"Psammisia pauciflora","June","2017","Psammisia pauciflora",-78.874084,0.163226,"1021.822754","2017-06-20T13:23:47Z",2017-06-20 13:23:47
"623","MashpiCapuchin","20/06/2017","401",NA,NA,NA,NA,NA,NA,NA,NA,NA,NA,NA,"Phaethornis yaruqui","fly",NA,NA,NA,NA,NA,NA,NA,NA,NA,NA,"June","2017",NA,-78.874765,0.162057,"979.899048","2017-06-20T14:04:10Z",2017-06-20 14:04:10
"624","MashpiCapuchin","20/06/2017","428",NA,NA,NA,NA,NA,NA,NA,NA,NA,NA,NA,"Urosticte benjamini","fly",NA,NA,NA,NA,NA,NA,NA,NA,NA,NA,"June","2017",NA,-78.880068,0.158419,"893.290161","2017-06-20T15:43:30Z",2017-06-20 15:43:30
"625","MashpiCapuchin","21/02/2018","1848",NA,NA,NA,NA,NA,NA,NA,NA,NA,NA,NA,"Phaethornis yaruqui","fly",NA,NA,NA,NA,NA,NA,NA,NA,NA,NA,"February","2018",NA,-78.875684,0.16119,"968.979309","2018-02-21T13:17:58Z",2018-02-21 13:17:58
"626","MashpiCapuchin","21/03/2018","379","Palicourea sodiroi","Palicourea sodiroi","2","DC",12,NA,NA,NA,NA,NA,NA,"Aglaiocercus coelestis","hovering",NA,NA,NA,NA,NA,NA,NA,NA,NA,"Palicourea sodiroi","March","2018","Palicourea sodiroi",-78.874782,0.162042,"989.530151","2018-03-21T12:50:36Z",2018-03-21 12:50:36
"627","MashpiCapuchin","21/03/2018","381",NA,NA,NA,NA,NA,NA,NA,NA,NA,NA,NA,"Urosticte benjamini","perch",NA,NA,NA,NA,NA,NA,NA,NA,NA,NA,"March","2018",NA,-78.874903,0.161918,"987.504456","2018-03-21T12:53:29Z",2018-03-21 12:53:29
"628","MashpiCapuchin","21/03/2018","415",NA,NA,NA,NA,NA,NA,NA,NA,NA,NA,NA,"Thalurania fannyi","perch",NA,NA,NA,NA,NA,NA,NA,NA,NA,NA,"March","2018",NA,-78.879655,0.158843,"903.362610","2018-03-21T15:02:07Z",2018-03-21 15:02:07
"629","MashpiCapuchin","27/06/2018","2215","Columnea minor","Columnea minor","4","DC",9,NA,NA,NA,NA,NA,NA,"Phaethornis yaruqui","perch",NA,NA,NA,NA,NA,NA,NA,NA,NA,"Columnea minor","June","2018","Columnea minor",-78.878301,0.159849,"909.377075","2018-06-27T15:38:41Z",2018-06-27 15:38:41
"630","MashpiCapuchin","27/09/2018","2908","Palicourea amarilla grande","Palicourea sp. 4","2","DC",3,NA,NA,NA,NA,NA,NA,"Coeligena torquata","hovering",NA,NA,NA,NA,NA,NA,NA,NA,NA,"Palicourea sp4","September","2018","Palicourea sp4",-78.877696,0.159998,"923.648865","2018-09-27T15:00:07Z",2018-09-27 15:00:07
"631","MashpiCapuchin","24/03/2019","240",NA,NA,NA,NA,NA,NA,NA,NA,NA,NA,NA,"Schistes geoffroyi","fly",NA,NA,NA,NA,NA,NA,NA,NA,NA,NA,"March","2019",NA,NA,NA,NA,NA,NA
"632","MashpiLaguna","13/05/2017","639",NA,NA,NA,"DC",NA,NA,NA,NA,NA,NA,NA,"Aglaiocercus coelestis","F","female, flying around Palicorea sp6",NA,NA,NA,NA,NA,NA,NA,NA,NA,"May","2017",NA,-78.870546,0.170204,"1188.267","2017-05-13T14:54:07Z",2017-05-13 14:54:07
"633","MashpiLaguna","13/05/2017","655",NA,NA,NA,"DC",NA,NA,NA,NA,NA,NA,NA,"Aglaiocercus coelestis","P","x2, male and female",NA,NA,NA,NA,NA,NA,NA,NA,NA,"May","2017",NA,-78.868135,0.172728,"1281.972","2017-05-13T16:09:55Z",2017-05-13 16:09:55
"634","MashpiLaguna","16/10/2018","602","Columnea minor","Columnea minor","2","DC",13,NA,NA,NA,NA,NA,NA,"Phaethornis yaruqui","feeding",NA,NA,NA,NA,NA,NA,NA,NA,NA,"Columnea minor","October","2018","Columnea minor",NA,NA,NA,NA,NA
"635","MashpiLaguna","16/10/2018","610","Psammisia sodiroi","Psammisia sodiroi","5","DC",39,NA,NA,NA,NA,NA,NA,"Phaethornis syrmatophorus","fighting","2 individuals",NA,NA,NA,NA,NA,NA,NA,NA,"Psammisia sodiroi","October","2018","Psammisia sodiroi",NA,NA,NA,NA,NA
"636","MashpiLaguna","16/10/2018","614","Cavendishia venosa","Cavendishia venosa","5","DC",8,NA,NA,NA,NA,NA,NA,"Coeligena wilsoni","feeding",NA,NA,NA,NA,NA,NA,NA,NA,NA,"Cavendishia venosa","October","2018","Cavendishia venosa",NA,NA,NA,NA,NA
"637","MashpiLaguna","16/10/2018","618",NA,NA,NA,NA,NA,NA,NA,NA,NA,NA,NA,"Phaethornis syrmatophorus","flying",NA,NA,NA,NA,NA,NA,NA,NA,NA,NA,"October","2018",NA,NA,NA,NA,NA,NA
"638","MashpiLaguna","17/12/2018","552",NA,NA,NA,"DC",NA,NA,NA,NA,NA,NA,NA,"Phaethornis yaruqui","fly",NA,NA,NA,NA,NA,NA,NA,NA,NA,NA,"December","2018",NA,-78.872198,0.169001,"1115.736","2018-12-17T14:42:50Z",2018-12-17 14:42:50
"639","MashpiLaguna","17/12/2018","608",NA,NA,NA,NA,NA,NA,NA,NA,NA,NA,NA,"Aglaiocercus kingii","fly",NA,NA,NA,NA,NA,NA,NA,NA,NA,NA,"December","2018",NA,-78.866225,0.172843,"1298.386","2018-12-17T17:27:06Z",2018-12-17 17:27:06
"640","MashpiLaguna","18/08/2017","1058",NA,NA,NA,NA,NA,NA,NA,NA,NA,NA,NA,"Aglaiocercus coelestis","p","female",NA,NA,NA,NA,NA,NA,NA,NA,NA,"August","2017",NA,-78.86946,0.171514,"1220.769","2017-08-18T15:11:07Z",2017-08-18 15:11:07
"641","MashpiLaguna","19/07/2017","941",NA,NA,NA,NA,NA,NA,NA,NA,NA,NA,NA,"Heliodoxa imperatrix","H",NA,NA,NA,NA,NA,NA,NA,NA,NA,NA,"July","2017",NA,-78.86761,0.173055,"1288.213","2017-07-19T16:54:00Z",2017-07-19 16:54:00
"642","MashpiLaguna","21/02/2018","217","Palicourea sp3","Palicourea asplundii","4","DC",45,NA,NA,NA,NA,NA,NA,"Urosticte benjamini","f,s",NA,NA,NA,NA,NA,NA,NA,NA,NA,"Palicourea asplundii","February","2018","Palicourea asplundii",-78.871067,0.170046,"1170.947998","2018-02-21T14:23:42Z",2018-02-21 14:23:42
"643","MashpiLaguna","21/02/2018","226","Palicourea sp3","Palicourea asplundii","4",NA,NA,"11","9",11,"8",5,12,"Urosticte benjamini",NA,NA,NA,NA,NA,NA,NA,NA,NA,NA,"Palicourea asplundii","February","2018","Palicourea asplundii",-78.870329,0.170594,"1189.853149","2018-02-21T15:07:51Z",2018-02-21 15:07:51
"644","MashpiLaguna","21/02/2018","228","Palicourea sp3","Palicourea asplundii","4","DC",25,NA,NA,NA,NA,NA,NA,"Urosticte benjamini","f",NA,NA,NA,NA,NA,NA,NA,NA,NA,"Palicourea asplundii","February","2018","Palicourea asplundii",-78.870132,0.170765,"1197.788940","2018-02-21T15:10:53Z",2018-02-21 15:10:53
"645","MashpiLaguna","21/02/2018","262",NA,NA,"7",NA,70,NA,NA,NA,NA,NA,NA,"Masked Flowerpiercer",NA,NA,NA,NA,NA,NA,NA,NA,NA,NA,NA,"February","2018",NA,-78.867405,0.17297,"1281.011597","2018-02-21T15:59:00Z",2018-02-21 15:59:00
"646","MashpiLaguna","21/09/2017","1113",NA,NA,NA,"DC",NA,NA,NA,NA,NA,NA,NA,"Coeligena wilsoni","h",NA,NA,NA,NA,NA,NA,NA,NA,NA,NA,"September","2017",NA,-78.87222,0.168034,"1101.721069","2017-09-21T12:57:00Z",2017-09-21 12:57:00
"647","MashpiLaguna","21/09/2017","1152",NA,NA,NA,"DC",NA,NA,NA,NA,NA,NA,NA,"Heliodoxa jacula","h",NA,NA,NA,NA,NA,NA,NA,NA,NA,NA,"September","2017",NA,-78.868292,0.172628,"1281.825684","2017-09-21T15:41:18Z",2017-09-21 15:41:18
"648","MashpiLaguna","22/01/2018","16","Besleria solanoides","Besleria solanoides","3","DC",20,NA,NA,NA,NA,NA,NA,"Aglaiocercus coelestis","p",NA,NA,NA,NA,NA,NA,NA,NA,NA,"Besleria solanoides","January","2018","Besleria solanoides",-78.872135,0.168986,"1147.180","2018-01-22T14:09:41Z",2018-01-22 14:09:41
"649","MashpiLaguna","22/01/2018","50","Anthropterus sp2","Anthopterus ecuadorensis","0.5","DC",4,NA,NA,NA,NA,NA,NA,"Boissonneaua jardini","p,h",NA,NA,NA,NA,NA,NA,NA,NA,NA,"Anthopterus ecuadorensis","January","2018","Anthopterus ecuadorensis",-78.866291,0.172846,"1292.272","2018-01-22T16:47:27Z",2018-01-22 16:47:27
"650","MashpiLaguna","23/05/2018","551",NA,NA,NA,NA,NA,NA,NA,NA,NA,NA,NA,"Adelomyia melanogenys","p",NA,NA,NA,NA,NA,NA,NA,NA,NA,NA,"May","2018",NA,NA,NA,NA,NA,NA
"651","MashpiLaguna","23/05/2018","554",NA,NA,NA,NA,NA,NA,NA,NA,NA,NA,NA,"Aglaiocercus coelestis","p",NA,NA,NA,NA,NA,NA,NA,NA,NA,NA,"May","2018",NA,NA,NA,NA,NA,NA
"652","MashpiLaguna","25/04/2018","471","Columnea rubriacuta","Columnea rubriacuta","2","DC",4,NA,NA,NA,NA,NA,NA,"Aglaiocercus coelestis","c",NA,NA,NA,NA,NA,NA,NA,NA,NA,"Columnea rubriacuta","April","2018","Columnea rubriacuta",NA,NA,NA,NA,NA
"653","MashpiLaguna","25/04/2018","481","Gasteranthus pansamalanus","Gasteranthus pansamalanus","2","DC",1,NA,NA,NA,NA,NA,NA,"Aglaiocercus coelestis","c",NA,NA,NA,NA,NA,NA,NA,NA,NA,"Gasteranthus pansamalanus","April","2018","Gasteranthus pansamalanus",NA,NA,NA,NA,NA
"654","MashpiLaguna","25/07/2018","450","Guzmania xanthobracteata","Guzmania amplectens","4","DC",27,NA,NA,NA,NA,NA,NA,"Aglaiocercus coelestis","feeding",NA,NA,NA,NA,NA,NA,NA,NA,NA,"Guzmania amplectens","July","2018","Guzmania amplectens",-78.86866,0.172049,"1248.437378","2018-07-25T14:57:06Z",2018-07-25 14:57:06
"655","MashpiLaguna","25/07/2018","452",NA,NA,NA,NA,NA,NA,NA,NA,NA,NA,NA,"Aglaiocercus coelestis","p",NA,NA,NA,NA,NA,NA,NA,NA,NA,NA,"July","2018",NA,-78.868494,0.172283,"1258.285278","2018-07-25T15:05:44Z",2018-07-25 15:05:44
"656","MashpiLaguna","25/07/2018","453",NA,NA,NA,NA,NA,NA,NA,NA,NA,NA,NA,"Phaethornis syrmatophorus","flying",NA,NA,NA,NA,NA,NA,NA,NA,NA,NA,"July","2018",NA,-78.868473,0.172301,"1264.493408","2018-07-25T15:09:02Z",2018-07-25 15:09:02
"657","MashpiLaguna","27/09/2018","787",NA,NA,NA,NA,NA,NA,NA,NA,NA,NA,NA,"Phaethornis yaruqui","flying",NA,NA,NA,NA,NA,NA,NA,NA,NA,NA,"September","2018",NA,-78.872153,0.169669,"1134.188599","2018-09-27T13:37:59Z",2018-09-27 13:37:59
"658","MashpiLaguna","27/09/2018","799","Palicourea asplundii","Palicourea asplundii","2","DC",25,NA,NA,NA,NA,NA,NA,"Aglaiocercus coelestis","fighting",NA,NA,NA,NA,NA,NA,NA,NA,NA,"Palicourea asplundii","September","2018","Palicourea asplundii",-78.870416,0.170524,"1181.894165","2018-09-27T14:09:57Z",2018-09-27 14:09:57
"659","Puyucunapi","2017-12-27","624","Meriania sp.","Meriania tomentosa","5","DC",17,NA,NA,NA,NA,NA,NA,"Ocreatus underwoodii, Boissonneaua flavescens",NA,NA,NA,NA,NA,NA,NA,NA,NA,NA,"Meriania tomentosa",NA,NA,"Meriania tomentosa",NA,NA,NA,NA,NA
"660","Puyucunapi","2017-12-27","688",NA,NA,NA,NA,NA,NA,NA,NA,NA,NA,NA,"Heliangelus strophianus, Aglaiocercus coelestis",NA,NA,NA,NA,NA,NA,NA,NA,NA,NA,NA,NA,NA,NA,NA,NA,NA,NA,NA
"661","Puyucunapi","2018-06-25","952","Columnea medicinalis","Columnea medicinalis","3","DC",4,NA,NA,NA,NA,NA,NA,"Ocreatus underwoodii",NA,NA,NA,NA,NA,NA,NA,NA,NA,NA,"Columnea medicinalis",NA,NA,"Columnea medicinalis",NA,NA,NA,NA,NA
"662","Puyucunapi","2018-08-16","368","Palicourea sp. flor roja","Palicourea demissa","4","DC",8,NA,NA,NA,NA,NA,NA,"Aglaiocercus coelestis",NA,NA,NA,NA,NA,NA,NA,NA,NA,NA,"Palicourea demissa",NA,NA,"Palicourea demissa",NA,NA,NA,NA,NA
"663","Puyucunapi","2018-08-16","385","Palicourea sp. flor roja","Palicourea demissa","4","DC",12,NA,NA,NA,NA,NA,NA,"Aglaiocercus coelestis",NA,NA,NA,NA,NA,NA,NA,NA,NA,NA,"Palicourea demissa",NA,NA,"Palicourea demissa",NA,NA,NA,NA,NA
"664","Puyucunapi","2018-10-23","533","Psammisia sodiroi","Psammisia sodiroi","2","DC",18,NA,NA,NA,NA,NA,NA,"Aglaiocercus coelestis",NA,NA,NA,NA,NA,NA,NA,NA,NA,NA,"Psammisia sodiroi",NA,NA,"Psammisia sodiroi",NA,NA,NA,NA,NA
"665","Puyucunapi","2018-10-23","534","Guzmania Andr√©s","Guzmania xanthobractea","1","DC",1,NA,NA,NA,NA,NA,NA,"Aglaiocercus coelestis",NA,NA,NA,NA,NA,NA,NA,NA,NA,NA,"Guzmania xanthobractea",NA,NA,"Guzmania xanthobractea",NA,NA,NA,NA,NA
"666","Puyucunapi","2018-10-23","537",NA,NA,NA,NA,NA,NA,NA,NA,NA,NA,NA,"Coeligena wilsoni",NA,NA,NA,NA,NA,NA,NA,NA,NA,NA,NA,NA,NA,NA,NA,NA,NA,NA,NA
"667","Puyucunapi","2018-10-23","537",NA,NA,NA,NA,NA,NA,NA,NA,NA,NA,NA,"Aglaiocercus coelestis",NA,NA,NA,NA,NA,NA,NA,NA,NA,NA,NA,NA,NA,NA,NA,NA,NA,NA,NA
"668","Puyucunapi","2018-10-23","538","Gasteranthus sp.","Gasteranthus quitensis",NA,"DC",NA,NA,NA,NA,NA,NA,NA,"Adelomyia melanogenys",NA,NA,NA,NA,NA,NA,NA,NA,NA,NA,"Gasteranthus quitensis",NA,NA,"Gasteranthus quitensis",NA,NA,NA,NA,NA
"669","Puyucunapi","2018-10-23","538","Ericaceae sp2","Macleania recumbens",NA,"DC",NA,NA,NA,NA,NA,NA,NA,"Adelomyia melanogenys",NA,NA,NA,NA,NA,NA,NA,NA,NA,NA,"Macleania recumbens",NA,NA,"Macleania recumbens",NA,NA,NA,NA,NA
"670","Puyucunapi","2018-10-23","538",NA,NA,NA,NA,NA,NA,NA,NA,NA,NA,NA,"Adelomyia melanogenys",NA,NA,NA,NA,NA,NA,NA,NA,NA,NA,NA,NA,NA,NA,NA,NA,NA,NA,NA
"671","Puyucunapi","2018-12-17","907","Bomarea pardina","Bomarea pardina","4","DC",12,NA,NA,NA,NA,NA,NA,"Coeligena wilsoni",NA,NA,NA,NA,NA,NA,NA,NA,NA,NA,"Bomarea pardina",NA,NA,"Bomarea pardina",NA,NA,NA,NA,NA
"672","Puyucunapi","2018-12-17","939",NA,NA,NA,NA,NA,NA,NA,NA,NA,NA,NA,"Coeligena wilsoni",NA,NA,NA,NA,NA,NA,NA,NA,NA,NA,NA,NA,NA,NA,NA,NA,NA,NA,NA
"673","Puyucunapi","2019-02-18","217","Ericaceae sp1.","Macleania recumbens","4","DC",1,NA,NA,NA,NA,NA,NA,"Aglaiocercus coelestis","female, feeding",NA,NA,NA,NA,NA,NA,NA,NA,NA,"Macleania recumbens",NA,NA,"Macleania recumbens",NA,NA,NA,NA,NA
"674","Puyucunapi","2019-02-18","219","Columnea flor morada","Columnea katzensteiniae","5","DC",1,NA,NA,NA,NA,NA,NA,"Aglaiocercus coelestis","male, feeding",NA,NA,NA,NA,NA,NA,NA,NA,NA,"Columnea katzensteiniae",NA,NA,"Columnea katzensteiniae",NA,NA,NA,NA,NA
"675","Rumisitana","43120","1257",NA,NA,NA,NA,NA,NA,NA,NA,NA,NA,NA,"Calliphlox mitchellii",NA,NA,NA,NA,NA,NA,NA,NA,NA,NA,NA,NA,NA,NA,NA,NA,NA,NA,NA
"676","Rumisitana","43120","1267",NA,NA,NA,NA,NA,NA,NA,NA,NA,NA,NA,"Ocreatus underwoodii",NA,NA,NA,NA,NA,NA,NA,NA,NA,NA,NA,NA,NA,NA,NA,NA,NA,NA,NA
"677","Rumisitana","43120","1297",NA,NA,NA,"DC",NA,NA,NA,NA,NA,NA,NA,"Amazilia",NA,NA,NA,NA,NA,NA,NA,NA,NA,NA,NA,NA,NA,NA,NA,NA,NA,NA,NA
"678","Rumisitana","43120","1304","Guzmania sp.1","Guzmania rhonhofiana","3","DC",3,NA,NA,NA,NA,NA,NA,"Ocreatus underwoodii",NA,NA,NA,NA,NA,NA,NA,NA,NA,NA,"Guzmania rhonhofiana",NA,NA,"Guzmania rhonhofiana",NA,NA,NA,NA,NA
"679","Rumisitana","43421","717","Guzmania monostachia","Guzmania monostachia","3","DC",2,NA,NA,NA,NA,NA,NA,"Amazilia tzacatl","feeding",NA,NA,NA,NA,NA,NA,NA,NA,NA,"Guzmania monostachia",NA,NA,"Guzmania monostachia",NA,NA,NA,NA,NA
"680","Rumisitana","43421","717","Tillandsia sp.2","Vriecea cylindrica","4","DC",10,NA,NA,NA,NA,NA,NA,"Amazilia tzacatl","feeding",NA,NA,NA,NA,NA,NA,NA,NA,NA,"Vriesea cylindrica",NA,NA,"Vriesea cylindrica",NA,NA,NA,NA,NA
"681","Rumisitana","43421","718","Macleania smithiana cf. cordata","Macleania smithiana","3","DC",9,NA,NA,NA,NA,NA,NA,"Amazilia tzacatl","feeding",NA,NA,NA,NA,NA,NA,NA,NA,NA,"Macleania smithiana",NA,NA,"Macleania smithiana",NA,NA,NA,NA,NA
"682","Rumisitana","43484","996","Erythrina edulis","Erythrina edulis","5","DC",128,NA,NA,NA,NA,NA,NA,"Amazilia tzacatl","feeding",NA,NA,NA,NA,NA,NA,NA,NA,NA,"Erythrina edulis",NA,NA,"Erythrina edulis",NA,NA,NA,NA,NA
"683","Rumisitana","17/03/2019","813","Guzmania foto",NA,"5","DC",10,NA,NA,NA,NA,NA,NA,"Urosticte benjamini",NA,NA,NA,NA,NA,NA,NA,NA,NA,NA,"Guzmania foto","March","2019","Guzmania foto",-78.672837,0.062866,"1432.511963","2019-03-17T16:15:37Z",2019-03-17 16:15:37
"684","Rumisitana","17/03/2019","815","Guzmania foto",NA,"4","DC",13,NA,NA,NA,NA,NA,NA,"Amazilia tzacatl",NA,NA,NA,NA,NA,NA,NA,NA,NA,NA,"Guzmania foto","March","2019","Guzmania foto",-78.672038,0.062253,"1413.050781","2019-03-17T16:25:47Z",2019-03-17 16:25:47
"685","Rumisitana","17/03/2019","837","Heliconia harlingii",NA,"4","DC",3,NA,NA,NA,NA,NA,NA,"Phaethornis yaruqui",NA,NA,NA,NA,NA,NA,NA,NA,NA,NA,"Heliconia harlingii","March","2019","Heliconia harlingii",-78.675534,0.064578,"1467.551147","2019-03-17T17:29:00Z",2019-03-17 17:29:00
"686","Rumisitana","17/03/2019","841","Guzmania foto",NA,"2","DC",5,NA,NA,NA,NA,NA,NA,"Amazilia tzacatl",NA,NA,NA,NA,NA,NA,NA,NA,NA,NA,"Guzmania foto","March","2019","Guzmania foto",-78.67538,0.064971,"1472.538574","2019-03-17T17:39:44Z",2019-03-17 17:39:44
"687","Sachatamia_disturbed","2017-12-28","706",NA,NA,NA,NA,NA,NA,NA,NA,NA,NA,NA,"Heliangelus strophianus",NA,NA,NA,NA,NA,NA,NA,NA,NA,NA,NA,NA,NA,NA,NA,NA,NA,NA,NA
"688","Sachatamia_disturbed","2017-12-28","742",NA,NA,NA,NA,NA,NA,NA,NA,NA,NA,NA,"Heliodoxa rubinoides","perchado",NA,NA,NA,NA,NA,NA,NA,NA,NA,NA,NA,NA,NA,NA,NA,NA,NA,NA
"689","Sachatamia_disturbed","2017-12-28","747",NA,NA,NA,NA,NA,NA,NA,NA,NA,NA,NA,"Amazilia tzacatl",NA,NA,NA,NA,NA,NA,NA,NA,NA,NA,NA,NA,NA,NA,NA,NA,NA,NA,NA
"690","Sachatamia_disturbed","2018-08-15","334",NA,NA,NA,"DC",NA,NA,NA,NA,NA,NA,NA,"Amazilia tzacatl",NA,NA,NA,NA,NA,NA,NA,NA,NA,NA,NA,NA,NA,NA,NA,NA,NA,NA,NA
"691","Sachatamia_disturbed","2018-10-22","525",NA,NA,NA,"DC",NA,NA,NA,NA,NA,NA,NA,"Myrtis fanny",NA,NA,NA,NA,NA,NA,NA,NA,NA,NA,NA,NA,NA,NA,NA,NA,NA,NA,NA
"692","Sachatamia","2017-12-12","565","Bromelia sp6-Guzmania sp9","Guzmania wittmackii","3","DC",4,NA,NA,NA,NA,NA,NA,"Phaethornis yaruqui",NA,"fly",NA,NA,NA,NA,NA,NA,NA,NA,"Guzmania wittmackii",NA,NA,"Guzmania wittmackii",NA,NA,NA,NA,NA
"693","Sachatamia","2018-01-22","867",NA,NA,NA,NA,NA,NA,NA,NA,NA,NA,NA,"Ocreatus underwoodii","perch",NA,NA,NA,NA,NA,NA,NA,NA,NA,NA,NA,NA,NA,NA,NA,NA,NA,NA
"694","Sachatamia","2018-01-22","892",NA,NA,NA,NA,NA,NA,NA,NA,NA,NA,NA,"Ocreatus underwoodii","perch",NA,NA,NA,NA,NA,NA,NA,NA,NA,NA,NA,NA,NA,NA,NA,NA,NA,NA
"695","Sachatamia","2018-01-22","1402","Renealmia sessilifolia","Renealmia sessilifolia","1","DC",3,NA,NA,NA,NA,NA,NA,"Aglaiocercus coelestis",NA,"fly",NA,NA,NA,NA,NA,NA,NA,NA,"Renealmia sessilifolia",NA,NA,"Renealmia sessilifolia",NA,NA,NA,NA,NA
"696","Sachatamia","2018-02-20","1286","Guzmania sp12-Mezobromelia aff capituligera","Guzmania danielii","5","DC",10,NA,NA,NA,NA,NA,NA,"Ocreatus underwoodii","perch",NA,NA,NA,NA,NA,NA,NA,NA,NA,"Guzmania danielii",NA,NA,"Guzmania danielii",NA,NA,NA,NA,NA
"697","Sachatamia","2018-02-20","1804",NA,NA,NA,NA,NA,NA,NA,NA,NA,NA,NA,"Coeligena torquata",NA,"fly",NA,NA,NA,NA,NA,NA,NA,NA,NA,NA,NA,NA,NA,NA,NA,NA,NA
"698","Sachatamia","2018-02-20","1811",NA,NA,NA,NA,NA,NA,NA,NA,NA,NA,NA,"Phaethornis yaruqui",NA,"fly",NA,NA,NA,NA,NA,NA,NA,NA,NA,NA,NA,NA,NA,NA,NA,NA,NA
"699","Sachatamia","2018-04-24","524",NA,NA,NA,NA,NA,NA,NA,NA,NA,NA,NA,"Aglaiocercus coelestis","p",NA,NA,NA,NA,NA,NA,NA,NA,NA,NA,NA,NA,NA,NA,NA,NA,NA,NA
"700","Sachatamia","2018-04-24","545","Palicourea demissa","Palicourea anderssoniana","2","DC",41,NA,NA,NA,NA,NA,NA,"Coeligena torquata","fly",NA,NA,NA,NA,NA,NA,NA,NA,NA,"Palicourea anderssoniana",NA,NA,"Palicourea anderssoniana",NA,NA,NA,NA,NA
"701","Sachatamia","2018-04-24","578",NA,NA,NA,NA,NA,NA,NA,NA,NA,NA,NA,"Aglaiocercus coelestis","perch",NA,NA,NA,NA,NA,NA,NA,NA,NA,NA,NA,NA,NA,NA,NA,NA,NA,NA
"702","Sachatamia","2018-07-23","2359",NA,NA,NA,NA,NA,NA,NA,NA,NA,NA,NA,"Ocreatus underwoodii","perch",NA,NA,NA,NA,NA,NA,NA,NA,NA,NA,NA,NA,NA,NA,NA,NA,NA,NA
"703","Sachatamia","2018-09-25","2820",NA,NA,NA,NA,NA,NA,NA,NA,NA,NA,NA,"Aglaiocercus coelestis","perch",NA,NA,NA,NA,NA,NA,NA,NA,NA,NA,NA,NA,NA,NA,NA,NA,NA,NA
"704","Sachatamia","2018-11-20","425",NA,NA,NA,NA,NA,NA,NA,NA,NA,NA,NA,"Phaethornis yaruqui","fly",NA,NA,NA,NA,NA,NA,NA,NA,NA,NA,NA,NA,NA,NA,NA,NA,NA,NA
"705","Sachatamia","2018-11-20","434",NA,NA,NA,NA,NA,NA,NA,NA,NA,NA,NA,"Heliodoxa leadbeateri",NA,NA,NA,NA,NA,NA,NA,NA,NA,NA,NA,NA,NA,NA,NA,NA,NA,NA,NA
"706","Sachatamia",NA,"338",NA,NA,NA,NA,NA,NA,NA,NA,NA,NA,NA,"Phaethornis yaruqui",NA,"fly",NA,NA,NA,NA,NA,NA,NA,NA,NA,NA,NA,NA,NA,NA,NA,NA,NA
"707","Sachatamia",NA,"169",NA,NA,NA,NA,NA,NA,NA,NA,NA,NA,NA,"Phaethornis yaruqui",NA,"fly",NA,NA,NA,NA,NA,NA,NA,NA,NA,NA,NA,NA,NA,NA,NA,NA,NA
"708","Sachatamia",NA,"210",NA,NA,NA,NA,NA,NA,NA,NA,NA,NA,NA,"Phaethornis yaruqui",NA,"fly",NA,NA,NA,NA,NA,NA,NA,NA,NA,NA,NA,NA,NA,NA,NA,NA,NA
"709","Sachatamia",NA,"531",NA,NA,NA,NA,NA,NA,NA,NA,NA,NA,NA,"Aglaiocercus coelestis",NA,"fly",NA,NA,NA,NA,NA,NA,NA,NA,NA,NA,NA,NA,NA,NA,NA,NA,NA
"710","Sachatamia",NA,"319",NA,NA,NA,NA,NA,NA,NA,NA,NA,NA,NA,"Coeligena wilsoni",NA,"fly",NA,NA,NA,NA,NA,NA,NA,NA,NA,NA,NA,NA,NA,NA,NA,NA,NA
"711","Sachatamia",NA,"325",NA,NA,NA,NA,NA,NA,NA,NA,NA,NA,NA,"Ocreatus underwoodii",NA,"fly",NA,NA,NA,NA,NA,NA,NA,NA,NA,NA,NA,NA,NA,NA,NA,NA,NA
"712","Sachatamia",NA,"347",NA,NA,NA,NA,NA,NA,NA,NA,NA,NA,NA,"Aglaiocercus coelestis",NA,"fly",NA,NA,NA,NA,NA,NA,NA,NA,NA,NA,NA,NA,NA,NA,NA,NA,NA
"713","Sachatamia",NA,"360",NA,NA,NA,NA,NA,NA,NA,NA,NA,NA,NA,"Aglaiocercus coelestis",NA,"perch and fly",NA,NA,NA,NA,NA,NA,NA,NA,NA,NA,NA,NA,NA,NA,NA,NA,NA
"714","UnPocoDelChoco_disturbed","23/12/2017","448",NA,NA,NA,NA,NA,NA,NA,NA,NA,NA,NA,"Thalurania fannyi","feeding palicorea",NA,NA,NA,NA,NA,NA,NA,NA,NA,NA,"December","2017",NA,NA,NA,NA,NA,NA
"715","UnPocoDelChoco_disturbed","23/12/2017","449",NA,NA,NA,NA,NA,NA,NA,NA,NA,NA,NA,"Phaethornis yaruqui",NA,"past fly",NA,NA,NA,NA,NA,NA,NA,NA,NA,"December","2017",NA,NA,NA,NA,NA,NA
"716","UnPocoDelChoco_disturbed","23/12/2017","449",NA,NA,NA,NA,NA,NA,NA,NA,NA,NA,NA,"Ocreatus underwoodii",NA,"fly male and female",NA,NA,NA,NA,NA,NA,NA,NA,NA,"December","2017",NA,NA,NA,NA,NA,NA
"717","UnPocoDelChoco_disturbed","23/12/2017","453",NA,NA,NA,NA,NA,NA,NA,NA,NA,NA,NA,"Phaethornis yaruqui",NA,"flying",NA,NA,NA,NA,NA,NA,NA,NA,NA,"December","2017",NA,NA,NA,NA,NA,NA
"718","UnPocoDelChoco_disturbed","23/12/2017","453",NA,NA,NA,NA,NA,NA,NA,NA,NA,NA,NA,"Urosticte benjamini","feeding at Tilandsia sp2 20 seconds",NA,NA,NA,NA,NA,NA,NA,NA,NA,NA,"December","2017",NA,NA,NA,NA,NA,NA
"719","UnPocoDelChoco_disturbed","23/12/2017","458",NA,NA,NA,NA,NA,NA,NA,NA,NA,NA,NA,"Ocreatus underwoodii","female feeding palicourea",NA,NA,NA,NA,NA,NA,NA,NA,NA,NA,"December","2017",NA,NA,NA,NA,NA,NA
"720","UnPocoDelChoco_disturbed","23/12/2017","458",NA,NA,NA,NA,NA,NA,NA,NA,NA,NA,NA,"Ocreatus underwoodii","male feeding palicourea",NA,NA,NA,NA,NA,NA,NA,NA,NA,NA,"December","2017",NA,NA,NA,NA,NA,NA
"721","UnPocoDelChoco_disturbed","23/12/2017","460",NA,NA,NA,NA,NA,NA,NA,NA,NA,NA,NA,"Ocreatus underwoodii","female feeding palicourea",NA,NA,NA,NA,NA,NA,NA,NA,NA,NA,"December","2017",NA,NA,NA,NA,NA,NA
"722","UnPocoDelChoco_disturbed","23/12/2017","462",NA,NA,NA,NA,NA,NA,NA,NA,NA,NA,NA,"Amazilia tzacatl","feeding palicourea",NA,NA,NA,NA,NA,NA,NA,NA,NA,NA,"December","2017",NA,NA,NA,NA,NA,NA
"723","UnPocoDelChoco_disturbed","23/12/2017","462",NA,NA,NA,NA,NA,NA,NA,NA,NA,NA,NA,"Ocreatus underwoodii","feeding male",NA,NA,NA,NA,NA,NA,NA,NA,NA,NA,"December","2017",NA,NA,NA,NA,NA,NA
"724","UnPocoDelChoco_disturbed","23/12/2017","465",NA,NA,NA,NA,NA,NA,NA,NA,NA,NA,NA,"Ocreatus underwoodii","fly",NA,NA,NA,NA,NA,NA,NA,NA,NA,NA,"December","2017",NA,NA,NA,NA,NA,NA
"725","UnPocoDelChoco_disturbed","23/12/2017","469",NA,NA,NA,NA,NA,NA,NA,NA,NA,NA,NA,"Ocreatus underwoodii","feeding palicourea 30 seconds",NA,NA,NA,NA,NA,NA,NA,NA,NA,NA,"December","2017",NA,NA,NA,NA,NA,NA
"726","UnPocoDelChoco_disturbed","23/12/2017","476",NA,NA,NA,NA,NA,NA,NA,NA,NA,NA,NA,"Ocreatus underwoodii","feeding palicourea",NA,NA,NA,NA,NA,NA,NA,NA,NA,NA,"December","2017",NA,NA,NA,NA,NA,NA
"727","UnPocoDelChoco_disturbed","23/12/2017","477",NA,NA,NA,NA,NA,NA,NA,NA,NA,NA,NA,"Ocreatus underwoodii","visited palicourea",NA,NA,NA,NA,NA,NA,NA,NA,NA,NA,"December","2017",NA,NA,NA,NA,NA,NA
"728","UnPocoDelChoco_disturbed","23/12/2017","478",NA,NA,NA,NA,NA,NA,NA,NA,NA,NA,NA,"Ocreatus underwoodii","feeding palicourea",NA,NA,NA,NA,NA,NA,NA,NA,NA,NA,"December","2017",NA,NA,NA,NA,NA,NA
"729","UnPocoDelChoco_disturbed","23/12/2017","480",NA,NA,NA,NA,NA,NA,NA,NA,NA,NA,NA,"Ocreatus underwoodii","feeding palicorea",NA,NA,NA,NA,NA,NA,NA,NA,NA,NA,"December","2017",NA,NA,NA,NA,NA,NA
"730","UnPocoDelChoco_disturbed","23/12/2017","495",NA,NA,NA,NA,NA,NA,NA,NA,NA,NA,NA,"Ocreatus underwoodii","fly",NA,NA,NA,NA,NA,NA,NA,NA,NA,NA,"December","2017",NA,NA,NA,NA,NA,NA
"731","UnPocoDelChoco_disturbed","23/12/2017","500",NA,NA,NA,NA,NA,NA,NA,NA,NA,NA,NA,"Thalurania fannyi","feeding Psamisia Sp1",NA,NA,NA,NA,NA,NA,NA,NA,NA,NA,"December","2017",NA,NA,NA,NA,NA,NA
"732","UnPocoDelChoco_disturbed","23/12/2017","501",NA,NA,NA,NA,NA,NA,NA,NA,NA,NA,NA,"Thalurania fannyi","feeding palicourea",NA,NA,NA,NA,NA,NA,NA,NA,NA,NA,"December","2017",NA,NA,NA,NA,NA,NA
"733","UnPocoDelChoco_disturbed","23/12/2017","507",NA,NA,NA,NA,NA,NA,NA,NA,NA,NA,NA,"Ocreatus underwoodii","female feeding palicourea",NA,NA,NA,NA,NA,NA,NA,NA,NA,NA,"December","2017",NA,NA,NA,NA,NA,NA
"734","UnPocoDelChoco_disturbed","17/2/2018","621",NA,NA,NA,NA,NA,NA,NA,NA,NA,NA,NA,"Ocreatus underwoodii","flying past",NA,NA,NA,NA,NA,NA,NA,NA,NA,NA,"February","2018",NA,-78.835834,0.0469919,"1226.0378418","17-FEB-18 10:16:41",2018-02-17 10:16:41
"735","UnPocoDelChoco_disturbed","17/2/2018","627",NA,NA,NA,NA,NA,NA,NA,NA,NA,NA,NA,"Heliodoxa jacula","flying past",NA,NA,NA,NA,NA,NA,NA,NA,NA,NA,"February","2018",NA,-78.8355699,0.0468387,"1221.2312012","17-FEB-18 10:32:50",2018-02-17 10:32:50
"736","UnPocoDelChoco_disturbed","17/2/2018","628",NA,NA,NA,NA,NA,NA,NA,NA,NA,NA,NA,"Ocreatus underwoodii","flying",NA,NA,NA,NA,NA,NA,NA,NA,NA,NA,"February","2018",NA,-78.8355599,0.0468301,"1221.2312012","17-FEB-18 10:32:57",2018-02-17 10:32:57
"737","UnPocoDelChoco_disturbed","20/4/2018","920",NA,NA,NA,NA,NA,NA,NA,NA,NA,NA,NA,"Phaethornis yaruqui","visited Columnea Sp1",NA,NA,NA,NA,NA,NA,NA,NA,NA,NA,"April","2018",NA,-78.840022,0.0546492,"1194.5546875","20-ABR-18 8:14:03",2018-04-20 08:14:03
"738","UnPocoDelChoco_disturbed","20/6/2018","72",NA,NA,NA,NA,NA,NA,NA,NA,NA,NA,NA,"heliodoxa jacula",NA,"fly past",NA,NA,NA,NA,NA,NA,NA,NA,NA,"June","2018",NA,-78.8405286,0.0526478,"1198.6403809","20-JUN-18 7:48:17",2018-06-20 07:48:17
"739","UnPocoDelChoco_disturbed","20/6/2018","106",NA,NA,NA,NA,NA,NA,NA,NA,NA,NA,NA,"ocreatus underwoodii",NA,"fly past",NA,NA,NA,NA,NA,NA,NA,NA,NA,"June","2018",NA,-78.8344606,0.0470361,"1226.7587891","20-JUN-18 10:35:37",2018-06-20 10:35:37
"740","UnPocoDelChoco_disturbed","31/8/2018","229",NA,NA,NA,NA,NA,NA,NA,NA,NA,NA,NA,"Phaethornis yaruqui",NA,"fly past",NA,NA,NA,NA,NA,NA,NA,NA,NA,"August","2018",NA,NA,NA,NA,NA,NA
"741","UnPocoDelChoco_disturbed","31/8/2018","238",NA,NA,NA,NA,NA,NA,NA,NA,NA,NA,NA,"Phaethornis yaruqui",NA,"fly past",NA,NA,NA,NA,NA,NA,NA,NA,NA,"August","2018",NA,NA,NA,NA,NA,NA
"742","UnPocoDelChoco_disturbed","31/8/2018","253",NA,NA,NA,NA,NA,NA,NA,NA,NA,NA,NA,"Thalurania fannyi",NA,"perchado bebiendo del mata palo plant",NA,NA,NA,NA,NA,NA,NA,NA,NA,"August","2018",NA,NA,NA,NA,NA,NA
"743","UnPocoDelChoco_disturbed","27/10/2018","391",NA,NA,NA,NA,NA,NA,NA,NA,NA,NA,NA,"Ocreatus underwoodii",NA,"feeding palicourea",NA,NA,NA,NA,NA,NA,NA,NA,NA,"October","2018",NA,-78.8358641,0.0470007,"1220.7504883","27-OCT-18 10:02:43",2018-10-27 10:02:43
"744","UnPocoDelChoco","24/03/2017","147",NA,NA,NA,NA,NA,NA,NA,NA,NA,NA,NA,"Phaethornis yaruqui",NA,NA,NA,NA,NA,NA,NA,NA,NA,NA,NA,"March","2017",NA,-78.8432941,0.0532402,"1183.2595215","24-MAR-17 8:32:54",2017-03-24 08:32:54
"745","UnPocoDelChoco","24/03/2017","160",NA,NA,NA,NA,NA,NA,NA,NA,NA,NA,NA,"Phaethornis yaruqui",NA,NA,NA,NA,NA,NA,NA,NA,NA,NA,NA,"March","2017",NA,-78.8409949,0.0521048,"1183.7402344","24-MAR-17 9:26:40",2017-03-24 09:26:40
"746","UnPocoDelChoco","24/03/2017","171",NA,NA,NA,NA,NA,NA,NA,NA,NA,NA,NA,"Phaethornis yaruqui",NA,NA,NA,NA,NA,NA,NA,NA,NA,NA,NA,"March","2017",NA,-78.8406454,0.05171,"1175.5690918","24-MAR-17 9:57:38",2017-03-24 09:57:38
"747","UnPocoDelChoco","24/03/2017","175",NA,NA,NA,NA,NA,NA,NA,NA,NA,NA,NA,"Phaethornis yaruqui",NA,NA,NA,NA,NA,NA,NA,NA,NA,NA,NA,"March","2017",NA,-78.8408596,0.0514974,"1157.3039551","24-MAR-17 10:09:44",2017-03-24 10:09:44
"748","UnPocoDelChoco","24/03/2017","190",NA,NA,NA,NA,NA,NA,NA,NA,NA,NA,NA,"Phaethornis yaruqui",NA,NA,NA,NA,NA,NA,NA,NA,NA,NA,NA,"March","2017",NA,-78.8430963,0.0509481,"1049.6372070","24-MAR-17 11:26:06",2017-03-24 11:26:06
"749","UnPocoDelChoco","26/04/2017","213",NA,NA,NA,NA,NA,NA,NA,NA,NA,NA,NA,"Phaethornis yaruqui",NA,NA,NA,NA,NA,NA,NA,NA,NA,NA,NA,"April","2017",NA,-78.8440364,0.0534097,"1195.2758789","26-ABR-17 7:20:21",2017-04-26 07:20:21
"750","UnPocoDelChoco","26/04/2017","218",NA,NA,NA,NA,NA,NA,NA,NA,NA,NA,NA,"Phaethornis yaruqui",NA,NA,NA,NA,NA,NA,NA,NA,NA,NA,NA,"April","2017",NA,-78.8431522,0.0530931,"1205.6101074","26-ABR-17 7:37:00",2017-04-26 07:37:00
"751","UnPocoDelChoco","26/04/2017","221",NA,NA,NA,NA,NA,NA,NA,NA,NA,NA,NA,"Coeligena wilsoni",NA,NA,NA,NA,NA,NA,NA,NA,NA,NA,NA,"April","2017",NA,-78.843053,0.0530859,"1174.8481445","26-ABR-17 7:46:15",2017-04-26 07:46:15
"752","UnPocoDelChoco","26/04/2017","223",NA,NA,NA,NA,NA,NA,NA,NA,NA,NA,NA,"Phaethornis yaruqui",NA,NA,NA,NA,NA,NA,NA,NA,NA,NA,NA,"April","2017",NA,-78.8428297,0.0529625,"1177.4916992","26-ABR-17 7:52:00",2017-04-26 07:52:00
"753","UnPocoDelChoco","26/04/2017","223",NA,NA,NA,NA,NA,NA,NA,NA,NA,NA,NA,"Phaethornis yaruqui",NA,"probably visited P. demissa",NA,NA,NA,NA,NA,NA,NA,NA,NA,"April","2017",NA,-78.8428297,0.0529625,"1177.4916992","26-ABR-17 7:52:00",2017-04-26 07:52:00
"754","UnPocoDelChoco","26/04/2017","237",NA,NA,NA,NA,NA,NA,NA,NA,NA,NA,NA,"Phaethornis yaruqui",NA,NA,NA,NA,NA,NA,NA,NA,NA,NA,NA,"April","2017",NA,-78.8407995,0.0512864,"1216.9052734","26-ABR-17 8:44:16",2017-04-26 08:44:16
"755","UnPocoDelChoco","26/04/2017","244",NA,NA,NA,NA,NA,NA,NA,NA,NA,NA,NA,"Phaethornis yaruqui",NA,NA,NA,NA,NA,NA,NA,NA,NA,NA,NA,"April","2017",NA,-78.8413025,0.0511602,"1150.0942383","26-ABR-17 9:14:27",2017-04-26 09:14:27
"756","UnPocoDelChoco","26/04/2017","249",NA,NA,NA,NA,NA,NA,NA,NA,NA,NA,NA,"Phaethornis yaruqui",NA,NA,NA,NA,NA,NA,NA,NA,NA,NA,NA,"April","2017",NA,-78.8423429,0.0513335,"1118.1306152","26-ABR-17 9:35:03",2017-04-26 09:35:03
"757","UnPocoDelChoco","18/05/2017","268",NA,NA,NA,NA,NA,NA,NA,NA,NA,NA,NA,"Phaethornis yaruqui",NA,NA,NA,NA,NA,NA,NA,NA,NA,NA,NA,"May","2017",NA,-78.8444009,0.053324,"1189.7482910","17-MAY-17 7:14:13",2017-05-17 07:14:13
"758","UnPocoDelChoco","18/05/2017","281",NA,NA,NA,NA,NA,NA,NA,NA,NA,NA,NA,"Phaethornis yaruqui",NA,NA,NA,NA,NA,NA,NA,NA,NA,NA,NA,"May","2017",NA,-78.8423834,0.0524432,"1163.7927246","17-MAY-17 8:04:44",2017-05-17 08:04:44
"759","UnPocoDelChoco","18/05/2017","285",NA,NA,NA,NA,NA,NA,NA,NA,NA,NA,NA,"Phaethornis yaruqui",NA,NA,NA,NA,NA,NA,NA,NA,NA,NA,NA,"May","2017",NA,-78.8420563,0.0523339,"1174.1271973","17-MAY-17 8:13:31",2017-05-17 08:13:31
"760","UnPocoDelChoco","18/05/2017","294",NA,NA,NA,NA,NA,NA,NA,NA,NA,NA,NA,"Phaethornis yaruqui",NA,NA,NA,NA,NA,NA,NA,NA,NA,NA,NA,"May","2017",NA,-78.8409738,0.0517163,"1183.9804688","17-MAY-17 8:39:45",2017-05-17 08:39:45
"761","UnPocoDelChoco","18/05/2017","316",NA,NA,NA,NA,NA,NA,NA,NA,NA,NA,NA,"Phaethornis yaruqui",NA,NA,NA,NA,NA,NA,NA,NA,NA,NA,NA,"May","2017",NA,-78.8422754,0.0512565,"1088.0895996","17-MAY-17 9:59:17",2017-05-17 09:59:17
"762","UnPocoDelChoco","18/05/2017","324",NA,NA,NA,NA,NA,NA,NA,NA,NA,NA,NA,"Phaethornis yaruqui",NA,NA,NA,NA,NA,NA,NA,NA,NA,NA,NA,"May","2017",NA,-78.842792,0.0510077,"1064.0568848","17-MAY-17 10:24:38",2017-05-17 10:24:38
"763","UnPocoDelChoco","18/05/2017","326",NA,NA,NA,NA,NA,NA,NA,NA,NA,NA,NA,"Phaethornis yaruqui",NA,NA,NA,NA,NA,NA,NA,NA,NA,NA,NA,"May","2017",NA,-78.8431312,0.0509966,"1033.0544434","17-MAY-17 10:35:22",2017-05-17 10:35:22
"764","UnPocoDelChoco","18/05/2017","332",NA,NA,NA,NA,NA,NA,NA,NA,NA,NA,NA,"Phaethornis yaruqui",NA,NA,NA,NA,NA,NA,NA,NA,NA,NA,NA,"May","2017",NA,-78.8431841,0.050386,"1047.7145996","17-MAY-17 11:15:18",2017-05-17 11:15:18
"765","UnPocoDelChoco","14/06/2017","34",NA,NA,NA,NA,NA,NA,NA,NA,NA,NA,NA,"Phaethornis yaruqui",NA,NA,NA,NA,NA,NA,NA,NA,NA,NA,NA,"June","2017",NA,-78.8410131,0.0520897,"1183.4997559","19-JUN-18 8:39:50",2018-06-19 08:39:50
"766","UnPocoDelChoco","14/06/2017","38",NA,NA,NA,NA,NA,NA,NA,NA,NA,NA,NA,"Heliodoxa jacula",NA,NA,NA,NA,NA,NA,NA,NA,NA,NA,NA,"June","2017",NA,-78.8407513,0.0518633,"1173.6464844","19-JUN-18 8:54:37",2018-06-19 08:54:37
"767","UnPocoDelChoco","14/06/2017","48",NA,NA,NA,NA,NA,NA,NA,NA,NA,NA,NA,"Phaethornis yaruqui",NA,"eat catch insects",NA,NA,NA,NA,NA,NA,NA,NA,NA,"June","2017",NA,-78.8415607,0.0513343,"1134.9536133","19-JUN-18 9:27:17",2018-06-19 09:27:17
"768","UnPocoDelChoco","14/06/2017","55",NA,NA,NA,NA,NA,NA,NA,NA,NA,NA,NA,"Phaethornis yaruqui","fly 30 seconds around the Guzmania Sp2",NA,NA,NA,NA,NA,NA,NA,NA,NA,NA,"June","2017",NA,-78.843081,0.0507073,"1040.5046387","19-JUN-18 9:57:10",2018-06-19 09:57:10
"769","UnPocoDelChoco","19/07/2017","82",NA,NA,NA,NA,NA,NA,NA,NA,NA,NA,NA,"Phaethornis yaruqui",NA,NA,NA,NA,NA,NA,NA,NA,NA,NA,NA,"July","2017",NA,-78.842994,0.0531304,"1170.2817383","19-JUL-17 7:56:21",2017-07-19 07:56:21
"770","UnPocoDelChoco","19/07/2017","101",NA,NA,NA,NA,NA,NA,NA,NA,NA,NA,NA,"Phaethornis yaruqui",NA,"flying",NA,NA,NA,NA,NA,NA,NA,NA,NA,"July","2017",NA,-78.8422986,0.0515547,"1118.8515625","19-JUL-17 9:33:20",2017-07-19 09:33:20
"771","UnPocoDelChoco","19/07/2017","104",NA,NA,NA,NA,NA,NA,NA,NA,NA,NA,NA,"Phaethornis yaruqui",NA,"flying",NA,NA,NA,NA,NA,NA,NA,NA,NA,"July","2017",NA,-78.8423371,0.0510251,"1081.8413086","19-JUL-17 10:01:29",2017-07-19 10:01:29
"772","UnPocoDelChoco","19/07/2017","108",NA,NA,NA,NA,NA,NA,NA,NA,NA,NA,NA,"Phaethornis yaruqui",NA,"flying",NA,NA,NA,NA,NA,NA,NA,NA,NA,"July","2017",NA,-78.8431116,0.0504555,"1014.7897949","19-JUL-17 10:39:23",2017-07-19 10:39:23
"773","UnPocoDelChoco","23/09/2017","149","Palicourea guianensis",NA,"5",NA,7,NA,NA,NA,NA,NA,NA,"Heliodoxa jacula","visiting the plant and feeding",NA,NA,NA,NA,NA,NA,NA,NA,NA,"Palicourea guianensis","September","2017","Palicourea guianensis",-78.8430521,0.0530687,"1184.2207031","23-SEP-17 7:55:44",2017-09-23 07:55:44
"774","UnPocoDelChoco","23/09/2017","154",NA,NA,NA,NA,NA,NA,NA,NA,NA,NA,NA,"Phaethornis yaruqui","flying",NA,NA,NA,NA,NA,NA,NA,NA,NA,NA,"September","2017",NA,-78.8428207,0.0526768,"1184.7014160","23-SEP-17 8:12:51",2017-09-23 08:12:51
"775","UnPocoDelChoco","23/09/2017","185",NA,NA,NA,NA,NA,NA,NA,NA,NA,NA,NA,"Phaethornis yaruqui","feeding mastersoni",NA,NA,NA,NA,NA,NA,NA,NA,NA,NA,"September","2017",NA,-78.8427448,0.0512512,"1057.0874023","23-SEP-17 10:07:23",2017-09-23 10:07:23
"776","UnPocoDelChoco","17/10/2017","241",NA,NA,NA,NA,NA,NA,NA,NA,NA,NA,NA,"Heliothryx barroti","eating insects",NA,NA,NA,NA,NA,NA,NA,NA,NA,NA,"October","2017",NA,-78.8408546,0.0512964,"1206.0905762","17-OCT-17 8:58:12",2017-10-17 08:58:12
"777","UnPocoDelChoco","17/10/2017","259",NA,NA,NA,NA,NA,NA,NA,NA,NA,NA,NA,"Phaethornis yaruqui",NA,"heard",NA,NA,NA,NA,NA,NA,NA,NA,NA,"October","2017",NA,-78.8423468,0.0512625,"1108.5175781","17-OCT-17 9:59:06",2017-10-17 09:59:06
"778","UnPocoDelChoco","25/11/2017","337",NA,NA,NA,NA,NA,NA,NA,NA,NA,NA,NA,"Phaethornis yaruqui",NA,"flying past",NA,NA,NA,NA,NA,NA,NA,NA,NA,"November","2017",NA,-78.8410063,0.0521303,"1177.0109863","25-NOV-17 9:10:33",2017-11-25 09:10:33
"779","UnPocoDelChoco","25/11/2017","372",NA,NA,NA,NA,NA,NA,NA,NA,NA,NA,NA,"Ocreatus underwoodii","fedin","flying past",NA,NA,NA,NA,NA,NA,NA,NA,NA,"November","2017",NA,-78.8431238,0.0502857,"1011.6652832","25-NOV-17 11:07:14",2017-11-25 11:07:14
"780","UnPocoDelChoco","21/12/2017","392",NA,NA,NA,NA,NA,NA,NA,NA,NA,NA,NA,"Ocreatus underwoodii","feeding on Palicorea guianensis for 20 seconds",NA,NA,NA,NA,NA,NA,NA,NA,NA,NA,"December","2017",NA,NA,NA,NA,NA,NA
"781","UnPocoDelChoco","21/12/2017","393",NA,NA,NA,NA,NA,NA,NA,NA,NA,NA,NA,"Ocreatus underwoodii",NA,"flying past",NA,NA,NA,NA,NA,NA,NA,NA,NA,"December","2017",NA,NA,NA,NA,NA,NA
"782","UnPocoDelChoco","21/12/2017","427",NA,NA,NA,NA,NA,NA,NA,NA,NA,NA,NA,"Ocreatus underwoodii",NA,"flying past",NA,NA,NA,NA,NA,NA,NA,NA,NA,"December","2017",NA,NA,NA,NA,NA,NA
"783","UnPocoDelChoco","21/12/2017","430",NA,NA,NA,NA,NA,NA,NA,NA,NA,NA,NA,"Phaethornis yaruqui",NA,"flying past",NA,NA,NA,NA,NA,NA,NA,NA,NA,"December","2017",NA,NA,NA,NA,NA,NA
"784","UnPocoDelChoco","21/12/2017","438",NA,NA,NA,NA,NA,NA,NA,NA,NA,NA,NA,"Phaethornis yaruqui",NA,"flying past",NA,NA,NA,NA,NA,NA,NA,NA,NA,"December","2017",NA,NA,NA,NA,NA,NA
"785","UnPocoDelChoco","22/01/2018","521",NA,NA,NA,NA,NA,NA,NA,NA,NA,NA,NA,"Ocreatus underwoodii",NA,NA,NA,NA,NA,NA,NA,NA,NA,NA,NA,"January","2018",NA,-78.8447563,0.0536303,"1200.3227539","22-JAN-18 7:25:24",2018-01-22 07:25:24
"786","UnPocoDelChoco","22/01/2018","522",NA,NA,NA,NA,NA,NA,NA,NA,NA,NA,NA,"Ocreatus underwoodii",NA,NA,NA,NA,NA,NA,NA,NA,NA,NA,NA,"January","2018",NA,-78.8447621,0.0536393,"1200.0822754","22-JAN-18 7:26:39",2018-01-22 07:26:39
"787","UnPocoDelChoco","22/01/2018","559",NA,NA,NA,NA,NA,NA,NA,NA,NA,NA,NA,"Heliodoxa jacula",NA,"feeding in pitcarnia nigra",NA,NA,NA,NA,NA,NA,NA,NA,NA,"January","2018",NA,-78.8420208,0.0514436,"1135.9147949","22-JAN-18 9:26:26",2018-01-22 09:26:26
"788","UnPocoDelChoco","21/02/2018","650",NA,NA,NA,NA,NA,NA,NA,NA,NA,NA,NA,"Phaethornis yaruqui",NA,"flying",NA,NA,NA,NA,NA,NA,NA,NA,NA,"February","2018",NA,-78.8447217,0.053628,"1210.6569824","21-FEB-18 7:15:33",2018-02-21 07:15:33
"789","UnPocoDelChoco","21/02/2018","660",NA,NA,NA,NA,NA,NA,NA,NA,NA,NA,NA,"Phaethornis yaruqui",NA,"flying",NA,NA,NA,NA,NA,NA,NA,NA,NA,"February","2018",NA,-78.8433997,0.0531511,"1202.2451172","21-FEB-18 8:00:09",2018-02-21 08:00:09
"790","UnPocoDelChoco","21/02/2018","661",NA,NA,NA,NA,NA,NA,NA,NA,NA,NA,NA,"Ocreatus underwoodii",NA,"flying",NA,NA,NA,NA,NA,NA,NA,NA,NA,"February","2018",NA,-78.8433899,0.0531468,"1201.0437012","21-FEB-18 8:00:27",2018-02-21 08:00:27
"791","UnPocoDelChoco","21/02/2018","670",NA,NA,NA,NA,NA,NA,NA,NA,NA,NA,NA,"Phaethornis yaruqui",NA,"flying past",NA,NA,NA,NA,NA,NA,NA,NA,NA,"February","2018",NA,-78.8429741,0.0528623,"1201.2839355","21-FEB-18 8:18:23",2018-02-21 08:18:23
"792","UnPocoDelChoco","21/02/2018","671",NA,NA,NA,NA,NA,NA,NA,NA,NA,NA,NA,"Phaethornis striigularis",NA,"feeding in kholeria villosa",NA,NA,NA,NA,NA,NA,NA,NA,NA,"February","2018",NA,-78.842862,0.0528254,"1195.7563477","21-FEB-18 8:19:33",2018-02-21 08:19:33
"793","UnPocoDelChoco","21/02/2018","673",NA,NA,NA,NA,NA,NA,NA,NA,NA,NA,NA,"Phaethornis yaruqui",NA,"flying past",NA,NA,NA,NA,NA,NA,NA,NA,NA,"February","2018",NA,-78.8427001,0.0527849,"1181.3369141","21-FEB-18 8:22:55",2018-02-21 08:22:55
"794","UnPocoDelChoco","21/02/2018","680",NA,NA,NA,NA,NA,NA,NA,NA,NA,NA,NA,"Phaethornis yaruqui",NA,"flying past",NA,NA,NA,NA,NA,NA,NA,NA,NA,"February","2018",NA,-78.8415959,0.0520058,"1180.1352539","21-FEB-18 8:43:26",2018-02-21 08:43:26
"795","UnPocoDelChoco","21/02/2018","704",NA,NA,NA,NA,NA,NA,NA,NA,NA,NA,NA,"Phaethornis yaruqui",NA,NA,NA,NA,NA,NA,NA,NA,NA,NA,NA,"February","2018",NA,-78.8415963,0.0512567,"1147.9313965","21-FEB-18 9:50:48",2018-02-21 09:50:48
"796","UnPocoDelChoco","21/02/2018","720",NA,NA,NA,NA,NA,NA,NA,NA,NA,NA,NA,"Phaethornis yaruqui",NA,NA,NA,NA,NA,NA,NA,NA,NA,NA,NA,"February","2018",NA,-78.8422599,0.050921,"1082.8024902","21-FEB-18 10:41:35",2018-02-21 10:41:35
"797","UnPocoDelChoco","24/03/2018","786",NA,NA,NA,NA,NA,NA,NA,NA,NA,NA,NA,"Popelairia Conversii","feeding at the Palicourea, 20 sec",NA,NA,NA,NA,NA,NA,NA,NA,NA,NA,"March","2018",NA,-78.8445679,0.0534024,"1199.6015625","24-MAR-18 7:16:08",2018-03-24 07:16:08
"798","UnPocoDelChoco","24/03/2018","807",NA,NA,NA,NA,NA,NA,NA,NA,NA,NA,NA,"Phaethornis Yaruqui",NA,NA,NA,NA,NA,NA,NA,NA,NA,NA,NA,"March","2018",NA,-78.8409041,0.0520898,"1182.2980957","24-MAR-18 8:18:01",2018-03-24 08:18:01
"799","UnPocoDelChoco","24/03/2018","819",NA,NA,NA,NA,NA,NA,NA,NA,NA,NA,NA,"Phaethornis Yaruqui","flying past",NA,NA,NA,NA,NA,NA,NA,NA,NA,NA,"March","2018",NA,-78.8421452,0.0514829,"1138.0776367","24-MAR-18 8:48:47",2018-03-24 08:48:47
"800","UnPocoDelChoco","24/03/2018","822",NA,NA,NA,NA,NA,NA,NA,NA,NA,NA,NA,"Phaethornis Yaruqui","flying past",NA,NA,NA,NA,NA,NA,NA,NA,NA,NA,"March","2018",NA,-78.8422355,0.0512695,"1114.2854004","24-MAR-18 9:04:57",2018-03-24 09:04:57
"801","UnPocoDelChoco","19/04/2018","851",NA,NA,NA,NA,NA,NA,NA,NA,NA,NA,NA,"Phaethornis Yaruqui","fly past",NA,NA,NA,NA,NA,NA,NA,NA,NA,NA,"April","2018",NA,-78.8442817,0.0534248,"1181.5771484","19-ABR-18 7:34:12",2018-04-19 07:34:12
"802","UnPocoDelChoco","19/04/2018","853",NA,NA,NA,NA,NA,NA,NA,NA,NA,NA,NA,"Phaethornis Yaruqui","fly past",NA,NA,NA,NA,NA,NA,NA,NA,NA,NA,"April","2018",NA,-78.8438554,0.0534656,"1185.6628418","19-ABR-18 7:39:06",2018-04-19 07:39:06
"803","UnPocoDelChoco","19/04/2018","889",NA,NA,NA,NA,NA,NA,NA,NA,NA,NA,NA,"Phaethornis Yaruqui","fly past",NA,NA,NA,NA,NA,NA,NA,NA,NA,NA,"April","2018",NA,-78.8420872,0.0514656,"1109.9594727","19-ABR-18 9:01:06",2018-04-19 09:01:06
"804","UnPocoDelChoco","19/04/2018","898",NA,NA,NA,NA,NA,NA,NA,NA,NA,NA,NA,"Phaethornis Yaruqui","fly past",NA,NA,NA,NA,NA,NA,NA,NA,NA,NA,"April","2018",NA,-78.8429166,0.0509663,"1057.3276367","19-ABR-18 9:27:56",2018-04-19 09:27:56
"805","UnPocoDelChoco","19/04/2018","900",NA,NA,NA,NA,NA,NA,NA,NA,NA,NA,NA,"Phaethornis Yaruqui","fly around  my",NA,NA,NA,NA,NA,NA,NA,NA,NA,NA,"April","2018",NA,-78.8433286,0.0509437,"1050.3583984","19-ABR-18 9:31:39",2018-04-19 09:31:39
"806","UnPocoDelChoco","17/05/2018","965",NA,NA,NA,NA,NA,NA,NA,NA,NA,NA,NA,"Phaethornis Yaruqui","fly past",NA,NA,NA,NA,NA,NA,NA,NA,NA,NA,"May","2018",NA,-78.8439454,0.053411,"1185.9030762","17-MAY-18 7:55:50",2018-05-17 07:55:50
"807","UnPocoDelChoco","17/05/2018","973",NA,NA,NA,NA,NA,NA,NA,NA,NA,NA,NA,"Phaethornis Yaruqui","fly past",NA,NA,NA,NA,NA,NA,NA,NA,NA,NA,"May","2018",NA,-78.8427068,0.0530056,"1175.8093262","17-MAY-18 8:20:22",2018-05-17 08:20:22
"808","UnPocoDelChoco","17/05/2018","987",NA,NA,NA,NA,NA,NA,NA,NA,NA,NA,NA,"Phaethornis Yaruqui","visited plant 986 but didn't feed",NA,NA,NA,NA,NA,NA,NA,NA,NA,NA,"May","2018",NA,-78.8410965,0.0513188,"1155.8620605","17-MAY-18 9:07:12",2018-05-17 09:07:12
"809","UnPocoDelChoco","17/05/2018","989",NA,NA,NA,NA,NA,NA,NA,NA,NA,NA,NA,"Phaethornis Yaruqui","fly past",NA,NA,NA,NA,NA,NA,NA,NA,NA,NA,"May","2018",NA,-78.8416393,0.0513589,"1138.7988281","17-MAY-18 9:17:26",2018-05-17 09:17:26
"810","UnPocoDelChoco","17/05/2018","3",NA,NA,NA,NA,NA,NA,NA,NA,NA,NA,NA,"Thalurania fannyi","Feeding on flowers",NA,NA,NA,NA,NA,NA,NA,NA,NA,NA,"May","2018",NA,-78.8432625,0.0509766,"1023.6818848","17-MAY-18 10:22:50",2018-05-17 10:22:50
"811","UnPocoDelChoco","19/06/2018","23",NA,NA,NA,NA,NA,NA,NA,NA,NA,NA,NA,"phaethornis yaruqui",NA,"fly past",NA,NA,NA,NA,NA,NA,NA,NA,NA,"June","2018",NA,-78.8429011,0.0530099,"1191.4306641","19-JUN-18 8:01:41",2018-06-19 08:01:41
"812","UnPocoDelChoco","19/06/2018","47",NA,NA,NA,NA,NA,NA,NA,NA,NA,NA,NA,"phaethornis yaruqui",NA,"fly past",NA,NA,NA,NA,NA,NA,NA,NA,NA,"June","2018",NA,-78.8413998,0.0511474,"1138.7988281","19-JUN-18 9:14:28",2018-06-19 09:14:28
"813","UnPocoDelChoco","18/07/2018","125",NA,NA,NA,NA,NA,NA,NA,NA,NA,NA,NA,"phaethornis yaruqui",NA,"fly past",NA,NA,NA,NA,NA,NA,NA,NA,NA,"July","2018",NA,-78.8440885,0.0534655,"1175.8093262","18-JUL-18 8:24:10",2018-07-18 08:24:10
"814","UnPocoDelChoco","18/07/2018","132",NA,NA,NA,NA,NA,NA,NA,NA,NA,NA,NA,"phaethornis yaruqui",NA,"fly past",NA,NA,NA,NA,NA,NA,NA,NA,NA,"July","2018",NA,-78.8427852,0.0528532,"1183.7402344","18-JUL-18 9:08:55",2018-07-18 09:08:55
"815","UnPocoDelChoco","18/07/2018","152",NA,NA,NA,NA,NA,NA,NA,NA,NA,NA,NA,"phaethornis yaruqui",NA,"fly passed",NA,NA,NA,NA,NA,NA,NA,NA,NA,"July","2018",NA,-78.8419431,0.0514426,"1142.8845215","18-JUL-18 10:00:44",2018-07-18 10:00:44
"816","UnPocoDelChoco","18/07/2018","165",NA,NA,NA,NA,NA,NA,NA,NA,NA,NA,NA,"heliodoxa jacula",NA,"fly past",NA,NA,NA,NA,NA,NA,NA,NA,NA,"July","2018",NA,-78.8423701,0.0509946,"1067.1811523","18-JUL-18 10:32:27",2018-07-18 10:32:27
"817","UnPocoDelChoco","18/07/2018","173",NA,NA,NA,NA,NA,NA,NA,NA,NA,NA,NA,"Colibri delphinae","catch insects",NA,NA,NA,NA,NA,NA,NA,NA,NA,NA,"July","2018",NA,-78.8434339,0.0499629,"1010.7041016","18-JUL-18 10:54:35",2018-07-18 10:54:35
"818","UnPocoDelChoco","20/08/2018","176",NA,NA,NA,NA,NA,NA,NA,NA,NA,NA,NA,"phaethornis yaruqui",NA,NA,NA,NA,NA,NA,NA,NA,NA,NA,NA,"August","2018",NA,-78.8447932,0.0535107,"1191.6708984","20-AUG-18 8:02:07",2018-08-20 08:02:07
"819","UnPocoDelChoco","20/08/2018","224",NA,NA,NA,NA,NA,NA,NA,NA,NA,NA,NA,"Phaethornis striigularis",NA,"fly past two individuo",NA,NA,NA,NA,NA,NA,NA,NA,NA,"August","2018",NA,-78.8432792,0.0509302,"1028.0078125","20-AUG-18 10:22:21",2018-08-20 10:22:21
"820","UnPocoDelChoco","20/08/2018","225",NA,NA,NA,NA,NA,NA,NA,NA,NA,NA,NA,"Phaethornis yaruqui",NA,"fly past",NA,NA,NA,NA,NA,NA,NA,NA,NA,"August","2018",NA,-78.8430286,0.0509011,"1023.6818848","20-AUG-18 10:23:59",2018-08-20 10:23:59
"821","UnPocoDelChoco","22/09/2018","287",NA,NA,NA,NA,NA,NA,NA,NA,NA,NA,NA,"Heliothryx barroti","one individual eating insects",NA,NA,NA,NA,NA,NA,NA,NA,NA,NA,"September","2018",NA,-78.8409457,0.0521113,"1180.1352539","22-SEP-18 8:10:31",2018-09-22 08:10:31
"822","UnPocoDelChoco","22/09/2018","291",NA,NA,NA,NA,NA,NA,NA,NA,NA,NA,NA,"Phaethornis yaruqui","one individual flying past",NA,NA,NA,NA,NA,NA,NA,NA,NA,NA,"September","2018",NA,-78.8410921,0.0515567,"1150.8151855","22-SEP-18 8:27:00",2018-09-22 08:27:00
"823","UnPocoDelChoco","22/09/2018","299",NA,NA,NA,NA,NA,NA,NA,NA,NA,NA,NA,"Phaethornis yaruqui","one individual flying past",NA,NA,NA,NA,NA,NA,NA,NA,NA,NA,"September","2018",NA,-78.8424647,0.0511051,"1124.3791504","22-SEP-18 8:50:07",2018-09-22 08:50:07
"824","UnPocoDelChoco","24/10/2018","320",NA,NA,NA,NA,NA,NA,NA,NA,NA,NA,NA,"White-whiskered Hermit",NA,"Visit Heliconia",NA,NA,NA,NA,NA,NA,NA,NA,NA,"October","2018",NA,-78.8409827,0.0515653,"1177.7319336","24-OCT-18 8:39:32",2018-10-24 08:39:32
"825","UnPocoDelChoco","24/10/2018","334",NA,NA,NA,NA,NA,NA,NA,NA,NA,NA,NA,"White-whiskered Hermit",NA,"fly past",NA,NA,NA,NA,NA,NA,NA,NA,NA,"October","2018",NA,-78.8430723,0.0506092,"1026.5656738","24-OCT-18 9:18:40",2018-10-24 09:18:40
"826","UnPocoDelChoco","24/10/2018","344",NA,NA,NA,NA,NA,NA,NA,NA,NA,NA,NA,"White-whiskered Hermit",NA,"fly past, visit G. wittmackii",NA,NA,NA,NA,NA,NA,NA,NA,NA,"October","2018",NA,-78.8435765,0.0498313,"1014.0688477","24-OCT-18 9:31:13",2018-10-24 09:31:13
"827","UnPocoDelChoco","17/11/2018","409",NA,NA,NA,NA,NA,NA,NA,NA,NA,NA,NA,"Ocreatus underwoodii","feeding palicourea guianensis 20seconds",NA,NA,NA,NA,NA,NA,NA,NA,NA,NA,"November","2018",NA,-78.8448037,0.0535972,"1199.1210938","17-NOV-18 7:41:09",2018-11-17 07:41:09
"828","UnPocoDelChoco","17/11/2018","418",NA,NA,NA,NA,NA,NA,NA,NA,NA,NA,NA,"Ocreatus underwoodii","feeding palicourea guianensis 20seconds",NA,NA,NA,NA,NA,NA,NA,NA,NA,NA,"November","2018",NA,-78.8443352,0.053371,"1198.1596680","17-NOV-18 8:00:00",2018-11-17 08:00:00
"829","UnPocoDelChoco","17/11/2018","463",NA,NA,NA,NA,NA,NA,NA,NA,NA,NA,NA,"Phaethornis yaruqui",NA,"fly past",NA,NA,NA,NA,NA,NA,NA,NA,NA,"November","2018",NA,-78.8423955,0.0509537,"1078.9572754","17-NOV-18 9:58:01",2018-11-17 09:58:01
"830","UnPocoDelChoco","17/11/2018","489",NA,NA,NA,NA,NA,NA,NA,NA,NA,NA,NA,"Phaethornis yaruqui",NA,"fly past",NA,NA,NA,NA,NA,NA,NA,NA,NA,"November","2018",NA,-78.8433571,0.0498129,"1002.7731934","17-NOV-18 10:57:05",2018-11-17 10:57:05
"831","Verdecocha","18/03/2017","NA","Fuchsia cinerea",NA,"10","DC",13,NA,NA,NA,NA,NA,NA,"Coeligena lutetiae","Alimentandose 5""","0-25",NA,NA,NA,NA,NA,NA,NA,NA,"Fuchsia cinerea","March","2017","Fuchsia cinerea",NA,NA,NA,NA,NA
"832","Verdecocha","18/03/2017","NA",NA,NA,NA,NA,NA,NA,NA,NA,NA,NA,NA,"Metallura tyrianthina","Perchando","0-25",NA,NA,NA,NA,NA,NA,NA,NA,NA,"March","2017",NA,NA,NA,NA,NA,NA
"833","Verdecocha","18/03/2017","NA",NA,NA,NA,NA,NA,NA,NA,NA,NA,NA,NA,"Eriocnemis luciani",NA,"25-50",NA,NA,NA,NA,NA,NA,NA,NA,NA,"March","2017",NA,NA,NA,NA,NA,NA
"834","Verdecocha","18/03/2017","357",NA,NA,NA,NA,NA,NA,NA,NA,NA,NA,NA,"Coeligena lutetiae",NA,NA,NA,NA,NA,NA,NA,NA,NA,NA,NA,"March","2017",NA,-78.5950705,-0.12477829,"3458.442","18-MAR-17 8:04:37",2017-03-18 08:04:37
"835","Verdecocha","18/03/2017","368",NA,NA,NA,NA,NA,NA,NA,NA,NA,NA,NA,"Coeligena lutetiae","flying",NA,NA,NA,NA,NA,NA,NA,NA,NA,NA,"March","2017",NA,-78.5958952,-0.12318456,"3411.098","18-MAR-17 8:55:01",2017-03-18 08:55:01
"836","Verdecocha","18/03/2017","373","Macleania rupestris","Macleania rupestris","4",NA,5,NA,NA,NA,NA,NA,NA,"Metallura tyrianthina","Alimentandose",NA,NA,NA,NA,NA,NA,NA,NA,NA,"Macleania rupestris","March","2017","Macleania rupestris",-78.59643466,-0.12284668,"3401.245","18-MAR-17 9:11:53",2017-03-18 09:11:53
"837","Verdecocha","18/03/2017","373","Axinaea sp. 1","Miconia corymbiformis","7","DC",11,NA,NA,NA,NA,NA,NA,"Coeligena lutetiae","Perchando 7""",NA,NA,NA,NA,NA,NA,NA,NA,NA,"Miconia corymbiformis","March","2017","Miconia corymbiformis",-78.59643466,-0.12284668,"3401.245","18-MAR-17 9:11:53",2017-03-18 09:11:53
"838","Verdecocha","18/03/2017","373",NA,NA,NA,NA,NA,NA,NA,NA,NA,NA,NA,"Eriocnemis luciani","Perchando 1""",NA,NA,NA,NA,NA,NA,NA,NA,NA,NA,"March","2017",NA,-78.59643466,-0.12284668,"3401.245","18-MAR-17 9:11:53",2017-03-18 09:11:53
"839","Verdecocha","18/03/2017","373",NA,NA,NA,NA,NA,NA,NA,NA,NA,NA,NA,"Metallura tyrianthina",NA,NA,NA,NA,NA,NA,NA,NA,NA,NA,NA,"March","2017",NA,-78.59643466,-0.12284668,"3401.245","18-MAR-17 9:11:53",2017-03-18 09:11:53
"840","Verdecocha","18/03/2017","375",NA,NA,NA,NA,NA,NA,NA,NA,NA,NA,NA,"Metallura tyrianthina",NA,NA,NA,NA,NA,NA,NA,NA,NA,NA,NA,"March","2017",NA,-78.59709465,-0.12244988,"3414.943","18-MAR-17 9:23:08",2017-03-18 09:23:08
"841","Verdecocha","18/03/2017","377",NA,NA,NA,NA,NA,NA,NA,NA,NA,NA,NA,"Metallura tyrianthina",NA,NA,NA,NA,NA,NA,NA,NA,NA,NA,NA,"March","2017",NA,-78.59731098,-0.12225157,"3428.161","18-MAR-17 9:27:41",2017-03-18 09:27:41
"842","Verdecocha","18/03/2017","382",NA,NA,NA,NA,NA,NA,NA,NA,NA,NA,NA,"Coeligena lutetiae",NA,NA,NA,NA,NA,NA,NA,NA,NA,NA,NA,"March","2017",NA,-78.59740964,-0.12185242,"3413.261","18-MAR-17 9:41:14",2017-03-18 09:41:14
"843","Verdecocha","18/03/2017","383",NA,NA,NA,NA,NA,NA,NA,NA,NA,NA,NA,"Coeligena lutetiae",NA,NA,NA,NA,NA,NA,NA,NA,NA,NA,NA,"March","2017",NA,-78.59741752,-0.12176164,"3418.308","18-MAR-17 9:43:00",2017-03-18 09:43:00
"844","Verdecocha","18/03/2017","383",NA,NA,NA,NA,NA,NA,NA,NA,NA,NA,NA,"Metallura tyrianthina",NA,NA,NA,NA,NA,NA,NA,NA,NA,NA,NA,"March","2017",NA,-78.59741752,-0.12176164,"3418.308","18-MAR-17 9:43:00",2017-03-18 09:43:00
"845","Verdecocha","18/03/2017","387",NA,NA,NA,NA,NA,NA,NA,NA,NA,NA,NA,"Eriocnemis luciani","Perchando 8""",NA,NA,NA,NA,NA,NA,NA,NA,NA,NA,"March","2017",NA,-78.59787877,-0.12116804,"3384.662","18-MAR-17 9:52:04",2017-03-18 09:52:04
"846","Verdecocha","18/03/2017","388",NA,NA,NA,NA,NA,NA,NA,NA,NA,NA,NA,"Metallura tyrianthina",NA,NA,NA,NA,NA,NA,NA,NA,NA,NA,NA,"March","2017",NA,-78.59760863,-0.12085598,"3397.399","18-MAR-17 9:58:09",2017-03-18 09:58:09
"847","Verdecocha","18/03/2017","388",NA,NA,NA,NA,NA,NA,NA,NA,NA,NA,NA,"Metallura tyrianthina",NA,NA,NA,NA,NA,NA,NA,NA,NA,NA,NA,"March","2017",NA,-78.59760863,-0.12085598,"3397.399","18-MAR-17 9:58:09",2017-03-18 09:58:09
"848","Verdecocha","18/03/2017","392",NA,NA,NA,NA,NA,NA,NA,NA,NA,NA,NA,"Metallura tyrianthina",NA,NA,NA,NA,NA,NA,NA,NA,NA,NA,NA,"March","2017",NA,-78.59753453,-0.11998912,"3396.438","18-MAR-17 10:13:20",2017-03-18 10:13:20
"849","Verdecocha","18/03/2017","396",NA,NA,NA,NA,NA,NA,NA,NA,NA,NA,NA,"Metallura tyrianthina",NA,NA,NA,NA,NA,NA,NA,NA,NA,NA,NA,"March","2017",NA,-78.59761684,-0.11985191,"3387.305","18-MAR-17 10:20:27",2017-03-18 10:20:27
"850","Verdecocha","18/03/2017","399",NA,NA,NA,NA,NA,NA,NA,NA,NA,NA,NA,"Eriocnemis luciani",NA,NA,NA,NA,NA,NA,NA,NA,NA,NA,NA,"March","2017",NA,-78.59778305,-0.11952963,"3376.010","18-MAR-17 10:25:33",2017-03-18 10:25:33
"851","Verdecocha","18/03/2017","403",NA,NA,NA,NA,NA,NA,NA,NA,NA,NA,NA,"Metallura tyrianthina",NA,NA,NA,NA,NA,NA,NA,NA,NA,NA,NA,"March","2017",NA,-78.59768775,-0.11902604,"3382.739","18-MAR-17 10:38:42",2017-03-18 10:38:42
"852","Verdecocha","18/03/2017","405",NA,NA,NA,NA,NA,NA,NA,NA,NA,NA,NA,"Metallura tyrianthina",NA,NA,NA,NA,NA,NA,NA,NA,NA,NA,NA,"March","2017",NA,-78.59758599,-0.1187621,"3383.220","18-MAR-17 10:48:13",2017-03-18 10:48:13
"853","Verdecocha","18/03/2017","410",NA,NA,NA,NA,NA,NA,NA,NA,NA,NA,NA,"Coeligena lutetiae",NA,NA,NA,NA,NA,NA,NA,NA,NA,NA,NA,"March","2017",NA,-78.59741316,-0.11819389,"3382.258","18-MAR-17 11:08:38",2017-03-18 11:08:38
"854","Verdecocha","18/03/2017","414",NA,NA,NA,NA,NA,NA,NA,NA,NA,NA,NA,"Metallura tyrianthina","Comiendo insectos",NA,NA,NA,NA,NA,NA,NA,NA,NA,NA,"March","2017",NA,-78.59722691,-0.11752057,"3388.987","18-MAR-17 11:19:26",2017-03-18 11:19:26
"855","Verdecocha","18/03/2017","423","Macleania rupestris","Macleania rupestris","6","DC",4,NA,NA,NA,NA,NA,NA,"Eriocnemis luciani","Alimentandose",NA,NA,NA,NA,NA,NA,NA,NA,NA,"Macleania rupestris","March","2017","Macleania rupestris",-78.595018,-0.124941,"3299.146","2018-03-07T13:52:29Z",2018-03-07 13:52:29
"856","Verdecocha","18/03/2017","424",NA,NA,NA,NA,NA,NA,NA,NA,NA,NA,NA,"Eriocnemis luciani",NA,NA,NA,NA,NA,NA,NA,NA,NA,NA,NA,"March","2017",NA,-78.595135,-0.124502,"3307.282","2018-03-07T13:58:08Z",2018-03-07 13:58:08
"857","Verdecocha","18/03/2017","427","Macleania rupestris","Macleania rupestris","7","DC",6,NA,NA,NA,NA,NA,NA,"Eriocnemis luciani","Alimentandose 7""",NA,NA,NA,NA,NA,NA,NA,NA,NA,"Macleania rupestris","March","2017","Macleania rupestris",-78.595153,-0.124363,"3316.631","2018-03-07T14:02:45Z",2018-03-07 14:02:45
"858","Verdecocha","18/03/2017","429","Disterigma alaternoides","Disterigma noyesiae","1","DC",3,NA,NA,NA,NA,NA,NA,"Metallura tyrianthina","feeding",NA,NA,NA,NA,NA,NA,NA,NA,NA,"Disterigma noyesiae","March","2017","Disterigma noyesiae",-78.595202,-0.124192,"3325.017","2018-03-07T14:05:29Z",2018-03-07 14:05:29
"859","Verdecocha","04/04/2017","92","Salvia pichinchensis","Salvia pichinchensis","6","DC",12,NA,NA,NA,NA,NA,NA,"Pterophanes cyanopterus","feeding","3 sec; flor morada",NA,NA,NA,NA,NA,NA,NA,NA,"Salvia pichinchensis","April","2017","Salvia pichinchensis",-78.59496,-0.125027,"3453.556","2017-04-04T13:15:11Z",2017-04-04 13:15:11
"860","Verdecocha","04/04/2017","92",NA,NA,NA,NA,NA,NA,NA,NA,NA,NA,NA,"Metallura tyrianthina",NA,"2 ind.",NA,NA,NA,NA,NA,NA,NA,NA,NA,"April","2017",NA,-78.59496,-0.125027,"3453.556","2017-04-04T13:15:11Z",2017-04-04 13:15:11
"861","Verdecocha","04/04/2017","92",NA,NA,NA,NA,NA,NA,NA,NA,NA,NA,NA,"Coeligena lutetiae","pass by flying",NA,NA,NA,NA,NA,NA,NA,NA,NA,NA,"April","2017",NA,-78.59496,-0.125027,"3453.556","2017-04-04T13:15:11Z",2017-04-04 13:15:11
"862","Verdecocha","04/04/2017","95","Axinaea sp. 1","Miconia corymbiformis","7","DC",2,NA,NA,NA,NA,NA,NA,"Metallura tyrianthina","feeding","3 flowers",NA,NA,NA,NA,NA,NA,NA,NA,"Miconia corymbiformis","April","2017","Miconia corymbiformis",-78.595128,-0.124516,"3427.765","2017-04-04T13:35:34Z",2017-04-04 13:35:34
"863","Verdecocha","04/04/2017","95","Macleania rupestris","Macleania rupestris","8","DC",9,NA,NA,NA,NA,NA,NA,"Eriocnemis luciani","feeding",NA,NA,NA,NA,NA,NA,NA,NA,NA,"Macleania rupestris","April","2017","Macleania rupestris",-78.595128,-0.124516,"3427.765","2017-04-04T13:35:34Z",2017-04-04 13:35:34
"864","Verdecocha","04/04/2017","98","Macleania rupestris","Macleania rupestris","6","DC",30,NA,NA,NA,NA,NA,NA,"Coeligena lutetiae","pass by flying","2 ind",NA,NA,NA,NA,NA,NA,NA,NA,"Macleania rupestris","April","2017","Macleania rupestris",-78.595294,-0.124013,"3420.238","2017-04-04T13:51:30Z",2017-04-04 13:51:30
"865","Verdecocha","04/04/2017","98",NA,NA,NA,NA,NA,NA,NA,NA,NA,NA,NA,"Metallura tyrianthina",NA,NA,NA,NA,NA,NA,NA,NA,NA,NA,NA,"April","2017",NA,-78.595294,-0.124013,"3420.238","2017-04-04T13:51:30Z",2017-04-04 13:51:30
"866","Verdecocha","04/04/2017","99",NA,NA,NA,NA,NA,NA,NA,NA,NA,NA,NA,"Eriocnemis luciani","perching","4 sec",NA,NA,NA,NA,NA,NA,NA,NA,NA,"April","2017",NA,-78.595322,-0.123993,"3420.281","2017-04-04T13:54:04Z",2017-04-04 13:54:04
"867","Verdecocha","04/04/2017","100",NA,NA,NA,NA,NA,NA,NA,NA,NA,NA,NA,"Metallura tyrianthina",NA,NA,NA,NA,NA,NA,NA,NA,NA,NA,NA,"April","2017",NA,-78.595289,-0.123919,"3419.834","2017-04-04T13:56:41Z",2017-04-04 13:56:41
"868","Verdecocha","04/04/2017","101",NA,NA,NA,NA,NA,NA,NA,NA,NA,NA,NA,"Metallura tyrianthina","perching","3 sec",NA,NA,NA,NA,NA,NA,NA,NA,NA,"April","2017",NA,-78.595483,-0.123736,"3418.501","2017-04-04T14:04:00Z",2017-04-04 14:04:00
"869","Verdecocha","04/04/2017","103","Macleania rupestris","Macleania rupestris","4","DC",3,NA,NA,NA,NA,NA,NA,"Eriocnemis luciani",NA,NA,NA,NA,NA,NA,NA,NA,NA,NA,"Macleania rupestris","April","2017","Macleania rupestris",-78.595626,-0.123499,"3420.638","2017-04-04T14:12:46Z",2017-04-04 14:12:46
"870","Verdecocha","04/04/2017","103","Tillandsia sp. 1","Tillandsia polyantha","4","DC",3,NA,NA,NA,NA,NA,NA,"Eriocnemis luciani",NA,"morada",NA,NA,NA,NA,NA,NA,NA,NA,"Tillandsia polyantha","April","2017","Tillandsia polyantha",-78.595626,-0.123499,"3420.638","2017-04-04T14:12:46Z",2017-04-04 14:12:46
"871","Verdecocha","04/04/2017","104",NA,NA,NA,NA,NA,NA,NA,NA,NA,NA,NA,"Coeligena lutetiae","pass by flying",NA,NA,NA,NA,NA,NA,NA,NA,NA,NA,"April","2017",NA,-78.595812,-0.123362,"3419.899","2017-04-04T14:16:59Z",2017-04-04 14:16:59
"872","Verdecocha","04/04/2017","108",NA,NA,NA,NA,NA,NA,NA,NA,NA,NA,NA,"Coeligena lutetiae","pass by flying",NA,NA,NA,NA,NA,NA,NA,NA,NA,NA,"April","2017",NA,-78.596073,-0.123189,"3421.766","2017-04-04T14:30:16Z",2017-04-04 14:30:16
"873","Verdecocha","04/04/2017","110",NA,NA,NA,NA,NA,NA,NA,NA,NA,NA,NA,"Coeligena lutetiae","pass by flying","2 ind",NA,NA,NA,NA,NA,NA,NA,NA,NA,"April","2017",NA,-78.596203,-0.12305,"3418.659","2017-04-04T14:34:59Z",2017-04-04 14:34:59
"874","Verdecocha","04/04/2017","116",NA,NA,NA,NA,NA,NA,NA,NA,NA,NA,NA,"Coeligena lutetiae","pass by flying",NA,NA,NA,NA,NA,NA,NA,NA,NA,NA,"April","2017",NA,-78.596586,-0.12282,"3414.416","2017-04-04T14:48:12Z",2017-04-04 14:48:12
"875","Verdecocha","04/04/2017","119",NA,NA,NA,NA,NA,NA,NA,NA,NA,NA,NA,"Metallura tyrianthina",NA,"Dos individuos",NA,NA,NA,NA,NA,NA,NA,NA,NA,"April","2017",NA,-78.596813,-0.12264,"3409.802","2017-04-04T14:57:57Z",2017-04-04 14:57:57
"876","Verdecocha","04/04/2017","125",NA,NA,NA,NA,NA,NA,NA,NA,NA,NA,NA,"Coeligena lutetiae","pass by flying",NA,NA,NA,NA,NA,NA,NA,NA,NA,NA,"April","2017",NA,-78.59727,-0.122301,"3406.195","2017-04-04T15:14:35Z",2017-04-04 15:14:35
"877","Verdecocha","04/04/2017","129",NA,NA,NA,NA,NA,NA,NA,NA,NA,NA,NA,"Metallura tyrianthina",NA,NA,NA,NA,NA,NA,NA,NA,NA,NA,NA,"April","2017",NA,-78.597578,-0.12187,"3409.616","2017-04-04T15:32:14Z",2017-04-04 15:32:14
"878","Verdecocha","04/04/2017","134","Solanum sp. 1","Deprea granulosa","2","DC",1,NA,NA,NA,NA,NA,NA,"Metallura tyrianthina","Perchado 40' comiendo solanaceae (Solanum sp. 1 lila)","lila",NA,NA,NA,NA,NA,NA,NA,NA,"Deprea granulosa","April","2017","Deprea granulosa",-78.597681,-0.121572,"3393.897","2017-04-04T15:43:51Z",2017-04-04 15:43:51
"879","Verdecocha","04/04/2017","140",NA,NA,NA,NA,NA,NA,NA,NA,NA,NA,NA,"Metallura tyrianthina","heard",NA,NA,NA,NA,NA,NA,NA,NA,NA,NA,"April","2017",NA,-78.597692,-0.120737,"3379.408","2017-04-04T16:21:39Z",2017-04-04 16:21:39
"880","Verdecocha","04/04/2017","147",NA,NA,NA,NA,NA,NA,NA,NA,NA,NA,NA,"Metallura tyrianthina","heard",NA,NA,NA,NA,NA,NA,NA,NA,NA,NA,"April","2017",NA,-78.597679,-0.120112,"3374.110","2017-04-04T16:39:49Z",2017-04-04 16:39:49
"881","Verdecocha","04/04/2017","192",NA,NA,NA,NA,NA,NA,NA,NA,NA,NA,NA,"Metallura Tyrianthina",NA,NA,NA,NA,NA,NA,NA,NA,NA,NA,NA,"April","2017",NA,-78.597257,-0.11763,"3376.340","2017-04-04T18:22:45Z",2017-04-04 18:22:45
"882","Verdecocha","04/04/2017","192",NA,NA,NA,NA,NA,NA,NA,NA,NA,NA,NA,"Eriocnemis luciani",NA,NA,NA,NA,NA,NA,NA,NA,NA,NA,NA,"April","2017",NA,-78.597257,-0.11763,"3376.340","2017-04-04T18:22:45Z",2017-04-04 18:22:45
"883","Verdecocha","04/04/2017","196","Macleania rupestris","Macleania rupestris","4","DC",6,NA,NA,NA,NA,NA,NA,"Eriocnemis luciani","feeding",NA,NA,NA,NA,NA,NA,NA,NA,NA,"Macleania rupestris","April","2017","Macleania rupestris",-78.597216,-0.117397,"3377.266","2017-04-04T18:29:52Z",2017-04-04 18:29:52
"884","Verdecocha","04/04/2017","196",NA,NA,NA,NA,NA,NA,NA,NA,NA,NA,NA,"Metallura tyrianthina",NA,NA,NA,NA,NA,NA,NA,NA,NA,NA,NA,"April","2017",NA,-78.597216,-0.117397,"3377.266","2017-04-04T18:29:52Z",2017-04-04 18:29:52
"885","Verdecocha","04/04/2017","206",NA,NA,NA,NA,NA,NA,NA,NA,NA,NA,NA,"Eriocnemis luciani","Comiendo insectos",NA,NA,NA,NA,NA,NA,NA,NA,NA,NA,"April","2017",NA,-78.597374,-0.116697,"3392.650","2017-04-04T18:45:31Z",2017-04-04 18:45:31
"886","Verdecocha","04/04/2017","213",NA,NA,NA,NA,NA,NA,NA,NA,NA,NA,NA,"Eriocnemis luciani",NA,NA,NA,NA,NA,NA,NA,NA,NA,NA,NA,"April","2017",NA,-78.597649,-0.115996,"3394.951","2017-04-04T18:59:04Z",2017-04-04 18:59:04
"887","Verdecocha","04/04/2017","221","Disterigma alaternoides","Disterigma noyesiae","2","DC",7,NA,NA,NA,NA,NA,NA,"Eriocnemis luciani","Aliment√°ndose",NA,NA,NA,NA,NA,NA,NA,NA,NA,"Disterigma noyesiae","April","2017","Disterigma noyesiae",-78.597942,-0.115347,"3401.760","2017-04-04T19:12:36Z",2017-04-04 19:12:36
"888","Verdecocha","04/04/2017","226",NA,NA,NA,NA,NA,NA,NA,NA,NA,NA,NA,"Eriocnemis nigrivestis","Perchada durante 3'","hembra",NA,NA,NA,NA,NA,NA,NA,NA,NA,"April","2017",NA,-78.598011,-0.115186,"3415.235","2017-04-04T19:26:00Z",2017-04-04 19:26:00
"889","Verdecocha","04/04/2017","231","Tillandsia sp. 1","Tillandsia polyantha","4","DC",1,NA,NA,NA,NA,NA,NA,"Eriocnemis nigrivestis","Aliment√°ndose","morada",NA,NA,NA,NA,NA,NA,NA,NA,"Tillandsia polyantha","April","2017","Tillandsia polyantha",-78.598093,-0.115027,"3421.969","2017-04-04T19:31:25Z",2017-04-04 19:31:25
"890","Verdecocha","04/04/2017","234",NA,NA,NA,NA,NA,NA,NA,NA,NA,NA,NA,"Metallura tyrianthina","Comiendo insectos",NA,NA,NA,NA,NA,NA,NA,NA,NA,NA,"April","2017",NA,-78.598133,-0.114851,"3426.084","2017-04-04T19:35:59Z",2017-04-04 19:35:59
"891","Verdecocha","05/05/2017","301","Macleania rupestris","Macleania rupestris","4","DC",7,NA,NA,NA,NA,NA,NA,"Coeligena lutetiae","Aliment√°ndose",NA,NA,NA,NA,NA,NA,NA,NA,NA,"Macleania rupestris","May","2017","Macleania rupestris",-78.595105,-0.124415,"3407.950","2017-05-05T13:16:03Z",2017-05-05 13:16:03
"892","Verdecocha","05/05/2017","307","Macleania rupestris","Macleania rupestris","8","DC",40,NA,NA,NA,NA,NA,NA,"Metallura tyrianthina","2 ind. aliment√°ndose, tambi√©n 1 Coeligena lutetiae aliment√°ndose de la misma planta",NA,NA,NA,NA,NA,NA,NA,NA,NA,"Macleania rupestris","May","2017","Macleania rupestris",-78.595303,-0.123914,"3410.643","2017-05-05T13:34:14Z",2017-05-05 13:34:14
"893","Verdecocha","05/05/2017","310",NA,NA,NA,NA,NA,NA,NA,NA,NA,NA,NA,"Eriocnemis luciani",NA,NA,NA,NA,NA,NA,NA,NA,NA,NA,NA,"May","2017",NA,-78.595619,-0.123632,"3415.674","2017-05-05T13:57:48Z",2017-05-05 13:57:48
"894","Verdecocha","05/05/2017","323",NA,NA,NA,NA,NA,NA,NA,NA,NA,NA,NA,"Metallura tyrianthina","heard",NA,NA,NA,NA,NA,NA,NA,NA,NA,NA,"May","2017",NA,-78.597137,-0.122354,"3405.305","2017-05-05T14:41:56Z",2017-05-05 14:41:56
"895","Verdecocha","05/05/2017","332","Solanum sp. 1","Deprea granulosa","3","DC",27,NA,NA,NA,NA,NA,NA,"Metallura tyrianthina","aliment√°ndose","lila","en carpeta",NA,NA,NA,NA,NA,NA,NA,"Deprea granulosa","May","2017","Deprea granulosa",-78.597668,-0.121584,"3404.664","2017-05-05T15:31:44Z",2017-05-05 15:31:44
"896","Verdecocha","05/05/2017","336","Guzmania sp. 1","Guzmania bakeri","6","DC",2,NA,NA,NA,NA,NA,NA,"Eriocnemis luciani","perching",NA,NA,NA,NA,NA,NA,NA,NA,NA,"Guzmania bakeri","May","2017","Guzmania bakeri",-78.59768,-0.120777,"3384.182","2017-05-05T15:56:34Z",2017-05-05 15:56:34
"897","Verdecocha","05/05/2017","339",NA,NA,NA,NA,NA,NA,NA,NA,NA,NA,NA,"Eriocnemis luciani","heard",NA,NA,NA,NA,NA,NA,NA,NA,NA,NA,"May","2017",NA,-78.597707,-0.120551,"3379.446","2017-05-05T16:02:55Z",2017-05-05 16:02:55
"898","Verdecocha","05/05/2017","352",NA,NA,NA,NA,NA,NA,NA,NA,NA,NA,NA,"Eriocnemis luciani","flying",NA,NA,NA,NA,NA,NA,NA,NA,NA,NA,"May","2017",NA,-78.59772,-0.119362,"3373.418","2017-05-05T16:41:21Z",2017-05-05 16:41:21
"899","Verdecocha","05/05/2017","361","Palicourea fuchsioides","Palicourea fuchsioides","2","DC",21,NA,NA,NA,NA,NA,NA,"Eriocnemis nigrivestis","aliment√°ndose, macho",NA,NA,NA,NA,NA,NA,NA,NA,NA,"Palicourea fuchsioides","May","2017","Palicourea fuchsioides",-78.597618,-0.11871,"3384.376","2017-05-05T17:16:03Z",2017-05-05 17:16:03
"900","Verdecocha","05/05/2017","363",NA,NA,NA,NA,NA,NA,NA,NA,NA,NA,NA,"Eriocnemis nigrivestis","perching",NA,NA,NA,NA,NA,NA,NA,NA,NA,NA,"May","2017",NA,-78.59756,-0.118618,"3384.362","2017-05-05T17:24:40Z",2017-05-05 17:24:40
"901","Verdecocha","05/05/2017","363",NA,NA,NA,NA,NA,NA,NA,NA,NA,NA,NA,"Metallura tyrianthina","heard",NA,NA,NA,NA,NA,NA,NA,NA,NA,NA,"May","2017",NA,-78.59756,-0.118618,"3384.362","2017-05-05T17:24:40Z",2017-05-05 17:24:40
"902","Verdecocha","05/05/2017","386",NA,NA,NA,NA,NA,NA,NA,NA,NA,NA,NA,"Eriocnemis luciani","perching",NA,NA,NA,NA,NA,NA,NA,NA,NA,NA,"May","2017",NA,-78.597351,-0.116799,"3398.867","2017-05-05T18:08:42Z",2017-05-05 18:08:42
"903","Verdecocha","05/05/2017","392",NA,NA,NA,NA,NA,NA,NA,NA,NA,NA,NA,"Metallura tyrianthina","perching",NA,NA,NA,NA,NA,NA,NA,NA,NA,NA,"May","2017",NA,-78.597517,-0.116403,"3403.131","2017-05-05T18:22:14Z",2017-05-05 18:22:14
"904","Verdecocha","12/06/2017","102","Axinaea sp. 1","Miconia corymbiformis","6","DC",4,NA,NA,NA,NA,NA,NA,"Metallura tyrianthina","feeding",NA,NA,NA,NA,NA,NA,NA,NA,NA,"Miconia corymbiformis","June","2017","Miconia corymbiformis",-78.597888,-0.11524,"3414.399","2018-06-13T17:27:09Z",2018-06-13 17:27:09
"905","Verdecocha","12/06/2017","107","Macleania rupestris","Macleania rupestris","7","DC",31,NA,NA,NA,NA,NA,NA,"Eriocnemis luciani","feeding","2 sec",NA,NA,NA,NA,NA,NA,NA,NA,"Macleania rupestris","June","2017","Macleania rupestris",-78.595185,-0.124244,"3423.106","2017-06-12T14:02:01Z",2017-06-12 14:02:01
"906","Verdecocha","12/06/2017","108","Centropogon sp. 1","Siphocampylus rupestris","5","DC",23,NA,NA,NA,NA,NA,NA,"Coeligena lutetiae","feeding",NA,NA,NA,NA,NA,NA,NA,NA,NA,"Siphocampylus rupestris","June","2017","Siphocampylus rupestris",-78.595258,-0.123957,"3426.152","2017-06-12T14:10:15Z",2017-06-12 14:10:15
"907","Verdecocha","12/06/2017","120",NA,NA,NA,NA,NA,NA,NA,NA,NA,NA,NA,"Metallura tyrianthina",NA,"heard",NA,NA,NA,NA,NA,NA,NA,NA,NA,"June","2017",NA,-78.596923,-0.122549,"3411.574","2017-06-12T14:42:43Z",2017-06-12 14:42:43
"908","Verdecocha","12/06/2017","123",NA,NA,NA,NA,NA,NA,NA,NA,NA,NA,NA,"Metallura tyrianthina",NA,"heard",NA,NA,NA,NA,NA,NA,NA,NA,NA,"June","2017",NA,-78.597342,-0.122167,"3420.416","2017-06-12T14:55:35Z",2017-06-12 14:55:35
"909","Verdecocha","12/06/2017","126",NA,NA,NA,NA,NA,NA,NA,NA,NA,NA,NA,"Metallura tyrianthina",NA,"seen, heard",NA,NA,NA,NA,NA,NA,NA,NA,NA,"June","2017",NA,-78.597428,-0.12202,"3422.749","2017-06-12T15:11:54Z",2017-06-12 15:11:54
"910","Verdecocha","12/06/2017","128","Guzmania sp. 1","Guzmania bakeri","2","DC",2,NA,NA,NA,NA,NA,NA,"Metallura tyrianthina",NA,NA,NA,NA,NA,NA,NA,NA,NA,NA,"Guzmania bakeri","June","2017","Guzmania bakeri",-78.59752,-0.121848,"3419.155","2017-06-12T15:21:53Z",2017-06-12 15:21:53
"911","Verdecocha","12/06/2017","135",NA,NA,NA,NA,NA,NA,NA,NA,NA,NA,NA,"Metallura tyrianthina",NA,"heard",NA,NA,NA,NA,NA,NA,NA,NA,NA,"June","2017",NA,-78.597729,-0.12047,"3382.911","2017-06-12T16:00:40Z",2017-06-12 16:00:40
"912","Verdecocha","12/06/2017","144","Macleania rupestris","Macleania rupestris","5","DC",4,NA,NA,NA,NA,NA,NA,"Eriocnemis luciani","feeding",NA,NA,NA,NA,NA,NA,NA,NA,NA,"Macleania rupestris","June","2017","Macleania rupestris",-78.597739,-0.119619,"3376.798","2017-06-12T16:25:14Z",2017-06-12 16:25:14
"913","Verdecocha","12/06/2017","173",NA,NA,NA,NA,NA,NA,NA,NA,NA,NA,NA,"Eriocnemis luciani",NA,"heard",NA,NA,NA,NA,NA,NA,NA,NA,NA,"June","2017",NA,-78.597224,-0.117518,"3377.971","2017-06-12T17:49:45Z",2017-06-12 17:49:45
"914","Verdecocha","12/06/2017","179",NA,NA,NA,NA,NA,NA,NA,NA,NA,NA,NA,"Eriocnemis luciani","perch","more tha 3 min",NA,NA,NA,NA,NA,NA,NA,NA,NA,"June","2017",NA,-78.597298,-0.11674,"3395.637","2017-06-12T18:01:37Z",2017-06-12 18:01:37
"915","Verdecocha","12/06/2017","188","Thibaudia floribunda","Thibaudia floribunda","5","DC",47,NA,NA,NA,NA,NA,NA,"Metallura tyrianthina","feeding",NA,NA,NA,NA,NA,NA,NA,NA,NA,"Thibaudia floribunda","June","2017","Thibaudia floribunda",-78.597793,-0.115693,"3403.925","2017-06-12T18:23:05Z",2017-06-12 18:23:05
"916","Verdecocha","12/06/2017","190","Gaultheria sp. 3","Clethra ovalifolia","2","ES",352,"44","4",14,"6",13,5,"Metallura tyrianthina","feeding","flor muy peque√±a color crema","yes",NA,NA,NA,NA,NA,NA,NA,"Clethra ovalifolia","June","2017","Clethra ovalifolia",-78.597934,-0.115191,"3418.807","2017-06-12T18:33:24Z",2017-06-12 18:33:24
"917","Verdecocha","11/07/2017","447",NA,NA,NA,NA,NA,NA,NA,NA,NA,NA,NA,"Metallura tyrianthina","heard",NA,NA,NA,NA,NA,NA,NA,NA,NA,NA,"July","2017",NA,-78.597597,-0.116141,"3399.088","2018-07-09T17:20:25Z",2018-07-09 17:20:25
"918","Verdecocha","11/07/2017","450",NA,NA,NA,NA,NA,NA,NA,NA,NA,NA,NA,"Metallura tyrianthina","heard",NA,NA,NA,NA,NA,NA,NA,NA,NA,NA,"July","2017",NA,-78.597826,-0.115661,"3402.949","2018-07-09T17:28:08Z",2018-07-09 17:28:08
"919","Verdecocha","11/07/2017","450",NA,NA,NA,NA,NA,NA,NA,NA,NA,NA,NA,"Ramphomicron microrhynchum","heard",NA,NA,NA,NA,NA,NA,NA,NA,NA,NA,"July","2017",NA,-78.597826,-0.115661,"3402.949","2018-07-09T17:28:08Z",2018-07-09 17:28:08
"920","Verdecocha","11/07/2017","451","Axinaea sp. 1","Miconia corymbiformis","8","DC",5,NA,NA,NA,NA,NA,NA,"Metallura tyrianthina","feeding",NA,NA,NA,NA,NA,NA,NA,NA,NA,"Miconia corymbiformis","July","2017","Miconia corymbiformis",-78.597843,-0.11551,"3402.588","2018-07-09T17:30:15Z",2018-07-09 17:30:15
"921","Verdecocha","11/07/2017","468","Guzmania sp. 1","Guzmania bakeri","7","DC",6,NA,NA,NA,NA,NA,NA,"Eriocnemis luciani","feeding","from 6 flowers (flying and perching)",NA,NA,NA,NA,NA,NA,NA,NA,"Guzmania bakeri","July","2017","Guzmania bakeri",-78.596765,-0.122636,"3398.812","2017-07-11T14:08:51Z",2017-07-11 14:08:51
"922","Verdecocha","11/07/2017","470",NA,NA,NA,NA,NA,NA,NA,NA,NA,NA,NA,"Metallura tyrianthina","heard",NA,NA,NA,NA,NA,NA,NA,NA,NA,NA,"July","2017",NA,-78.596943,-0.122569,"3398.749","2017-07-11T14:16:39Z",2017-07-11 14:16:39
"923","Verdecocha","11/07/2017","475",NA,NA,NA,NA,NA,NA,NA,NA,NA,NA,NA,"Metallura tyrianthina","heard","2 ind",NA,NA,NA,NA,NA,NA,NA,NA,NA,"July","2017",NA,-78.597407,-0.122143,"3417.211","2017-07-11T14:41:20Z",2017-07-11 14:41:20
"924","Verdecocha","11/07/2017","490",NA,NA,NA,NA,NA,NA,NA,NA,NA,NA,NA,"Eriocnemis luciani","heard",NA,NA,NA,NA,NA,NA,NA,NA,NA,NA,"July","2017",NA,-78.597726,-0.120325,"3382.165","2017-07-11T15:31:44Z",2017-07-11 15:31:44
"925","Verdecocha","11/07/2017","490",NA,NA,NA,NA,NA,NA,NA,NA,NA,NA,NA,"Metallura tyrianthina","heard",NA,NA,NA,NA,NA,NA,NA,NA,NA,NA,"July","2017",NA,-78.597726,-0.120325,"3382.165","2017-07-11T15:31:44Z",2017-07-11 15:31:44
"926","Verdecocha","11/07/2017","516",NA,NA,NA,NA,NA,NA,NA,NA,NA,NA,NA,"Metallura tyrianthina","perching","1 minute, male",NA,NA,NA,NA,NA,NA,NA,NA,NA,"July","2017",NA,-78.597408,-0.118232,"3379.511","2017-07-11T17:00:28Z",2017-07-11 17:00:28
"927","Verdecocha","11/07/2017","520",NA,NA,NA,NA,NA,NA,NA,NA,NA,NA,NA,"Metallura tyrianthina","perching","5 sec",NA,NA,NA,NA,NA,NA,NA,NA,NA,"July","2017",NA,-78.597325,-0.117843,"3380.236","2017-07-11T17:15:34Z",2017-07-11 17:15:34
"928","Verdecocha","11/07/2017","525",NA,NA,NA,NA,NA,NA,NA,NA,NA,NA,NA,"Eriocnemis luciani","heard",NA,NA,NA,NA,NA,NA,NA,NA,NA,NA,"July","2017",NA,-78.597232,-0.117494,"3377.167","2017-07-11T17:27:00Z",2017-07-11 17:27:00
"929","Verdecocha","10/08/2017","652",NA,NA,NA,NA,NA,NA,NA,NA,NA,NA,NA,"Ramphomicron microrhynchum","heard",NA,NA,NA,NA,NA,NA,NA,NA,NA,NA,"August","2017",NA,-78.595037,-0.124772,"3454.120","2017-08-10T13:21:20Z",2017-08-10 13:21:20
"930","Verdecocha","10/08/2017","654",NA,NA,NA,NA,NA,NA,NA,NA,NA,NA,NA,"Ramphomicron microrhynchum","insects","male searches on a dried Bromeliad",NA,NA,NA,NA,NA,NA,NA,NA,NA,"August","2017",NA,-78.595143,-0.124386,"3441.780","2017-08-10T13:26:30Z",2017-08-10 13:26:30
"931","Verdecocha","10/08/2017","655","Axinaea sp. 1","Miconia corymbiformis","7","DC",14,NA,NA,NA,NA,NA,NA,"Ramphomicron microrhynchum","feeding",NA,NA,NA,NA,NA,NA,NA,NA,NA,"Miconia corymbiformis","August","2017","Miconia corymbiformis",-78.595194,-0.12428,"3433.444","2017-08-10T13:30:11Z",2017-08-10 13:30:11
"932","Verdecocha","10/08/2017","655","Salvia pichinchensis","Salvia pichinchensis","2","DC",10,NA,NA,NA,NA,NA,NA,"Lafresnaya lafresnayi","feeding","female",NA,NA,NA,NA,NA,NA,NA,NA,"Salvia pichinchensis","August","2017","Salvia pichinchensis",-78.595194,-0.12428,"3433.444","2017-08-10T13:30:11Z",2017-08-10 13:30:11
"933","Verdecocha","10/08/2017","677","Thibaudia floribunda","Thibaudia floribunda","4","DC",83,NA,NA,NA,NA,NA,NA,"Metallura tyrianthina","feeding",NA,NA,NA,NA,NA,NA,NA,NA,NA,"Thibaudia floribunda","August","2017","Thibaudia floribunda",-78.597174,-0.122343,"3414.284","2017-08-10T14:41:49Z",2017-08-10 14:41:49
"934","Verdecocha","10/08/2017","677",NA,NA,NA,NA,NA,NA,NA,NA,NA,NA,NA,"Eriocnemis luciani","heard",NA,NA,NA,NA,NA,NA,NA,NA,NA,NA,"August","2017",NA,-78.597174,-0.122343,"3414.284","2017-08-10T14:41:49Z",2017-08-10 14:41:49
"935","Verdecocha","10/08/2017","677",NA,NA,NA,NA,NA,NA,NA,NA,NA,NA,NA,"Metallura tyrianthina","heard",NA,NA,NA,NA,NA,NA,NA,NA,NA,NA,"August","2017",NA,-78.597174,-0.122343,"3414.284","2017-08-10T14:41:49Z",2017-08-10 14:41:49
"936","Verdecocha","10/08/2017","678","Racinaea tetrantha","Racinaea tetrantha","5","DC",13,NA,NA,NA,NA,NA,NA,"Metallura tyrianthina","feeding",NA,NA,NA,NA,NA,NA,NA,NA,NA,"Racinaea tetrantha","August","2017","Racinaea tetrantha",-78.597248,-0.122299,"3417.785","2017-08-10T14:45:20Z",2017-08-10 14:45:20
"937","Verdecocha","10/08/2017","679","Thibaudia floribunda","Thibaudia floribunda","3","DC",159,NA,NA,NA,NA,NA,NA,"Metallura tyrianthina","perching","female",NA,NA,NA,NA,NA,NA,NA,NA,"Thibaudia floribunda","August","2017","Thibaudia floribunda",-78.597291,-0.122321,"3419.186","2017-08-10T14:47:03Z",2017-08-10 14:47:03
"938","Verdecocha","10/08/2017","703",NA,NA,NA,NA,NA,NA,NA,NA,NA,NA,NA,"Metallura tyrianthina","heard",NA,NA,NA,NA,NA,NA,NA,NA,NA,NA,"August","2017",NA,-78.597663,-0.119757,"3378.212","2017-08-10T16:15:34Z",2017-08-10 16:15:34
"939","Verdecocha","10/08/2017","713","Racinaea tetrantha","Racinaea tetrantha","9","DC",13,NA,NA,NA,NA,NA,NA,"Metallura tyrianthina","feeding",NA,NA,NA,NA,NA,NA,NA,NA,NA,"Racinaea tetrantha","August","2017","Racinaea tetrantha",-78.597596,-0.11888,"3376.666","2017-08-10T16:46:51Z",2017-08-10 16:46:51
"940","Verdecocha","10/08/2017","713",NA,NA,NA,NA,NA,NA,NA,NA,NA,NA,NA,"Eriocnemis luciani","perching",NA,NA,NA,NA,NA,NA,NA,NA,NA,NA,"August","2017",NA,-78.597596,-0.11888,"3376.666","2017-08-10T16:46:51Z",2017-08-10 16:46:51
"941","Verdecocha","10/08/2017","715","Palicourea fuchsioides","Palicourea fuchsioides","2","DC",52,NA,NA,NA,NA,NA,NA,"Eriocnemis nigrivestis","feeding","male",NA,NA,NA,NA,NA,NA,NA,NA,"Palicourea fuchsioides","August","2017","Palicourea fuchsioides",-78.597572,-0.118711,"3377.566","2017-08-10T16:53:05Z",2017-08-10 16:53:05
"942","Verdecocha","10/08/2017","718",NA,NA,NA,NA,NA,NA,NA,NA,NA,NA,NA,"Metallura tyrianthina","flying",NA,NA,NA,NA,NA,NA,NA,NA,NA,NA,"August","2017",NA,-78.597502,-0.118551,"3377.248","2017-08-10T17:00:46Z",2017-08-10 17:00:46
"943","Verdecocha","10/08/2017","723","Racinaea tetrantha","Racinaea tetrantha","6","DC",3,NA,NA,NA,NA,NA,NA,"Metallura tyrianthina","feeding",NA,NA,NA,NA,NA,NA,NA,NA,NA,"Racinaea tetrantha","August","2017","Racinaea tetrantha",-78.597321,-0.118052,"3380.888","2017-08-10T17:20:13Z",2017-08-10 17:20:13
"944","Verdecocha","10/08/2017","728","Racinaea tetrantha","Racinaea tetrantha","4","DC",3,NA,NA,NA,NA,NA,NA,"Metallura tyrianthina","heard",NA,NA,NA,NA,NA,NA,NA,NA,NA,"Racinaea tetrantha","August","2017","Racinaea tetrantha",-78.59724,-0.117652,"3379.390","2017-08-10T17:30:30Z",2017-08-10 17:30:30
"945","Verdecocha","10/08/2017","734",NA,NA,NA,NA,NA,NA,NA,NA,NA,NA,NA,"Eriocnemis luciani",NA,"female",NA,NA,NA,NA,NA,NA,NA,NA,NA,"August","2017",NA,-78.597314,-0.116929,"3391.524","2017-08-10T17:47:32Z",2017-08-10 17:47:32
"946","Verdecocha","10/08/2017","735","Racinaea tetrantha","Racinaea tetrantha","2","DC",5,NA,NA,NA,NA,NA,NA,"Metallura tyrianthina","heard",NA,NA,NA,NA,NA,NA,NA,NA,NA,"Racinaea tetrantha","August","2017","Racinaea tetrantha",-78.597318,-0.116806,"3398.996","2017-08-10T17:50:45Z",2017-08-10 17:50:45
"947","Verdecocha","10/08/2017","741",NA,NA,NA,NA,NA,NA,NA,NA,NA,NA,NA,"Metallura tyrianthina","heard",NA,NA,NA,NA,NA,NA,NA,NA,NA,NA,"August","2017",NA,-78.597562,-0.116227,"3402.999","2017-08-10T18:03:09Z",2017-08-10 18:03:09
"948","Verdecocha","10/08/2017","742",NA,NA,NA,NA,NA,NA,NA,NA,NA,NA,NA,"Eriocnemis luciani","heard",NA,NA,NA,NA,NA,NA,NA,NA,NA,NA,"August","2017",NA,-78.597717,-0.11595,"3405.511","2017-08-10T18:08:23Z",2017-08-10 18:08:23
"949","Verdecocha","10/08/2017","750","Guzmania sp. 1","Guzmania bakeri","2","DC",10,NA,NA,NA,NA,NA,NA,"Metallura tyrianthina","feeding",NA,NA,NA,NA,NA,NA,NA,NA,NA,"Guzmania bakeri","August","2017","Guzmania bakeri",-78.59805,-0.115085,"3428.236","2017-08-10T18:40:22Z",2017-08-10 18:40:22
"950","Verdecocha","06/09/2017","1",NA,NA,NA,NA,NA,NA,NA,NA,NA,NA,NA,"Metallura tyrianthina","heard",NA,NA,NA,NA,NA,NA,NA,NA,NA,NA,"September","2017",NA,-78.595008,-0.125202,"3448.322","2017-09-06T12:58:44Z",2017-09-06 12:58:44
"951","Verdecocha","06/09/2017","1",NA,NA,NA,NA,NA,NA,NA,NA,NA,NA,NA,"Ramphomicron microrhynchum","heard",NA,NA,NA,NA,NA,NA,NA,NA,NA,NA,"September","2017",NA,-78.595008,-0.125202,"3448.322","2017-09-06T12:58:44Z",2017-09-06 12:58:44
"952","Verdecocha","06/09/2017","4",NA,NA,NA,NA,NA,NA,NA,NA,NA,NA,NA,"Metallura tyrianthina","heard",NA,NA,NA,NA,NA,NA,NA,NA,NA,NA,"September","2017",NA,-78.594986,-0.124902,"3434.450","2017-09-06T13:22:46Z",2017-09-06 13:22:46
"953","Verdecocha","06/09/2017","7",NA,NA,NA,NA,NA,NA,NA,NA,NA,NA,NA,"Metallura tyrianthina","heard",NA,NA,NA,NA,NA,NA,NA,NA,NA,NA,"September","2017",NA,-78.595117,-0.124309,"3410.799","2017-09-06T13:37:33Z",2017-09-06 13:37:33
"954","Verdecocha","06/09/2017","8","Axinaea sp. 1","Miconia corymbiformis","6","DC",18,NA,NA,NA,NA,NA,NA,"Eriocnemis luciani","feeding",NA,NA,NA,NA,NA,NA,NA,NA,NA,"Miconia corymbiformis","September","2017","Miconia corymbiformis",-78.595138,-0.12423,"3410.474","2017-09-06T13:41:46Z",2017-09-06 13:41:46
"955","Verdecocha","06/09/2017","18",NA,NA,NA,NA,NA,NA,NA,NA,NA,NA,NA,"Metallura tyrianthina","heard",NA,NA,NA,NA,NA,NA,NA,NA,NA,NA,"September","2017",NA,-78.595974,-0.123286,"3417.573","2017-09-06T14:07:24Z",2017-09-06 14:07:24
"956","Verdecocha","06/09/2017","18",NA,NA,NA,NA,NA,NA,NA,NA,NA,NA,NA,"Eriocnemis luciani","heard",NA,NA,NA,NA,NA,NA,NA,NA,NA,NA,"September","2017",NA,-78.595974,-0.123286,"3417.573","2017-09-06T14:07:24Z",2017-09-06 14:07:24
"957","Verdecocha","06/09/2017","20","Heppiella repens","Heppiella repens","6","DC",28,NA,NA,NA,NA,NA,NA,"Metallura tyrianthina","feeding","female",NA,NA,NA,NA,NA,NA,NA,NA,"Heppiella repens","September","2017","Heppiella repens",-78.596073,-0.123134,"3417.076","2017-09-06T14:14:08Z",2017-09-06 14:14:08
"958","Verdecocha","06/09/2017","20",NA,NA,NA,NA,NA,NA,NA,NA,NA,NA,NA,"Coeligena lutetiae","pass by flying","female",NA,NA,NA,NA,NA,NA,NA,NA,NA,"September","2017",NA,-78.596073,-0.123134,"3417.076","2017-09-06T14:14:08Z",2017-09-06 14:14:08
"959","Verdecocha","06/09/2017","24",NA,NA,NA,NA,NA,NA,NA,NA,NA,NA,NA,"Metallura tyrianthina","heard",NA,NA,NA,NA,NA,NA,NA,NA,NA,NA,"September","2017",NA,-78.596312,-0.122844,"3416.429","2017-09-06T14:31:09Z",2017-09-06 14:31:09
"960","Verdecocha","06/09/2017","28",NA,NA,NA,NA,NA,NA,NA,NA,NA,NA,NA,"Eriocnemis luciani","heard",NA,NA,NA,NA,NA,NA,NA,NA,NA,NA,"September","2017",NA,-78.596734,-0.122641,"3408.698","2017-09-06T14:38:26Z",2017-09-06 14:38:26
"961","Verdecocha","06/09/2017","31","Racinaea tetrantha","Racinaea tetrantha","5","DC",21,NA,NA,NA,NA,NA,NA,"Metallura tyrianthina","feeding",NA,NA,NA,NA,NA,NA,NA,NA,NA,"Racinaea tetrantha","September","2017","Racinaea tetrantha",-78.59725,-0.12228,"3406.238","2017-09-06T14:53:17Z",2017-09-06 14:53:17
"962","Verdecocha","06/09/2017","31",NA,NA,NA,NA,NA,NA,NA,NA,NA,NA,NA,"Metallura tyrianthina","heard",NA,NA,NA,NA,NA,NA,NA,NA,NA,NA,"September","2017",NA,-78.59725,-0.12228,"3406.238","2017-09-06T14:53:17Z",2017-09-06 14:53:17
"963","Verdecocha","06/09/2017","46",NA,NA,NA,NA,NA,NA,NA,NA,NA,NA,NA,"Coeligena lutetiae","perching",NA,NA,NA,NA,NA,NA,NA,NA,NA,NA,"September","2017",NA,-78.59769,-0.121063,"3378.873","2017-09-06T15:23:00Z",2017-09-06 15:23:00
"964","Verdecocha","06/09/2017","46",NA,NA,NA,NA,NA,NA,NA,NA,NA,NA,NA,"Metallura tyrianthina","heard","2 ind.",NA,NA,NA,NA,NA,NA,NA,NA,NA,"September","2017",NA,-78.59769,-0.121063,"3378.873","2017-09-06T15:23:00Z",2017-09-06 15:23:00
"965","Verdecocha","06/09/2017","46",NA,NA,NA,NA,NA,NA,NA,NA,NA,NA,NA,"Metallura tyrianthina","perching","female",NA,NA,NA,NA,NA,NA,NA,NA,NA,"September","2017",NA,-78.59769,-0.121063,"3378.873","2017-09-06T15:23:00Z",2017-09-06 15:23:00
"966","Verdecocha","06/09/2017","53",NA,NA,NA,NA,NA,NA,NA,NA,NA,NA,NA,"Coeligena lutetiae","heard","2 ind",NA,NA,NA,NA,NA,NA,NA,NA,NA,"September","2017",NA,-78.59771,-0.120421,"3377.222","2017-09-06T15:38:11Z",2017-09-06 15:38:11
"967","Verdecocha","06/09/2017","73",NA,NA,NA,NA,NA,NA,NA,NA,NA,NA,NA,"Metallura tyrianthina","heard",NA,NA,NA,NA,NA,NA,NA,NA,NA,NA,"September","2017",NA,-78.597601,-0.118872,"3380.767","2017-09-06T16:15:39Z",2017-09-06 16:15:39
"968","Verdecocha","06/09/2017","74",NA,NA,NA,NA,NA,NA,NA,NA,NA,NA,NA,"Metallura tyrianthina","perching",NA,NA,NA,NA,NA,NA,NA,NA,NA,NA,"September","2017",NA,-78.597604,-0.118798,"3379.358","2017-09-06T16:17:57Z",2017-09-06 16:17:57
"969","Verdecocha","06/09/2017","87",NA,NA,NA,NA,NA,NA,NA,NA,NA,NA,NA,"Metallura tyrianthina","heard",NA,NA,NA,NA,NA,NA,NA,NA,NA,NA,"September","2017",NA,-78.597331,-0.117962,"3385.262","2017-09-06T16:56:45Z",2017-09-06 16:56:45
"970","Verdecocha","06/09/2017","93","Thibaudia floribunda","Thibaudia floribunda","6","DC",15,NA,NA,NA,NA,NA,NA,"Metallura tyrianthina","feeding",NA,NA,NA,NA,NA,NA,NA,NA,NA,"Thibaudia floribunda","September","2017","Thibaudia floribunda",-78.597237,-0.117499,"3384.390","2017-09-06T17:08:50Z",2017-09-06 17:08:50
"971","Verdecocha","07/10/2017","308","Axinaea sp. 1","Miconia corymbiformis","7","DC",6,NA,NA,NA,NA,NA,NA,"Eriocnemis luciani","feeding",NA,NA,NA,NA,NA,NA,NA,NA,NA,"Miconia corymbiformis","October","2017","Miconia corymbiformis",-78.594995,-0.125162,"3469.361","2017-10-07T13:26:00Z",2017-10-07 13:26:00
"972","Verdecocha","07/10/2017","311","Miconia sp. 2","Miconia bracteolata","9",NA,NA,"40",NA,NA,NA,NA,NA,"Metallura tyrianthina","heard","2 ind","1223-1226",NA,NA,NA,NA,NA,NA,NA,"Miconia bracteolata","October","2017","Miconia bracteolata",-78.594965,-0.12496,"3452.957","2017-10-07T13:36:03Z",2017-10-07 13:36:03
"973","Verdecocha","07/10/2017","311","Miconia sp. 2","Miconia bracteolata","9",NA,NA,"34",NA,NA,NA,NA,NA,"Ramphomicron microrhynchum","heard","2 ind",NA,NA,NA,NA,NA,NA,NA,NA,"Miconia bracteolata","October","2017","Miconia bracteolata",-78.594965,-0.12496,"3452.957","2017-10-07T13:36:03Z",2017-10-07 13:36:03
"974","Verdecocha","07/10/2017","314",NA,NA,NA,NA,NA,NA,NA,NA,NA,NA,NA,"Coeligena lutetiae","seen",NA,NA,NA,NA,NA,NA,NA,NA,NA,NA,"October","2017",NA,-78.59506,-0.12487,"3435.011","2017-10-07T13:45:15Z",2017-10-07 13:45:15
"975","Verdecocha","07/10/2017","317",NA,NA,NA,NA,NA,NA,NA,NA,NA,NA,NA,"Eriocnemis luciani","heard",NA,NA,NA,NA,NA,NA,NA,NA,NA,NA,"October","2017",NA,-78.595127,-0.124441,"3420.683","2017-10-07T13:52:31Z",2017-10-07 13:52:31
"976","Verdecocha","07/10/2017","317",NA,NA,NA,NA,NA,NA,NA,NA,NA,NA,NA,"Metallura tyrianthina","heard",NA,NA,NA,NA,NA,NA,NA,NA,NA,NA,"October","2017",NA,-78.595127,-0.124441,"3420.683","2017-10-07T13:52:31Z",2017-10-07 13:52:31
"977","Verdecocha","07/10/2017","318","Miconia sp. 2","Miconia bracteolata","8",NA,NA,"4",NA,NA,NA,NA,NA,"Ramphomicron microrhynchum",NA,NA,NA,NA,NA,NA,NA,NA,NA,NA,"Miconia bracteolata","October","2017","Miconia bracteolata",-78.595144,-0.124271,"3413.602","2017-10-07T13:56:17Z",2017-10-07 13:56:17
"978","Verdecocha","07/10/2017","321",NA,NA,NA,NA,NA,NA,NA,NA,NA,NA,NA,"Metallura tyrianthina","heard","2 ind",NA,NA,NA,NA,NA,NA,NA,NA,NA,"October","2017",NA,-78.595187,-0.124057,"3414.721","2017-10-07T14:06:37Z",2017-10-07 14:06:37
"979","Verdecocha","07/10/2017","322","Miconia sp. 2","Miconia bracteolata","7",NA,NA,"19",NA,NA,NA,NA,NA,"Ramphomicron microrhynchum","heard",NA,NA,NA,NA,NA,NA,NA,NA,NA,"Miconia bracteolata","October","2017","Miconia bracteolata",-78.595217,-0.123993,"3415.076","2017-10-07T14:12:17Z",2017-10-07 14:12:17
"980","Verdecocha","07/10/2017","325",NA,NA,NA,NA,NA,NA,NA,NA,NA,NA,NA,"Eriocnemis luciani","perching",NA,NA,NA,NA,NA,NA,NA,NA,NA,NA,"October","2017",NA,-78.595637,-0.123537,"3419.268","2017-10-07T14:23:21Z",2017-10-07 14:23:21
"981","Verdecocha","07/10/2017","329",NA,NA,NA,NA,NA,NA,NA,NA,NA,NA,NA,"Metallura tyrianthina","feeding",NA,NA,NA,NA,NA,NA,NA,NA,NA,NA,"October","2017",NA,-78.596001,-0.123232,"3424.455","2017-10-07T14:33:38Z",2017-10-07 14:33:38
"982","Verdecocha","07/10/2017","330","Racinaea tetrantha","Racinaea tetrantha","6","DC",6,NA,NA,NA,NA,NA,NA,"Eriocnemis luciani","feeding",NA,NA,NA,NA,NA,NA,NA,NA,NA,"Racinaea tetrantha","October","2017","Racinaea tetrantha",-78.596065,-0.123169,"3426.553","2017-10-07T14:36:16Z",2017-10-07 14:36:16
"983","Verdecocha","07/10/2017","330","Schefflera sp. 1",NA,"8",NA,NA,"3",NA,NA,NA,NA,NA,"Metallura tyrianthina","feeding","3 pi√±as",NA,NA,NA,NA,NA,NA,NA,NA,"Schefflera sp1","October","2017","Schefflera sp1",-78.596065,-0.123169,"3426.553","2017-10-07T14:36:16Z",2017-10-07 14:36:16
"984","Verdecocha","07/10/2017","330",NA,NA,NA,NA,NA,NA,NA,NA,NA,NA,NA,"Metallura tyrianthina","heard",NA,NA,NA,NA,NA,NA,NA,NA,NA,NA,"October","2017",NA,-78.596065,-0.123169,"3426.553","2017-10-07T14:36:16Z",2017-10-07 14:36:16
"985","Verdecocha","07/10/2017","337",NA,NA,NA,NA,NA,NA,NA,NA,NA,NA,NA,"Eriocnemis luciani","heard",NA,NA,NA,NA,NA,NA,NA,NA,NA,NA,"October","2017",NA,-78.596619,-0.122769,"3426.613","2017-10-07T14:57:43Z",2017-10-07 14:57:43
"986","Verdecocha","07/10/2017","338","Miconia sp. 2","Miconia bracteolata","7",NA,NA,"5",NA,NA,NA,NA,NA,"Ramphomicron microrhynchum","heard",NA,NA,NA,NA,NA,NA,NA,NA,NA,"Miconia bracteolata","October","2017","Miconia bracteolata",-78.59673,-0.122638,"3425.529","2017-10-07T15:02:16Z",2017-10-07 15:02:16
"987","Verdecocha","07/10/2017","339",NA,NA,NA,NA,NA,NA,NA,NA,NA,NA,NA,"Eriocnemis luciani","heard",NA,NA,NA,NA,NA,NA,NA,NA,NA,NA,"October","2017",NA,-78.596867,-0.122536,"3420.485","2017-10-07T15:10:26Z",2017-10-07 15:10:26
"988","Verdecocha","07/10/2017","340","Racinaea tetrantha","Racinaea tetrantha","5","DC",32,NA,NA,NA,NA,NA,NA,"Eriocnemis luciani","feeding","10 sec",NA,NA,NA,NA,NA,NA,NA,NA,"Racinaea tetrantha","October","2017","Racinaea tetrantha",-78.596849,-0.122607,"3420.725","2017-10-07T15:14:00Z",2017-10-07 15:14:00
"989","Verdecocha","07/10/2017","345","Racinaea tetrantha","Racinaea tetrantha","9","DC",12,NA,NA,NA,NA,NA,NA,"Eriocnemis luciani","feeding",NA,NA,NA,NA,NA,NA,NA,NA,NA,"Racinaea tetrantha","October","2017","Racinaea tetrantha",-78.597342,-0.122178,"3429.376","2017-10-07T15:30:47Z",2017-10-07 15:30:47
"990","Verdecocha","07/10/2017","345",NA,NA,NA,NA,NA,NA,NA,NA,NA,NA,NA,"Metallura tyrianthina","heard",NA,NA,NA,NA,NA,NA,NA,NA,NA,NA,"October","2017",NA,-78.597342,-0.122178,"3429.376","2017-10-07T15:30:47Z",2017-10-07 15:30:47
"991","Verdecocha","07/10/2017","350","Racinaea tetrantha","Racinaea tetrantha","6","DC",2,NA,NA,NA,NA,NA,NA,"Metallura tyrianthina","feeding",NA,NA,NA,NA,NA,NA,NA,NA,NA,"Racinaea tetrantha","October","2017","Racinaea tetrantha",-78.597515,-0.121817,"3423.603","2017-10-07T15:43:39Z",2017-10-07 15:43:39
"992","Verdecocha","07/10/2017","369","Racinaea tetrantha","Racinaea tetrantha","8","DC",24,NA,NA,NA,NA,NA,NA,"Eriocnemis luciani","feeding",NA,NA,NA,NA,NA,NA,NA,NA,NA,"Racinaea tetrantha","October","2017","Racinaea tetrantha",-78.597715,-0.120393,"3389.345","2017-10-07T16:15:40Z",2017-10-07 16:15:40
"993","Verdecocha","07/10/2017","377","Thibaudia floribunda","Thibaudia floribunda","1","DC",9,NA,NA,NA,NA,NA,NA,"Metallura tyrianthina","feeding",NA,NA,NA,NA,NA,NA,NA,NA,NA,"Thibaudia floribunda","October","2017","Thibaudia floribunda",-78.597678,-0.119746,"3389.216","2017-10-07T16:31:54Z",2017-10-07 16:31:54
"994","Verdecocha","07/10/2017","384","Bomarea sp. 1","Bomarea patacocensis","3","DC",26,NA,NA,NA,NA,NA,NA,"Coeligena lutetiae","feeding","Bomarea multiflora?",NA,NA,NA,NA,NA,NA,NA,NA,"Bomarea patacocensis","October","2017","Bomarea patacocensis",-78.597681,-0.119149,"3388.253","2017-10-07T16:45:00Z",2017-10-07 16:45:00
"995","Verdecocha","07/10/2017","392",NA,NA,NA,NA,NA,NA,NA,NA,NA,NA,NA,"Metallura tyrianthina","heard",NA,NA,NA,NA,NA,NA,NA,NA,NA,NA,"October","2017",NA,-78.597459,-0.118471,"3391.201","2017-10-07T17:04:15Z",2017-10-07 17:04:15
"996","Verdecocha","07/10/2017","397","Gaiadendrum sp. 1","Gaiadendron punctatum","2",NA,320,"20","13",18,"25",9,15,"Metallura tyrianthina","feeding","flores otros racimos; 25, 36, 47, 57, 53, 23",NA,NA,NA,NA,NA,NA,NA,NA,"Gaiadendron punctatum","October","2017","Gaiadendron punctatum",-78.597304,-0.118028,"3393.989","2017-10-07T17:11:28Z",2017-10-07 17:11:28
"997","Verdecocha","07/10/2017","399",NA,NA,NA,NA,NA,NA,NA,NA,NA,NA,NA,"Metallura tyrianthina","insects",NA,NA,NA,NA,NA,NA,NA,NA,NA,NA,"October","2017",NA,-78.597313,-0.117805,"3394.500","2017-10-07T17:31:36Z",2017-10-07 17:31:36
"998","Verdecocha","07/10/2017","409",NA,NA,NA,NA,NA,NA,NA,NA,NA,NA,NA,"Eriocnemis luciani","heard",NA,NA,NA,NA,NA,NA,NA,NA,NA,NA,"October","2017",NA,-78.597401,-0.116606,"3413.044","2017-10-07T17:51:37Z",2017-10-07 17:51:37
"999","Verdecocha","07/10/2017","421","Palicourea fuchsioides","Palicourea fuchsioides","2","DC",9,NA,NA,NA,NA,NA,NA,"Metallura tyrianthina",NA,"2 ind",NA,NA,NA,NA,NA,NA,NA,NA,"Palicourea fuchsioides","October","2017","Palicourea fuchsioides",-78.598006,-0.115197,"3432.474","2017-10-07T18:13:42Z",2017-10-07 18:13:42
"1000","Verdecocha","07/11/2017","3",NA,NA,NA,NA,NA,NA,NA,NA,NA,NA,NA,"Coeligena lutetiae","heard",NA,NA,NA,NA,NA,NA,NA,NA,NA,NA,"November","2017",NA,-78.595284,-0.12589,"3304.166","2017-11-07T13:16:33Z",2017-11-07 13:16:33
"1001","Verdecocha","07/11/2017","4","Columnea dielsii","Columnea dielsii","4","DC",11,NA,NA,NA,NA,NA,NA,"Coeligena lutetiae","feeding",NA,NA,NA,NA,NA,NA,NA,NA,NA,"Columnea dielsii","November","2017","Columnea dielsii",-78.595478,-0.126197,"3298.102","2017-11-07T13:20:15Z",2017-11-07 13:20:15
"1002","Verdecocha","07/11/2017","4","Columnea dielsii","Columnea dielsii","5","DC",5,NA,NA,NA,NA,NA,NA,"Coeligena lutetiae","feeding",NA,NA,NA,NA,NA,NA,NA,NA,NA,"Columnea dielsii","November","2017","Columnea dielsii",-78.595478,-0.126197,"3298.102","2017-11-07T13:20:15Z",2017-11-07 13:20:15
"1003","Verdecocha","07/11/2017","6",NA,NA,NA,NA,NA,NA,NA,NA,NA,NA,NA,"Metallura tyrianthina","heard","3 ind",NA,NA,NA,NA,NA,NA,NA,NA,NA,"November","2017",NA,-78.595128,-0.124561,"3284.815","2017-11-07T13:28:03Z",2017-11-07 13:28:03
"1004","Verdecocha","07/11/2017","12",NA,NA,NA,NA,NA,NA,NA,NA,NA,NA,NA,"Eriocnemis luciani","heard",NA,NA,NA,NA,NA,NA,NA,NA,NA,NA,"November","2017",NA,-78.595335,-0.123832,"3347.902","2017-11-07T13:46:27Z",2017-11-07 13:46:27
"1005","Verdecocha","07/11/2017","12",NA,NA,NA,NA,NA,NA,NA,NA,NA,NA,NA,"Metallura tyrianthina","heard",NA,NA,NA,NA,NA,NA,NA,NA,NA,NA,"November","2017",NA,-78.595335,-0.123832,"3347.902","2017-11-07T13:46:27Z",2017-11-07 13:46:27
"1006","Verdecocha","07/11/2017","16",NA,NA,NA,NA,NA,NA,NA,NA,NA,NA,NA,"Metallura tyrianthina","flying",NA,NA,NA,NA,NA,NA,NA,NA,NA,NA,"November","2017",NA,-78.596071,-0.12313,"3388.261","2017-11-07T14:05:23Z",2017-11-07 14:05:23
"1007","Verdecocha","07/11/2017","26",NA,NA,NA,NA,NA,NA,NA,NA,NA,NA,NA,"Eriocnemis luciani","heard",NA,NA,NA,NA,NA,NA,NA,NA,NA,NA,"November","2017",NA,-78.597098,-0.122411,"3399.788","2017-11-07T14:34:34Z",2017-11-07 14:34:34
"1008","Verdecocha","07/11/2017","37",NA,NA,NA,NA,NA,NA,NA,NA,NA,NA,NA,"Metallura tyrianthina","flying",NA,NA,NA,NA,NA,NA,NA,NA,NA,NA,"November","2017",NA,-78.597662,-0.1214,"3395.394","2017-11-07T14:58:03Z",2017-11-07 14:58:03
"1009","Verdecocha","07/11/2017","47",NA,NA,NA,NA,NA,NA,NA,NA,NA,NA,NA,"Metallura tyrianthina","heard",NA,NA,NA,NA,NA,NA,NA,NA,NA,NA,"November","2017",NA,-78.59764,-0.120066,"3382.790","2017-11-07T15:30:37Z",2017-11-07 15:30:37
"1010","Verdecocha","07/11/2017","49",NA,NA,NA,NA,NA,NA,NA,NA,NA,NA,NA,"Metallura tyrianthina","feeding insects",NA,NA,NA,NA,NA,NA,NA,NA,NA,NA,"November","2017",NA,-78.59766,-0.119881,"3384.943","2017-11-07T15:35:01Z",2017-11-07 15:35:01
"1011","Verdecocha","07/11/2017","54",NA,NA,NA,NA,NA,NA,NA,NA,NA,NA,NA,"Metallura tyrianthina","heard",NA,NA,NA,NA,NA,NA,NA,NA,NA,NA,"November","2017",NA,-78.597667,-0.119271,"3381.948","2017-11-07T15:48:25Z",2017-11-07 15:48:25
"1012","Verdecocha","07/11/2017","59",NA,NA,NA,NA,NA,NA,NA,NA,NA,NA,NA,"Metallura tyrianthina","heard",NA,NA,NA,NA,NA,NA,NA,NA,NA,NA,"November","2017",NA,-78.597484,-0.118561,"3383.869","2017-11-07T16:03:09Z",2017-11-07 16:03:09
"1013","Verdecocha","07/11/2017","65","Gaiadendrum sp. 1","Gaiadendron punctatum","2","ES",411,"13","27",22,"38",40,31,"Metallura tyrianthina",NA,NA,NA,NA,NA,NA,NA,NA,NA,NA,"Gaiadendron punctatum","November","2017","Gaiadendron punctatum",-78.597283,-0.118028,"3383.784","2017-11-07T16:11:24Z",2017-11-07 16:11:24
"1014","Verdecocha","07/11/2017","71",NA,NA,NA,NA,NA,NA,NA,NA,NA,NA,NA,"Metallura tyrianthina","heard",NA,NA,NA,NA,NA,NA,NA,NA,NA,NA,"November","2017",NA,-78.597187,-0.117295,"3388.356","2017-11-07T16:27:41Z",2017-11-07 16:27:41
"1015","Verdecocha","07/11/2017","87","Macleania rupestris","Macleania rupestris","4","DC",4,NA,NA,NA,NA,NA,NA,"Eriocnemis luciani","feeding",NA,NA,NA,NA,NA,NA,NA,NA,NA,"Macleania rupestris","November","2017","Macleania rupestris",-78.597819,-0.115525,"3409.192","2017-11-07T16:56:30Z",2017-11-07 16:56:30
"1016","Verdecocha","07/11/2017","87",NA,NA,NA,NA,NA,NA,NA,NA,NA,NA,NA,"Metallura tyrianthina","heard",NA,NA,NA,NA,NA,NA,NA,NA,NA,NA,"November","2017",NA,-78.597819,-0.115525,"3409.192","2017-11-07T16:56:30Z",2017-11-07 16:56:30
"1017","Verdecocha","10/12/2017","485",NA,NA,NA,NA,NA,NA,NA,NA,NA,NA,NA,"Metallura tyrianthina","heard",NA,NA,NA,NA,NA,NA,NA,NA,NA,NA,"December","2017",NA,-78.595096,-0.124389,"3431.860","2017-12-10T13:44:53Z",2017-12-10 13:44:53
"1018","Verdecocha","10/12/2017","485",NA,NA,NA,NA,NA,NA,NA,NA,NA,NA,NA,"Coeligena lutetiae","heard","2 ind",NA,NA,NA,NA,NA,NA,NA,NA,NA,"December","2017",NA,-78.595096,-0.124389,"3431.860","2017-12-10T13:44:53Z",2017-12-10 13:44:53
"1019","Verdecocha","10/12/2017","494","Axinaea sp. 1","Miconia corymbiformis","6","DC",18,NA,NA,NA,NA,NA,NA,"Metallura tyrianthina","feeding",NA,NA,NA,NA,NA,NA,NA,NA,NA,"Miconia corymbiformis","December","2017","Miconia corymbiformis",-78.596046,-0.123132,"3431.302","2017-12-10T14:06:08Z",2017-12-10 14:06:08
"1020","Verdecocha","10/12/2017","496",NA,NA,NA,NA,NA,NA,NA,NA,NA,NA,NA,"Metallura tyrianthina","heard",NA,NA,NA,NA,NA,NA,NA,NA,NA,NA,"December","2017",NA,-78.596279,-0.122887,"3429.970","2017-12-10T14:12:53Z",2017-12-10 14:12:53
"1021","Verdecocha","10/12/2017","496",NA,NA,NA,NA,NA,NA,NA,NA,NA,NA,NA,"Eriocnemis luciani","heard",NA,NA,NA,NA,NA,NA,NA,NA,NA,NA,"December","2017",NA,-78.596279,-0.122887,"3429.970","2017-12-10T14:12:53Z",2017-12-10 14:12:53
"1022","Verdecocha","10/12/2017","499",NA,NA,NA,NA,NA,NA,NA,NA,NA,NA,NA,"Eriocnemis luciani","heard",NA,NA,NA,NA,NA,NA,NA,NA,NA,NA,"December","2017",NA,-78.596699,-0.12266,"3422.412","2017-12-10T14:21:15Z",2017-12-10 14:21:15
"1023","Verdecocha","10/12/2017","502","Axinaea sp. 1","Miconia corymbiformis","7","DC",4,NA,NA,NA,NA,NA,NA,"Eriocnemis luciani","feeding",NA,NA,NA,NA,NA,NA,NA,NA,NA,"Miconia corymbiformis","December","2017","Miconia corymbiformis",-78.596957,-0.122505,"3414.438","2017-12-10T14:31:18Z",2017-12-10 14:31:18
"1024","Verdecocha","10/12/2017","513",NA,NA,NA,NA,NA,NA,NA,NA,NA,NA,NA,"Eriocnemis luciani","heard",NA,NA,NA,NA,NA,NA,NA,NA,NA,NA,"December","2017",NA,-78.597703,-0.121239,"3392.500","2017-12-10T14:55:51Z",2017-12-10 14:55:51
"1025","Verdecocha","10/12/2017","525",NA,NA,NA,NA,NA,NA,NA,NA,NA,NA,NA,"Coeligena lutetiae","heard",NA,NA,NA,NA,NA,NA,NA,NA,NA,NA,"December","2017",NA,-78.597764,-0.119569,"3380.126","2017-12-10T15:21:30Z",2017-12-10 15:21:30
"1026","Verdecocha","10/12/2017","539",NA,NA,NA,NA,NA,NA,NA,NA,NA,NA,NA,"Metallura tyrianthina",NA,"macho",NA,NA,NA,NA,NA,NA,NA,NA,NA,"December","2017",NA,-78.597315,-0.118008,"3381.539","2017-12-10T15:53:48Z",2017-12-10 15:53:48
"1027","Verdecocha","10/12/2017","546","Palicourea amethystina","Palicourea amethystina","4","DC",13,NA,NA,NA,NA,NA,NA,"Eriocnemis luciani","feeding",NA,NA,NA,NA,NA,NA,NA,NA,NA,"Palicourea amethystina","December","2017","Palicourea amethystina",-78.597338,-0.116982,"3385.776","2017-12-10T16:16:25Z",2017-12-10 16:16:25
"1028","Verdecocha","10/12/2017","560",NA,NA,NA,NA,NA,NA,NA,NA,NA,NA,NA,"Metallura tyrianthina","heard",NA,NA,NA,NA,NA,NA,NA,NA,NA,NA,"December","2017",NA,-78.597937,-0.115232,"3410.664","2017-12-10T16:43:48Z",2017-12-10 16:43:48
"1029","Verdecocha","10/12/2017","561","Epidendrum sp. 1","Epidendrum mesogastropodium","4","DC",22,NA,NA,NA,NA,NA,NA,"Metallura tyrianthina","feeding",NA,NA,NA,NA,NA,NA,NA,NA,NA,"Epidendrum mesogastropodium","December","2017","Epidendrum mesogastropodium",-78.597978,-0.11518,"3416.397","2017-12-10T16:46:52Z",2017-12-10 16:46:52
"1030","Verdecocha","10/01/2018","100",NA,NA,NA,NA,NA,NA,NA,NA,NA,NA,NA,"Metallura tyrianthina","heard",NA,NA,NA,NA,NA,NA,NA,NA,NA,NA,"January","2018",NA,-78.595126,-0.12513,"3458.471","2018-01-10T13:19:51Z",2018-01-10 13:19:51
"1031","Verdecocha","10/01/2018","104","Columnea dielsii","Columnea dielsii","3","DC",6,NA,NA,NA,NA,NA,NA,"Coeligena lutetiae","feeding","female",NA,NA,NA,NA,NA,NA,NA,NA,"Columnea dielsii","January","2018","Columnea dielsii",-78.595066,-0.124545,"3428.302","2018-01-10T13:29:35Z",2018-01-10 13:29:35
"1032","Verdecocha","10/01/2018","107",NA,NA,NA,NA,NA,NA,NA,NA,NA,NA,NA,"Coeligena lutetiae","perching",NA,NA,NA,NA,NA,NA,NA,NA,NA,NA,"January","2018",NA,-78.595194,-0.123995,"3421.216","2018-01-10T13:37:29Z",2018-01-10 13:37:29
"1033","Verdecocha","10/01/2018","115","Columnea dielsii","Columnea dielsii","4","DC",38,NA,NA,NA,NA,NA,NA,"Coeligena lutetiae","heard",NA,NA,NA,NA,NA,NA,NA,NA,NA,"Columnea dielsii","January","2018","Columnea dielsii",-78.596196,-0.122982,"3425.236","2018-01-10T14:00:05Z",2018-01-10 14:00:05
"1034","Verdecocha","10/01/2018","123",NA,NA,NA,NA,NA,NA,NA,NA,NA,NA,NA,"Eriocnemis luciani","perching",NA,NA,NA,NA,NA,NA,NA,NA,NA,NA,"January","2018",NA,-78.597016,-0.122467,"3412.430","2018-01-10T14:14:08Z",2018-01-10 14:14:08
"1035","Verdecocha","10/01/2018","132",NA,NA,NA,NA,NA,NA,NA,NA,NA,NA,NA,"Coeligena lutetiae","heard",NA,NA,NA,NA,NA,NA,NA,NA,NA,NA,"January","2018",NA,-78.597739,-0.12121,"3389.557","2018-01-10T14:43:50Z",2018-01-10 14:43:50
"1036","Verdecocha","10/01/2018","137",NA,NA,NA,NA,NA,NA,NA,NA,NA,NA,NA,"Metallura tyrianthina","heard",NA,NA,NA,NA,NA,NA,NA,NA,NA,NA,"January","2018",NA,-78.597653,-0.119735,"3380.400","2018-01-10T15:03:48Z",2018-01-10 15:03:48
"1037","Verdecocha","10/01/2018","139",NA,NA,NA,NA,NA,NA,NA,NA,NA,NA,NA,"Metallura tyrianthina","flying",NA,NA,NA,NA,NA,NA,NA,NA,NA,NA,"January","2018",NA,-78.597783,-0.119547,"3376.022","2018-01-10T15:08:20Z",2018-01-10 15:08:20
"1038","Verdecocha","10/01/2018","140",NA,NA,NA,NA,NA,NA,NA,NA,NA,NA,NA,"Metallura tyrianthina","heard",NA,NA,NA,NA,NA,NA,NA,NA,NA,NA,"January","2018",NA,-78.597733,-0.119371,"3377.625","2018-01-10T15:10:39Z",2018-01-10 15:10:39
"1039","Verdecocha","10/01/2018","149","Disterigma alaternoides","Disterigma noyesiae","5","DC",2,NA,NA,NA,NA,NA,NA,"Metallura tyrianthina","feeding",NA,NA,NA,NA,NA,NA,NA,NA,NA,"Disterigma noyesiae","January","2018","Disterigma noyesiae",-78.597485,-0.118541,"3380.270","2018-01-10T15:36:52Z",2018-01-10 15:36:52
"1040","Verdecocha","10/01/2018","151",NA,NA,NA,NA,NA,NA,NA,NA,NA,NA,NA,"Metallura tyrianthina","perching","female",NA,NA,NA,NA,NA,NA,NA,NA,NA,"January","2018",NA,-78.597467,-0.118407,"3380.430","2018-01-10T15:47:10Z",2018-01-10 15:47:10
"1041","Verdecocha","10/01/2018","156",NA,NA,NA,NA,NA,NA,NA,NA,NA,NA,NA,"Metallura tyrianthina","perching",NA,NA,NA,NA,NA,NA,NA,NA,NA,NA,"January","2018",NA,-78.597314,-0.118064,"3381.489","2018-01-10T15:58:17Z",2018-01-10 15:58:17
"1042","Verdecocha","10/01/2018","180","Disterigma alaternoides","Disterigma noyesiae","5","DC",2,NA,NA,NA,NA,NA,NA,"Metallura tyrianthina","feeding",NA,NA,NA,NA,NA,NA,NA,NA,NA,"Disterigma noyesiae","January","2018","Disterigma noyesiae",-78.59791,-0.115321,"3412.296","2018-01-10T16:52:15Z",2018-01-10 16:52:15
"1043","Verdecocha","05/02/2018","194",NA,NA,NA,NA,NA,NA,NA,NA,NA,NA,NA,"Coeligena lutetiae","flying",NA,NA,NA,NA,NA,NA,NA,NA,NA,NA,"February","2018",NA,-78.595088,-0.124399,"3420.211","2018-02-05T14:02:36Z",2018-02-05 14:02:36
"1044","Verdecocha","05/02/2018","201","Macleania rupestris",NA,"5",NA,10,NA,NA,NA,NA,NA,NA,"Eriocnemis luciani","feeding",NA,NA,NA,NA,NA,NA,NA,NA,NA,"Macleania rupestris","February","2018","Macleania rupestris",-78.595278,-0.12392,"3420.805","2018-02-05T14:12:09Z",2018-02-05 14:12:09
"1045","Verdecocha","05/02/2018","208","Axinaea sp. 1","Miconia corymbiformis","6",NA,4,NA,NA,NA,NA,NA,NA,"Eriocnemis luciani","feeding",NA,NA,NA,NA,NA,NA,NA,NA,NA,"Miconia corymbiformis","February","2018","Miconia corymbiformis",-78.596089,-0.123108,"3424.780","2018-02-05T14:29:45Z",2018-02-05 14:29:45
"1046","Verdecocha","05/02/2018","218","Columnea dielsii","Columnea dielsii","5",NA,3,NA,NA,NA,NA,NA,NA,"Coeligena lutetiae","feeding",NA,NA,NA,NA,NA,NA,NA,NA,NA,"Columnea dielsii","February","2018","Columnea dielsii",-78.597305,-0.12221,"3420.814","2018-02-05T14:58:17Z",2018-02-05 14:58:17
"1047","Verdecocha","05/02/2018","219",NA,NA,NA,NA,NA,NA,NA,NA,NA,NA,NA,"Metallura tyrianthina","seen",NA,NA,NA,NA,NA,NA,NA,NA,NA,NA,"February","2018",NA,-78.59746,-0.12204,"3422.688","2018-02-05T15:02:09Z",2018-02-05 15:02:09
"1048","Verdecocha","05/02/2018","220",NA,NA,NA,NA,NA,NA,NA,NA,NA,NA,NA,"Coeligena lutetiae","heard",NA,NA,NA,NA,NA,NA,NA,NA,NA,NA,"February","2018",NA,-78.597527,-0.121963,"3420.934","2018-02-05T15:04:20Z",2018-02-05 15:04:20
"1049","Verdecocha","05/02/2018","240",NA,NA,NA,NA,NA,NA,NA,NA,NA,NA,NA,"Metallura tyrianthina","flying","male",NA,NA,NA,NA,NA,NA,NA,NA,NA,"February","2018",NA,-78.597802,-0.119429,"3375.396","2018-02-05T15:52:19Z",2018-02-05 15:52:19
"1050","Verdecocha","05/02/2018","244",NA,NA,NA,NA,NA,NA,NA,NA,NA,NA,NA,"Eriocnemis luciani","fighting","2 ind",NA,NA,NA,NA,NA,NA,NA,NA,NA,"February","2018",NA,-78.597703,-0.119014,"3379.623","2018-02-05T16:03:40Z",2018-02-05 16:03:40
"1051","Verdecocha","05/02/2018","250",NA,NA,NA,NA,NA,NA,NA,NA,NA,NA,NA,"Metallura tyrianthina","seen",NA,NA,NA,NA,NA,NA,NA,NA,NA,NA,"February","2018",NA,-78.597625,-0.118715,"3381.344","2018-02-05T16:16:19Z",2018-02-05 16:16:19
"1052","Verdecocha","05/02/2018","251",NA,NA,NA,NA,NA,NA,NA,NA,NA,NA,NA,"Metallura tyrianthina","seen",NA,NA,NA,NA,NA,NA,NA,NA,NA,NA,"February","2018",NA,-78.597566,-0.118619,"3380.825","2018-02-05T16:19:55Z",2018-02-05 16:19:55
"1053","Verdecocha","05/02/2018","252",NA,NA,NA,NA,NA,NA,NA,NA,NA,NA,NA,"Eriocnemis luciani","feeding insects",NA,NA,NA,NA,NA,NA,NA,NA,NA,NA,"February","2018",NA,-78.597549,-0.118574,"3378.521","2018-02-05T16:30:01Z",2018-02-05 16:30:01
"1054","Verdecocha","05/02/2018","257",NA,NA,NA,NA,NA,NA,NA,NA,NA,NA,NA,"Metallura tyrianthina",NA,NA,NA,NA,NA,NA,NA,NA,NA,NA,NA,"February","2018",NA,-78.597463,-0.118231,"3378.077","2018-02-05T16:40:11Z",2018-02-05 16:40:11
"1055","Verdecocha","05/02/2018","261",NA,NA,NA,NA,NA,NA,NA,NA,NA,NA,NA,"Metallura tyrianthina","feeding insects",NA,NA,NA,NA,NA,NA,NA,NA,NA,NA,"February","2018",NA,-78.597352,-0.118003,"3378.879","2018-02-05T16:46:30Z",2018-02-05 16:46:30
"1056","Verdecocha","05/02/2018","280",NA,NA,NA,NA,NA,NA,NA,NA,NA,NA,NA,"Eriocnemis luciani","heard",NA,NA,NA,NA,NA,NA,NA,NA,NA,NA,"February","2018",NA,-78.597437,-0.116468,"3395.823","2018-02-05T17:16:45Z",2018-02-05 17:16:45
"1057","Verdecocha","05/02/2018","285",NA,NA,NA,NA,NA,NA,NA,NA,NA,NA,NA,"Metallura tyrianthina","perching",NA,NA,NA,NA,NA,NA,NA,NA,NA,NA,"February","2018",NA,-78.597724,-0.115983,"3396.596","2018-02-05T17:26:15Z",2018-02-05 17:26:15
"1058","Verdecocha","05/02/2018","289",NA,NA,NA,NA,NA,NA,NA,NA,NA,NA,NA,"Metallura tyrianthina","feeding insects","male",NA,NA,NA,NA,NA,NA,NA,NA,NA,"February","2018",NA,-78.59789,-0.115515,"3403.321","2018-02-05T17:37:08Z",2018-02-05 17:37:08
"1059","Verdecocha","07/03/2018","422",NA,NA,NA,NA,NA,NA,NA,NA,NA,NA,NA,"Eriocnemis luciani","heard",NA,NA,NA,NA,NA,NA,NA,NA,NA,NA,"March","2018",NA,-78.594995,-0.124966,"3292.744","2018-03-07T13:50:34Z",2018-03-07 13:50:34
"1060","Verdecocha","07/03/2018","424",NA,NA,NA,NA,NA,NA,NA,NA,NA,NA,NA,"Coeligena lutetiae","heard",NA,NA,NA,NA,NA,NA,NA,NA,NA,NA,"March","2018",NA,-78.595135,-0.124502,"3307.282","2018-03-07T13:58:08Z",2018-03-07 13:58:08
"1061","Verdecocha","07/03/2018","440",NA,NA,NA,NA,NA,NA,NA,NA,NA,NA,NA,"Eriocnemis luciani","perching",NA,NA,NA,NA,NA,NA,NA,NA,NA,NA,"March","2018",NA,-78.596629,-0.122781,"3391.222","2018-03-07T14:35:29Z",2018-03-07 14:35:29
"1062","Verdecocha","07/03/2018","443",NA,NA,NA,NA,NA,NA,NA,NA,NA,NA,NA,"Eriocnemis luciani","heard",NA,NA,NA,NA,NA,NA,NA,NA,NA,NA,"March","2018",NA,-78.596968,-0.122557,"3387.458","2018-03-07T14:43:38Z",2018-03-07 14:43:38
"1063","Verdecocha","07/03/2018","456",NA,NA,NA,NA,NA,NA,NA,NA,NA,NA,NA,"Eriocnemis luciani","heard",NA,NA,NA,NA,NA,NA,NA,NA,NA,NA,"March","2018",NA,-78.59777,-0.120363,"3375.036","2018-03-07T15:23:55Z",2018-03-07 15:23:55
"1064","Verdecocha","07/03/2018","464",NA,NA,NA,NA,NA,NA,NA,NA,NA,NA,NA,"Metallura tyrianthina","heard",NA,NA,NA,NA,NA,NA,NA,NA,NA,NA,"March","2018",NA,-78.597748,-0.119358,"3372.318","2018-03-07T15:45:33Z",2018-03-07 15:45:33
"1065","Verdecocha","07/03/2018","490",NA,NA,NA,NA,NA,NA,NA,NA,NA,NA,NA,"Eriocnemis luciani","heard",NA,NA,NA,NA,NA,NA,NA,NA,NA,NA,"March","2018",NA,-78.597282,-0.117551,"3376.462","2018-03-07T16:55:50Z",2018-03-07 16:55:50
"1066","Verdecocha","07/03/2018","504",NA,NA,NA,NA,NA,NA,NA,NA,NA,NA,NA,"Eriocnemis luciani","heard",NA,NA,NA,NA,NA,NA,NA,NA,NA,NA,"March","2018",NA,-78.597712,-0.115984,"3400.702","2018-03-07T17:24:25Z",2018-03-07 17:24:25
"1067","Verdecocha","07/03/2018","512",NA,NA,NA,NA,NA,NA,NA,NA,NA,NA,NA,"Metallura tyrianthina","feeding insects",NA,NA,NA,NA,NA,NA,NA,NA,NA,NA,"March","2018",NA,-78.598056,-0.115082,"3424.531","2018-03-07T17:53:41Z",2018-03-07 17:53:41
"1068","Verdecocha","04/04/2018","1908",NA,NA,NA,NA,NA,NA,NA,NA,NA,NA,NA,"Eriocnemis luciani",NA,NA,NA,NA,NA,NA,NA,NA,NA,NA,NA,"April","2018",NA,-78.595012,-0.124976,"3297.948","2018-04-04T13:47:54Z",2018-04-04 13:47:54
"1069","Verdecocha","04/04/2018","1910",NA,NA,NA,NA,NA,NA,NA,NA,NA,NA,NA,"Coeligena lutetiae","heard",NA,NA,NA,NA,NA,NA,NA,NA,NA,NA,"April","2018",NA,-78.595069,-0.124802,"3299.013","2018-04-04T13:50:13Z",2018-04-04 13:50:13
"1070","Verdecocha","04/04/2018","1917",NA,NA,NA,NA,NA,NA,NA,NA,NA,NA,NA,"Eriocnemis luciani","heard",NA,NA,NA,NA,NA,NA,NA,NA,NA,NA,"April","2018",NA,-78.595588,-0.123624,"3353.440","2018-04-04T14:11:30Z",2018-04-04 14:11:30
"1071","Verdecocha","04/04/2018","1924",NA,NA,NA,NA,NA,NA,NA,NA,NA,NA,NA,"Eriocnemis luciani","perching",NA,NA,NA,NA,NA,NA,NA,NA,NA,NA,"April","2018",NA,-78.596441,-0.122802,"3382.877","2018-04-04T14:28:59Z",2018-04-04 14:28:59
"1072","Verdecocha","04/04/2018","1934",NA,NA,NA,NA,NA,NA,NA,NA,NA,NA,NA,"Eriocnemis luciani","heard",NA,NA,NA,NA,NA,NA,NA,NA,NA,NA,"April","2018",NA,-78.597553,-0.12194,"3397.495","2018-04-04T14:52:14Z",2018-04-04 14:52:14
"1073","Verdecocha","04/04/2018","1944","Macleania rupestris","Macleania rupestris","4","DC",3,NA,NA,NA,NA,NA,NA,"Eriocnemis luciani","feeding",NA,NA,NA,NA,NA,NA,NA,NA,NA,"Macleania rupestris","April","2018","Macleania rupestris",-78.597691,-0.120795,"3376.290","2018-04-04T15:16:21Z",2018-04-04 15:16:21
"1074","Verdecocha","04/04/2018","1953","Columnea dielsii","Columnea dielsii","0.5","DC",1,NA,NA,NA,NA,NA,NA,"Coeligena lutetiae","seen",NA,NA,NA,NA,NA,NA,NA,NA,NA,"Columnea dielsii","April","2018","Columnea dielsii",-78.597657,-0.120043,"3374.774","2018-04-04T15:30:50Z",2018-04-04 15:30:50
"1075","Verdecocha","04/04/2018","1957","Macleania rupestris","Macleania rupestris","4","DC",6,NA,NA,NA,NA,NA,NA,"Eriocnemis luciani",NA,NA,NA,NA,NA,NA,NA,NA,NA,NA,"Macleania rupestris","April","2018","Macleania rupestris",-78.597679,-0.11973,"3377.528","2018-04-04T15:36:32Z",2018-04-04 15:36:32
"1076","Verdecocha","04/04/2018","1982",NA,NA,NA,NA,NA,NA,NA,NA,NA,NA,NA,"Metallura tyrianthina","heard",NA,NA,NA,NA,NA,NA,NA,NA,NA,NA,"April","2018",NA,-78.597336,-0.118138,"3385.583","2018-04-04T16:24:13Z",2018-04-04 16:24:13
"1077","Verdecocha","04/04/2018","2007",NA,NA,NA,NA,NA,NA,NA,NA,NA,NA,NA,"Eriocnemis luciani",NA,NA,NA,NA,NA,NA,NA,NA,NA,NA,NA,"April","2018",NA,-78.597558,-0.116224,"3402.945","2018-04-04T16:53:46Z",2018-04-04 16:53:46
"1078","Verdecocha","04/04/2018","2010",NA,NA,NA,NA,NA,NA,NA,NA,NA,NA,NA,"Metallura tyrianthina","heard",NA,NA,NA,NA,NA,NA,NA,NA,NA,NA,"April","2018",NA,-78.59777,-0.115869,"3403.733","2018-04-04T17:00:51Z",2018-04-04 17:00:51
"1079","Verdecocha","14/05/2018","132","Salvia pichinchensis","Salvia pichinchensis","2","DC",16,NA,NA,NA,NA,NA,NA,"Metallura tyrianthina","heard",NA,NA,NA,NA,NA,NA,NA,NA,NA,"Salvia pichinchensis","May","2018","Salvia pichinchensis",-78.595045,-0.124919,"3432.632","2018-05-14T13:18:44Z",2018-05-14 13:18:44
"1080","Verdecocha","14/05/2018","134",NA,NA,NA,NA,NA,NA,NA,NA,NA,NA,NA,"Metallura tyrianthina","heard",NA,NA,NA,NA,NA,NA,NA,NA,NA,NA,"May","2018",NA,-78.595058,-0.124678,"3425.349","2018-05-14T13:25:42Z",2018-05-14 13:25:42
"1081","Verdecocha","14/05/2018","134",NA,NA,NA,NA,NA,NA,NA,NA,NA,NA,NA,"Coeligena lutetiae","heard",NA,NA,NA,NA,NA,NA,NA,NA,NA,NA,"May","2018",NA,-78.595058,-0.124678,"3425.349","2018-05-14T13:25:42Z",2018-05-14 13:25:42
"1082","Verdecocha","14/05/2018","141",NA,NA,NA,NA,NA,NA,NA,NA,NA,NA,NA,"Eriocnemis luciani","heard",NA,NA,NA,NA,NA,NA,NA,NA,NA,NA,"May","2018",NA,-78.595264,-0.123958,"3419.376","2018-05-14T13:38:26Z",2018-05-14 13:38:26
"1083","Verdecocha","14/05/2018","144",NA,NA,NA,NA,NA,NA,NA,NA,NA,NA,NA,"Eriocnemis luciani","heard",NA,NA,NA,NA,NA,NA,NA,NA,NA,NA,"May","2018",NA,-78.595967,-0.123251,"3425.793","2018-05-14T13:50:52Z",2018-05-14 13:50:52
"1084","Verdecocha","14/05/2018","163","Guzmania sp. 1","Guzmania bakeri","6","DC",6,NA,NA,NA,NA,NA,NA,"Eriocnemis luciani","feeding",NA,NA,NA,NA,NA,NA,NA,NA,NA,"Guzmania bakeri","May","2018","Guzmania bakeri",-78.597689,-0.121354,"3391.314","2018-05-14T14:45:52Z",2018-05-14 14:45:52
"1085","Verdecocha","14/05/2018","166",NA,NA,NA,NA,NA,NA,NA,NA,NA,NA,NA,"Coeligena lutetiae","heard",NA,NA,NA,NA,NA,NA,NA,NA,NA,NA,"May","2018",NA,-78.597709,-0.120868,"3383.076","2018-05-14T14:53:36Z",2018-05-14 14:53:36
"1086","Verdecocha","14/05/2018","172","Macleania rupestris","Macleania rupestris","5","DC",2,NA,NA,NA,NA,NA,NA,"Coeligena lutetiae","heard",NA,NA,NA,NA,NA,NA,NA,NA,NA,"Macleania rupestris","May","2018","Macleania rupestris",-78.597637,-0.120016,"3374.883","2018-05-14T15:07:03Z",2018-05-14 15:07:03
"1087","Verdecocha","14/05/2018","177",NA,NA,NA,NA,NA,NA,NA,NA,NA,NA,NA,"Eriocnemis luciani","heard",NA,NA,NA,NA,NA,NA,NA,NA,NA,NA,"May","2018",NA,-78.597746,-0.119625,"3373.000","2018-05-14T15:13:09Z",2018-05-14 15:13:09
"1088","Verdecocha","14/05/2018","184","Guzmania sp. 1","Guzmania bakeri","5","DC",9,NA,NA,NA,NA,NA,NA,"Eriocnemis luciani","feeding",NA,NA,NA,NA,NA,NA,NA,NA,NA,"Guzmania bakeri","May","2018","Guzmania bakeri",-78.597688,-0.119087,"3373.610","2018-05-14T15:26:53Z",2018-05-14 15:26:53
"1089","Verdecocha","14/05/2018","185","Symplocus sp.1","Symplocus quitensis","7","DC",10,NA,NA,NA,NA,NA,NA,"Metallura tyrianthina",NA,"Flores peque√±as rosadas, muchos frutos",NA,NA,NA,NA,NA,NA,NA,NA,"Symplocos quitensis","May","2018","Symplocos quitensis",-78.597672,-0.119029,"3374.529","2018-05-14T15:29:07Z",2018-05-14 15:29:07
"1090","Verdecocha","14/05/2018","189","Gaultheria sp. 3","Clethra ovalifolia","4","DC",3,NA,NA,NA,NA,NA,NA,"Metallura tyrianthina",NA,NA,NA,NA,NA,NA,NA,NA,NA,NA,"Clethra ovalifolia","May","2018","Clethra ovalifolia",-78.597618,-0.118785,"3378.013","2018-05-14T15:46:31Z",2018-05-14 15:46:31
"1091","Verdecocha","14/05/2018","207",NA,NA,NA,NA,NA,NA,NA,NA,NA,NA,NA,"Metallura tyrianthina",NA,"feeding insects",NA,NA,NA,NA,NA,NA,NA,NA,NA,"May","2018",NA,-78.597319,-0.117763,"3382.717","2018-05-14T16:23:12Z",2018-05-14 16:23:12
"1092","Verdecocha","13/06/2018","2",NA,NA,NA,NA,NA,NA,NA,NA,NA,NA,NA,"Metallura tyrianthina","heard",NA,NA,NA,NA,NA,NA,NA,NA,NA,NA,"June","2018",NA,-78.594989,-0.124953,"3439.106","2018-06-13T13:28:25Z",2018-06-13 13:28:25
"1093","Verdecocha","13/06/2018","8","Guzmania sp. 1","Guzmania bakeri","7","DC",5,NA,NA,NA,NA,NA,NA,"Eriocnemis luciani","feeding",NA,NA,NA,NA,NA,NA,NA,NA,NA,"Guzmania bakeri","June","2018","Guzmania bakeri",-78.595191,-0.124149,"3415.575","2018-06-13T13:48:42Z",2018-06-13 13:48:42
"1094","Verdecocha","13/06/2018","14",NA,NA,NA,NA,NA,NA,NA,NA,NA,NA,NA,"Metallura tyrianthina","heard",NA,NA,NA,NA,NA,NA,NA,NA,NA,NA,"June","2018",NA,-78.595999,-0.123256,"3423.861","2018-06-13T14:07:23Z",2018-06-13 14:07:23
"1095","Verdecocha","13/06/2018","33","Guzmania sp. 1","Guzmania bakeri","2","DC",6,NA,NA,NA,NA,NA,NA,"Metallura tyrianthina","feeding",NA,NA,NA,NA,NA,NA,NA,NA,NA,"Guzmania bakeri","June","2018","Guzmania bakeri",-78.597668,-0.121568,"3403.342","2018-06-13T15:18:56Z",2018-06-13 15:18:56
"1096","Verdecocha","13/06/2018","42",NA,NA,NA,NA,NA,NA,NA,NA,NA,NA,NA,"Eriocnemis luciani","heard",NA,NA,NA,NA,NA,NA,NA,NA,NA,NA,"June","2018",NA,-78.597677,-0.12035,"3379.168","2018-06-13T15:48:06Z",2018-06-13 15:48:06
"1097","Verdecocha","13/06/2018","81","Tillandsia sp. 1","Tillandsia polyantha","6","DC",1,NA,NA,NA,NA,NA,NA,"Eriocnemis luciani","feeding",NA,NA,NA,NA,NA,NA,NA,NA,NA,"Tillandsia polyantha","June","2018","Tillandsia polyantha",-78.597258,-0.11718,"3386.074","2018-06-13T16:59:48Z",2018-06-13 16:59:48
"1098","Verdecocha","13/06/2018","88",NA,NA,NA,NA,NA,NA,NA,NA,NA,NA,NA,"Eriocnemis luciani","heard",NA,NA,NA,NA,NA,NA,NA,NA,NA,NA,"June","2018",NA,-78.59745,-0.116446,"3398.832","2018-06-13T17:09:43Z",2018-06-13 17:09:43
"1099","Verdecocha","13/06/2018","104","Guzmania sp. 1","Guzmania bakeri","1","DC",3,NA,NA,NA,NA,NA,NA,"Eriocnemis nigrivestis","feeding","male",NA,NA,NA,NA,NA,NA,NA,NA,"Guzmania bakeri","June","2018","Guzmania bakeri",-78.597971,-0.115156,"3418.339","2018-06-13T17:28:30Z",2018-06-13 17:28:30
"1100","Verdecocha","09/07/2018","388",NA,NA,NA,NA,NA,NA,NA,NA,NA,NA,NA,"Metallura tyrianthina","heard",NA,NA,NA,NA,NA,NA,NA,NA,NA,NA,"July","2018",NA,-78.597402,-0.122071,"3418.076","2018-07-09T14:14:17Z",2018-07-09 14:14:17
"1101","Verdecocha","09/07/2018","400","Guzmania sp. 1","Guzmania bakeri","4","DC",4,NA,NA,NA,NA,NA,NA,"Eriocnemis luciani","feeding",NA,NA,NA,NA,NA,NA,NA,NA,NA,"Guzmania bakeri","July","2018","Guzmania bakeri",-78.597717,-0.120653,"3376.777","2018-07-09T15:14:55Z",2018-07-09 15:14:55
"1102","Verdecocha","09/07/2018","406",NA,NA,NA,NA,NA,NA,NA,NA,NA,NA,NA,"Metallura tyrianthina","heard",NA,NA,NA,NA,NA,NA,NA,NA,NA,NA,"July","2018",NA,-78.597656,-0.119829,"3376.266","2018-07-09T15:30:55Z",2018-07-09 15:30:55
"1103","Verdecocha","09/07/2018","417",NA,NA,NA,NA,NA,NA,NA,NA,NA,NA,NA,"Metallura tyrianthina","heard",NA,NA,NA,NA,NA,NA,NA,NA,NA,NA,"July","2018",NA,-78.597653,-0.118972,"3380.118","2018-07-09T15:57:46Z",2018-07-09 15:57:46
"1104","Verdecocha","14/08/2018","483",NA,NA,NA,NA,NA,NA,NA,NA,NA,NA,NA,"Metallura tyrianthina","heard",NA,NA,NA,NA,NA,NA,NA,NA,NA,NA,"August","2018",NA,-78.595143,-0.124287,"3402.209","2018-08-14T13:45:01Z",2018-08-14 13:45:01
"1105","Verdecocha","14/08/2018","500","Salvia pichinchensis","Salvia pichinchensis","2","DC",5,NA,NA,NA,NA,NA,NA,"Eriocnemis luciani","heard",NA,NA,NA,NA,NA,NA,NA,NA,NA,"Salvia pichinchensis","August","2018","Salvia pichinchensis",-78.596088,-0.123113,"3416.709","2018-08-14T14:10:13Z",2018-08-14 14:10:13
"1106","Verdecocha","14/08/2018","506",NA,NA,NA,NA,NA,NA,NA,NA,NA,NA,NA,"Eriocnemis luciani","heard",NA,NA,NA,NA,NA,NA,NA,NA,NA,NA,"August","2018",NA,-78.596618,-0.122802,"3414.596","2018-08-14T14:21:22Z",2018-08-14 14:21:22
"1107","Verdecocha","14/08/2018","511",NA,NA,NA,NA,NA,NA,NA,NA,NA,NA,NA,"Coeligena lutetiae","heard",NA,NA,NA,NA,NA,NA,NA,NA,NA,NA,"August","2018",NA,-78.596993,-0.12252,"3406.134","2018-08-14T14:31:42Z",2018-08-14 14:31:42
"1108","Verdecocha","14/08/2018","512","Axinaea sp. 1","Miconia corymbiformis","6","DC",3,NA,NA,NA,NA,NA,NA,"Metallura tyrianthina","feeding",NA,NA,NA,NA,NA,NA,NA,NA,NA,"Miconia corymbiformis","August","2018","Miconia corymbiformis",-78.597137,-0.122463,"3406.435","2018-08-14T14:39:01Z",2018-08-14 14:39:01
"1109","Verdecocha","14/08/2018","520",NA,NA,NA,NA,NA,NA,NA,NA,NA,NA,NA,"Metallura tyrianthina","heard",NA,NA,NA,NA,NA,NA,NA,NA,NA,NA,"August","2018",NA,-78.597537,-0.121914,"3411.873","2018-08-14T15:00:17Z",2018-08-14 15:00:17
"1110","Verdecocha","14/08/2018","523",NA,NA,NA,NA,NA,NA,NA,NA,NA,NA,NA,"Metallura tyrianthina","heard",NA,NA,NA,NA,NA,NA,NA,NA,NA,NA,"August","2018",NA,-78.597538,-0.12171,"3404.212","2018-08-14T15:05:52Z",2018-08-14 15:05:52
"1111","Verdecocha","14/08/2018","526","Palicourea amethystina","Palicourea amethystina","4","DC",21,NA,NA,NA,NA,NA,NA,"Metallura tyrianthina","feeding",NA,NA,NA,NA,NA,NA,NA,NA,NA,"Palicourea amethystina","August","2018","Palicourea amethystina",-78.597655,-0.121514,"3395.455","2018-08-14T15:10:47Z",2018-08-14 15:10:47
"1112","Verdecocha","14/08/2018","531",NA,NA,NA,NA,NA,NA,NA,NA,NA,NA,NA,"Metallura tyrianthina","heard",NA,NA,NA,NA,NA,NA,NA,NA,NA,NA,"August","2018",NA,-78.597725,-0.120933,"3381.828","2018-08-14T15:27:57Z",2018-08-14 15:27:57
"1113","Verdecocha","14/08/2018","540",NA,NA,NA,NA,NA,NA,NA,NA,NA,NA,NA,"Coeligena lutetiae","heard",NA,NA,NA,NA,NA,NA,NA,NA,NA,NA,"August","2018",NA,-78.597713,-0.120315,"3376.210","2018-08-14T15:51:21Z",2018-08-14 15:51:21
"1114","Verdecocha","14/08/2018","548",NA,NA,NA,NA,NA,NA,NA,NA,NA,NA,NA,"Metallura tyrianthina","heard",NA,NA,NA,NA,NA,NA,NA,NA,NA,NA,"August","2018",NA,-78.597666,-0.119757,"3375.730","2018-08-14T16:05:34Z",2018-08-14 16:05:34
"1115","Verdecocha","14/08/2018","549","Macleania rupestris","Macleania rupestris","5","DC",2,NA,NA,NA,NA,NA,NA,"Metallura tyrianthina","feeding",NA,NA,NA,NA,NA,NA,NA,NA,NA,"Macleania rupestris","August","2018","Macleania rupestris",-78.597773,-0.119581,"3372.498","2018-08-14T16:08:48Z",2018-08-14 16:08:48
"1116","Verdecocha","14/08/2018","552",NA,NA,NA,NA,NA,NA,NA,NA,NA,NA,NA,"Coeligena lutetiae","heard",NA,NA,NA,NA,NA,NA,NA,NA,NA,NA,"August","2018",NA,-78.597766,-0.119378,"3375.546","2018-08-14T16:13:40Z",2018-08-14 16:13:40
"1117","Verdecocha","14/08/2018","558",NA,NA,NA,NA,NA,NA,NA,NA,NA,NA,NA,"Metallura tyrianthina","heard",NA,NA,NA,NA,NA,NA,NA,NA,NA,NA,"August","2018",NA,-78.59769,-0.118988,"3379.965","2018-08-14T16:22:16Z",2018-08-14 16:22:16
"1118","Verdecocha","14/08/2018","584",NA,NA,NA,NA,NA,NA,NA,NA,NA,NA,NA,"Eriocnemis luciani","heard",NA,NA,NA,NA,NA,NA,NA,NA,NA,NA,"August","2018",NA,-78.597208,-0.117318,"3389.428","2018-08-14T17:21:21Z",2018-08-14 17:21:21
"1119","Verdecocha","14/08/2018","592",NA,NA,NA,NA,NA,NA,NA,NA,NA,NA,NA,"Metallura tyrianthina","heard",NA,NA,NA,NA,NA,NA,NA,NA,NA,NA,"August","2018",NA,-78.597418,-0.116596,"3402.864","2018-08-14T17:30:52Z",2018-08-14 17:30:52
"1120","Verdecocha","14/08/2018","608",NA,NA,NA,NA,NA,NA,NA,NA,NA,NA,NA,"Metallura tyrianthina","seen",NA,NA,NA,NA,NA,NA,NA,NA,NA,NA,"August","2018",NA,-78.597951,-0.115161,"3422.274","2018-08-14T17:55:35Z",2018-08-14 17:55:35
"1121","Verdecocha","11/09/2018","594",NA,NA,NA,NA,NA,NA,NA,NA,NA,NA,NA,"Coeligena lutetiae","heard",NA,NA,NA,NA,NA,NA,NA,NA,NA,NA,"September","2018",NA,-78.595127,-0.124569,"3304.919","2018-09-11T13:47:12Z",2018-09-11 13:47:12
"1122","Verdecocha","11/09/2018","604",NA,NA,NA,NA,NA,NA,NA,NA,NA,NA,NA,"Coeligena lutetiae","heard",NA,NA,NA,NA,NA,NA,NA,NA,NA,NA,"September","2018",NA,-78.595501,-0.123628,"3297.846","2018-09-11T14:06:41Z",2018-09-11 14:06:41
"1123","Verdecocha","11/09/2018","620",NA,NA,NA,NA,NA,NA,NA,NA,NA,NA,NA,"Eriocnemis luciani","heard",NA,NA,NA,NA,NA,NA,NA,NA,NA,NA,"September","2018",NA,-78.597212,-0.122311,"3374.943","2018-09-11T14:40:40Z",2018-09-11 14:40:40
"1124","Verdecocha","11/09/2018","628","Racinaea tetrantha","Racinaea tetrantha","7","DC",18,NA,NA,NA,NA,NA,NA,"Metallura tyrianthina","feeding",NA,NA,NA,NA,NA,NA,NA,NA,NA,"Racinaea tetrantha","September","2018","Racinaea tetrantha",-78.597468,-0.121753,"3390.016","2018-09-11T14:57:52Z",2018-09-11 14:57:52
"1125","Verdecocha","11/09/2018","639",NA,NA,NA,NA,NA,NA,NA,NA,NA,NA,NA,"Eriocnemis luciani","heard",NA,NA,NA,NA,NA,NA,NA,NA,NA,NA,"September","2018",NA,-78.597721,-0.120936,"3376.832","2018-09-11T15:15:44Z",2018-09-11 15:15:44
"1126","Verdecocha","11/09/2018","643",NA,NA,NA,NA,NA,NA,NA,NA,NA,NA,NA,"Metallura tyrianthina","heard",NA,NA,NA,NA,NA,NA,NA,NA,NA,NA,"September","2018",NA,-78.597714,-0.120631,"3377.997","2018-09-11T15:20:57Z",2018-09-11 15:20:57
"1127","Verdecocha","11/09/2018","648",NA,NA,NA,NA,NA,NA,NA,NA,NA,NA,NA,"Metallura tyrianthina","heard",NA,NA,NA,NA,NA,NA,NA,NA,NA,NA,"September","2018",NA,-78.597719,-0.120317,"3378.504","2018-09-11T15:29:00Z",2018-09-11 15:29:00
"1128","Verdecocha","11/09/2018","670",NA,NA,NA,NA,NA,NA,NA,NA,NA,NA,NA,"Coeligena lutetiae","heard",NA,NA,NA,NA,NA,NA,NA,NA,NA,NA,"September","2018",NA,-78.597575,-0.118691,"3386.615","2018-09-11T16:06:50Z",2018-09-11 16:06:50
"1129","Verdecocha","11/09/2018","695",NA,NA,NA,NA,NA,NA,NA,NA,NA,NA,NA,"Metallura tyrianthina","heard",NA,NA,NA,NA,NA,NA,NA,NA,NA,NA,"September","2018",NA,-78.59733,-0.116811,"3397.274","2018-09-11T16:46:09Z",2018-09-11 16:46:09
"1130","Verdecocha","10/10/2018","91",NA,NA,NA,NA,NA,NA,NA,NA,NA,NA,NA,"Metallura tyrianthina","heard",NA,NA,NA,NA,NA,NA,NA,NA,NA,NA,"October","2018",NA,-78.595116,-0.125179,"3424.171","2018-10-10T13:39:26Z",2018-10-10 13:39:26
"1131","Verdecocha","10/10/2018","99",NA,NA,NA,NA,NA,NA,NA,NA,NA,NA,NA,"Eriocnemis luciani","heard",NA,NA,NA,NA,NA,NA,NA,NA,NA,NA,"October","2018",NA,-78.595228,-0.124072,"3403.469","2018-10-10T13:58:17Z",2018-10-10 13:58:17
"1132","Verdecocha","10/10/2018","104",NA,NA,NA,NA,NA,NA,NA,NA,NA,NA,NA,"Eriocnemis luciani","heard",NA,NA,NA,NA,NA,NA,NA,NA,NA,NA,"October","2018",NA,-78.595572,-0.12363,"3410.563","2018-10-10T14:06:39Z",2018-10-10 14:06:39
"1133","Verdecocha","10/10/2018","119",NA,NA,NA,NA,NA,NA,NA,NA,NA,NA,NA,"Coeligena lutetiae","heard",NA,NA,NA,NA,NA,NA,NA,NA,NA,NA,"October","2018",NA,-78.596886,-0.122533,"3409.704","2018-10-10T14:46:07Z",2018-10-10 14:46:07
"1134","Verdecocha","10/10/2018","138",NA,NA,NA,NA,NA,NA,NA,NA,NA,NA,NA,"Metallura tyrianthina","feeding","piercing",NA,NA,NA,NA,NA,NA,NA,NA,NA,"October","2018",NA,-78.597658,-0.121401,"3394.998","2018-10-10T15:17:13Z",2018-10-10 15:17:13
"1135","Verdecocha","10/10/2018","139","Heppiella repens","Heppiella repens","2","DC",30,NA,NA,NA,NA,NA,NA,"Coeligena lutetiae","feeding","female",NA,NA,NA,NA,NA,NA,NA,NA,"Heppiella repens","October","2018","Heppiella repens",-78.597673,-0.121346,"3392.903","2018-10-10T15:20:24Z",2018-10-10 15:20:24
"1136","Verdecocha","10/10/2018","151",NA,NA,NA,NA,NA,NA,NA,NA,NA,NA,NA,"Eriocnemis luciani","heard",NA,NA,NA,NA,NA,NA,NA,NA,NA,NA,"October","2018",NA,-78.597703,-0.120481,"3381.985","2018-10-10T15:42:06Z",2018-10-10 15:42:06
"1137","Verdecocha","10/10/2018","160",NA,NA,NA,NA,NA,NA,NA,NA,NA,NA,NA,"Metallura tyrianthina","heard",NA,NA,NA,NA,NA,NA,NA,NA,NA,NA,"October","2018",NA,-78.597654,-0.119844,"3383.263","2018-10-10T15:53:23Z",2018-10-10 15:53:23
"1138","Verdecocha","10/10/2018","166","Racinaea tetrantha","Racinaea tetrantha","7","DC",4,NA,NA,NA,NA,NA,NA,"Metallura tyrianthina","feeding",NA,NA,NA,NA,NA,NA,NA,NA,NA,"Racinaea tetrantha","October","2018","Racinaea tetrantha",-78.597693,-0.119308,"3379.403","2018-10-10T16:05:48Z",2018-10-10 16:05:48
"1139","Verdecocha","10/10/2018","172",NA,NA,NA,NA,NA,NA,NA,NA,NA,NA,NA,"Metallura tyrianthina","heard",NA,NA,NA,NA,NA,NA,NA,NA,NA,NA,"October","2018",NA,-78.597591,-0.118786,"3383.691","2018-10-10T16:15:11Z",2018-10-10 16:15:11
"1140","Verdecocha","10/10/2018","193",NA,NA,NA,NA,NA,NA,NA,NA,NA,NA,NA,"Eriocnemis luciani","feeding","Tillandisia",NA,NA,NA,NA,NA,NA,NA,NA,NA,"October","2018",NA,-78.597226,-0.117321,"3389.815","2018-10-10T16:57:07Z",2018-10-10 16:57:07
"1141","Verdecocha","10/10/2018","197",NA,NA,NA,NA,NA,NA,NA,NA,NA,NA,NA,"Metallura tyrianthina","heard",NA,NA,NA,NA,NA,NA,NA,NA,NA,NA,"October","2018",NA,-78.597317,-0.116757,"3401.152","2018-10-10T17:08:58Z",2018-10-10 17:08:58
"1142","Verdecocha","10/10/2018","199",NA,NA,NA,NA,NA,NA,NA,NA,NA,NA,NA,"Eriocnemis luciani","heard",NA,NA,NA,NA,NA,NA,NA,NA,NA,NA,"October","2018",NA,-78.597415,-0.11652,"3406.147","2018-10-10T17:13:41Z",2018-10-10 17:13:41
"1143","Verdecocha","10/10/2018","208",NA,NA,NA,NA,NA,NA,NA,NA,NA,NA,NA,"Metallura tyrianthina","heard",NA,NA,NA,NA,NA,NA,NA,NA,NA,NA,"October","2018",NA,-78.597756,-0.115846,"3406.060","2018-10-10T17:25:30Z",2018-10-10 17:25:30
"1144","Verdecocha","11/11/2018","231",NA,NA,NA,NA,NA,NA,NA,NA,NA,NA,NA,"Eriocnemis luciani","heard",NA,NA,NA,NA,NA,NA,NA,NA,NA,NA,"November","2018",NA,-78.594983,-0.125027,"3365.327","2018-11-11T12:54:45Z",2018-11-11 12:54:45
"1145","Verdecocha","11/11/2018","233",NA,NA,NA,NA,NA,NA,NA,NA,NA,NA,NA,"Metallura tyrianthina","heard",NA,NA,NA,NA,NA,NA,NA,NA,NA,NA,"November","2018",NA,-78.594961,-0.124862,"3448.393","2018-11-11T12:59:26Z",2018-11-11 12:59:26
"1146","Verdecocha","11/11/2018","243",NA,NA,NA,NA,NA,NA,NA,NA,NA,NA,NA,"Eriocnemis luciani","heard",NA,NA,NA,NA,NA,NA,NA,NA,NA,NA,"November","2018",NA,-78.595345,-0.123816,"3425.456","2018-11-11T13:21:08Z",2018-11-11 13:21:08
"1147","Verdecocha","11/11/2018","257",NA,NA,NA,NA,NA,NA,NA,NA,NA,NA,NA,"Eriocnemis luciani","heard",NA,NA,NA,NA,NA,NA,NA,NA,NA,NA,"November","2018",NA,-78.59652,-0.122833,"3424.360","2018-11-11T13:44:20Z",2018-11-11 13:44:20
"1148","Verdecocha","11/11/2018","263","Heppiella repens","Heppiella repens","5","DC",20,NA,NA,NA,NA,NA,NA,"Eriocnemis luciani","feeding",NA,NA,NA,NA,NA,NA,NA,NA,NA,"Heppiella repens","November","2018","Heppiella repens",-78.597113,-0.122391,"3415.292","2018-11-11T13:58:58Z",2018-11-11 13:58:58
"1149","Verdecocha","11/11/2018","282",NA,NA,NA,NA,NA,NA,NA,NA,NA,NA,NA,"Eriocnemis luciani","heard",NA,NA,NA,NA,NA,NA,NA,NA,NA,NA,"November","2018",NA,-78.597686,-0.120537,"3384.572","2018-11-11T14:37:34Z",2018-11-11 14:37:34
"1150","Verdecocha","11/11/2018","292","Racinaea tetrantha","Racinaea tetrantha","6","DC",12,NA,NA,NA,NA,NA,NA,"Metallura tyrianthina","feeding",NA,NA,NA,NA,NA,NA,NA,NA,NA,"Racinaea tetrantha","November","2018","Racinaea tetrantha",-78.597594,-0.119784,"3383.846","2018-11-11T14:51:27Z",2018-11-11 14:51:27
"1151","Verdecocha","11/11/2018","297","Macleania rupestris","Macleania rupestris","5","DC",5,NA,NA,NA,NA,NA,NA,"Eriocnemis luciani","feeding",NA,NA,NA,NA,NA,NA,NA,NA,NA,"Macleania rupestris","November","2018","Macleania rupestris",-78.597707,-0.119368,"3380.462","2018-11-11T14:59:38Z",2018-11-11 14:59:38
"1152","Verdecocha","11/11/2018","303",NA,NA,NA,NA,NA,NA,NA,NA,NA,NA,NA,"Metallura tyrianthina","heard",NA,NA,NA,NA,NA,NA,NA,NA,NA,NA,"November","2018",NA,-78.597572,-0.118743,"3384.259","2018-11-11T15:16:56Z",2018-11-11 15:16:56
"1153","Verdecocha","11/11/2018","327","Macleania rupestris","Macleania rupestris","7","DC",7,NA,NA,NA,NA,NA,NA,"Eriocnemis nigrivestis","feeding","no se ve bien",NA,NA,NA,NA,NA,NA,NA,NA,"Macleania rupestris","November","2018","Macleania rupestris",-78.597208,-0.117219,"3390.476","2018-11-11T15:52:21Z",2018-11-11 15:52:21
"1154","Verdecocha","11/11/2018","351",NA,NA,NA,NA,NA,NA,NA,NA,NA,NA,NA,"Metallura tyrianthina","feeding",NA,NA,NA,NA,NA,NA,NA,NA,NA,NA,"November","2018",NA,-78.597942,-0.115184,"3419.249","2018-11-11T16:32:51Z",2018-11-11 16:32:51
"1155","Verdecocha","11/12/2018","352","Columnea dielsii","Columnea dielsii","5","DC",5,NA,NA,NA,NA,NA,NA,"Coeligena lutetiae","feeding","also fighting, 2 ind",NA,NA,NA,NA,NA,NA,NA,NA,"Columnea dielsii","December","2018","Columnea dielsii",-78.594921,-0.125019,"3453.197","2018-12-11T13:31:28Z",2018-12-11 13:31:28
"1156","Verdecocha","11/12/2018","354",NA,NA,NA,NA,NA,NA,NA,NA,NA,NA,NA,"Pterophanes cyanopterus","flying",NA,NA,NA,NA,NA,NA,NA,NA,NA,NA,"December","2018",NA,-78.595014,-0.124845,"3439.829","2018-12-11T13:35:59Z",2018-12-11 13:35:59
"1157","Verdecocha","11/12/2018","371","Heppiella repens","Heppiella repens","4","DC",11,NA,NA,NA,NA,NA,NA,"Metallura tyrianthina","perching",NA,NA,NA,NA,NA,NA,NA,NA,NA,"Heppiella repens","December","2018","Heppiella repens",-78.596173,-0.122999,"3424.948","2018-12-11T14:14:36Z",2018-12-11 14:14:36
"1158","Verdecocha","11/12/2018","373",NA,NA,NA,NA,NA,NA,NA,NA,NA,NA,NA,"Eriocnemis luciani","heard",NA,NA,NA,NA,NA,NA,NA,NA,NA,NA,"December","2018",NA,-78.596599,-0.12274,"3419.975","2018-12-11T14:22:03Z",2018-12-11 14:22:03
"1159","Verdecocha","11/12/2018","377",NA,NA,NA,NA,NA,NA,NA,NA,NA,NA,NA,"Metallura tyrianthina","heard",NA,NA,NA,NA,NA,NA,NA,NA,NA,NA,"December","2018",NA,-78.597025,-0.122469,"3412.185","2018-12-11T14:35:54Z",2018-12-11 14:35:54
"1160","Verdecocha","11/12/2018","388","Macleania rupestris","Macleania rupestris","8","DC",13,NA,NA,NA,NA,NA,NA,"Eriocnemis luciani","feeding",NA,NA,NA,NA,NA,NA,NA,NA,NA,"Macleania rupestris","December","2018","Macleania rupestris",-78.597716,-0.120897,"3389.616","2018-12-11T15:06:25Z",2018-12-11 15:06:25
"1161","Verdecocha","11/12/2018","400","Disterigma alaternoides","Disterigma noyesiae","5","DC",8,NA,NA,NA,NA,NA,NA,"Metallura tyrianthina","feeding",NA,NA,NA,NA,NA,NA,NA,NA,NA,"Disterigma noyesiae","December","2018","Disterigma noyesiae",-78.597713,-0.119694,"3378.707","2018-12-11T15:34:25Z",2018-12-11 15:34:25
"1162","Verdecocha","11/12/2018","411",NA,NA,NA,NA,NA,NA,NA,NA,NA,NA,NA,"Eriocnemis nigrivestis","flying","male",NA,NA,NA,NA,NA,NA,NA,NA,NA,"December","2018",NA,-78.59758,-0.118719,"3384.051","2018-12-11T16:09:38Z",2018-12-11 16:09:38
"1163","Verdecocha","11/12/2018","423",NA,NA,NA,NA,NA,NA,NA,NA,NA,NA,NA,"Eriocnemis nigrivestis","perching","female also atack a Tyrian Metaltail",NA,NA,NA,NA,NA,NA,NA,NA,NA,"December","2018",NA,-78.597322,-0.1179,"3378.921","2018-12-11T16:39:10Z",2018-12-11 16:39:10
"1164","Verdecocha","11/12/2018","428",NA,NA,NA,NA,NA,NA,NA,NA,NA,NA,NA,"Eriocnemis luciani","heard",NA,NA,NA,NA,NA,NA,NA,NA,NA,NA,"December","2018",NA,-78.597246,-0.117289,"3386.178","2018-12-11T16:47:58Z",2018-12-11 16:47:58
"1165","Verdecocha","11/12/2018","429",NA,NA,NA,NA,NA,NA,NA,NA,NA,NA,NA,"Coeligena lutetiae","flying",NA,NA,NA,NA,NA,NA,NA,NA,NA,NA,"December","2018",NA,-78.597256,-0.117257,"3387.233","2018-12-11T16:48:51Z",2018-12-11 16:48:51
"1166","Verdecocha","11/12/2018","430",NA,NA,NA,NA,NA,NA,NA,NA,NA,NA,NA,"Eriocnemis luciani","heard",NA,NA,NA,NA,NA,NA,NA,NA,NA,NA,"December","2018",NA,-78.597329,-0.117038,"3386.446","2018-12-11T16:51:14Z",2018-12-11 16:51:14
"1167","Verdecocha","11/12/2018","431",NA,NA,NA,NA,NA,NA,NA,NA,NA,NA,NA,"Metallura tyrianthina","heard",NA,NA,NA,NA,NA,NA,NA,NA,NA,NA,"December","2018",NA,-78.597328,-0.116931,"3389.071","2018-12-11T16:56:58Z",2018-12-11 16:56:58
"1168","Verdecocha","11/12/2018","432","Macleania rupestris","Macleania rupestris","7","DC",7,NA,NA,NA,NA,NA,NA,"Eriocnemis luciani","feeding","perch",NA,NA,NA,NA,NA,NA,NA,NA,"Macleania rupestris","December","2018","Macleania rupestris",-78.597344,-0.116749,"3396.515","2018-12-11T17:01:37Z",2018-12-11 17:01:37
"1169","Verdecocha","11/12/2018","447",NA,NA,NA,NA,NA,NA,NA,NA,NA,NA,NA,"Eriocnemis luciani","heard",NA,NA,NA,NA,NA,NA,NA,NA,NA,NA,"December","2018",NA,-78.59789,-0.115397,"3411.256","2018-12-11T17:28:44Z",2018-12-11 17:28:44
"1170","Verdecocha","09/01/2019","553",NA,NA,NA,NA,NA,NA,NA,NA,NA,NA,NA,"Coeligena lutetiae","heard",NA,NA,NA,NA,NA,NA,NA,NA,NA,NA,"January","2019",NA,-78.595079,-0.124659,"3433.352","2019-01-09T13:36:41Z",2019-01-09 13:36:41
"1171","Verdecocha","09/01/2019","562",NA,NA,NA,NA,NA,NA,NA,NA,NA,NA,NA,"Coeligena lutetiae","flying",NA,NA,NA,NA,NA,NA,NA,NA,NA,NA,"January","2019",NA,-78.596019,-0.123177,"3429.849","2019-01-09T14:14:04Z",2019-01-09 14:14:04
"1172","Verdecocha","09/01/2019","585",NA,NA,NA,NA,NA,NA,NA,NA,NA,NA,NA,"Metallura tyrianthina","heard",NA,NA,NA,NA,NA,NA,NA,NA,NA,NA,"January","2019",NA,-78.597668,-0.121004,"3387.884","2019-01-09T15:05:25Z",2019-01-09 15:05:25
"1173","Verdecocha","09/01/2019","593",NA,NA,NA,NA,NA,NA,NA,NA,NA,NA,NA,"Metallura tyrianthina","heard",NA,NA,NA,NA,NA,NA,NA,NA,NA,NA,"January","2019",NA,-78.597643,-0.119921,"3383.423","2019-01-09T15:23:14Z",2019-01-09 15:23:14
"1174","Verdecocha","09/01/2019","594",NA,NA,NA,NA,NA,NA,NA,NA,NA,NA,NA,"Eriocnemis luciani","heard",NA,NA,NA,NA,NA,NA,NA,NA,NA,NA,"January","2019",NA,-78.597735,-0.119647,"3379.601","2019-01-09T15:27:37Z",2019-01-09 15:27:37
"1175","Verdecocha","09/01/2019","605","Disterigma alaternoides","Disterigma noyesiae","2","DC",5,NA,NA,NA,NA,NA,NA,"Metallura tyrianthina","feeding",NA,NA,NA,NA,NA,NA,NA,NA,NA,"Disterigma noyesiae","January","2019","Disterigma noyesiae",-78.597513,-0.118634,"3381.780","2019-01-09T16:08:46Z",2019-01-09 16:08:46
"1176","Verdecocha","09/01/2019","640",NA,NA,NA,NA,NA,NA,NA,NA,NA,NA,NA,"Coeligena lutetiae","flying",NA,NA,NA,NA,NA,NA,NA,NA,NA,NA,"January","2019",NA,-78.597952,-0.115171,"3417.099","2019-01-09T17:00:06Z",2019-01-09 17:00:06
"1177","Verdecocha","09/01/2019","641",NA,NA,NA,NA,NA,NA,NA,NA,NA,NA,NA,"Metallura tyrianthina","heard",NA,NA,NA,NA,NA,NA,NA,NA,NA,NA,"January","2019",NA,-78.598011,-0.115115,"3418.946","2019-01-09T17:01:10Z",2019-01-09 17:01:10
"1178","Verdecocha","05/02/2019","2",NA,NA,NA,NA,NA,NA,NA,NA,NA,NA,NA,"Metallura tyrianthina","heard",NA,NA,NA,NA,NA,NA,NA,NA,NA,NA,"February","2019",NA,-78.595107,-0.125105,"3457.691","2019-02-05T13:50:10Z",2019-02-05 13:50:10
"1179","Verdecocha","05/02/2019","8",NA,NA,NA,NA,NA,NA,NA,NA,NA,NA,NA,"Coeligena lutetiae","heard",NA,NA,NA,NA,NA,NA,NA,NA,NA,NA,"February","2019",NA,-78.595036,-0.124816,"3442.224","2019-02-05T13:55:23Z",2019-02-05 13:55:23
"1180","Verdecocha","05/02/2019","11",NA,NA,NA,NA,NA,NA,NA,NA,NA,NA,NA,"Coeligena lutetiae","heard",NA,NA,NA,NA,NA,NA,NA,NA,NA,NA,"February","2019",NA,-78.595126,-0.124312,"3426.592","2019-02-05T14:02:05Z",2019-02-05 14:02:05
"1181","Verdecocha","05/02/2019","16",NA,NA,NA,NA,NA,NA,NA,NA,NA,NA,NA,"Coeligena lutetiae","heard",NA,NA,NA,NA,NA,NA,NA,NA,NA,NA,"February","2019",NA,-78.59533,-0.123902,"3428.894","2019-02-05T14:09:21Z",2019-02-05 14:09:21
"1182","Verdecocha","05/02/2019","20",NA,NA,NA,NA,NA,NA,NA,NA,NA,NA,NA,"Coeligena lutetiae","feeding","female feeding Columnea dielsii",NA,NA,NA,NA,NA,NA,NA,NA,NA,"February","2019",NA,-78.595634,-0.123545,"3429.497","2019-02-05T14:14:43Z",2019-02-05 14:14:43
"1183","Verdecocha","05/02/2019","35",NA,NA,NA,NA,NA,NA,NA,NA,NA,NA,NA,"Metallura tyrianthina","heard",NA,NA,NA,NA,NA,NA,NA,NA,NA,NA,"February","2019",NA,-78.597511,-0.121817,"3417.003","2019-02-05T15:00:52Z",2019-02-05 15:00:52
"1184","Verdecocha","05/02/2019","42",NA,NA,NA,NA,NA,NA,NA,NA,NA,NA,NA,"Coeligena lutetiae","heard",NA,NA,NA,NA,NA,NA,NA,NA,NA,NA,"February","2019",NA,-78.597721,-0.120571,"3384.583","2019-02-05T15:23:58Z",2019-02-05 15:23:58
"1185","Verdecocha","05/02/2019","50",NA,NA,NA,NA,NA,NA,NA,NA,NA,NA,NA,"Metallura tyrianthina","heard",NA,NA,NA,NA,NA,NA,NA,NA,NA,NA,"February","2019",NA,-78.597727,-0.119766,"3381.798","2019-02-05T15:35:05Z",2019-02-05 15:35:05
"1186","Verdecocha","05/02/2019","52",NA,"Disterigma noyesiae","7","DC",17,NA,NA,NA,NA,NA,NA,"Metallura tyrianthina","feeding",NA,NA,NA,NA,NA,NA,NA,NA,NA,"Disterigma noyesiae","February","2019","Disterigma noyesiae",-78.597819,-0.119465,"3376.476","2019-02-05T15:38:54Z",2019-02-05 15:38:54
"1187","Verdecocha","05/02/2019","56",NA,NA,NA,NA,NA,NA,NA,NA,NA,NA,NA,"Metallura tyrianthina","heard",NA,NA,NA,NA,NA,NA,NA,NA,NA,NA,"February","2019",NA,-78.597679,-0.119083,"3380.554","2019-02-05T15:46:15Z",2019-02-05 15:46:15
"1188","Verdecocha","05/02/2019","58",NA,NA,NA,NA,NA,NA,NA,NA,NA,NA,NA,"Eriocnemis luciani","heard",NA,NA,NA,NA,NA,NA,NA,NA,NA,NA,"February","2019",NA,-78.597741,-0.118986,"3382.042","2019-02-05T15:51:48Z",2019-02-05 15:51:48
"1189","Verdecocha","05/02/2019","60",NA,NA,NA,NA,NA,NA,NA,NA,NA,NA,NA,"Coeligena lutetiae","heard",NA,NA,NA,NA,NA,NA,NA,NA,NA,NA,"February","2019",NA,-78.597671,-0.118889,"3384.196","2019-02-05T15:55:57Z",2019-02-05 15:55:57
"1190","Verdecocha","05/02/2019","79",NA,NA,NA,NA,NA,NA,NA,NA,NA,NA,NA,"Eriocnemis luciani","heard",NA,NA,NA,NA,NA,NA,NA,NA,NA,NA,"February","2019",NA,-78.597302,-0.117683,"3382.816","2019-02-05T16:27:35Z",2019-02-05 16:27:35
"1191","Verdecocha","05/02/2019","81",NA,NA,NA,NA,NA,NA,NA,NA,NA,NA,NA,"Eriocnemis luciani","heard",NA,NA,NA,NA,NA,NA,NA,NA,NA,NA,"February","2019",NA,-78.597235,-0.117425,"3381.728","2019-02-05T16:29:56Z",2019-02-05 16:29:56
"1192","Verdecocha","05/02/2019","95",NA,NA,NA,NA,NA,NA,NA,NA,NA,NA,NA,"Eriocnemis luciani","heard",NA,NA,NA,NA,NA,NA,NA,NA,NA,NA,"February","2019",NA,-78.597701,-0.115995,"3399.844","2019-02-05T16:47:27Z",2019-02-05 16:47:27
"1193","Verdecocha","05/02/2019","100","Macleania rupestris","Macleania rupestris","5","DC",8,NA,NA,NA,NA,NA,NA,"Eriocnemis luciani","feeding",NA,NA,NA,NA,NA,NA,NA,NA,NA,"Macleania rupestris","February","2019","Macleania rupestris",-78.597854,-0.115459,"3402.454","2019-02-05T17:00:19Z",2019-02-05 17:00:19
"1194","Verdecocha","05/02/2019","109",NA,"Disterigma noyesiae","2","DC",8,NA,NA,NA,NA,NA,NA,"Metallura tyrianthina","feeding",NA,NA,NA,NA,NA,NA,NA,NA,NA,"Disterigma noyesiae","February","2019","Disterigma noyesiae",NA,NA,NA,NA,NA
"1195","Yanacocha_disturbed","2018-02-08","1540","Brachyotum ledifolium","Brachyotum ledifolium","3","DC",6,NA,NA,NA,NA,NA,NA,"Metallura tyrianthina",NA,NA,NA,NA,NA,NA,NA,NA,NA,7,"Brachyotum ledifolium",NA,NA,"Brachyotum ledifolium",NA,NA,NA,NA,NA
"1196","Yanacocha_disturbed","2018-02-08","1562","Brachyotum ledifolium","Brachyotum ledifolium","2","DC",16,NA,NA,NA,NA,NA,NA,"Metallura tyrianthina","Feeding",NA,NA,NA,NA,NA,NA,NA,NA,51,"Brachyotum ledifolium",NA,NA,"Brachyotum ledifolium",NA,NA,NA,NA,NA
"1197","Yanacocha_disturbed","2018-02-08","1580","Brachyotum ledifolium","Brachyotum ledifolium","3","DC",2,NA,NA,NA,NA,NA,NA,"Eriocnemis luciani","Feeding",NA,NA,NA,NA,NA,NA,NA,NA,76,"Brachyotum ledifolium",NA,NA,"Brachyotum ledifolium",NA,NA,NA,NA,NA
"1198","Yanacocha_disturbed","2018-02-08","1543","Siphocampylus giganteus","Siphocampylus giganteus","3","DC",4,NA,NA,NA,NA,NA,NA,"Eriocnemis luciani","Feeding",NA,NA,NA,NA,NA,NA,NA,NA,18,"Siphocampylus giganteus",NA,NA,"Siphocampylus giganteus",NA,NA,NA,NA,NA
"1199","Yanacocha_disturbed","2018-02-08","1543","Tristerix sp.","Tristerix longebracteatus","4","DC",8,NA,NA,NA,NA,NA,NA,"Eriocnemis luciani","Feeding",NA,NA,NA,NA,NA,NA,NA,NA,19,"Tristerix longebracteatus",NA,NA,"Tristerix longebracteatus",NA,NA,NA,NA,NA
"1200","Yanacocha_disturbed","2018-02-08","1542",NA,NA,NA,NA,NA,NA,NA,NA,NA,NA,NA,"Eriocnemis luciani",NA,NA,NA,NA,NA,NA,NA,NA,NA,16,NA,NA,NA,NA,NA,NA,NA,NA,NA
"1201","Yanacocha_disturbed","2018-02-08","1586",NA,NA,NA,"DC",NA,NA,NA,NA,NA,NA,NA,"Eriocnemis luciani","Perch",NA,NA,NA,NA,NA,NA,NA,NA,87,NA,NA,NA,NA,NA,NA,NA,NA,NA
"1202","Yanacocha_disturbed","2018-06-04","924","Siphocampylus giganteus","Siphocampylus giganteus","3","DC",39,NA,NA,NA,NA,NA,NA,"Ensifera ensifera",NA,NA,NA,NA,NA,NA,NA,NA,NA,387,"Siphocampylus giganteus",NA,NA,"Siphocampylus giganteus",NA,NA,NA,NA,NA
"1203","Yanacocha_disturbed","2018-06-04","888",NA,NA,NA,NA,NA,NA,NA,NA,NA,NA,NA,"Metallura tyrianthina",NA,NA,NA,NA,NA,NA,NA,NA,NA,338,NA,NA,NA,NA,NA,NA,NA,NA,NA
"1204","Yanacocha_disturbed","2018-06-04","907",NA,NA,NA,NA,NA,NA,NA,NA,NA,NA,NA,"Metallura tyrianthina",NA,NA,NA,NA,NA,NA,NA,NA,NA,363,NA,NA,NA,NA,NA,NA,NA,NA,NA
"1205","Yanacocha_disturbed","2018-10-05","2986","Barnadesia spinosa","Barnadesia spinosa","1","DC",2,NA,NA,NA,NA,NA,NA,"Eriocnemis luciani","perching",NA,NA,NA,NA,NA,NA,NA,NA,572,"Barnadesia spinosa",NA,NA,"Barnadesia spinosa",NA,NA,NA,NA,NA
"1206","Yanacocha_disturbed","2018-10-05","2986",NA,NA,NA,"DC",NA,NA,NA,NA,NA,NA,NA,"Eriocnemis luciani",NA,NA,NA,NA,NA,NA,NA,NA,NA,573,NA,NA,NA,NA,NA,NA,NA,NA,NA
"1207","Yanacocha_disturbed","2018-12-03","803",NA,NA,NA,NA,NA,NA,NA,NA,NA,NA,NA,"Metallura tyrianthina",NA,NA,NA,NA,NA,NA,NA,NA,NA,695,NA,NA,NA,NA,NA,NA,NA,NA,NA
"1208","Yanacocha_disturbed","2018-12-03","806","Brachyotum ledifolium","Brachyotum ledifolium","3","DC",58,NA,NA,NA,NA,NA,NA,"Metallura tyrianthina","hovering, no piercing",NA,NA,NA,NA,NA,NA,NA,NA,701,"Brachyotum ledifolium",NA,NA,"Brachyotum ledifolium",NA,NA,NA,NA,NA
"1209","Yanacocha_disturbed","2018-12-03","825",NA,NA,NA,NA,NA,NA,NA,NA,NA,NA,NA,"Ensifera ensifera",NA,NA,NA,NA,NA,NA,NA,NA,NA,737,NA,NA,NA,NA,NA,NA,NA,NA,NA
"1210","Yanacocha_disturbed","2018-12-03","826",NA,NA,NA,NA,NA,NA,NA,NA,NA,NA,NA,"Eriocnemis luciani",NA,NA,NA,NA,NA,NA,NA,NA,NA,741,NA,NA,NA,NA,NA,NA,NA,NA,NA
"1211","Yanacocha_disturbed","2019-02-05","130",NA,NA,NA,NA,NA,NA,NA,NA,NA,NA,NA,"Metallura tyrianthina",NA,NA,NA,NA,NA,NA,NA,NA,NA,822,NA,NA,NA,NA,NA,NA,NA,NA,NA
"1212","Yanacocha_disturbed","2019-02-05","151",NA,NA,NA,NA,NA,NA,NA,NA,NA,NA,NA,"Eriocnemis luciani",NA,NA,NA,NA,NA,NA,NA,NA,NA,NA,NA,NA,NA,NA,NA,NA,NA,NA,NA
"1213","Yanacocha_disturbed","2019-02-05","168","Brachyotum ledifolium","Brachyotum ledifolium","2","DC",11,NA,NA,NA,NA,NA,NA,"Metallura tyrianthina",NA,NA,NA,NA,NA,NA,NA,NA,NA,NA,"Brachyotum ledifolium",NA,NA,"Brachyotum ledifolium",NA,NA,NA,NA,NA
"1214","Yanacocha_disturbed","2019-04-11","478",NA,NA,NA,NA,NA,NA,NA,NA,NA,NA,NA,"Metallura tyrianthina",NA,NA,NA,NA,NA,NA,NA,NA,NA,NA,NA,NA,NA,NA,NA,NA,NA,NA,NA
"1215","Yanacocha_disturbed","2019-04-11","525","Barnadesia spinosa","Barnadesia spinosa","2","DC",1,NA,NA,NA,NA,NA,NA,"Aglaeactis cupripennis","perching",NA,NA,NA,NA,NA,NA,NA,NA,NA,"Barnadesia spinosa",NA,NA,"Barnadesia spinosa",NA,NA,NA,NA,NA
"1216","Yanacocha_disturbed","2019-04-11","536",NA,NA,NA,NA,NA,NA,NA,NA,NA,NA,NA,"Eriocnemis luciani","Feeding",NA,NA,NA,NA,NA,NA,NA,NA,NA,NA,NA,NA,NA,NA,NA,NA,NA,NA
"1217","Yanacocha_disturbed","2019-04-11","546","Siphocampylus giganteus","Siphocampylus giganteus","3","DC",3,NA,NA,NA,NA,NA,NA,"Eriocnemis luciani","Feeding",NA,NA,NA,NA,NA,NA,NA,NA,NA,"Siphocampylus giganteus",NA,NA,"Siphocampylus giganteus",NA,NA,NA,NA,NA
"1218","Yanacocha_disturbed","2019-04-11","547","Siphocampylus giganteus","Siphocampylus giganteus","3","DC",1,NA,NA,NA,NA,NA,NA,"Eriocnemis luciani","Feeding",NA,NA,NA,NA,NA,NA,NA,NA,NA,"Siphocampylus giganteus",NA,NA,"Siphocampylus giganteus",NA,NA,NA,NA,NA
"1219","Yanacocha_disturbed","2019-04-11","547","Brachyotum ledifolium","Brachyotum ledifolium","3","DC",1,NA,NA,NA,NA,NA,NA,"Eriocnemis luciani","Feeding",NA,NA,NA,NA,NA,NA,NA,NA,NA,"Brachyotum ledifolium",NA,NA,"Brachyotum ledifolium",NA,NA,NA,NA,NA
"1220","Yanacocha","18/02/2017","65",NA,NA,NA,NA,NA,NA,NA,NA,NA,NA,NA,"Metallura tyrianthina","two individuals calling",NA,NA,NA,NA,NA,NA,NA,NA,NA,NA,"February","2017",NA,-78.5895743,-0.1163114,"3509.151","18-FEB-17 6:32:12",2017-02-18 06:32:12
"1221","Yanacocha","18/02/2017","69",NA,NA,NA,NA,NA,NA,NA,NA,NA,NA,NA,"Metallura tyrianthina",NA,NA,NA,NA,NA,NA,NA,NA,NA,NA,NA,"February","2017",NA,-78.5897677,-0.11685,"3521.408","18-FEB-17 6:49:25",2017-02-18 06:49:25
"1222","Yanacocha","18/02/2017","74",NA,NA,NA,NA,NA,NA,NA,NA,NA,NA,NA,"Coeligena lutetiae",NA,NA,NA,NA,NA,NA,NA,NA,NA,NA,NA,"February","2017",NA,-78.5899051,-0.1171989,"3530.781","18-FEB-17 7:10:14",2017-02-18 07:10:14
"1223","Yanacocha","18/02/2017","75",NA,NA,NA,NA,NA,NA,NA,NA,NA,NA,NA,"Coeligena lutetiae","perchado 00:00:15",NA,NA,NA,NA,NA,NA,NA,NA,NA,NA,"February","2017",NA,-78.5899836,-0.1173199,"3532.223","18-FEB-17 7:14:36",2017-02-18 07:14:36
"1224","Yanacocha","18/02/2017","75",NA,NA,NA,NA,NA,NA,NA,NA,NA,NA,NA,"Metallura tyrianthina",NA,NA,NA,NA,NA,NA,NA,NA,NA,NA,NA,"February","2017",NA,-78.5899836,-0.1173199,"3532.223","18-FEB-17 7:14:36",2017-02-18 07:14:36
"1225","Yanacocha","18/02/2017","78",NA,NA,NA,NA,NA,NA,NA,NA,NA,NA,NA,"Coeligena lutetiae",NA,NA,NA,NA,NA,NA,NA,NA,NA,NA,NA,"February","2017",NA,-78.5900784,-0.1175193,"3525.494","18-FEB-17 7:24:07",2017-02-18 07:24:07
"1226","Yanacocha","18/02/2017","81",NA,NA,NA,NA,NA,NA,NA,NA,NA,NA,NA,"Coeligena lutetiae","pasa volando",NA,NA,NA,NA,NA,NA,NA,NA,NA,NA,"February","2017",NA,-78.5903355,-0.1176683,"3509.873","18-FEB-17 7:37:05",2017-02-18 07:37:05
"1227","Yanacocha","18/02/2017","81",NA,NA,NA,NA,NA,NA,NA,NA,NA,NA,NA,"Metallura tyrianthina","pasa volando",NA,NA,NA,NA,NA,NA,NA,NA,NA,NA,"February","2017",NA,-78.5903355,-0.1176683,"3509.873","18-FEB-17 7:37:05",2017-02-18 07:37:05
"1228","Yanacocha","18/02/2017","85",NA,NA,NA,NA,NA,NA,NA,NA,NA,NA,NA,"Coeligena lutetiae","pasa volando",NA,NA,NA,NA,NA,NA,NA,NA,NA,NA,"February","2017",NA,-78.5904074,-0.1179548,"3507.950","18-FEB-17 7:50:24",2017-02-18 07:50:24
"1229","Yanacocha","18/02/2017","93",NA,NA,NA,NA,NA,NA,NA,NA,NA,NA,NA,"Coeligena lutetiae","pasa volando",NA,NA,NA,NA,NA,NA,NA,NA,NA,NA,"February","2017",NA,-78.5903338,-0.11868,"3513.237","18-FEB-17 8:11:23",2017-02-18 08:11:23
"1230","Yanacocha","18/02/2017","93",NA,NA,NA,NA,NA,NA,NA,NA,NA,NA,NA,"Coeligena lutetiae","2 ind. Pasan volando",NA,NA,NA,NA,NA,NA,NA,NA,NA,NA,"February","2017",NA,-78.5903338,-0.11868,"3513.237","18-FEB-17 8:11:23",2017-02-18 08:11:23
"1231","Yanacocha","18/02/2017","98",NA,NA,NA,NA,NA,NA,NA,NA,NA,NA,NA,"Metallura tyrianthina",NA,NA,NA,NA,NA,NA,NA,NA,NA,NA,NA,"February","2017",NA,-78.5906407,-0.1190595,"3509.873","18-FEB-17 8:29:26",2017-02-18 08:29:26
"1232","Yanacocha","18/02/2017","103",NA,NA,NA,NA,NA,NA,NA,NA,NA,NA,NA,"Coeligena lutetiae",NA,NA,NA,NA,NA,NA,NA,NA,NA,NA,NA,"February","2017",NA,-78.5905687,-0.1195677,"3517.803","18-FEB-17 8:48:59",2017-02-18 08:48:59
"1233","Yanacocha","18/02/2017","109",NA,NA,NA,NA,NA,NA,NA,NA,NA,NA,NA,"Coeligena lutetiae","2 ind pasan volando",NA,NA,NA,NA,NA,NA,NA,NA,NA,NA,"February","2017",NA,-78.589623,-0.11641,"3502.742","2019-02-07T13:46:50Z",2019-02-07 13:46:50
"1234","Yanacocha","18/02/2017","114",NA,NA,NA,NA,NA,NA,NA,NA,NA,NA,NA,"Metallura tyrianthina",NA,NA,NA,NA,NA,NA,NA,NA,NA,NA,NA,"February","2017",NA,-78.589782,-0.116997,"3518.768","2019-02-07T13:57:33Z",2019-02-07 13:57:33
"1235","Yanacocha","18/02/2017","114",NA,NA,NA,NA,NA,NA,NA,NA,NA,NA,NA,"Coeligena lutetiae",NA,"2 ind",NA,NA,NA,NA,NA,NA,NA,NA,NA,"February","2017",NA,-78.589782,-0.116997,"3518.768","2019-02-07T13:57:33Z",2019-02-07 13:57:33
"1236","Yanacocha","18/02/2017","117",NA,NA,NA,NA,NA,NA,NA,NA,NA,NA,NA,"Coeligena lutetiae",NA,NA,NA,NA,NA,NA,NA,NA,NA,NA,NA,"February","2017",NA,-78.590033,-0.117501,"3520.009","2019-02-07T14:06:21Z",2019-02-07 14:06:21
"1237","Yanacocha","18/02/2017","122",NA,NA,NA,NA,NA,NA,NA,NA,NA,NA,NA,"Coeligena lutetiae",NA,"2 ind pasan volando",NA,NA,NA,NA,NA,NA,NA,NA,NA,"February","2017",NA,-78.590318,-0.117605,"3506.799","2019-02-07T14:16:36Z",2019-02-07 14:16:36
"1238","Yanacocha","18/02/2017","124",NA,NA,NA,NA,NA,NA,NA,NA,NA,NA,NA,"Lafresnaya lafresnayi","volando 2 sec",NA,NA,NA,NA,NA,NA,NA,NA,NA,NA,"February","2017",NA,-78.59044,-0.117986,"3507.875","2019-02-07T14:24:22Z",2019-02-07 14:24:22
"1239","Yanacocha","18/02/2017","130",NA,NA,NA,NA,NA,NA,NA,NA,NA,NA,NA,"Coeligena lutetiae",NA,NA,NA,NA,NA,NA,NA,NA,NA,NA,NA,"February","2017",NA,-78.590443,-0.11859,"3514.136","2019-02-07T14:45:07Z",2019-02-07 14:45:07
"1240","Yanacocha","18/02/2017","134",NA,NA,NA,NA,NA,NA,NA,NA,NA,NA,NA,"Coeligena lutetiae","perch 2 sec",NA,NA,NA,NA,NA,NA,NA,NA,NA,NA,"February","2017",NA,-78.590636,-0.118935,"3514.219","2019-02-07T14:56:40Z",2019-02-07 14:56:40
"1241","Yanacocha","18/02/2017","141",NA,NA,NA,NA,NA,NA,NA,NA,NA,NA,NA,"Coeligena lutetiae",NA,NA,NA,NA,NA,NA,NA,NA,NA,NA,NA,"February","2017",NA,-78.590531,-0.119408,"3515.579","2019-02-07T15:12:25Z",2019-02-07 15:12:25
"1242","Yanacocha","18/02/2017","143",NA,NA,NA,NA,NA,NA,NA,NA,NA,NA,NA,"Coeligena lutetiae",NA,NA,NA,NA,NA,NA,NA,NA,NA,NA,NA,"February","2017",NA,-78.590529,-0.119572,"3518.592","2019-02-07T15:15:01Z",2019-02-07 15:15:01
"1243","Yanacocha","18/02/2017","143",NA,NA,NA,NA,NA,NA,NA,NA,NA,NA,NA,"Metallura tyrianthina",NA,NA,NA,NA,NA,NA,NA,NA,NA,NA,NA,"February","2017",NA,-78.590529,-0.119572,"3518.592","2019-02-07T15:15:01Z",2019-02-07 15:15:01
"1244","Yanacocha","18/02/2017","145",NA,NA,NA,NA,NA,NA,NA,NA,NA,NA,NA,"Coeligena lutetiae","3 ind. Peleando en una Fuchsia por 3 sec",NA,NA,NA,NA,NA,NA,NA,NA,NA,NA,"February","2017",NA,-78.590582,-0.119722,"3518.159","2019-02-07T15:19:17Z",2019-02-07 15:19:17
"1245","Yanacocha","18/02/2017","164",NA,NA,NA,NA,NA,NA,NA,NA,NA,NA,NA,"Coeligena lutetiae",NA,NA,NA,NA,NA,NA,NA,NA,NA,NA,NA,"February","2017",NA,-78.590116,-0.121405,"3503.604","2019-02-07T16:03:00Z",2019-02-07 16:03:00
"1246","Yanacocha","17/03/2017","24",NA,NA,NA,NA,NA,NA,NA,NA,NA,NA,NA,"Metallura tyrianthina",NA,"GPS amarillo no buena se√±al",NA,NA,NA,NA,NA,NA,NA,NA,NA,"March","2017",NA,-78.590415,-0.118418,"3505.827","2019-03-07T14:03:18Z",2019-03-07 14:03:18
"1247","Yanacocha","17/03/2017","28","Tillandsia sp. 1","Tillandsia polyantha","6","DC",4,NA,NA,NA,NA,NA,NA,"Eriocnemis luciani",NA,"morada, error 24 m en GPS",NA,NA,NA,NA,NA,NA,NA,NA,"Tillandsia polyantha","March","2017","Tillandsia polyantha",-78.590448,-0.118681,"3507.997","2019-03-07T14:12:07Z",2019-03-07 14:12:07
"1248","Yanacocha","17/03/2017","32","Columnea dielsii","Columnea dielsii","3","DC",2,NA,NA,NA,NA,NA,NA,"Coeligena lutetiae","feeding from C. dielsii - 6 sec.","GPS amarillo no buena se√±al",NA,NA,NA,NA,NA,NA,NA,NA,"Columnea dielsii","March","2017","Columnea dielsii",-78.590594,-0.119054,"3506.733","2019-03-07T14:22:19Z",2019-03-07 14:22:19
"1249","Yanacocha","17/03/2017","33","Fuchsia cinerea",NA,"5","DC",10,NA,NA,NA,NA,NA,NA,"Coeligena lutetiae","hovering 2 sec","error 27 m en GPS",NA,NA,NA,NA,NA,NA,NA,NA,"Fuchsia cinerea","March","2017","Fuchsia cinerea",-78.590574,-0.119085,"3506.934","2019-03-07T14:23:19Z",2019-03-07 14:23:19
"1250","Yanacocha","17/03/2017","38","Columnea dielsii","Columnea dielsii","6","DC",7,NA,NA,NA,NA,NA,NA,"Metallura tyrianthina",NA,"GPS amarillo no buena se√±al",NA,NA,NA,NA,NA,NA,NA,NA,"Columnea dielsii","March","2017","Columnea dielsii",-78.590524,-0.119438,"3504.115","2019-03-07T14:36:33Z",2019-03-07 14:36:33
"1251","Yanacocha","17/03/2017",NA,"Fuchsia cinerea",NA,"8","DC",7,NA,NA,NA,NA,NA,NA,"Metallura tyrianthina",NA,"Error GPS",NA,NA,NA,NA,NA,NA,NA,NA,"Fuchsia cinerea","March","2017","Fuchsia cinerea",NA,NA,NA,NA,NA
"1252","Yanacocha","17/03/2017",NA,"Maclaenia rupestris","Maclaenia rupestris","3","DC",8,NA,NA,NA,NA,NA,NA,"Eriocnemis luciani","4 individuals","Error GPS",NA,NA,NA,NA,NA,NA,NA,NA,"Macleania rupestris","March","2017","Macleania rupestris",NA,NA,NA,NA,NA
"1253","Yanacocha","17/03/2017","43","Columnea dielsii","Columnea dielsii","6","DC",2,NA,NA,NA,NA,NA,NA,"Coeligena lutetiae",NA,"error 20m en GPS",NA,NA,NA,NA,NA,NA,NA,NA,"Columnea dielsii","March","2017","Columnea dielsii",-78.590576,-0.11972,"3507.829","2019-03-07T14:46:05Z",2019-03-07 14:46:05
"1254","Yanacocha","17/03/2017","53","Maclaenia rupestris","Maclaenia rupestris","3","DC",6,NA,NA,NA,NA,NA,NA,"Coeligena lutetiae",NA,"error 27m en GPS",NA,NA,NA,NA,NA,NA,NA,NA,"Macleania rupestris","March","2017","Macleania rupestris",-78.590393,-0.120396,"3507.845","2019-03-07T15:04:09Z",2019-03-07 15:04:09
"1255","Yanacocha","17/03/2017","60","Columnea dielsii","Columnea dielsii","5","DC",6,NA,NA,NA,NA,NA,NA,"Coeligena lutetiae",NA,"error 58m en GPS",NA,NA,NA,NA,NA,NA,NA,NA,"Columnea dielsii","March","2017","Columnea dielsii",-78.590742,-0.120993,"3514.607","2019-03-07T15:17:33Z",2019-03-07 15:17:33
"1256","Yanacocha","17/03/2017",NA,"Columnea dielsii","Columnea dielsii","3","DC",3,NA,NA,NA,NA,NA,NA,"Coeligena lutetiae","two individuals. 1 perching",NA,NA,NA,NA,NA,NA,NA,NA,NA,"Columnea dielsii","March","2017","Columnea dielsii",NA,NA,NA,NA,NA
"1257","Yanacocha","17/03/2017",NA,"Centropogon pichinchensis","Centropogon pichinchensis","2","DC",1,NA,NA,NA,NA,NA,NA,"Coeligena lutetiae",NA,"Error GPS",NA,NA,NA,NA,NA,NA,NA,NA,"Centropogon pichinchensis","March","2017","Centropogon pichinchensis",NA,NA,NA,NA,NA
"1258","Yanacocha","17/03/2017","66","Columnea dielsii","Columnea dielsii","5","DC",18,NA,NA,NA,NA,NA,NA,"Coeligena lutetiae",NA,"error 14m en GPS",NA,NA,NA,NA,NA,NA,NA,NA,"Columnea dielsii","March","2017","Columnea dielsii",-78.590267,-0.12126,"3505.819","2019-03-07T15:25:33Z",2019-03-07 15:25:33
"1259","Yanacocha","17/03/2017","76","Centropogon pichinchensis","Centropogon pichinchensis","3","DC",1,NA,NA,NA,NA,NA,NA,"Coeligena lutetiae",NA,"error 14m en GPS",NA,NA,NA,NA,NA,NA,NA,NA,"Centropogon pichinchensis","March","2017","Centropogon pichinchensis",-78.589904,-0.12215,"3508.111","2019-03-07T15:41:34Z",2019-03-07 15:41:34
"1260","Yanacocha","17/03/2017",NA,"Fuchsia cinerea",NA,"4","DC",2,NA,NA,NA,NA,NA,NA,"Coeligena lutetiae",NA,"Error GPS",NA,NA,NA,NA,NA,NA,NA,NA,"Fuchsia cinerea","March","2017","Fuchsia cinerea",NA,NA,NA,NA,NA
"1261","Yanacocha","04/04/2017","1",NA,NA,NA,NA,NA,NA,NA,NA,NA,NA,NA,"Coeligena lutetiae",NA,NA,NA,NA,NA,NA,NA,NA,NA,NA,NA,"April","2017",NA,-78.58962,-0.11635,"3502.309","2017-04-04T12:47:50Z",2017-04-04 12:47:50
"1262","Yanacocha","04/04/2017","3",NA,NA,NA,NA,NA,NA,NA,NA,NA,NA,NA,"Metallura tyrianthina",NA,NA,NA,NA,NA,NA,NA,NA,NA,NA,NA,"April","2017",NA,-78.589775,-0.116899,"3514.853","2017-04-04T13:06:25Z",2017-04-04 13:06:25
"1263","Yanacocha","04/04/2017","5",NA,NA,NA,NA,NA,NA,NA,NA,NA,NA,NA,"Metallura tyrianthina","Volando 2""",NA,NA,NA,NA,NA,NA,NA,NA,NA,NA,"April","2017",NA,-78.589856,-0.117108,"3518.874","2017-04-04T13:10:19Z",2017-04-04 13:10:19
"1264","Yanacocha","04/04/2017","6","Tropaeolum sp. 1","Tropaeolum tuberosum","3","DC",25,NA,NA,NA,NA,NA,NA,"Coeligena lutetiae","Comiendo 2""",NA,NA,NA,NA,NA,NA,NA,NA,NA,"Tropaeolum tuberosum","April","2017","Tropaeolum tuberosum",-78.589915,-0.117192,"3520.351","2017-04-04T13:14:27Z",2017-04-04 13:14:27
"1265","Yanacocha","04/04/2017","8",NA,NA,NA,NA,NA,NA,NA,NA,NA,NA,NA,"Lafresnaya lafresnayi",NA,NA,NA,NA,NA,NA,NA,NA,NA,NA,NA,"April","2017",NA,-78.590025,-0.117316,"3521.088","2017-04-04T13:20:02Z",2017-04-04 13:20:02
"1266","Yanacocha","04/04/2017","10",NA,NA,NA,NA,NA,NA,NA,NA,NA,NA,NA,"Metallura tyrianthina",NA,NA,NA,NA,NA,NA,NA,NA,NA,NA,NA,"April","2017",NA,-78.590113,-0.117577,"3516.340","2017-04-04T13:26:29Z",2017-04-04 13:26:29
"1267","Yanacocha","04/04/2017","11",NA,NA,NA,NA,NA,NA,NA,NA,NA,NA,NA,"Metallura tyrianthina",NA,NA,NA,NA,NA,NA,NA,NA,NA,NA,NA,"April","2017",NA,-78.590141,-0.117406,"3511.197","2017-04-04T13:29:00Z",2017-04-04 13:29:00
"1268","Yanacocha","04/04/2017","10",NA,NA,NA,NA,NA,NA,NA,NA,NA,NA,NA,"Coeligena lutetiae",NA,NA,NA,NA,NA,NA,NA,NA,NA,NA,NA,"April","2017",NA,-78.590113,-0.117577,"3516.340","2017-04-04T13:26:29Z",2017-04-04 13:26:29
"1269","Yanacocha","04/04/2017","12",NA,NA,NA,NA,NA,NA,NA,NA,NA,NA,NA,"Metallura tyrianthina",NA,NA,NA,NA,NA,NA,NA,NA,NA,NA,NA,"April","2017",NA,-78.590233,-0.117465,"3505.716","2017-04-04T13:32:25Z",2017-04-04 13:32:25
"1270","Yanacocha","04/04/2017","13",NA,NA,NA,NA,NA,NA,NA,NA,NA,NA,NA,"Metallura tyrianthina",NA,NA,NA,NA,NA,NA,NA,NA,NA,NA,NA,"April","2017",NA,-78.590244,-0.117658,"3503.733","2017-04-04T13:37:01Z",2017-04-04 13:37:01
"1271","Yanacocha","04/04/2017","14",NA,NA,NA,NA,NA,NA,NA,NA,NA,NA,NA,"Metallura tyrianthina",NA,NA,NA,NA,NA,NA,NA,NA,NA,NA,NA,"April","2017",NA,-78.59032,-0.117746,"3503.200","2017-04-04T13:39:42Z",2017-04-04 13:39:42
"1272","Yanacocha","04/04/2017","16",NA,NA,NA,NA,NA,NA,NA,NA,NA,NA,NA,"Metallura tyrianthina",NA,NA,NA,NA,NA,NA,NA,NA,NA,NA,NA,"April","2017",NA,-78.590281,-0.117905,"3501.389","2017-04-04T13:42:50Z",2017-04-04 13:42:50
"1273","Yanacocha","04/04/2017","20",NA,NA,NA,NA,NA,NA,NA,NA,NA,NA,NA,"Metallura tyrianthina",NA,NA,NA,NA,NA,NA,NA,NA,NA,NA,NA,"April","2017",NA,-78.590397,-0.118281,"3501.547","2017-04-04T13:53:26Z",2017-04-04 13:53:26
"1274","Yanacocha","04/04/2017","22",NA,NA,NA,NA,NA,NA,NA,NA,NA,NA,NA,"Coeligena lutetiae",NA,NA,NA,NA,NA,NA,NA,NA,NA,NA,NA,"April","2017",NA,-78.590391,-0.118468,"3501.200","2017-04-04T14:03:07Z",2017-04-04 14:03:07
"1275","Yanacocha","04/04/2017","24",NA,NA,NA,NA,NA,NA,NA,NA,NA,NA,NA,"Metallura tyrianthina",NA,NA,NA,NA,NA,NA,NA,NA,NA,NA,NA,"April","2017",NA,-78.590479,-0.118675,"3505.489","2017-04-04T14:08:54Z",2017-04-04 14:08:54
"1276","Yanacocha","04/04/2017","28",NA,NA,NA,NA,NA,NA,NA,NA,NA,NA,NA,"Metallura tyrianthina",NA,NA,NA,NA,NA,NA,NA,NA,NA,NA,NA,"April","2017",NA,-78.590661,-0.118884,"3505.136","2017-04-04T14:15:44Z",2017-04-04 14:15:44
"1277","Yanacocha","04/04/2017","29",NA,NA,NA,NA,NA,NA,NA,NA,NA,NA,NA,"Metallura tyrianthina",NA,NA,NA,NA,NA,NA,NA,NA,NA,NA,NA,"April","2017",NA,-78.590726,-0.118963,"3504.284","2017-04-04T14:21:02Z",2017-04-04 14:21:02
"1278","Yanacocha","04/04/2017","31",NA,NA,NA,NA,NA,NA,NA,NA,NA,NA,NA,"Metallura tyrianthina",NA,NA,NA,NA,NA,NA,NA,NA,NA,NA,NA,"April","2017",NA,-78.590672,-0.119058,"3500.339","2017-04-04T14:33:33Z",2017-04-04 14:33:33
"1279","Yanacocha","04/04/2017","34",NA,NA,NA,NA,NA,NA,NA,NA,NA,NA,NA,"Metallura tyrianthina",NA,NA,NA,NA,NA,NA,NA,NA,NA,NA,NA,"April","2017",NA,-78.590549,-0.119252,"3497.984","2017-04-04T14:38:05Z",2017-04-04 14:38:05
"1280","Yanacocha","04/04/2017","45",NA,NA,NA,NA,NA,NA,NA,NA,NA,NA,NA,"Metallura tyrianthina",NA,NA,NA,NA,NA,NA,NA,NA,NA,NA,NA,"April","2017",NA,-78.590324,-0.120258,"3502.307","2017-04-04T14:57:31Z",2017-04-04 14:57:31
"1281","Yanacocha","04/04/2017","49",NA,NA,NA,NA,NA,NA,NA,NA,NA,NA,NA,"Metallura tyrianthina",NA,NA,NA,NA,NA,NA,NA,NA,NA,NA,NA,"April","2017",NA,-78.590763,-0.120959,"3512.468","2017-04-04T15:08:15Z",2017-04-04 15:08:15
"1282","Yanacocha","04/04/2017","58",NA,NA,NA,NA,NA,NA,NA,NA,NA,NA,NA,"Coeligena lutetiae",NA,NA,NA,NA,NA,NA,NA,NA,NA,NA,NA,"April","2017",NA,-78.590207,-0.12148,"3497.251","2017-04-04T15:40:36Z",2017-04-04 15:40:36
"1283","Yanacocha","04/04/2017","73",NA,NA,NA,NA,NA,NA,NA,NA,NA,NA,NA,"Eriocnemis luciani",NA,NA,NA,NA,NA,NA,NA,NA,NA,NA,NA,"April","2017",NA,-78.590129,-0.122436,"3505.155","2017-04-04T15:57:56Z",2017-04-04 15:57:56
"1284","Yanacocha","04/04/2017","78",NA,NA,NA,NA,NA,NA,NA,NA,NA,NA,NA,"Coeligena lutetiae",NA,NA,NA,NA,NA,NA,NA,NA,NA,NA,NA,"April","2017",NA,-78.590406,-0.122281,"3488.607","2017-04-04T16:07:27Z",2017-04-04 16:07:27
"1285","Yanacocha","04/04/2017","91","Maclaenia rupestris","Maclaenia rupestris","9","DC",8,NA,NA,NA,NA,NA,NA,"Coeligena lutetiae","Volando 3""",NA,NA,NA,NA,NA,NA,NA,NA,NA,"Macleania rupestris","April","2017","Macleania rupestris",-78.59074,-0.123171,"3483.085","2017-04-04T16:28:41Z",2017-04-04 16:28:41
"1286","Yanacocha","04/04/2017","99",NA,NA,NA,NA,NA,NA,NA,NA,NA,NA,NA,"Coeligena lutetiae",NA,NA,NA,NA,NA,NA,NA,NA,NA,NA,NA,"April","2017",NA,-78.590686,-0.123865,"3482.845","2017-04-04T16:41:20Z",2017-04-04 16:41:20
"1287","Yanacocha","04/04/2017","114","Tropaeolum sp. 1","Tropaeolum tuberosum","3","DC",19,NA,NA,NA,NA,NA,NA,"Metallura tyrianthina","Comiendo 10""",NA,NA,NA,NA,NA,NA,NA,NA,NA,"Tropaeolum tuberosum","April","2017","Tropaeolum tuberosum",-78.590924,-0.125104,"3483.052","2017-04-04T17:04:46Z",2017-04-04 17:04:46
"1288","Yanacocha","04/04/2017","122",NA,NA,NA,NA,NA,NA,NA,NA,NA,NA,NA,"Coeligena lutetiae",NA,NA,NA,NA,NA,NA,NA,NA,NA,NA,NA,"April","2017",NA,-78.591242,-0.125772,"3482.311","2017-04-04T17:23:44Z",2017-04-04 17:23:44
"1289","Yanacocha","06/05/2017","404",NA,NA,NA,NA,NA,NA,NA,NA,NA,NA,NA,"Coeligena lutetiae","A/V",NA,NA,NA,NA,NA,NA,NA,NA,NA,NA,"May","2017",NA,-78.589604,-0.116497,"3473.864","2017-05-06T13:29:40Z",2017-05-06 13:29:40
"1290","Yanacocha","06/05/2017","404",NA,NA,NA,NA,NA,NA,NA,NA,NA,NA,NA,"Metallura tyrianthina","A",NA,NA,NA,NA,NA,NA,NA,NA,NA,NA,"May","2017",NA,-78.589604,-0.116497,"3473.864","2017-05-06T13:29:40Z",2017-05-06 13:29:40
"1291","Yanacocha","06/05/2017",NA,NA,NA,NA,NA,NA,NA,NA,NA,NA,NA,NA,"Metallura tyrianthina","A",NA,NA,NA,NA,NA,NA,NA,NA,NA,NA,"May","2017",NA,NA,NA,NA,NA,NA
"1292","Yanacocha","06/05/2017","418",NA,NA,NA,NA,NA,NA,NA,NA,NA,NA,NA,"Coeligena lutetiae","A",NA,NA,NA,NA,NA,NA,NA,NA,NA,NA,"May","2017",NA,-78.590061,-0.117461,"3519.220","2017-05-06T14:53:51Z",2017-05-06 14:53:51
"1293","Yanacocha","06/05/2017","422",NA,NA,NA,NA,NA,NA,NA,NA,NA,NA,NA,"Metallura tyrianthina","A",NA,NA,NA,NA,NA,NA,NA,NA,NA,NA,"May","2017",NA,-78.590266,-0.117578,"3506.030","2017-05-06T15:12:32Z",2017-05-06 15:12:32
"1294","Yanacocha","06/05/2017","433",NA,NA,NA,NA,NA,NA,NA,NA,NA,NA,NA,"Eriocnemis luciani","A",NA,NA,NA,NA,NA,NA,NA,NA,NA,NA,"May","2017",NA,-78.590427,-0.118732,"3509.548","2017-05-06T15:38:58Z",2017-05-06 15:38:58
"1295","Yanacocha","06/05/2017","452",NA,NA,NA,NA,NA,NA,NA,NA,NA,NA,NA,"Metallura tyrianthina","A",NA,NA,NA,NA,NA,NA,NA,NA,NA,NA,"May","2017",NA,-78.590762,-0.120773,"3523.206","2017-05-06T16:42:15Z",2017-05-06 16:42:15
"1296","Yanacocha","06/05/2017","464",NA,NA,NA,NA,NA,NA,NA,NA,NA,NA,NA,"Metallura tyrianthina","A/V",NA,NA,NA,NA,NA,NA,NA,NA,NA,NA,"May","2017",NA,-78.590088,-0.121826,"3505.875","2017-05-06T17:18:37Z",2017-05-06 17:18:37
"1297","Yanacocha","06/05/2017","479","Salvia pichinchensis","Salvia pichinchensis","1","DC",9,NA,NA,NA,NA,NA,NA,"Coeligena lutetiae","A",NA,NA,NA,NA,NA,NA,NA,NA,NA,"Salvia pichinchensis","May","2017","Salvia pichinchensis",-78.590242,-0.12252,"3510.137","2017-05-06T17:53:20Z",2017-05-06 17:53:20
"1298","Yanacocha","06/05/2017","481","Centropogon pichinchensis","Centropogon pichinchensis","1","DC",5,NA,NA,NA,NA,NA,NA,"Coeligena lutetiae","V",NA,NA,NA,NA,NA,NA,NA,NA,NA,"Centropogon pichinchensis","May","2017","Centropogon pichinchensis",-78.59037,-0.122534,"3502.666","2017-05-06T17:58:49Z",2017-05-06 17:58:49
"1299","Yanacocha","06/05/2017","519","Tropaeolum sp. 1","Tropaeolum tuberosum","1","DC",1,NA,NA,NA,NA,NA,NA,"Metallura tyrianthina","A",NA,NA,NA,NA,NA,NA,NA,NA,NA,"Tropaeolum tuberosum","May","2017","Tropaeolum tuberosum",-78.59075,-0.124745,"3481.693","2017-05-06T19:12:05Z",2017-05-06 19:12:05
"1300","Yanacocha","14/06/2017","196",NA,NA,NA,NA,NA,NA,NA,NA,NA,NA,NA,"Coeligena lutetiae",NA,"heard",NA,NA,NA,NA,NA,NA,NA,NA,NA,"June","2017",NA,-78.589617,-0.116354,"3506.900","2017-06-14T13:18:26Z",2017-06-14 13:18:26
"1301","Yanacocha","14/06/2017","196",NA,NA,NA,NA,NA,NA,NA,NA,NA,NA,NA,"Ramphomicron microrhynchum",NA,"heard",NA,NA,NA,NA,NA,NA,NA,NA,NA,"June","2017",NA,-78.589617,-0.116354,"3506.900","2017-06-14T13:18:26Z",2017-06-14 13:18:26
"1302","Yanacocha","14/06/2017","198",NA,NA,NA,NA,NA,NA,NA,NA,NA,NA,NA,"Metallura tyrianthina",NA,"2 ind. heard",NA,NA,NA,NA,NA,NA,NA,NA,NA,"June","2017",NA,-78.589739,-0.116545,"3509.898","2017-06-14T13:25:09Z",2017-06-14 13:25:09
"1303","Yanacocha","14/06/2017","204",NA,NA,NA,NA,NA,NA,NA,NA,NA,NA,NA,"Eriocnemis luciani",NA,"heard",NA,NA,NA,NA,NA,NA,NA,NA,NA,"June","2017",NA,-78.589886,-0.117111,"3515.742","2017-06-14T13:45:21Z",2017-06-14 13:45:21
"1304","Yanacocha","14/06/2017","204","Verbesina sp. 1",NA,"7","ES",NA,"TRUE",NA,NA,NA,NA,NA,"Ramphomicron microrhynchum","feeding","Verbesina arborea? Se contaron los racimos con flores pero no se puede contar las flores en los racimos",NA,NA,NA,NA,NA,NA,NA,NA,"Verbesina sp1","June","2017","Verbesina sp1",-78.589886,-0.117111,"3515.742","2017-06-14T13:45:21Z",2017-06-14 13:45:21
"1305","Yanacocha","14/06/2017","205","Fuchsia cinerea",NA,"2","DC",3,NA,NA,NA,NA,NA,NA,"Coeligena lutetiae","feeding, perching","perching 10 sec",NA,NA,NA,NA,NA,NA,NA,NA,"Fuchsia cinerea","June","2017","Fuchsia cinerea",-78.589969,-0.117184,"3517.506","2017-06-14T13:53:50Z",2017-06-14 13:53:50
"1306","Yanacocha","14/06/2017","211",NA,NA,NA,NA,NA,NA,NA,NA,NA,NA,NA,"Ramphomicron microrhynchum",NA,"heard",NA,NA,NA,NA,NA,NA,NA,NA,NA,"June","2017",NA,-78.590328,-0.11736,"3505.792","2017-06-14T14:11:26Z",2017-06-14 14:11:26
"1307","Yanacocha","14/06/2017","211",NA,NA,NA,NA,NA,NA,NA,NA,NA,NA,NA,"Metallura tyrianthina",NA,"heard",NA,NA,NA,NA,NA,NA,NA,NA,NA,"June","2017",NA,-78.590328,-0.11736,"3505.792","2017-06-14T14:11:26Z",2017-06-14 14:11:26
"1308","Yanacocha","14/06/2017","215","Centropogon sp. 1","Siphocampylus rupestris","5","DC",62,NA,NA,NA,NA,NA,NA,"Coeligena lutetiae","feeding","30 sec",NA,NA,NA,NA,NA,NA,NA,NA,"Siphocampylus rupestris","June","2017","Siphocampylus rupestris",-78.590313,-0.11786,"3499.764","2017-06-14T14:23:33Z",2017-06-14 14:23:33
"1309","Yanacocha","14/06/2017","217","Maclaenia rupestris","Maclaenia rupestris","3","DC",15,NA,NA,NA,NA,NA,NA,"Eriocnemis luciani","feeding",NA,NA,NA,NA,NA,NA,NA,NA,NA,"Macleania rupestris","June","2017","Macleania rupestris",-78.590372,-0.118086,"3498.517","2017-06-14T14:32:43Z",2017-06-14 14:32:43
"1310","Yanacocha","14/06/2017","223","Maclaenia rupestris","Maclaenia rupestris","3","DC",3,NA,NA,NA,NA,NA,NA,"Eriocnemis luciani","feeding",NA,NA,NA,NA,NA,NA,NA,NA,NA,"Macleania rupestris","June","2017","Macleania rupestris",-78.590423,-0.118544,"3507.148","2017-06-14T14:59:32Z",2017-06-14 14:59:32
"1311","Yanacocha","14/06/2017","225","Maclaenia rupestris","Maclaenia rupestris","4","DC",1,NA,NA,NA,NA,NA,NA,"Coeligena lutetiae","feeding",NA,NA,NA,NA,NA,NA,NA,NA,NA,"Macleania rupestris","June","2017","Macleania rupestris",-78.590495,-0.118824,"3510.404","2017-06-14T15:15:07Z",2017-06-14 15:15:07
"1312","Yanacocha","14/06/2017","228","Centropogon pichinchensis","Centropogon pichinchensis","3","DC",18,NA,NA,NA,NA,NA,NA,"Coeligena lutetiae","feeding",NA,NA,NA,NA,NA,NA,NA,NA,NA,"Centropogon pichinchensis","June","2017","Centropogon pichinchensis",-78.590595,-0.119048,"3508.761","2017-06-14T15:24:27Z",2017-06-14 15:24:27
"1313","Yanacocha","14/06/2017","240",NA,NA,NA,NA,NA,NA,NA,NA,NA,NA,NA,"Metallura tyrianthina",NA,"heard",NA,NA,NA,NA,NA,NA,NA,NA,NA,"June","2017",NA,-78.590231,-0.120248,"3516.375","2017-06-14T16:32:59Z",2017-06-14 16:32:59
"1314","Yanacocha","14/06/2017","241",NA,NA,NA,NA,NA,NA,NA,NA,NA,NA,NA,"Ramphomicron microrhynchum",NA,"heard feeding",NA,NA,NA,NA,NA,NA,NA,NA,NA,"June","2017",NA,-78.590231,-0.120335,"3513.584","2017-06-14T16:42:04Z",2017-06-14 16:42:04
"1315","Yanacocha","14/06/2017","242","Disterigma alaternoides","Disterigma noyesiae","3","DC",20,NA,NA,NA,NA,NA,NA,"Metallura tyrianthina","feeding",NA,NA,NA,NA,NA,NA,NA,NA,NA,"Disterigma noyesiae","June","2017","Disterigma noyesiae",-78.590322,-0.120438,"3515.352","2017-06-14T16:45:42Z",2017-06-14 16:45:42
"1316","Yanacocha","14/06/2017","261",NA,NA,NA,NA,NA,NA,NA,NA,NA,NA,NA,"Coeligena lutetiae",NA,"flying",NA,NA,NA,NA,NA,NA,NA,NA,NA,"June","2017",NA,-78.589871,-0.122365,"3514.435","2017-06-14T18:17:57Z",2017-06-14 18:17:57
"1317","Yanacocha","14/06/2017","264",NA,NA,NA,NA,NA,NA,NA,NA,NA,NA,NA,"Metallura tyrianthina",NA,"heard",NA,NA,NA,NA,NA,NA,NA,NA,NA,"June","2017",NA,-78.590108,-0.122488,"3513.976","2017-06-14T18:27:54Z",2017-06-14 18:27:54
"1318","Yanacocha","14/06/2017","265",NA,NA,NA,NA,NA,NA,NA,NA,NA,NA,NA,"Coeligena lutetiae",NA,"flying",NA,NA,NA,NA,NA,NA,NA,NA,NA,"June","2017",NA,-78.59012,-0.122589,"3511.027","2017-06-14T18:32:15Z",2017-06-14 18:32:15
"1319","Yanacocha","14/06/2017","268","Centropogon sp. 1","Siphocampylus rupestris","2","DC",68,NA,NA,NA,NA,NA,NA,"Coeligena lutetiae","feeding",NA,NA,NA,NA,NA,NA,NA,NA,NA,"Siphocampylus rupestris","June","2017","Siphocampylus rupestris",-78.590335,-0.122584,"3502.216","2017-06-14T18:41:03Z",2017-06-14 18:41:03
"1320","Yanacocha","14/06/2017","271",NA,NA,NA,NA,NA,NA,NA,NA,NA,NA,NA,"Coeligena lutetiae",NA,"2 chaising",NA,NA,NA,NA,NA,NA,NA,NA,NA,"June","2017",NA,-78.590276,-0.122281,"3491.779","2017-06-14T18:51:38Z",2017-06-14 18:51:38
"1321","Yanacocha","14/06/2017","292","Centropogon sp. 1","Siphocampylus rupestris","10","DC",26,NA,NA,NA,NA,NA,NA,"Coeligena lutetiae","feeding",NA,NA,NA,NA,NA,NA,NA,NA,NA,"Siphocampylus rupestris","June","2017","Siphocampylus rupestris",-78.590535,-0.124271,"3469.977","2017-06-14T19:38:25Z",2017-06-14 19:38:25
"1322","Yanacocha","14/06/2017","307",NA,NA,NA,NA,NA,NA,NA,NA,NA,NA,NA,"Eriocnemis luciani","perching",NA,NA,NA,NA,NA,NA,NA,NA,NA,NA,"June","2017",NA,-78.591089,-0.125603,"3473.211","2017-06-14T20:05:15Z",2017-06-14 20:05:15
"1323","Yanacocha","14/06/2017","308","Centropogon pichinchensis","Centropogon pichinchensis","10","DC",6,NA,NA,NA,NA,NA,NA,"Eriocnemis luciani","feeding",NA,NA,NA,NA,NA,NA,NA,NA,NA,"Centropogon pichinchensis","June","2017","Centropogon pichinchensis",-78.591082,-0.12568,"3472.768","2017-06-14T20:07:18Z",2017-06-14 20:07:18
"1324","Yanacocha","14/07/2017","46",NA,NA,NA,NA,NA,NA,NA,NA,NA,NA,NA,"Metallura tyrianthina","perching","flying at the canopy, 2 ind.",NA,NA,NA,NA,NA,NA,NA,NA,NA,"July","2017",NA,-78.589744,-0.116569,"3511.414","2017-07-14T12:42:29Z",2017-07-14 12:42:29
"1325","Yanacocha","14/07/2017","47",NA,NA,NA,NA,NA,NA,NA,NA,NA,NA,NA,"Metallura tyrianthina","chaising",NA,NA,NA,NA,NA,NA,NA,NA,NA,NA,"July","2017",NA,-78.589783,-0.116667,"3513.670","2017-07-14T12:44:20Z",2017-07-14 12:44:20
"1326","Yanacocha","14/07/2017","48",NA,NA,NA,NA,NA,NA,NA,NA,NA,NA,NA,"Metallura tyrianthina","chaising","3 ind.",NA,NA,NA,NA,NA,NA,NA,NA,NA,"July","2017",NA,-78.589797,-0.116821,"3516.869","2017-07-14T12:47:23Z",2017-07-14 12:47:23
"1327","Yanacocha","14/07/2017","50",NA,NA,NA,NA,NA,NA,NA,NA,NA,NA,NA,"Eriocnemis luciani","heard",NA,NA,NA,NA,NA,NA,NA,NA,NA,NA,"July","2017",NA,-78.589828,-0.117001,"3519.340","2017-07-14T12:53:55Z",2017-07-14 12:53:55
"1328","Yanacocha","14/07/2017","52",NA,NA,NA,NA,NA,NA,NA,NA,NA,NA,NA,"Eriocnemis luciani","perching","5 sec",NA,NA,NA,NA,NA,NA,NA,NA,NA,"July","2017",NA,-78.589868,-0.117092,"3522.023","2017-07-14T12:58:28Z",2017-07-14 12:58:28
"1329","Yanacocha","14/07/2017","53",NA,NA,NA,NA,NA,NA,NA,NA,NA,NA,NA,"Coeligena lutetiae","heard",NA,NA,NA,NA,NA,NA,NA,NA,NA,NA,"July","2017",NA,-78.589926,-0.117206,"3523.396","2017-07-14T13:05:30Z",2017-07-14 13:05:30
"1330","Yanacocha","14/07/2017","54",NA,NA,NA,NA,NA,NA,NA,NA,NA,NA,NA,"Ramphomicron microrhynchum","perching","female",NA,NA,NA,NA,NA,NA,NA,NA,NA,"July","2017",NA,-78.59003,-0.117323,"3524.720","2017-07-14T13:09:28Z",2017-07-14 13:09:28
"1331","Yanacocha","14/07/2017","57",NA,NA,NA,NA,NA,NA,NA,NA,NA,NA,NA,"Metallura tyrianthina","heard",NA,NA,NA,NA,NA,NA,NA,NA,NA,NA,"July","2017",NA,-78.590196,-0.11741,"3514.708","2017-07-14T13:21:26Z",2017-07-14 13:21:26
"1332","Yanacocha","14/07/2017","65",NA,NA,NA,NA,NA,NA,NA,NA,NA,NA,NA,"Metallura tyrianthina","feeding","insects",NA,NA,NA,NA,NA,NA,NA,NA,NA,"July","2017",NA,-78.590402,-0.118342,"3505.154","2017-07-14T13:48:59Z",2017-07-14 13:48:59
"1333","Yanacocha","14/07/2017","68",NA,NA,NA,NA,NA,NA,NA,NA,NA,NA,NA,"Lafresnaya lafresnayi","perching",NA,NA,NA,NA,NA,NA,NA,NA,NA,NA,"July","2017",NA,-78.590371,-0.118563,"3505.838","2017-07-14T13:57:22Z",2017-07-14 13:57:22
"1334","Yanacocha","14/07/2017","74",NA,NA,NA,NA,NA,NA,NA,NA,NA,NA,NA,"Metallura tyrianthina","feeding",NA,NA,NA,NA,NA,NA,NA,NA,NA,NA,"July","2017",NA,-78.590602,-0.118922,"3507.923","2017-07-14T14:17:15Z",2017-07-14 14:17:15
"1335","Yanacocha","14/07/2017","78",NA,NA,NA,NA,NA,NA,NA,NA,NA,NA,NA,"Ramphomicron microrhynchum","heard",NA,NA,NA,NA,NA,NA,NA,NA,NA,NA,"July","2017",NA,-78.590488,-0.119479,"3503.463","2017-07-14T14:56:03Z",2017-07-14 14:56:03
"1336","Yanacocha","14/07/2017","81",NA,NA,NA,NA,NA,NA,NA,NA,NA,NA,NA,"Coeligena lutetiae","heard",NA,NA,NA,NA,NA,NA,NA,NA,NA,NA,"July","2017",NA,-78.59053,-0.119802,"3506.166","2017-07-14T15:03:01Z",2017-07-14 15:03:01
"1337","Yanacocha","14/07/2017","91",NA,NA,NA,NA,NA,NA,NA,NA,NA,NA,NA,"Metallura tyrianthina","heard",NA,NA,NA,NA,NA,NA,NA,NA,NA,NA,"July","2017",NA,-78.590396,-0.120424,"3508.706","2017-07-14T15:33:14Z",2017-07-14 15:33:14
"1338","Yanacocha","14/07/2017","116",NA,NA,NA,NA,NA,NA,NA,NA,NA,NA,NA,"Metallura tyrianthina","heard",NA,NA,NA,NA,NA,NA,NA,NA,NA,NA,"July","2017",NA,-78.590154,-0.122461,"3512.916","2017-07-14T16:32:14Z",2017-07-14 16:32:14
"1339","Yanacocha","14/07/2017","122",NA,NA,NA,NA,NA,NA,NA,NA,NA,NA,NA,"Ramphomicron microrhynchum","perching",NA,NA,NA,NA,NA,NA,NA,NA,NA,NA,"July","2017",NA,-78.590278,-0.122468,"3498.783","2017-07-14T16:45:31Z",2017-07-14 16:45:31
"1340","Yanacocha","14/07/2017","124",NA,NA,NA,NA,NA,NA,NA,NA,NA,NA,NA,"Coeligena lutetiae","perching",NA,NA,NA,NA,NA,NA,NA,NA,NA,NA,"July","2017",NA,-78.590262,-0.122292,"3489.615","2017-07-14T16:53:38Z",2017-07-14 16:53:38
"1341","Yanacocha","14/07/2017","125","Verbesina sp. 1",NA,"10","ES",NA,"TRUE",NA,NA,NA,NA,NA,"Ramphomicron microrhynchum","heard","43 racimos",NA,NA,NA,NA,NA,NA,NA,NA,"Verbesina sp1","July","2017","Verbesina sp1",-78.590569,-0.122505,"3481.470","2017-07-14T16:57:10Z",2017-07-14 16:57:10
"1342","Yanacocha","14/07/2017","140","Tropaeolum sp. 1","Tropaeolum tuberosum","4","DC",35,NA,NA,NA,NA,NA,NA,"Metallura tyrianthina","feeding, perching",NA,NA,NA,NA,NA,NA,NA,NA,NA,"Tropaeolum tuberosum","July","2017","Tropaeolum tuberosum",-78.590619,-0.123651,"3470.194","2017-07-14T17:24:40Z",2017-07-14 17:24:40
"1343","Yanacocha","14/07/2017","140",NA,NA,NA,NA,NA,NA,NA,NA,NA,NA,NA,"Metallura tyrianthina","heard",NA,NA,NA,NA,NA,NA,NA,NA,NA,NA,"July","2017",NA,-78.590619,-0.123651,"3470.194","2017-07-14T17:24:40Z",2017-07-14 17:24:40
"1344","Yanacocha","14/07/2017","145","Tropaeolum sp. 1","Tropaeolum tuberosum","2","DC",20,NA,NA,NA,NA,NA,NA,"Metallura tyrianthina","feeding, perching","female",NA,NA,NA,NA,NA,NA,NA,NA,"Tropaeolum tuberosum","July","2017","Tropaeolum tuberosum",-78.590508,-0.124123,"3469.212","2017-07-14T17:33:04Z",2017-07-14 17:33:04
"1345","Yanacocha","14/07/2017","147",NA,NA,NA,NA,NA,NA,NA,NA,NA,NA,NA,"Ramphomicron microrhynchum","perching",NA,NA,NA,NA,NA,NA,NA,NA,NA,NA,"July","2017",NA,-78.590531,-0.124451,"3469.094","2017-07-14T17:37:29Z",2017-07-14 17:37:29
"1346","Yanacocha","14/07/2017","154",NA,NA,NA,NA,NA,NA,NA,NA,NA,NA,NA,"Coeligena lutetiae","heard",NA,NA,NA,NA,NA,NA,NA,NA,NA,NA,"July","2017",NA,-78.590915,-0.124981,"3469.171","2017-07-14T17:48:30Z",2017-07-14 17:48:30
"1347","Yanacocha","14/07/2017","156",NA,NA,NA,NA,NA,NA,NA,NA,NA,NA,NA,"Ramphomicron microrhynchum","heard",NA,NA,NA,NA,NA,NA,NA,NA,NA,NA,"July","2017",NA,-78.590868,-0.125193,"3470.019","2017-07-14T17:51:11Z",2017-07-14 17:51:11
"1348","Yanacocha","14/07/2017","156",NA,NA,NA,NA,NA,NA,NA,NA,NA,NA,NA,"Metallura tyrianthina","heard",NA,NA,NA,NA,NA,NA,NA,NA,NA,NA,"July","2017",NA,-78.590868,-0.125193,"3470.019","2017-07-14T17:51:11Z",2017-07-14 17:51:11
"1349","Yanacocha","14/07/2017","162",NA,NA,NA,NA,NA,NA,NA,NA,NA,NA,NA,"Coeligena lutetiae","heard",NA,NA,NA,NA,NA,NA,NA,NA,NA,NA,"July","2017",NA,-78.5911,-0.12566,"3469.835","2017-07-14T18:01:18Z",2017-07-14 18:01:18
"1350","Yanacocha","14/07/2017","162",NA,NA,NA,NA,NA,NA,NA,NA,NA,NA,NA,"Ramphomicron microrhynchum","heard",NA,NA,NA,NA,NA,NA,NA,NA,NA,NA,"July","2017",NA,-78.5911,-0.12566,"3469.835","2017-07-14T18:01:18Z",2017-07-14 18:01:18
"1351","Yanacocha","09/08/2017","548","Axinaea sp. 1","Miconia corymbiformis","8","DC",25,NA,NA,NA,NA,NA,NA,"Metallura tyrianthina","feeding, perching",NA,NA,NA,NA,NA,NA,NA,NA,NA,"Miconia corymbiformis","August","2017","Miconia corymbiformis",-78.590652,-0.123612,"3484.118","2018-08-08T19:07:50Z",2018-08-08 19:07:50
"1352","Yanacocha","09/08/2017","549",NA,NA,NA,"DC",NA,NA,NA,NA,NA,NA,NA,"Coeligena lutetiae","heard",NA,NA,NA,NA,NA,NA,NA,NA,NA,NA,"August","2017",NA,-78.590603,-0.123682,"3484.208","2018-08-08T19:09:05Z",2018-08-08 19:09:05
"1353","Yanacocha","09/08/2017","551",NA,NA,NA,"DC",NA,NA,NA,NA,NA,NA,NA,"Coeligena lutetiae","perching",NA,NA,NA,NA,NA,NA,NA,NA,NA,NA,"August","2017",NA,-78.590558,-0.123797,"3485.647","2018-08-08T19:10:23Z",2018-08-08 19:10:23
"1354","Yanacocha","09/08/2017","554",NA,NA,NA,"DC",NA,NA,NA,NA,NA,NA,NA,"Ramphomicron microrhynchum","perching",NA,NA,NA,NA,NA,NA,NA,NA,NA,NA,"August","2017",NA,-78.590615,-0.124143,"3483.438","2018-08-08T19:13:37Z",2018-08-08 19:13:37
"1355","Yanacocha","09/08/2017","554",NA,NA,NA,"DC",NA,NA,NA,NA,NA,NA,NA,"Metallura tyrianthina","chaising",NA,NA,NA,NA,NA,NA,NA,NA,NA,NA,"August","2017",NA,-78.590615,-0.124143,"3483.438","2018-08-08T19:13:37Z",2018-08-08 19:13:37
"1356","Yanacocha","09/08/2017","555",NA,NA,NA,"DC",NA,NA,NA,NA,NA,NA,NA,"Eriocnemis luciani","heard, seen",NA,NA,NA,NA,NA,NA,NA,NA,NA,NA,"August","2017",NA,-78.590558,-0.12422,"3484.179","2018-08-08T19:14:25Z",2018-08-08 19:14:25
"1357","Yanacocha","09/08/2017","560",NA,NA,NA,"DC",NA,NA,NA,NA,NA,NA,NA,"Metallura tyrianthina","heard",NA,NA,NA,NA,NA,NA,NA,NA,NA,NA,"August","2017",NA,-78.590797,-0.124801,"3482.610","2018-08-08T19:20:12Z",2018-08-08 19:20:12
"1358","Yanacocha","09/08/2017","563",NA,NA,NA,"DC",NA,NA,NA,NA,NA,NA,NA,"Metallura tyrianthina","chaising","2 ind",NA,NA,NA,NA,NA,NA,NA,NA,NA,"August","2017",NA,-78.590885,-0.125042,"3482.427","2018-08-08T19:23:37Z",2018-08-08 19:23:37
"1359","Yanacocha","09/08/2017","564",NA,NA,NA,"DC",NA,NA,NA,NA,NA,NA,NA,"Coeligena lutetiae","volando, seen",NA,NA,NA,NA,NA,NA,NA,NA,NA,NA,"August","2017",NA,-78.590884,-0.125173,"3482.663","2018-08-08T19:24:22Z",2018-08-08 19:24:22
"1360","Yanacocha","09/08/2017","574",NA,NA,NA,"DC",NA,NA,NA,NA,NA,NA,NA,"Eriocnemis luciani","perching",NA,NA,NA,NA,NA,NA,NA,NA,NA,NA,"August","2017",NA,-78.590586,-0.118919,"3501.267","2017-08-09T15:26:46Z",2017-08-09 15:26:46
"1361","Yanacocha","09/08/2017",NA,NA,NA,NA,NA,NA,NA,NA,NA,NA,NA,NA,"Metallura tyrianthina","heard",NA,NA,NA,NA,NA,NA,NA,NA,NA,NA,"August","2017",NA,NA,NA,NA,NA,NA
"1362","Yanacocha","09/08/2017","601",NA,NA,NA,"DC",NA,NA,NA,NA,NA,NA,NA,"Coeligena lutetiae","perching",NA,NA,NA,NA,NA,NA,NA,NA,NA,NA,"August","2017",NA,-78.590068,-0.121823,"3493.074","2017-08-09T17:12:34Z",2017-08-09 17:12:34
"1363","Yanacocha","09/08/2017","614",NA,NA,NA,NA,NA,NA,NA,NA,NA,NA,NA,"Coeligena lutetiae","heard",NA,NA,NA,NA,NA,NA,NA,NA,NA,NA,"August","2017",NA,-78.590392,-0.122371,"3475.849","2017-08-09T17:40:43Z",2017-08-09 17:40:43
"1364","Yanacocha","09/08/2017","614",NA,NA,NA,"DC",NA,NA,NA,NA,NA,NA,NA,"Metallura tyrianthina","heard",NA,NA,NA,NA,NA,NA,NA,NA,NA,NA,"August","2017",NA,-78.590392,-0.122371,"3475.849","2017-08-09T17:40:43Z",2017-08-09 17:40:43
"1365","Yanacocha","09/08/2017","615",NA,NA,NA,NA,NA,NA,NA,NA,NA,NA,NA,"Ramphomicron microrhynchum","perching",NA,NA,NA,NA,NA,NA,NA,NA,NA,NA,"August","2017",NA,-78.590643,-0.122573,"3469.802","2017-08-09T17:45:31Z",2017-08-09 17:45:31
"1366","Yanacocha","09/08/2017","620",NA,NA,NA,"DC",NA,NA,NA,NA,NA,NA,NA,"Metallura tyrianthina","perching, feeding",NA,NA,NA,NA,NA,NA,NA,NA,NA,NA,"August","2017",NA,-78.590679,-0.123005,"3471.585","2017-08-09T17:58:34Z",2017-08-09 17:58:34
"1367","Yanacocha","09/08/2017","620",NA,NA,NA,"DC",NA,NA,NA,NA,NA,NA,NA,"Coeligena lutetiae","perching",NA,NA,NA,NA,NA,NA,NA,NA,NA,NA,"August","2017",NA,-78.590679,-0.123005,"3471.585","2017-08-09T17:58:34Z",2017-08-09 17:58:34
"1368","Yanacocha","09/08/2017","620",NA,NA,NA,"DC",NA,NA,NA,NA,NA,NA,NA,"Ramphomicron microrhynchum","heard",NA,NA,NA,NA,NA,NA,NA,NA,NA,NA,"August","2017",NA,-78.590679,-0.123005,"3471.585","2017-08-09T17:58:34Z",2017-08-09 17:58:34
"1369","Yanacocha","09/08/2017","623","Fuchsia cinerea",NA,"2","DC",15,NA,NA,NA,NA,NA,NA,"Metallura tyrianthina","heard","2 ind",NA,NA,NA,NA,NA,NA,NA,NA,"Fuchsia cinerea","August","2017","Fuchsia cinerea",-78.590677,-0.123333,"3471.011","2017-08-09T18:05:47Z",2017-08-09 18:05:47
"1370","Yanacocha","09/08/2017","627",NA,NA,NA,"DC",NA,NA,NA,NA,NA,NA,NA,"Metallura tyrianthina","feeding",NA,NA,NA,NA,NA,NA,NA,NA,NA,NA,"August","2017",NA,-78.590667,-0.123647,"3472.130","2017-08-09T18:15:10Z",2017-08-09 18:15:10
"1371","Yanacocha","09/08/2017","629",NA,NA,NA,"DC",NA,NA,NA,NA,NA,NA,NA,"Metallura tyrianthina","heard",NA,NA,NA,NA,NA,NA,NA,NA,NA,NA,"August","2017",NA,-78.590629,-0.123815,"3473.827","2017-08-09T18:19:37Z",2017-08-09 18:19:37
"1372","Yanacocha","09/08/2017","641",NA,NA,NA,NA,NA,NA,NA,NA,NA,NA,NA,"Coeligena lutetiae","heard",NA,NA,NA,NA,NA,NA,NA,NA,NA,NA,"August","2017",NA,-78.59098,-0.125244,"3476.509","2017-08-09T18:39:39Z",2017-08-09 18:39:39
"1373","Yanacocha","09/08/2017","646","Axinaea sp. 1","Miconia corymbiformis","10","DC",43,NA,NA,NA,NA,NA,NA,"Metallura tyrianthina","feeding",NA,NA,NA,NA,NA,NA,NA,NA,NA,"Miconia corymbiformis","August","2017","Miconia corymbiformis",-78.591154,-0.125734,"3476.470","2017-08-09T18:46:26Z",2017-08-09 18:46:26
"1374","Yanacocha","09/08/2017","649",NA,NA,NA,NA,NA,NA,NA,NA,NA,NA,NA,"Eriocnemis luciani","perching",NA,NA,NA,NA,NA,NA,NA,NA,NA,NA,"August","2017",NA,-78.591298,-0.125999,"3477.942","2017-08-09T18:53:14Z",2017-08-09 18:53:14
"1375","Yanacocha","09/08/2017","649",NA,NA,NA,NA,NA,NA,NA,NA,NA,NA,NA,"Lesbia nuna","feeding, perching",NA,NA,NA,NA,NA,NA,NA,NA,NA,NA,"August","2017",NA,-78.591298,-0.125999,"3477.942","2017-08-09T18:53:14Z",2017-08-09 18:53:14
"1376","Yanacocha","09/09/2017","120",NA,NA,NA,NA,NA,NA,NA,NA,NA,NA,NA,"Coeligena lutetiae","flying",NA,NA,NA,NA,NA,NA,NA,NA,NA,NA,"September","2017",NA,-78.589625,-0.116349,"3490.272","2017-09-08T12:58:18Z",2017-09-08 12:58:18
"1377","Yanacocha","09/09/2017","125","Tropaeolum sp. 1","Tropaeolum tuberosum","2","DC",40,NA,NA,NA,NA,NA,NA,"Eriocnemis luciani","feeding",NA,NA,NA,NA,NA,NA,NA,NA,NA,"Tropaeolum tuberosum","September","2017","Tropaeolum tuberosum",-78.589818,-0.117101,"3503.376","2017-09-08T13:24:44Z",2017-09-08 13:24:44
"1378","Yanacocha","09/09/2017","125","Centropogon pichinchensis","Centropogon pichinchensis","1","DC",2,NA,NA,NA,NA,NA,NA,"Metallura tyrianthina","feeding",NA,NA,NA,NA,NA,NA,NA,NA,NA,"Centropogon pichinchensis","September","2017","Centropogon pichinchensis",-78.589818,-0.117101,"3503.376","2017-09-08T13:24:44Z",2017-09-08 13:24:44
"1379","Yanacocha","09/09/2017","128","Racinaea tetrantha","Racinaea tetrantha","8","DC",5,NA,NA,NA,NA,NA,NA,"Ramphomicron microrhynchum","feeding","female",NA,NA,NA,NA,NA,NA,NA,NA,"Racinaea tetrantha","September","2017","Racinaea tetrantha",-78.589971,-0.117381,"3506.715","2017-09-08T13:34:48Z",2017-09-08 13:34:48
"1380","Yanacocha","09/09/2017","128",NA,NA,NA,NA,NA,NA,NA,NA,NA,NA,NA,"Metallura tyrianthina","chainsing R.microrhynchum",NA,NA,NA,NA,NA,NA,NA,NA,NA,NA,"September","2017",NA,-78.589971,-0.117381,"3506.715","2017-09-08T13:34:48Z",2017-09-08 13:34:48
"1381","Yanacocha","09/09/2017","130",NA,NA,NA,NA,NA,NA,NA,NA,NA,NA,NA,"Ramphomicron microrhynchum","heard",NA,NA,NA,NA,NA,NA,NA,NA,NA,NA,"September","2017",NA,-78.590037,-0.117554,"3504.648","2017-09-08T13:40:11Z",2017-09-08 13:40:11
"1382","Yanacocha","09/09/2017","132",NA,NA,NA,NA,NA,NA,NA,NA,NA,NA,NA,"Eriocnemis luciani","heard",NA,NA,NA,NA,NA,NA,NA,NA,NA,NA,"September","2017",NA,-78.59019,-0.117357,"3494.118","2017-09-08T13:47:10Z",2017-09-08 13:47:10
"1383","Yanacocha","09/09/2017","132",NA,NA,NA,NA,NA,NA,NA,NA,NA,NA,NA,"Metallura tyrianthina","flying","3 ind",NA,NA,NA,NA,NA,NA,NA,NA,NA,"September","2017",NA,-78.59019,-0.117357,"3494.118","2017-09-08T13:47:10Z",2017-09-08 13:47:10
"1384","Yanacocha","09/09/2017","137","Axinaea sp. 1","Miconia corymbiformis","8","DC",7,NA,NA,NA,NA,NA,NA,"Metallura tyrianthina","feeding",NA,NA,NA,NA,NA,NA,NA,NA,NA,"Miconia corymbiformis","September","2017","Miconia corymbiformis",-78.590345,-0.118138,"3486.978","2017-09-08T13:59:57Z",2017-09-08 13:59:57
"1385","Yanacocha","09/09/2017","137","Heppiella repens","Heppiella repens","3","DC",60,NA,NA,NA,NA,NA,NA,"Metallura tyrianthina","feeding","male",NA,NA,NA,NA,NA,NA,NA,NA,"Heppiella repens","September","2017","Heppiella repens",-78.590345,-0.118138,"3486.978","2017-09-08T13:59:57Z",2017-09-08 13:59:57
"1386","Yanacocha","09/09/2017","138",NA,NA,NA,NA,NA,NA,NA,NA,NA,NA,NA,"Metallura tyrianthina","heard","2 ind",NA,NA,NA,NA,NA,NA,NA,NA,NA,"September","2017",NA,-78.59036,-0.118449,"3489.305","2017-09-08T14:05:42Z",2017-09-08 14:05:42
"1387","Yanacocha","09/09/2017","141",NA,NA,NA,NA,NA,NA,NA,NA,NA,NA,NA,"Metallura tyrianthina","fighting",NA,NA,NA,NA,NA,NA,NA,NA,NA,NA,"September","2017",NA,-78.590484,-0.118831,"3492.379","2017-09-08T14:15:00Z",2017-09-08 14:15:00
"1388","Yanacocha","09/09/2017","143","Heppiella repens","Heppiella repens","3","DC",33,NA,NA,NA,NA,NA,NA,"Metallura tyrianthina","feeding",NA,NA,NA,NA,NA,NA,NA,NA,NA,"Heppiella repens","September","2017","Heppiella repens",-78.590623,-0.119033,"3494.365","2017-09-08T14:23:51Z",2017-09-08 14:23:51
"1389","Yanacocha","09/09/2017","143",NA,NA,NA,NA,NA,NA,NA,NA,NA,NA,NA,"Eriocnemis luciani","fighting",NA,NA,NA,NA,NA,NA,NA,NA,NA,NA,"September","2017",NA,-78.590623,-0.119033,"3494.365","2017-09-08T14:23:51Z",2017-09-08 14:23:51
"1390","Yanacocha","09/09/2017","146",NA,NA,NA,NA,NA,NA,NA,NA,NA,NA,NA,"Coeligena lutetiae","flying","2 ind",NA,NA,NA,NA,NA,NA,NA,NA,NA,"September","2017",NA,-78.590556,-0.119675,"3499.248","2017-09-08T14:35:16Z",2017-09-08 14:35:16
"1391","Yanacocha","09/09/2017","146",NA,NA,NA,NA,NA,NA,NA,NA,NA,NA,NA,"Metallura tyrianthina","heard",NA,NA,NA,NA,NA,NA,NA,NA,NA,NA,"September","2017",NA,-78.590556,-0.119675,"3499.248","2017-09-08T14:35:16Z",2017-09-08 14:35:16
"1392","Yanacocha","09/09/2017","151",NA,NA,NA,NA,NA,NA,NA,NA,NA,NA,NA,"Metallura tyrianthina",NA,NA,NA,NA,NA,NA,NA,NA,NA,NA,NA,"September","2017",NA,-78.590419,-0.120066,"3497.902","2017-09-08T14:45:18Z",2017-09-08 14:45:18
"1393","Yanacocha","09/09/2017","154","Centropogon pichinchensis","Centropogon pichinchensis","2","DC",5,NA,NA,NA,NA,NA,NA,"Lafresnaya lafresnayi","seen",NA,NA,NA,NA,NA,NA,NA,NA,NA,"Centropogon pichinchensis","September","2017","Centropogon pichinchensis",-78.590326,-0.120222,"3501.167","2017-09-08T14:49:55Z",2017-09-08 14:49:55
"1394","Yanacocha","09/09/2017","164",NA,NA,NA,NA,NA,NA,NA,NA,NA,NA,NA,"Metallura tyrianthina","fighting","2 ind",NA,NA,NA,NA,NA,NA,NA,NA,NA,"September","2017",NA,-78.590293,-0.121299,"3502.951","2017-09-08T15:20:44Z",2017-09-08 15:20:44
"1395","Yanacocha","09/09/2017","174","Tristerix sp. 1","Tristerix longebracteatus","11","DC",5,NA,NA,NA,NA,NA,NA,"Lesbia nuna","feeding",NA,NA,NA,NA,NA,NA,NA,NA,NA,"Tristerix longebracteatus","September","2017","Tristerix longebracteatus",-78.590134,-0.122462,"3505.728","2017-09-08T15:39:42Z",2017-09-08 15:39:42
"1396","Yanacocha","09/09/2017","174",NA,NA,NA,NA,NA,NA,NA,NA,NA,NA,NA,"Metallura tyrianthina","heard",NA,NA,NA,NA,NA,NA,NA,NA,NA,NA,"September","2017",NA,-78.590134,-0.122462,"3505.728","2017-09-08T15:39:42Z",2017-09-08 15:39:42
"1397","Yanacocha","09/09/2017","183",NA,NA,NA,NA,NA,NA,NA,NA,NA,NA,NA,"Metallura tyrianthina","heard",NA,NA,NA,NA,NA,NA,NA,NA,NA,NA,"September","2017",NA,-78.590718,-0.122775,"3479.167","2017-09-08T16:00:22Z",2017-09-08 16:00:22
"1398","Yanacocha","09/09/2017","183","Weimmannia pinnata","Weimmannia pinnata","11","DC",NA,NA,NA,NA,NA,NA,NA,"Ramphomicron microrhynchum","feeding","(2 ind) there were many inflorescens with little flowers we could not count",NA,NA,NA,NA,NA,NA,NA,NA,"Weinmannia pinnata","September","2017","Weinmannia pinnata",-78.590718,-0.122775,"3479.167","2017-09-08T16:00:22Z",2017-09-08 16:00:22
"1399","Yanacocha","09/09/2017","184","Weimmannia pinnata","Weimmannia pinnata",NA,NA,NA,NA,NA,NA,NA,NA,NA,"Coeligena lutetiae",NA,NA,NA,NA,NA,NA,NA,NA,NA,NA,"Weinmannia pinnata","September","2017","Weinmannia pinnata",-78.590647,-0.122885,"3479.732","2017-09-08T16:05:58Z",2017-09-08 16:05:58
"1400","Yanacocha","09/09/2017","184",NA,NA,NA,NA,NA,NA,NA,NA,NA,NA,NA,"Metallura tyrianthina","3 ind",NA,NA,NA,NA,NA,NA,NA,NA,NA,NA,"September","2017",NA,-78.590647,-0.122885,"3479.732","2017-09-08T16:05:58Z",2017-09-08 16:05:58
"1401","Yanacocha","09/09/2017","188",NA,NA,NA,NA,NA,NA,NA,NA,NA,NA,NA,"Metallura tyrianthina","seen","hembra",NA,NA,NA,NA,NA,NA,NA,NA,NA,"September","2017",NA,-78.590667,-0.123068,"3480.102","2017-09-08T16:14:55Z",2017-09-08 16:14:55
"1402","Yanacocha","09/09/2017","193",NA,NA,NA,NA,NA,NA,NA,NA,NA,NA,NA,"Metallura tyrianthina","heard",NA,NA,NA,NA,NA,NA,NA,NA,NA,NA,"September","2017",NA,-78.590676,-0.123662,"3481.418","2017-09-08T16:24:55Z",2017-09-08 16:24:55
"1403","Yanacocha","09/09/2017","195",NA,NA,NA,NA,NA,NA,NA,NA,NA,NA,NA,"Metallura tyrianthina","heard","2 ind",NA,NA,NA,NA,NA,NA,NA,NA,NA,"September","2017",NA,-78.590611,-0.123918,"3482.778","2017-09-08T16:28:26Z",2017-09-08 16:28:26
"1404","Yanacocha","09/09/2017","201",NA,NA,NA,NA,NA,NA,NA,NA,NA,NA,NA,"Metallura tyrianthina","visto","neblina",NA,NA,NA,NA,NA,NA,NA,NA,NA,"September","2017",NA,-78.590717,-0.124658,"3483.260","2017-09-08T16:41:48Z",2017-09-08 16:41:48
"1405","Yanacocha","09/09/2017","202",NA,NA,NA,NA,NA,NA,NA,NA,NA,NA,NA,"Ramphomicron microrhynchum","heard",NA,NA,NA,NA,NA,NA,NA,NA,NA,NA,"September","2017",NA,-78.590764,-0.124725,"3483.024","2017-09-08T16:43:39Z",2017-09-08 16:43:39
"1406","Yanacocha","09/09/2017","209",NA,NA,NA,NA,NA,NA,NA,NA,NA,NA,NA,"Metallura tyrianthina","heard",NA,NA,NA,NA,NA,NA,NA,NA,NA,NA,"September","2017",NA,-78.590949,-0.125238,"3482.857","2017-09-08T16:49:54Z",2017-09-08 16:49:54
"1407","Yanacocha","09/09/2017","211",NA,NA,NA,NA,NA,NA,NA,NA,NA,NA,NA,"Coeligena lutetiae","heard",NA,NA,NA,NA,NA,NA,NA,NA,NA,NA,"September","2017",NA,-78.591,-0.125223,"3484.515","2017-09-08T16:52:05Z",2017-09-08 16:52:05
"1408","Yanacocha","09/09/2017","212",NA,NA,NA,NA,NA,NA,NA,NA,NA,NA,NA,"Metallura tyrianthina","visto",NA,NA,NA,NA,NA,NA,NA,NA,NA,NA,"September","2017",NA,-78.591108,-0.125363,"3483.713","2017-09-08T16:53:19Z",2017-09-08 16:53:19
"1409","Yanacocha","09/09/2017","214",NA,NA,NA,NA,NA,NA,NA,NA,NA,NA,NA,"Metallura tyrianthina","feeding, fighting","3 ind",NA,NA,NA,NA,NA,NA,NA,NA,NA,"September","2017",NA,-78.591134,-0.125513,"3484.934","2017-09-08T16:58:25Z",2017-09-08 16:58:25
"1410","Yanacocha","09/09/2017","214","Miconia sp. 2","Miconia bracteolata","10",NA,NA,"TRUE",NA,NA,NA,NA,NA,"Ramphomicron microrhynchum","feeding",NA,NA,NA,NA,NA,NA,NA,NA,NA,"Miconia bracteolata","September","2017","Miconia bracteolata",-78.591134,-0.125513,"3484.934","2017-09-08T16:58:25Z",2017-09-08 16:58:25
"1411","Yanacocha","09/09/2017","214",NA,NA,NA,NA,NA,NA,NA,NA,NA,NA,NA,"Lesbia nuna","flying",NA,NA,NA,NA,NA,NA,NA,NA,NA,NA,"September","2017",NA,-78.591134,-0.125513,"3484.934","2017-09-08T16:58:25Z",2017-09-08 16:58:25
"1412","Yanacocha","09/09/2017","215","Miconia sp. 2","Miconia bracteolata","8",NA,NA,"TRUE",NA,NA,NA,NA,NA,"Metallura tyrianthina","feeding",NA,NA,NA,NA,NA,NA,NA,NA,NA,"Miconia bracteolata","September","2017","Miconia bracteolata",-78.591173,-0.125622,"3485.907","2017-09-08T17:04:05Z",2017-09-08 17:04:05
"1413","Yanacocha","09/09/2017","215",NA,NA,NA,NA,NA,NA,NA,NA,NA,NA,NA,"Ramphomicron microrhynchum","feeding",NA,NA,NA,NA,NA,NA,NA,NA,NA,NA,"September","2017",NA,-78.591173,-0.125622,"3485.907","2017-09-08T17:04:05Z",2017-09-08 17:04:05
"1414","Yanacocha","09/09/2017","215",NA,NA,NA,NA,NA,NA,NA,NA,NA,NA,NA,"Lesbia nuna","feeding",NA,NA,NA,NA,NA,NA,NA,NA,NA,NA,"September","2017",NA,-78.591173,-0.125622,"3485.907","2017-09-08T17:04:05Z",2017-09-08 17:04:05
"1415","Yanacocha","09/09/2017","215",NA,NA,NA,NA,NA,NA,NA,NA,NA,NA,NA,"Metallura tyrianthina","perching","female",NA,NA,NA,NA,NA,NA,NA,NA,NA,"September","2017",NA,-78.591173,-0.125622,"3485.907","2017-09-08T17:04:05Z",2017-09-08 17:04:05
"1416","Yanacocha","09/09/2017","215","Rubus roseus","Rubus roseus","3","DC",1,NA,NA,NA,NA,NA,NA,"Metallura tyrianthina","feeding",NA,NA,NA,NA,NA,NA,NA,NA,NA,"Rubus roseus","September","2017","Rubus roseus",-78.591173,-0.125622,"3485.907","2017-09-08T17:04:05Z",2017-09-08 17:04:05
"1417","Yanacocha","09/10/2017","424",NA,NA,NA,NA,NA,NA,NA,NA,NA,NA,NA,"Eriocnemis luciani","heard",NA,NA,NA,NA,NA,NA,NA,NA,NA,NA,"October","2017",NA,-78.589547,-0.116484,"3498.579","2017-10-09T13:24:04Z",2017-10-09 13:24:04
"1418","Yanacocha","09/10/2017","429","Tropaeolum sp. 1","Tropaeolum tuberosum","3","DC",8,NA,NA,NA,NA,NA,NA,"Eriocnemis luciani","feeding",NA,NA,NA,NA,NA,NA,NA,NA,NA,"Tropaeolum tuberosum","October","2017","Tropaeolum tuberosum",-78.589867,-0.117137,"3511.794","2017-10-09T13:39:39Z",2017-10-09 13:39:39
"1419","Yanacocha","09/10/2017","431","Brachyotum sp.2","Brachyotum gleasonii","2","DC",3,NA,NA,NA,NA,NA,NA,"Eriocnemis luciani",NA,NA,NA,NA,NA,NA,NA,NA,NA,NA,"Brachyotum gleasonii","October","2017","Brachyotum gleasonii",-78.589944,-0.117244,"3513.115","2017-10-09T13:48:48Z",2017-10-09 13:48:48
"1420","Yanacocha","09/10/2017","439","Axinaea sp. 1","Miconia corymbiformis","8","DC",33,NA,NA,NA,NA,NA,NA,"Metallura tyrianthina","feeding, perching",NA,NA,NA,NA,NA,NA,NA,NA,NA,"Miconia corymbiformis","October","2017","Miconia corymbiformis",-78.590243,-0.117353,"3503.406","2017-10-09T14:07:40Z",2017-10-09 14:07:40
"1421","Yanacocha","09/10/2017","440","Racinaea tetrantha","Racinaea tetrantha","7","DC",2,NA,NA,NA,NA,NA,NA,"Eriocnemis luciani","perching",NA,NA,NA,NA,NA,NA,NA,NA,NA,"Racinaea tetrantha","October","2017","Racinaea tetrantha",-78.590274,-0.117628,"3501.869","2017-10-09T14:16:02Z",2017-10-09 14:16:02
"1422","Yanacocha","09/10/2017","444","Maclaenia rupestris","Maclaenia rupestris","5","DC",2,NA,NA,NA,NA,NA,NA,"Metallura tyrianthina","feeding","hembra",NA,NA,NA,NA,NA,NA,NA,NA,"Macleania rupestris","October","2017","Macleania rupestris",-78.590387,-0.118401,"3506.243","2017-10-09T14:28:59Z",2017-10-09 14:28:59
"1423","Yanacocha","09/10/2017","455","Maclaenia rupestris","Maclaenia rupestris","4","DC",22,NA,NA,NA,NA,NA,NA,"Coeligena lutetiae",NA,NA,NA,NA,NA,NA,NA,NA,NA,NA,"Macleania rupestris","October","2017","Macleania rupestris",-78.590621,-0.119651,"3515.536","2017-10-09T15:06:03Z",2017-10-09 15:06:03
"1424","Yanacocha","09/10/2017","456","Rubus roseus","Rubus roseus","2","DC",1,NA,NA,NA,NA,NA,NA,"Metallura tyrianthina","heard",NA,NA,NA,NA,NA,NA,NA,NA,NA,"Rubus roseus","October","2017","Rubus roseus",-78.590529,-0.119719,"3514.794","2017-10-09T15:08:42Z",2017-10-09 15:08:42
"1425","Yanacocha","09/10/2017","464",NA,NA,NA,NA,NA,NA,NA,NA,NA,NA,NA,"Coeligena lutetiae",NA,NA,NA,NA,NA,NA,NA,NA,NA,NA,NA,"October","2017",NA,-78.59064,-0.120717,"3522.264","2017-10-09T15:24:35Z",2017-10-09 15:24:35
"1426","Yanacocha","09/10/2017","478",NA,NA,NA,NA,NA,NA,NA,NA,NA,NA,NA,"Coeligena lutetiae",NA,NA,NA,NA,NA,NA,NA,NA,NA,NA,NA,"October","2017",NA,-78.590042,-0.122339,"3515.209","2017-10-09T16:08:58Z",2017-10-09 16:08:58
"1427","Yanacocha","09/10/2017",NA,NA,NA,NA,NA,NA,NA,NA,NA,NA,NA,NA,"Eriocnemis luciani",NA,NA,NA,NA,NA,NA,NA,NA,NA,NA,NA,"October","2017",NA,NA,NA,NA,NA,NA
"1428","Yanacocha","09/10/2017",NA,NA,NA,NA,NA,NA,NA,NA,NA,NA,NA,NA,"Metallura tyrianthina","heard",NA,NA,NA,NA,NA,NA,NA,NA,NA,NA,"October","2017",NA,NA,NA,NA,NA,NA
"1429","Yanacocha","09/10/2017","497",NA,NA,NA,NA,NA,NA,NA,NA,NA,NA,NA,"Metallura tyrianthina","feeding",NA,NA,NA,NA,NA,NA,NA,NA,NA,NA,"October","2017",NA,-78.590595,-0.123935,"3487.097","2017-10-09T16:49:07Z",2017-10-09 16:49:07
"1430","Yanacocha","09/11/2017","93",NA,NA,NA,NA,NA,NA,NA,NA,NA,NA,NA,"Coeligena lutetiae","heard",NA,NA,NA,NA,NA,NA,NA,NA,NA,NA,"November","2017",NA,-78.589732,-0.116512,"3507.806","2017-11-09T12:37:24Z",2017-11-09 12:37:24
"1431","Yanacocha","09/11/2017","96",NA,NA,NA,NA,NA,NA,NA,NA,NA,NA,NA,"Metallura tyrianthina","heard","3 ind",NA,NA,NA,NA,NA,NA,NA,NA,NA,"November","2017",NA,-78.589839,-0.11705,"3519.968","2017-11-09T12:47:24Z",2017-11-09 12:47:24
"1432","Yanacocha","09/11/2017","98","Axinaea sp. 1","Miconia corymbiformis","6","DC",13,NA,NA,NA,NA,NA,NA,"Eriocnemis luciani","feeding",NA,NA,NA,NA,NA,NA,NA,NA,NA,"Miconia corymbiformis","November","2017","Miconia corymbiformis",-78.589953,-0.117196,"3524.562","2017-11-09T12:51:09Z",2017-11-09 12:51:09
"1433","Yanacocha","09/11/2017","102",NA,NA,NA,NA,NA,NA,NA,NA,NA,NA,NA,"Coeligena lutetiae","flying",NA,NA,NA,NA,NA,NA,NA,NA,NA,NA,"November","2017",NA,-78.590045,-0.117495,"3519.828","2017-11-09T13:05:01Z",2017-11-09 13:05:01
"1434","Yanacocha","09/11/2017","103",NA,NA,NA,NA,NA,NA,NA,NA,NA,NA,NA,"Metallura tyrianthina","heard",NA,NA,NA,NA,NA,NA,NA,NA,NA,NA,"November","2017",NA,-78.590175,-0.117325,"3513.029","2017-11-09T13:07:24Z",2017-11-09 13:07:24
"1435","Yanacocha","09/11/2017","104",NA,NA,NA,NA,NA,NA,NA,NA,NA,NA,NA,"Metallura tyrianthina","heard",NA,NA,NA,NA,NA,NA,NA,NA,NA,NA,"November","2017",NA,-78.590235,-0.117584,"3508.855","2017-11-09T13:14:05Z",2017-11-09 13:14:05
"1436","Yanacocha","09/11/2017","105",NA,NA,NA,NA,NA,NA,NA,NA,NA,NA,NA,"Metallura tyrianthina","heard",NA,NA,NA,NA,NA,NA,NA,NA,NA,NA,"November","2017",NA,-78.590341,-0.118112,"3506.580","2017-11-09T13:20:51Z",2017-11-09 13:20:51
"1437","Yanacocha","09/11/2017","114",NA,NA,NA,NA,NA,NA,NA,NA,NA,NA,NA,"Eriocnemis luciani","perching",NA,NA,NA,NA,NA,NA,NA,NA,NA,NA,"November","2017",NA,-78.590648,-0.118954,"3508.384","2017-11-09T14:03:59Z",2017-11-09 14:03:59
"1438","Yanacocha","09/11/2017","116",NA,NA,NA,NA,NA,NA,NA,NA,NA,NA,NA,"Coeligena lutetiae","perching","male",NA,NA,NA,NA,NA,NA,NA,NA,NA,"November","2017",NA,-78.590533,-0.119144,"3507.504","2017-11-09T14:12:28Z",2017-11-09 14:12:28
"1439","Yanacocha","09/11/2017","121",NA,NA,NA,NA,NA,NA,NA,NA,NA,NA,NA,"Eriocnemis luciani","heard",NA,NA,NA,NA,NA,NA,NA,NA,NA,NA,"November","2017",NA,-78.590473,-0.119942,"3514.266","2017-11-09T14:32:39Z",2017-11-09 14:32:39
"1440","Yanacocha","09/11/2017","122",NA,NA,NA,NA,NA,NA,NA,NA,NA,NA,NA,"Metallura tyrianthina","heard",NA,NA,NA,NA,NA,NA,NA,NA,NA,NA,"November","2017",NA,-78.590365,-0.120067,"3515.775","2017-11-09T14:36:29Z",2017-11-09 14:36:29
"1441","Yanacocha","09/11/2017","133",NA,NA,NA,NA,NA,NA,NA,NA,NA,NA,NA,"Coeligena lutetiae","heard",NA,NA,NA,NA,NA,NA,NA,NA,NA,NA,"November","2017",NA,-78.590195,-0.121462,"3514.012","2017-11-09T15:12:25Z",2017-11-09 15:12:25
"1442","Yanacocha","09/11/2017","134",NA,NA,NA,NA,NA,NA,NA,NA,NA,NA,NA,"Coeligena lutetiae","flying",NA,NA,NA,NA,NA,NA,NA,NA,NA,NA,"November","2017",NA,-78.590124,-0.121618,"3512.657","2017-11-09T15:14:52Z",2017-11-09 15:14:52
"1443","Yanacocha","09/11/2017","143",NA,NA,NA,NA,NA,NA,NA,NA,NA,NA,NA,"Eriocnemis luciani","heard",NA,NA,NA,NA,NA,NA,NA,NA,NA,NA,"November","2017",NA,-78.590024,-0.122424,"3521.542","2017-11-09T15:29:39Z",2017-11-09 15:29:39
"1444","Yanacocha","09/11/2017","143",NA,NA,NA,NA,NA,NA,NA,NA,NA,NA,NA,"Coeligena lutetiae","heard",NA,NA,NA,NA,NA,NA,NA,NA,NA,NA,"November","2017",NA,-78.590024,-0.122424,"3521.542","2017-11-09T15:29:39Z",2017-11-09 15:29:39
"1445","Yanacocha","09/11/2017","143",NA,NA,NA,NA,NA,NA,NA,NA,NA,NA,NA,"Metallura tyrianthina","heard",NA,NA,NA,NA,NA,NA,NA,NA,NA,NA,"November","2017",NA,-78.590024,-0.122424,"3521.542","2017-11-09T15:29:39Z",2017-11-09 15:29:39
"1446","Yanacocha","09/11/2017","144","Axinaea sp. 1","Miconia corymbiformis","9","DC",9,NA,NA,NA,NA,NA,NA,"Metallura tyrianthina","feeding",NA,NA,NA,NA,NA,NA,NA,NA,NA,"Miconia corymbiformis","November","2017","Miconia corymbiformis",-78.590109,-0.122404,"3515.531","2017-11-09T15:33:49Z",2017-11-09 15:33:49
"1447","Yanacocha","09/11/2017","148",NA,NA,NA,NA,NA,NA,NA,NA,NA,NA,NA,"Eriocnemis luciani","heard",NA,NA,NA,NA,NA,NA,NA,NA,NA,NA,"November","2017",NA,-78.590499,-0.12242,"3494.809","2017-11-09T15:41:30Z",2017-11-09 15:41:30
"1448","Yanacocha","09/11/2017","158",NA,NA,NA,NA,NA,NA,NA,NA,NA,NA,NA,"Metallura tyrianthina","heard",NA,NA,NA,NA,NA,NA,NA,NA,NA,NA,"November","2017",NA,-78.589728,-0.116372,"3372.781","2018-11-08T12:46:17Z",2018-11-08 12:46:17
"1449","Yanacocha","09/11/2017","164",NA,NA,NA,NA,NA,NA,NA,NA,NA,NA,NA,"Metallura tyrianthina","heard",NA,NA,NA,NA,NA,NA,NA,NA,NA,NA,"November","2017",NA,-78.590034,-0.117534,"3443.413","2018-11-08T13:02:36Z",2018-11-08 13:02:36
"1450","Yanacocha","09/11/2017","172",NA,NA,NA,NA,NA,NA,NA,NA,NA,NA,NA,"Coeligena lutetiae","flying",NA,NA,NA,NA,NA,NA,NA,NA,NA,NA,"November","2017",NA,-78.590315,-0.118106,"3461.758","2018-11-08T13:19:47Z",2018-11-08 13:19:47
"1451","Yanacocha","09/11/2017","174",NA,NA,NA,NA,NA,NA,NA,NA,NA,NA,NA,"Coeligena lutetiae","flying","2 ind",NA,NA,NA,NA,NA,NA,NA,NA,NA,"November","2017",NA,-78.590364,-0.118434,"3470.454","2018-11-08T13:24:58Z",2018-11-08 13:24:58
"1452","Yanacocha","09/11/2017","174",NA,NA,NA,NA,NA,NA,NA,NA,NA,NA,NA,"Metallura tyrianthina","heard",NA,NA,NA,NA,NA,NA,NA,NA,NA,NA,"November","2017",NA,-78.590364,-0.118434,"3470.454","2018-11-08T13:24:58Z",2018-11-08 13:24:58
"1453","Yanacocha","07/12/2017","407",NA,NA,NA,NA,NA,NA,NA,NA,NA,NA,NA,"Metallura tyrianthina","heard",NA,NA,NA,NA,NA,NA,NA,NA,NA,NA,"December","2017",NA,-78.589553,-0.116359,"3486.205","2017-12-07T13:07:03Z",2017-12-07 13:07:03
"1454","Yanacocha","07/12/2017","409",NA,NA,NA,NA,NA,NA,NA,NA,NA,NA,NA,"Metallura tyrianthina","heard",NA,NA,NA,NA,NA,NA,NA,NA,NA,NA,"December","2017",NA,-78.589857,-0.117151,"3506.707","2017-12-07T13:19:35Z",2017-12-07 13:19:35
"1455","Yanacocha","07/12/2017","412",NA,NA,NA,NA,NA,NA,NA,NA,NA,NA,NA,"Metallura tyrianthina","heard",NA,NA,NA,NA,NA,NA,NA,NA,NA,NA,"December","2017",NA,-78.589997,-0.117388,"3508.185","2017-12-07T13:24:49Z",2017-12-07 13:24:49
"1456","Yanacocha","07/12/2017","415",NA,NA,NA,NA,NA,NA,NA,NA,NA,NA,NA,"Metallura tyrianthina","heard","2 ind",NA,NA,NA,NA,NA,NA,NA,NA,NA,"December","2017",NA,-78.590074,-0.117585,"3506.995","2017-12-07T13:30:47Z",2017-12-07 13:30:47
"1457","Yanacocha","07/12/2017","418",NA,NA,NA,NA,NA,NA,NA,NA,NA,NA,NA,"Metallura tyrianthina",NA,NA,NA,NA,NA,NA,NA,NA,NA,NA,NA,"December","2017",NA,-78.590249,-0.117606,"3498.457","2017-12-07T13:49:46Z",2017-12-07 13:49:46
"1458","Yanacocha","07/12/2017","418",NA,NA,NA,NA,NA,NA,NA,NA,NA,NA,NA,"Pterophanes cyanopterus","seen",NA,NA,NA,NA,NA,NA,NA,NA,NA,NA,"December","2017",NA,-78.590249,-0.117606,"3498.457","2017-12-07T13:49:46Z",2017-12-07 13:49:46
"1459","Yanacocha","07/12/2017","418",NA,NA,NA,NA,NA,NA,NA,NA,NA,NA,NA,"Metallura tyrianthina","chaising with H. strophianus","2 ind",NA,NA,NA,NA,NA,NA,NA,NA,NA,"December","2017",NA,-78.590249,-0.117606,"3498.457","2017-12-07T13:49:46Z",2017-12-07 13:49:46
"1460","Yanacocha","07/12/2017","418","Axinaea sp. 1","Miconia corymbiformis","7","DC",30,NA,NA,NA,NA,NA,NA,"Heliangelus strophianus","feeding",NA,NA,NA,NA,NA,NA,NA,NA,NA,"Miconia corymbiformis","December","2017","Miconia corymbiformis",-78.590249,-0.117606,"3498.457","2017-12-07T13:49:46Z",2017-12-07 13:49:46
"1461","Yanacocha","07/12/2017","418","Racinaea tetrantha","Racinaea tetrantha","9","DC",7,NA,NA,NA,NA,NA,NA,"Heliangelus strophianus","feeding",NA,NA,NA,NA,NA,NA,NA,NA,NA,"Racinaea tetrantha","December","2017","Racinaea tetrantha",-78.590249,-0.117606,"3498.457","2017-12-07T13:49:46Z",2017-12-07 13:49:46
"1462","Yanacocha","07/12/2017","420",NA,NA,NA,NA,NA,NA,NA,NA,NA,NA,NA,"Metallura tyrianthina","flying",NA,NA,NA,NA,NA,NA,NA,NA,NA,NA,"December","2017",NA,-78.59022,-0.117519,"3498.824","2017-12-07T13:50:57Z",2017-12-07 13:50:57
"1463","Yanacocha","07/12/2017","420",NA,NA,NA,NA,NA,NA,NA,NA,NA,NA,NA,"Metallura tyrianthina",NA,"2 ind",NA,NA,NA,NA,NA,NA,NA,NA,NA,"December","2017",NA,-78.59022,-0.117519,"3498.824","2017-12-07T13:50:57Z",2017-12-07 13:50:57
"1464","Yanacocha","07/12/2017","425",NA,NA,NA,NA,NA,NA,NA,NA,NA,NA,NA,"Coeligena lutetiae","heard",NA,NA,NA,NA,NA,NA,NA,NA,NA,NA,"December","2017",NA,-78.59037,-0.11866,"3500.999","2017-12-07T14:06:56Z",2017-12-07 14:06:56
"1465","Yanacocha","07/12/2017","428",NA,NA,NA,NA,NA,NA,NA,NA,NA,NA,NA,"Coeligena lutetiae","seen",NA,NA,NA,NA,NA,NA,NA,NA,NA,NA,"December","2017",NA,-78.590624,-0.119026,"3504.192","2017-12-07T14:33:09Z",2017-12-07 14:33:09
"1466","Yanacocha","07/12/2017","430","Rubus roseus","Rubus roseus","2","DC",3,NA,NA,NA,NA,NA,NA,"Metallura tyrianthina","feeding",NA,NA,NA,NA,NA,NA,NA,NA,NA,"Rubus roseus","December","2017","Rubus roseus",-78.590462,-0.119416,"3506.528","2017-12-07T14:41:26Z",2017-12-07 14:41:26
"1467","Yanacocha","07/12/2017","431","Columnea dielsii","Columnea dielsii","4","DC",5,NA,NA,NA,NA,NA,NA,"Coeligena lutetiae","feeding",NA,NA,NA,NA,NA,NA,NA,NA,NA,"Columnea dielsii","December","2017","Columnea dielsii",-78.590444,-0.119595,"3507.594","2017-12-07T14:45:55Z",2017-12-07 14:45:55
"1468","Yanacocha","07/12/2017","433",NA,NA,NA,NA,NA,NA,NA,NA,NA,NA,NA,"Coeligena lutetiae","flying",NA,NA,NA,NA,NA,NA,NA,NA,NA,NA,"December","2017",NA,-78.590559,-0.119748,"3509.194","2017-12-07T14:49:22Z",2017-12-07 14:49:22
"1469","Yanacocha","07/12/2017","441",NA,NA,NA,NA,NA,NA,NA,NA,NA,NA,NA,"Metallura tyrianthina","heard",NA,NA,NA,NA,NA,NA,NA,NA,NA,NA,"December","2017",NA,-78.590365,-0.120421,"3515.428","2017-12-07T15:07:36Z",2017-12-07 15:07:36
"1470","Yanacocha","07/12/2017","445",NA,NA,NA,NA,NA,NA,NA,NA,NA,NA,NA,"Metallura tyrianthina","perching","female",NA,NA,NA,NA,NA,NA,NA,NA,NA,"December","2017",NA,-78.590447,-0.121049,"3519.536","2017-12-07T15:19:23Z",2017-12-07 15:19:23
"1471","Yanacocha","07/12/2017","453",NA,NA,NA,NA,NA,NA,NA,NA,NA,NA,NA,"Eriocnemis luciani","heard",NA,NA,NA,NA,NA,NA,NA,NA,NA,NA,"December","2017",NA,-78.590023,-0.122356,"3515.510","2017-12-07T15:46:53Z",2017-12-07 15:46:53
"1472","Yanacocha","07/12/2017","457",NA,NA,NA,NA,NA,NA,NA,NA,NA,NA,NA,"Eriocnemis luciani","heard",NA,NA,NA,NA,NA,NA,NA,NA,NA,NA,"December","2017",NA,-78.590611,-0.122497,"3486.590","2017-12-07T15:57:27Z",2017-12-07 15:57:27
"1473","Yanacocha","07/12/2017","458",NA,NA,NA,NA,NA,NA,NA,NA,NA,NA,NA,"Metallura tyrianthina","heard",NA,NA,NA,NA,NA,NA,NA,NA,NA,NA,"December","2017",NA,-78.590695,-0.122568,"3484.853","2017-12-07T15:59:03Z",2017-12-07 15:59:03
"1474","Yanacocha","07/12/2017","462",NA,NA,NA,NA,NA,NA,NA,NA,NA,NA,NA,"Metallura tyrianthina","heard",NA,NA,NA,NA,NA,NA,NA,NA,NA,NA,"December","2017",NA,-78.590628,-0.123041,"3485.752","2017-12-07T16:08:02Z",2017-12-07 16:08:02
"1475","Yanacocha","07/12/2017","464",NA,NA,NA,NA,NA,NA,NA,NA,NA,NA,NA,"Metallura tyrianthina","seen","male, female",NA,NA,NA,NA,NA,NA,NA,NA,NA,"December","2017",NA,-78.590638,-0.123312,"3484.805","2017-12-07T16:12:47Z",2017-12-07 16:12:47
"1476","Yanacocha","07/12/2017","466",NA,NA,NA,NA,NA,NA,NA,NA,NA,NA,NA,"Coeligena lutetiae","heard",NA,NA,NA,NA,NA,NA,NA,NA,NA,NA,"December","2017",NA,-78.590636,-0.123624,"3484.455","2017-12-07T16:19:10Z",2017-12-07 16:19:10
"1477","Yanacocha","07/12/2017","467","Axinaea sp. 1","Miconia corymbiformis","6","DC",15,NA,NA,NA,NA,NA,NA,"Heliangelus strophianus","feeding",NA,NA,NA,NA,NA,NA,NA,NA,NA,"Miconia corymbiformis","December","2017","Miconia corymbiformis",-78.590627,-0.123705,"3485.035","2017-12-07T16:21:43Z",2017-12-07 16:21:43
"1478","Yanacocha","07/12/2017","468",NA,NA,NA,NA,NA,NA,NA,NA,NA,NA,NA,"Metallura tyrianthina","heard",NA,NA,NA,NA,NA,NA,NA,NA,NA,NA,"December","2017",NA,-78.590631,-0.123846,"3484.217","2017-12-07T16:25:18Z",2017-12-07 16:25:18
"1479","Yanacocha","07/12/2017","470","Columnea dielsii","Columnea dielsii","5","DC",5,NA,NA,NA,NA,NA,NA,"Coeligena lutetiae","feeding",NA,NA,NA,NA,NA,NA,NA,NA,NA,"Columnea dielsii","December","2017","Columnea dielsii",-78.59059,-0.124264,"3484.572","2017-12-07T16:29:59Z",2017-12-07 16:29:59
"1480","Yanacocha","07/12/2017","473",NA,NA,NA,NA,NA,NA,NA,NA,NA,NA,NA,"Coeligena lutetiae","heard",NA,NA,NA,NA,NA,NA,NA,NA,NA,NA,"December","2017",NA,-78.591087,-0.125292,"3484.001","2017-12-07T16:41:32Z",2017-12-07 16:41:32
"1481","Yanacocha","07/12/2017","473",NA,NA,NA,NA,NA,NA,NA,NA,NA,NA,NA,"Pterophanes cyanopterus","heard",NA,NA,NA,NA,NA,NA,NA,NA,NA,NA,"December","2017",NA,-78.591087,-0.125292,"3484.001","2017-12-07T16:41:32Z",2017-12-07 16:41:32
"1482","Yanacocha","07/12/2017","477",NA,NA,NA,NA,NA,NA,NA,NA,NA,NA,NA,"Coeligena lutetiae","seen",NA,NA,NA,NA,NA,NA,NA,NA,NA,NA,"December","2017",NA,-78.591189,-0.125889,"3485.035","2017-12-07T16:48:15Z",2017-12-07 16:48:15
"1483","Yanacocha","07/12/2017","478",NA,NA,NA,NA,NA,NA,NA,NA,NA,NA,NA,"Metallura tyrianthina","see",NA,NA,NA,NA,NA,NA,NA,NA,NA,NA,"December","2017",NA,-78.591246,-0.126031,"3484.518","2017-12-07T16:49:57Z",2017-12-07 16:49:57
"1484","Yanacocha","07/12/2017","478","Columnea dielsii","Columnea dielsii","5","DC",3,NA,NA,NA,NA,NA,NA,"Coeligena lutetiae","feeding",NA,NA,NA,NA,NA,NA,NA,NA,NA,"Columnea dielsii","December","2017","Columnea dielsii",-78.591246,-0.126031,"3484.518","2017-12-07T16:49:57Z",2017-12-07 16:49:57
"1485","Yanacocha","09/01/2018","1",NA,NA,NA,NA,NA,NA,NA,NA,NA,NA,NA,"Metallura tyrianthina","feeding","insects, male",NA,NA,NA,NA,NA,NA,NA,NA,NA,"January","2018",NA,-78.589614,-0.116438,"3507.662","2018-01-09T13:02:06Z",2018-01-09 13:02:06
"1486","Yanacocha","09/01/2018","3",NA,NA,NA,NA,NA,NA,NA,NA,NA,NA,NA,"Metallura tyrianthina","heard","2 ind",NA,NA,NA,NA,NA,NA,NA,NA,NA,"January","2018",NA,-78.589741,-0.116778,"3513.963","2018-01-09T13:10:17Z",2018-01-09 13:10:17
"1487","Yanacocha","09/01/2018","6",NA,NA,NA,NA,NA,NA,NA,NA,NA,NA,NA,"Metallura tyrianthina","heard",NA,NA,NA,NA,NA,NA,NA,NA,NA,NA,"January","2018",NA,-78.589855,-0.117114,"3519.299","2018-01-09T13:16:47Z",2018-01-09 13:16:47
"1488","Yanacocha","09/01/2018","8","Columnea dielsii","Columnea dielsii","3","DC",7,NA,NA,NA,NA,NA,NA,"Coeligena lutetiae","feeding",NA,NA,NA,NA,NA,NA,NA,NA,NA,"Columnea dielsii","January","2018","Columnea dielsii",-78.58998,-0.117306,"3521.531","2018-01-09T13:21:49Z",2018-01-09 13:21:49
"1489","Yanacocha","09/01/2018","8","Tillandsia sp. 1","Tillandsia polyantha","3","DC",3,NA,NA,NA,NA,NA,NA,"Coeligena lutetiae","feeding",NA,NA,NA,NA,NA,NA,NA,NA,NA,"Tillandsia polyantha","January","2018","Tillandsia polyantha",-78.58998,-0.117306,"3521.531","2018-01-09T13:21:49Z",2018-01-09 13:21:49
"1490","Yanacocha","09/01/2018","9","Axinaea sp. 1","Miconia corymbiformis","7","DC",8,NA,NA,NA,NA,NA,NA,"Metallura tyrianthina","feeding",NA,NA,NA,NA,NA,NA,NA,NA,NA,"Miconia corymbiformis","January","2018","Miconia corymbiformis",-78.589997,-0.11736,"3520.639","2018-01-09T13:25:12Z",2018-01-09 13:25:12
"1491","Yanacocha","09/01/2018","9","Columnea dielsii","Columnea dielsii","5","DC",4,NA,NA,NA,NA,NA,NA,"Coeligena lutetiae","feeding",NA,NA,NA,NA,NA,NA,NA,NA,NA,"Columnea dielsii","January","2018","Columnea dielsii",-78.589997,-0.11736,"3520.639","2018-01-09T13:25:12Z",2018-01-09 13:25:12
"1492","Yanacocha","09/01/2018","13","Axinaea sp. 1","Miconia corymbiformis","8","DC",13,NA,NA,NA,NA,NA,NA,"Metallura tyrianthina","feeding",NA,NA,NA,NA,NA,NA,NA,NA,NA,"Miconia corymbiformis","January","2018","Miconia corymbiformis",-78.590142,-0.117377,"3510.851","2018-01-09T13:31:34Z",2018-01-09 13:31:34
"1493","Yanacocha","09/01/2018","14",NA,NA,NA,NA,NA,NA,NA,NA,NA,NA,NA,"Coeligena lutetiae","feeding","C. dielssi a m√°s de 5 m",NA,NA,NA,NA,NA,NA,NA,NA,NA,"January","2018",NA,-78.590211,-0.117303,"3509.646","2018-01-09T13:35:38Z",2018-01-09 13:35:38
"1494","Yanacocha","09/01/2018","16",NA,NA,NA,NA,NA,NA,NA,NA,NA,NA,NA,"Metallura tyrianthina","heard","3 ind",NA,NA,NA,NA,NA,NA,NA,NA,NA,"January","2018",NA,-78.590255,-0.117494,"3505.806","2018-01-09T13:41:12Z",2018-01-09 13:41:12
"1495","Yanacocha","09/01/2018","18","Columnea dielsii","Columnea dielsii","5","DC",5,NA,NA,NA,NA,NA,NA,"Coeligena lutetiae","feeding",NA,NA,NA,NA,NA,NA,NA,NA,NA,"Columnea dielsii","January","2018","Columnea dielsii",-78.590294,-0.11774,"3504.285","2018-01-09T13:45:39Z",2018-01-09 13:45:39
"1496","Yanacocha","09/01/2018","19","Maclaenia rupestris","Maclaenia rupestris","4","DC",5,NA,NA,NA,NA,NA,NA,"Metallura tyrianthina","feeding",NA,NA,NA,NA,NA,NA,NA,NA,NA,"Macleania rupestris","January","2018","Macleania rupestris",-78.590385,-0.118052,"3503.276","2018-01-09T13:50:29Z",2018-01-09 13:50:29
"1497","Yanacocha","09/01/2018","29",NA,NA,NA,NA,NA,NA,NA,NA,NA,NA,NA,"Coeligena lutetiae","perching",NA,NA,NA,NA,NA,NA,NA,NA,NA,NA,"January","2018",NA,-78.590627,-0.119067,"3510.046","2018-01-09T14:17:21Z",2018-01-09 14:17:21
"1498","Yanacocha","09/01/2018","56","Columnea dielsii","Columnea dielsii","5","DC",7,NA,NA,NA,NA,NA,NA,"Coeligena lutetiae","feeding",NA,NA,NA,NA,NA,NA,NA,NA,NA,"Columnea dielsii","January","2018","Columnea dielsii",-78.590136,-0.121813,"3512.694","2018-01-09T15:19:14Z",2018-01-09 15:19:14
"1499","Yanacocha","09/01/2018","64","Axinaea sp. 1","Miconia corymbiformis","6","DC",19,NA,NA,NA,NA,NA,NA,"Eriocnemis luciani","feeding",NA,NA,NA,NA,NA,NA,NA,NA,NA,"Miconia corymbiformis","January","2018","Miconia corymbiformis",-78.590159,-0.122412,"3514.567","2018-01-09T15:33:32Z",2018-01-09 15:33:32
"1500","Yanacocha","09/01/2018","66",NA,NA,NA,NA,NA,NA,NA,NA,NA,NA,NA,"Eriocnemis luciani","perching",NA,NA,NA,NA,NA,NA,NA,NA,NA,NA,"January","2018",NA,-78.590262,-0.122284,"3498.732","2018-01-09T15:38:48Z",2018-01-09 15:38:48
"1501","Yanacocha","09/01/2018","69",NA,NA,NA,NA,NA,NA,NA,NA,NA,NA,NA,"Metallura tyrianthina","chaising","2 ind",NA,NA,NA,NA,NA,NA,NA,NA,NA,"January","2018",NA,-78.590646,-0.122522,"3488.403","2018-01-09T15:46:05Z",2018-01-09 15:46:05
"1502","Yanacocha","09/01/2018","74","Axinaea sp. 1","Miconia corymbiformis","6","DC",3,NA,NA,NA,NA,NA,NA,"Coeligena lutetiae","chaising, perching","2ind",NA,NA,NA,NA,NA,NA,NA,NA,"Miconia corymbiformis","January","2018","Miconia corymbiformis",-78.590648,-0.123023,"3485.954","2018-01-09T15:56:27Z",2018-01-09 15:56:27
"1503","Yanacocha","09/01/2018","82",NA,NA,NA,NA,NA,NA,NA,NA,NA,NA,NA,"Metallura tyrianthina","heard","2 ind",NA,NA,NA,NA,NA,NA,NA,NA,NA,"January","2018",NA,-78.590549,-0.124244,"3485.495","2018-01-09T16:10:26Z",2018-01-09 16:10:26
"1504","Yanacocha","09/01/2018","87",NA,NA,NA,NA,NA,NA,NA,NA,NA,NA,NA,"Coeligena lutetiae","perching",NA,NA,NA,NA,NA,NA,NA,NA,NA,NA,"January","2018",NA,-78.590827,-0.124949,"3484.269","2018-01-09T16:20:35Z",2018-01-09 16:20:35
"1505","Yanacocha","09/01/2018","97","Tropaeolum sp. 1","Tropaeolum tuberosum","2","DC",6,NA,NA,NA,NA,NA,NA,"Coeligena lutetiae","feeding",NA,NA,NA,NA,NA,NA,NA,NA,NA,"Tropaeolum tuberosum","January","2018","Tropaeolum tuberosum",-78.591232,-0.125833,"3484.302","2018-01-09T16:36:01Z",2018-01-09 16:36:01
"1506","Yanacocha","07/02/2018","299",NA,NA,NA,NA,NA,NA,NA,NA,NA,NA,NA,"Eriocnemis luciani","heard",NA,NA,NA,NA,NA,NA,NA,NA,NA,NA,"February","2018",NA,-78.588856,-0.116955,"3416.821","2018-02-07T13:34:35Z",2018-02-07 13:34:35
"1507","Yanacocha","07/02/2018","300",NA,NA,NA,NA,NA,NA,NA,NA,NA,NA,NA,"Metallura tyrianthina","heard",NA,NA,NA,NA,NA,NA,NA,NA,NA,NA,"February","2018",NA,-78.58891,-0.116922,"3416.654","2018-02-07T13:34:46Z",2018-02-07 13:34:46
"1508","Yanacocha","07/02/2018","307","Centropogon pichinchensis","Centropogon pichinchensis","3","DC",1,NA,NA,NA,NA,NA,NA,"Metallura tyrianthina","heard",NA,NA,NA,NA,NA,NA,NA,NA,NA,"Centropogon pichinchensis","February","2018","Centropogon pichinchensis",-78.589914,-0.117173,"3481.914","2018-02-07T14:00:49Z",2018-02-07 14:00:49
"1509","Yanacocha","07/02/2018","308","Columnea dielsii","Columnea dielsii","3","DC",5,NA,NA,NA,NA,NA,NA,"Coeligena lutetiae","feeding and perching",NA,NA,NA,NA,NA,NA,NA,NA,NA,"Columnea dielsii","February","2018","Columnea dielsii",-78.589941,-0.117305,"3486.154","2018-02-07T14:03:39Z",2018-02-07 14:03:39
"1510","Yanacocha","07/02/2018","309","Columnea dielsii","Columnea dielsii","6","DC",5,NA,NA,NA,NA,NA,NA,"Coeligena lutetiae","feeding and perching",NA,NA,NA,NA,NA,NA,NA,NA,NA,"Columnea dielsii","February","2018","Columnea dielsii",-78.59,-0.117365,"3489.435","2018-02-07T14:07:08Z",2018-02-07 14:07:08
"1511","Yanacocha","07/02/2018","314","Tropaeolum sp. 1","Tropaeolum tuberosum","2","DC",40,NA,NA,NA,NA,NA,NA,"Eriocnemis luciani","feeding",NA,NA,NA,NA,NA,NA,NA,NA,NA,"Tropaeolum tuberosum","February","2018","Tropaeolum tuberosum",-78.590134,-0.117411,"3486.531","2018-02-07T14:14:48Z",2018-02-07 14:14:48
"1512","Yanacocha","07/02/2018","317",NA,NA,NA,NA,NA,NA,NA,NA,NA,NA,NA,"Metallura tyrianthina","heard",NA,NA,NA,NA,NA,NA,NA,NA,NA,NA,"February","2018",NA,-78.590236,-0.117549,"3490.447","2018-02-07T14:31:27Z",2018-02-07 14:31:27
"1513","Yanacocha","07/02/2018","323",NA,NA,NA,NA,NA,NA,NA,NA,NA,NA,NA,"Coeligena lutetiae","perching",NA,NA,NA,NA,NA,NA,NA,NA,NA,NA,"February","2018",NA,-78.590255,-0.118548,"3496.013","2018-02-07T14:46:19Z",2018-02-07 14:46:19
"1514","Yanacocha","07/02/2018","369","Columnea dielsii","Columnea dielsii","2","DC",9,NA,NA,NA,NA,NA,NA,"Eriocnemis luciani","feeding",NA,NA,NA,NA,NA,NA,NA,NA,NA,"Columnea dielsii","February","2018","Columnea dielsii",-78.590154,-0.122288,"3514.946","2018-02-07T16:42:39Z",2018-02-07 16:42:39
"1515","Yanacocha","07/02/2018","377",NA,NA,NA,NA,NA,NA,NA,NA,NA,NA,NA,"Coeligena lutetiae","Perching",NA,NA,NA,NA,NA,NA,NA,NA,NA,NA,"February","2018",NA,-78.590364,-0.122264,"3493.442","2018-02-07T16:58:13Z",2018-02-07 16:58:13
"1516","Yanacocha","07/02/2018","382",NA,NA,NA,NA,NA,NA,NA,NA,NA,NA,NA,"Metallura tyrianthina","Perching",NA,NA,NA,NA,NA,NA,NA,NA,NA,NA,"February","2018",NA,-78.590713,-0.122625,"3483.354","2018-02-07T17:06:15Z",2018-02-07 17:06:15
"1517","Yanacocha","07/02/2018","388",NA,NA,NA,NA,NA,NA,NA,NA,NA,NA,NA,"Coeligena lutetiae","Perching",NA,NA,NA,NA,NA,NA,NA,NA,NA,NA,"February","2018",NA,-78.590656,-0.123221,"3482.008","2018-02-07T17:15:48Z",2018-02-07 17:15:48
"1518","Yanacocha","07/02/2018","411",NA,NA,NA,NA,NA,NA,NA,NA,NA,NA,NA,"Coeligena lutetiae","flying",NA,NA,NA,NA,NA,NA,NA,NA,NA,NA,"February","2018",NA,-78.591143,-0.125829,"3467.447","2018-02-07T17:56:14Z",2018-02-07 17:56:14
"1519","Yanacocha","10/03/2018","513",NA,NA,NA,NA,NA,NA,NA,NA,NA,NA,NA,"Eriocnemis luciani","heard",NA,NA,NA,NA,NA,NA,NA,NA,NA,NA,"March","2018",NA,-78.589596,-0.116423,"3492.601","2018-03-10T12:52:47Z",2018-03-10 12:52:47
"1520","Yanacocha","10/03/2018","514",NA,NA,NA,NA,NA,NA,NA,NA,NA,NA,NA,"Metallura tyrianthina","heard",NA,NA,NA,NA,NA,NA,NA,NA,NA,NA,"March","2018",NA,-78.589647,-0.116465,"3495.371","2018-03-10T12:54:49Z",2018-03-10 12:54:49
"1521","Yanacocha","10/03/2018","517",NA,NA,NA,NA,NA,NA,NA,NA,NA,NA,NA,"Metallura tyrianthina","heard",NA,NA,NA,NA,NA,NA,NA,NA,NA,NA,"March","2018",NA,-78.589691,-0.116986,"3504.046","2018-03-10T13:00:16Z",2018-03-10 13:00:16
"1522","Yanacocha","10/03/2018","518",NA,NA,NA,NA,NA,NA,NA,NA,NA,NA,NA,"Eriocnemis luciani","perching","20s",NA,NA,NA,NA,NA,NA,NA,NA,NA,"March","2018",NA,-78.589733,-0.117081,"3505.645","2018-03-10T13:01:09Z",2018-03-10 13:01:09
"1523","Yanacocha","10/03/2018","522","Columnea dielsii","Columnea dielsii","4","DC",3,NA,NA,NA,NA,NA,NA,"Coeligena lutetiae","feeding",NA,NA,NA,NA,NA,NA,NA,NA,NA,"Columnea dielsii","March","2018","Columnea dielsii",-78.589937,-0.117457,"3503.777","2018-03-10T13:10:34Z",2018-03-10 13:10:34
"1524","Yanacocha","10/03/2018","522","Axinaea sp. 1","Miconia corymbiformis","7","DC",8,NA,NA,NA,NA,NA,NA,"Eriocnemis luciani","feeding",NA,NA,NA,NA,NA,NA,NA,NA,NA,"Miconia corymbiformis","March","2018","Miconia corymbiformis",-78.589937,-0.117457,"3503.777","2018-03-10T13:10:34Z",2018-03-10 13:10:34
"1525","Yanacocha","10/03/2018","524",NA,NA,NA,NA,NA,NA,NA,NA,NA,NA,NA,"Metallura tyrianthina","heard",NA,NA,NA,NA,NA,NA,NA,NA,NA,NA,"March","2018",NA,-78.590111,-0.117566,"3495.465","2018-03-10T13:16:30Z",2018-03-10 13:16:30
"1526","Yanacocha","10/03/2018","526","Axinaea sp. 1","Miconia corymbiformis","8","DC",31,NA,NA,NA,NA,NA,NA,"Eriocnemis luciani","feeding",NA,NA,NA,NA,NA,NA,NA,NA,NA,"Miconia corymbiformis","March","2018","Miconia corymbiformis",-78.590245,-0.117352,"3489.242","2018-03-10T13:19:12Z",2018-03-10 13:19:12
"1527","Yanacocha","10/03/2018","528","Maclaenia rupestris","Maclaenia rupestris","3","DC",6,NA,NA,NA,NA,NA,NA,"Metallura tyrianthina","heard",NA,NA,NA,NA,NA,NA,NA,NA,NA,"Macleania rupestris","March","2018","Macleania rupestris",-78.590299,-0.117635,"3488.475","2018-03-10T13:25:42Z",2018-03-10 13:25:42
"1528","Yanacocha","10/03/2018","531","Maclaenia rupestris","Maclaenia rupestris","4","DC",11,NA,NA,NA,NA,NA,NA,"Eriocnemis luciani","feeding",NA,NA,NA,NA,NA,NA,NA,NA,NA,"Macleania rupestris","March","2018","Macleania rupestris",-78.59045,-0.118068,"3490.410","2018-03-10T13:31:36Z",2018-03-10 13:31:36
"1529","Yanacocha","10/03/2018","534",NA,NA,NA,NA,NA,NA,NA,NA,NA,NA,NA,"Metallura tyrianthina","heard",NA,NA,NA,NA,NA,NA,NA,NA,NA,NA,"March","2018",NA,-78.590418,-0.118347,"3496.120","2018-03-10T13:39:11Z",2018-03-10 13:39:11
"1530","Yanacocha","10/03/2018","536",NA,NA,NA,NA,NA,NA,NA,NA,NA,NA,NA,"Coeligena lutetiae","heard",NA,NA,NA,NA,NA,NA,NA,NA,NA,NA,"March","2018",NA,-78.590417,-0.118588,"3498.362","2018-03-10T13:43:50Z",2018-03-10 13:43:50
"1531","Yanacocha","10/03/2018","540",NA,NA,NA,NA,NA,NA,NA,NA,NA,NA,NA,"Eriocnemis luciani","perching","20s",NA,NA,NA,NA,NA,NA,NA,NA,NA,"March","2018",NA,-78.590744,-0.118952,"3505.212","2018-03-10T14:00:38Z",2018-03-10 14:00:38
"1532","Yanacocha","10/03/2018","545",NA,NA,NA,NA,NA,NA,NA,NA,NA,NA,NA,"Eriocnemis luciani",NA,NA,NA,NA,NA,NA,NA,NA,NA,NA,NA,"March","2018",NA,-78.590647,-0.119227,"3505.624","2018-03-10T14:07:54Z",2018-03-10 14:07:54
"1533","Yanacocha","10/03/2018","554",NA,NA,NA,NA,NA,NA,NA,NA,NA,NA,NA,"Metallura tyrianthina",NA,NA,NA,NA,NA,NA,NA,NA,NA,NA,NA,"March","2018",NA,-78.590548,-0.119901,"3509.847","2018-03-10T14:20:11Z",2018-03-10 14:20:11
"1534","Yanacocha","10/03/2018","557",NA,NA,NA,NA,NA,NA,NA,NA,NA,NA,NA,"Metallura tyrianthina","heard",NA,NA,NA,NA,NA,NA,NA,NA,NA,NA,"March","2018",NA,-78.590362,-0.119962,"3509.194","2018-03-10T14:24:47Z",2018-03-10 14:24:47
"1535","Yanacocha","10/03/2018","562","Axinaea sp. 1","Miconia corymbiformis","7","DC",4,NA,NA,NA,NA,NA,NA,"Metallura tyrianthina","feeding",NA,NA,NA,NA,NA,NA,NA,NA,NA,"Miconia corymbiformis","March","2018","Miconia corymbiformis",-78.590411,-0.120415,"3514.409","2018-03-10T14:37:12Z",2018-03-10 14:37:12
"1536","Yanacocha","10/03/2018","568",NA,NA,NA,NA,NA,NA,NA,NA,NA,NA,NA,"Eriocnemis mosquera","perching",NA,NA,NA,NA,NA,NA,NA,NA,NA,NA,"March","2018",NA,-78.590513,-0.121082,"3520.091","2018-03-10T14:47:49Z",2018-03-10 14:47:49
"1537","Yanacocha","10/03/2018","568",NA,NA,NA,NA,NA,NA,NA,NA,NA,NA,NA,"Eriocnemis luciani","heard",NA,NA,NA,NA,NA,NA,NA,NA,NA,NA,"March","2018",NA,-78.590513,-0.121082,"3520.091","2018-03-10T14:47:49Z",2018-03-10 14:47:49
"1538","Yanacocha","10/03/2018","582",NA,NA,NA,NA,NA,NA,NA,NA,NA,NA,NA,"Metallura tyrianthina","heard",NA,NA,NA,NA,NA,NA,NA,NA,NA,NA,"March","2018",NA,-78.589873,-0.121995,"3493.687","2018-03-10T15:17:58Z",2018-03-10 15:17:58
"1539","Yanacocha","10/03/2018","587",NA,NA,NA,NA,NA,NA,NA,NA,NA,NA,NA,"Metallura tyrianthina","perching",NA,NA,NA,NA,NA,NA,NA,NA,NA,NA,"March","2018",NA,-78.59003,-0.122326,"3497.730","2018-03-10T15:23:32Z",2018-03-10 15:23:32
"1540","Yanacocha","10/03/2018","591","Axinaea sp. 1","Miconia corymbiformis","11","DC",3,NA,NA,NA,NA,NA,NA,"Eriocnemis luciani","heard",NA,NA,NA,NA,NA,NA,NA,NA,NA,"Miconia corymbiformis","March","2018","Miconia corymbiformis",-78.590167,-0.122417,"3491.943","2018-03-10T15:28:43Z",2018-03-10 15:28:43
"1541","Yanacocha","10/03/2018","595",NA,NA,NA,NA,NA,NA,NA,NA,NA,NA,NA,"Coeligena lutetiae","perching","10s",NA,NA,NA,NA,NA,NA,NA,NA,NA,"March","2018",NA,-78.590352,-0.12226,"3479.895","2018-03-10T15:33:28Z",2018-03-10 15:33:28
"1542","Yanacocha","10/03/2018","597","Columnea dielsii","Columnea dielsii","2","DC",2,NA,NA,NA,NA,NA,NA,"Coeligena lutetiae","feeding",NA,NA,NA,NA,NA,NA,NA,NA,NA,"Columnea dielsii","March","2018","Columnea dielsii",-78.590759,-0.122579,"3469.730","2018-03-10T15:39:37Z",2018-03-10 15:39:37
"1543","Yanacocha","10/03/2018","598","Palicourea fuchsioides","Palicourea fuchsioides","6","DC",11,NA,NA,NA,NA,NA,NA,"Coeligena lutetiae","feeding",NA,NA,NA,NA,NA,NA,NA,NA,NA,"Palicourea fuchsioides","March","2018","Palicourea fuchsioides",-78.590756,-0.122674,"3469.684","2018-03-10T15:40:16Z",2018-03-10 15:40:16
"1544","Yanacocha","10/03/2018","605","Columnea dielsii","Columnea dielsii","3","DC",1,NA,NA,NA,NA,NA,NA,"Coeligena lutetiae","feeding",NA,NA,NA,NA,NA,NA,NA,NA,NA,"Columnea dielsii","March","2018","Columnea dielsii",-78.590621,-0.123401,"3467.853","2018-03-10T15:50:58Z",2018-03-10 15:50:58
"1545","Yanacocha","10/03/2018","608",NA,NA,NA,NA,NA,NA,NA,NA,NA,NA,NA,"Coeligena lutetiae","perching",NA,NA,NA,NA,NA,NA,NA,NA,NA,NA,"March","2018",NA,-78.590696,-0.123659,"3468.008","2018-03-10T15:54:29Z",2018-03-10 15:54:29
"1546","Yanacocha","10/03/2018","619","Tropaeolum sp. 1","Tropaeolum tuberosum","2","DC",6,NA,NA,NA,NA,NA,NA,"Eriocnemis luciani","feeding",NA,NA,NA,NA,NA,NA,NA,NA,NA,"Tropaeolum tuberosum","March","2018","Tropaeolum tuberosum",-78.590932,-0.124994,"3469.599","2018-03-10T16:12:02Z",2018-03-10 16:12:02
"1547","Yanacocha","10/03/2018","629",NA,NA,NA,NA,NA,NA,NA,NA,NA,NA,NA,"Eriocnemis luciani","perching",NA,NA,NA,NA,NA,NA,NA,NA,NA,NA,"March","2018",NA,-78.591219,-0.125823,"3469.712","2018-03-10T16:25:42Z",2018-03-10 16:25:42
"1548","Yanacocha","05/04/2018","767","Tillandsia sp. 1","Tillandsia polyantha","3","DC",2,NA,NA,NA,NA,NA,NA,"Metallura tyrianthina","heard",NA,NA,NA,NA,NA,NA,NA,NA,NA,"Tillandsia polyantha","April","2018","Tillandsia polyantha",-78.590013,-0.117321,"3516.024","2018-04-05T14:17:43Z",2018-04-05 14:17:43
"1549","Yanacocha","05/04/2018","771","Tropaeolum sp. 1","Tropaeolum tuberosum","3","DC",17,NA,NA,NA,NA,NA,NA,"Eriocnemis luciani","feeding",NA,NA,NA,NA,NA,NA,NA,NA,NA,"Tropaeolum tuberosum","April","2018","Tropaeolum tuberosum",-78.590181,-0.117342,"3506.589","2018-04-05T14:25:51Z",2018-04-05 14:25:51
"1550","Yanacocha","05/04/2018","783",NA,NA,NA,NA,NA,NA,NA,NA,NA,NA,NA,"Eriocnemis luciani","heard",NA,NA,NA,NA,NA,NA,NA,NA,NA,NA,"April","2018",NA,-78.590569,-0.118871,"3504.150","2018-04-05T14:55:25Z",2018-04-05 14:55:25
"1551","Yanacocha","05/04/2018","787",NA,NA,NA,NA,NA,NA,NA,NA,NA,NA,NA,"Coeligena lutetiae","heard",NA,NA,NA,NA,NA,NA,NA,NA,NA,NA,"April","2018",NA,-78.590604,-0.119152,"3504.005","2018-04-05T15:04:56Z",2018-04-05 15:04:56
"1552","Yanacocha","05/04/2018","790",NA,NA,NA,NA,NA,NA,NA,NA,NA,NA,NA,"Metallura tyrianthina","heard",NA,NA,NA,NA,NA,NA,NA,NA,NA,NA,"April","2018",NA,-78.59053,-0.119523,"3511.688","2018-04-05T15:17:21Z",2018-04-05 15:17:21
"1553","Yanacocha","05/04/2018","792",NA,NA,NA,NA,NA,NA,NA,NA,NA,NA,NA,"Coeligena lutetiae","heard",NA,NA,NA,NA,NA,NA,NA,NA,NA,NA,"April","2018",NA,-78.590615,-0.119701,"3515.500","2018-04-05T15:21:07Z",2018-04-05 15:21:07
"1554","Yanacocha","05/04/2018","792",NA,NA,NA,NA,NA,NA,NA,NA,NA,NA,NA,"Metallura tyrianthina","heard",NA,NA,NA,NA,NA,NA,NA,NA,NA,NA,"April","2018",NA,-78.590615,-0.119701,"3515.500","2018-04-05T15:21:07Z",2018-04-05 15:21:07
"1555","Yanacocha","05/04/2018","794","Maclaenia rupestris","Maclaenia rupestris","5","DC",14,NA,NA,NA,NA,NA,NA,"Metallura tyrianthina","feeding",NA,NA,NA,NA,NA,NA,NA,NA,NA,"Macleania rupestris","April","2018","Macleania rupestris",-78.590442,-0.119965,"3513.080","2018-04-05T15:26:58Z",2018-04-05 15:26:58
"1556","Yanacocha","05/04/2018","808","Disterigma alaternoides","Disterigma noyesiae","2","DC",12,NA,NA,NA,NA,NA,NA,"Metallura tyrianthina","feeding",NA,NA,NA,NA,NA,NA,NA,NA,NA,"Disterigma noyesiae","April","2018","Disterigma noyesiae",-78.590253,-0.121073,"3520.482","2018-04-05T15:56:03Z",2018-04-05 15:56:03
"1557","Yanacocha","05/04/2018","814",NA,NA,NA,NA,NA,NA,NA,NA,NA,NA,NA,"Metallura tyrianthina","heard",NA,NA,NA,NA,NA,NA,NA,NA,NA,NA,"April","2018",NA,-78.590114,-0.121862,"3514.052","2018-04-05T16:18:03Z",2018-04-05 16:18:03
"1558","Yanacocha","05/04/2018","823",NA,NA,NA,NA,NA,NA,NA,NA,NA,NA,NA,"Eriocnemis luciani","heard",NA,NA,NA,NA,NA,NA,NA,NA,NA,NA,"April","2018",NA,-78.590141,-0.122486,"3514.758","2018-04-05T16:29:08Z",2018-04-05 16:29:08
"1559","Yanacocha","05/04/2018","826",NA,NA,NA,NA,NA,NA,NA,NA,NA,NA,NA,"Coeligena lutetiae","heard",NA,NA,NA,NA,NA,NA,NA,NA,NA,NA,"April","2018",NA,-78.590367,-0.122529,"3504.125","2018-04-05T16:33:35Z",2018-04-05 16:33:35
"1560","Yanacocha","05/04/2018","844","Fuchsia cinerea","Fuchsia ayavacensis","2","DC",1,NA,NA,NA,NA,NA,NA,"Eriocnemis luciani","heard",NA,NA,NA,NA,NA,NA,NA,NA,NA,"Fuchsia ayavacensis","April","2018","Fuchsia ayavacensis",-78.590607,-0.123747,"3480.195","2018-04-05T17:11:23Z",2018-04-05 17:11:23
"1561","Yanacocha","10/05/2018","1",NA,NA,NA,NA,NA,NA,NA,NA,NA,NA,NA,"Lafresnaya lafresnayi",NA,NA,NA,NA,NA,NA,NA,NA,NA,NA,NA,"May","2018",NA,-78.589576,-0.116623,"3497.620","2018-05-10T13:15:36Z",2018-05-10 13:15:36
"1562","Yanacocha","10/05/2018","3",NA,NA,NA,NA,NA,NA,NA,NA,NA,NA,NA,"Metallura tyrianthina","heard",NA,NA,NA,NA,NA,NA,NA,NA,NA,NA,"May","2018",NA,-78.58969,-0.116604,"3499.434","2018-05-10T13:18:46Z",2018-05-10 13:18:46
"1563","Yanacocha","10/05/2018","16",NA,NA,NA,NA,NA,NA,NA,NA,NA,NA,NA,"Metallura tyrianthina","fighting","2ind",NA,NA,NA,NA,NA,NA,NA,NA,NA,"May","2018",NA,-78.59016,-0.117446,"3508.642","2018-05-10T13:44:12Z",2018-05-10 13:44:12
"1564","Yanacocha","10/05/2018","25",NA,NA,NA,NA,NA,NA,NA,NA,NA,NA,NA,"Coeligena lutetiae","heard",NA,NA,NA,NA,NA,NA,NA,NA,NA,NA,"May","2018",NA,-78.590363,-0.118359,"3502.256","2018-05-10T13:57:10Z",2018-05-10 13:57:10
"1565","Yanacocha","10/05/2018","29",NA,NA,NA,NA,NA,NA,NA,NA,NA,NA,NA,"Eriocnemis luciani","heard",NA,NA,NA,NA,NA,NA,NA,NA,NA,NA,"May","2018",NA,-78.590442,-0.11868,"3506.665","2018-05-10T14:02:47Z",2018-05-10 14:02:47
"1566","Yanacocha","10/05/2018","32","Centropogon sp. 1","Siphocampylus rupestris","5","DC",29,NA,NA,NA,NA,NA,NA,"Eriocnemis luciani","feeding",NA,NA,NA,NA,NA,NA,NA,NA,NA,"Siphocampylus rupestris","May","2018","Siphocampylus rupestris",-78.590637,-0.118865,"3506.260","2018-05-10T14:08:47Z",2018-05-10 14:08:47
"1567","Yanacocha","10/05/2018","32",NA,NA,NA,NA,NA,NA,NA,NA,NA,NA,NA,"Metallura tyrianthina","heard",NA,NA,NA,NA,NA,NA,NA,NA,NA,NA,"May","2018",NA,-78.590637,-0.118865,"3506.260","2018-05-10T14:08:47Z",2018-05-10 14:08:47
"1568","Yanacocha","10/05/2018","41","Maclaenia rupestris","Maclaenia rupestris","3","DC",4,NA,NA,NA,NA,NA,NA,"Coeligena lutetiae","feeding",NA,NA,NA,NA,NA,NA,NA,NA,NA,"Macleania rupestris","May","2018","Macleania rupestris",-78.590479,-0.119881,"3510.492","2018-05-10T14:29:55Z",2018-05-10 14:29:55
"1569","Yanacocha","10/05/2018","41","Fuchsia cinerea","Fuchsia ayavacensis","5","DC",11,NA,NA,NA,NA,NA,NA,"Coeligena lutetiae","feeding",NA,NA,NA,NA,NA,NA,NA,NA,NA,"Fuchsia ayavacensis","May","2018","Fuchsia ayavacensis",-78.590479,-0.119881,"3510.492","2018-05-10T14:29:55Z",2018-05-10 14:29:55
"1570","Yanacocha","10/05/2018","41","Rubus roseus","Rubus roseus","3","DC",2,NA,NA,NA,NA,NA,NA,"Coeligena lutetiae","feeding",NA,NA,NA,NA,NA,NA,NA,NA,NA,"Rubus roseus","May","2018","Rubus roseus",-78.590479,-0.119881,"3510.492","2018-05-10T14:29:55Z",2018-05-10 14:29:55
"1571","Yanacocha","10/05/2018","41",NA,NA,NA,NA,NA,NA,NA,NA,NA,NA,NA,"Metallura tyrianthina","heard",NA,NA,NA,NA,NA,NA,NA,NA,NA,NA,"May","2018",NA,-78.590479,-0.119881,"3510.492","2018-05-10T14:29:55Z",2018-05-10 14:29:55
"1572","Yanacocha","10/05/2018","43","Centropogon pichinchensis","Centropogon pichinchensis","3","DC",1,NA,NA,NA,NA,NA,NA,"Eriocnemis luciani","feeding",NA,NA,NA,NA,NA,NA,NA,NA,NA,"Centropogon pichinchensis","May","2018","Centropogon pichinchensis",-78.590323,-0.12018,"3511.310","2018-05-10T14:35:52Z",2018-05-10 14:35:52
"1573","Yanacocha","10/05/2018","44","Centropogon pichinchensis","Centropogon pichinchensis","2","DC",2,NA,NA,NA,NA,NA,NA,"Eriocnemis luciani","feeding",NA,NA,NA,NA,NA,NA,NA,NA,NA,"Centropogon pichinchensis","May","2018","Centropogon pichinchensis",-78.590285,-0.120327,"3511.405","2018-05-10T14:41:27Z",2018-05-10 14:41:27
"1574","Yanacocha","10/05/2018","44","Centropogon sp. 2","Centropogon dissectus","2","DC",1,NA,NA,NA,NA,NA,NA,"Coeligena lutetiae","feeding",NA,NA,NA,NA,NA,NA,NA,NA,NA,"Centropogon dissectus","May","2018","Centropogon dissectus",-78.590285,-0.120327,"3511.405","2018-05-10T14:41:27Z",2018-05-10 14:41:27
"1575","Yanacocha","10/05/2018","57",NA,NA,NA,NA,NA,NA,NA,NA,NA,NA,NA,"Metallura tyrianthina","heard",NA,NA,NA,NA,NA,NA,NA,NA,NA,NA,"May","2018",NA,-78.590122,-0.121629,"3496.999","2018-05-10T15:09:30Z",2018-05-10 15:09:30
"1576","Yanacocha","10/05/2018","57","Axinaea sp. 1","Miconia corymbiformis","7","DC",5,NA,NA,NA,NA,NA,NA,"Metallura tyrianthina","feeding","10:10 llovisna",NA,NA,NA,NA,NA,NA,NA,NA,"Miconia corymbiformis","May","2018","Miconia corymbiformis",-78.590122,-0.121629,"3496.999","2018-05-10T15:09:30Z",2018-05-10 15:09:30
"1577","Yanacocha","10/05/2018","75","Maclaenia rupestris","Maclaenia rupestris","4","DC",10,NA,NA,NA,NA,NA,NA,"Metallura tyrianthina","feeding",NA,NA,NA,NA,NA,NA,NA,NA,NA,"Macleania rupestris","May","2018","Macleania rupestris",-78.590325,-0.122219,"3483.244","2018-05-10T15:36:04Z",2018-05-10 15:36:04
"1578","Yanacocha","10/05/2018","98","Asteraceae",NA,"12","ES",NA,"TRUE",NA,NA,NA,NA,NA,"Ramphomicron microrhynchum","feeding","male",NA,NA,NA,NA,NA,NA,NA,NA,"Asteraceae","May","2018","Asteraceae",-78.590533,-0.123967,"3478.777","2018-05-10T16:08:41Z",2018-05-10 16:08:41
"1579","Yanacocha","10/05/2018","99","Asteraceae",NA,"12","ES",NA,"TRUE",NA,NA,NA,NA,NA,"Ramphomicron microrhynchum","perching",NA,NA,NA,NA,NA,NA,NA,NA,NA,"Asteraceae","May","2018","Asteraceae",-78.590565,-0.124128,"3479.868","2018-05-10T16:11:19Z",2018-05-10 16:11:19
"1580","Yanacocha","10/05/2018","111","Centropogon sp. 1","Siphocampylus rupestris","7","DC",9,NA,NA,NA,NA,NA,NA,"Coeligena lutetiae","feeding",NA,NA,NA,NA,NA,NA,NA,NA,NA,"Siphocampylus rupestris","May","2018","Siphocampylus rupestris",-78.590917,-0.125274,"3481.296","2018-05-10T16:26:44Z",2018-05-10 16:26:44
"1581","Yanacocha","10/05/2018","111","Rubus roseus","Rubus roseus","6","DC",1,NA,NA,NA,NA,NA,NA,"Coeligena lutetiae","feeding",NA,NA,NA,NA,NA,NA,NA,NA,NA,"Rubus roseus","May","2018","Rubus roseus",-78.590917,-0.125274,"3481.296","2018-05-10T16:26:44Z",2018-05-10 16:26:44
"1582","Yanacocha","04/06/2018","621","Centropogon sp. 1","Siphocampylus rupestris","3","DC",23,NA,NA,NA,NA,NA,NA,"Coeligena lutetiae","feeding",NA,NA,NA,NA,NA,NA,NA,NA,NA,"Siphocampylus rupestris","June","2018","Siphocampylus rupestris",-78.589729,-0.116611,"3533.826","2018-06-04T13:46:35Z",2018-06-04 13:46:35
"1583","Yanacocha","04/06/2018","627","Centropogon sp. 1","Siphocampylus rupestris","6","DC",43,NA,NA,NA,NA,NA,NA,"Coeligena lutetiae","feeding",NA,NA,NA,NA,NA,NA,NA,NA,NA,"Siphocampylus rupestris","June","2018","Siphocampylus rupestris",-78.589848,-0.116975,"3535.819","2018-06-04T13:54:36Z",2018-06-04 13:54:36
"1584","Yanacocha","04/06/2018","632",NA,NA,NA,NA,NA,NA,NA,NA,NA,NA,NA,"Ramphomicron microrhynchum","heard",NA,NA,NA,NA,NA,NA,NA,NA,NA,NA,"June","2018",NA,-78.590082,-0.117534,"3529.775","2018-06-04T14:10:10Z",2018-06-04 14:10:10
"1585","Yanacocha","04/06/2018","632",NA,NA,NA,NA,NA,NA,NA,NA,NA,NA,NA,"Coeligena lutetiae","heard",NA,NA,NA,NA,NA,NA,NA,NA,NA,NA,"June","2018",NA,-78.590082,-0.117534,"3529.775","2018-06-04T14:10:10Z",2018-06-04 14:10:10
"1586","Yanacocha","04/06/2018","637",NA,NA,NA,NA,NA,NA,NA,NA,NA,NA,NA,"Metallura tyrianthina","heard",NA,NA,NA,NA,NA,NA,NA,NA,NA,NA,"June","2018",NA,-78.590345,-0.117827,"3509.495","2018-06-04T14:23:58Z",2018-06-04 14:23:58
"1587","Yanacocha","04/06/2018","640",NA,NA,NA,NA,NA,NA,NA,NA,NA,NA,NA,"Coeligena lutetiae","perching",NA,NA,NA,NA,NA,NA,NA,NA,NA,NA,"June","2018",NA,-78.5904,-0.118113,"3507.459","2018-06-04T14:31:38Z",2018-06-04 14:31:38
"1588","Yanacocha","04/06/2018","640",NA,NA,NA,NA,NA,NA,NA,NA,NA,NA,NA,"Metallura tyrianthina","heard",NA,NA,NA,NA,NA,NA,NA,NA,NA,NA,"June","2018",NA,-78.5904,-0.118113,"3507.459","2018-06-04T14:31:38Z",2018-06-04 14:31:38
"1589","Yanacocha","04/06/2018","653",NA,NA,NA,NA,NA,NA,NA,NA,NA,NA,NA,"Eriocnemis luciani","heard",NA,NA,NA,NA,NA,NA,NA,NA,NA,NA,"June","2018",NA,-78.590629,-0.118952,"3513.200","2018-06-04T15:07:20Z",2018-06-04 15:07:20
"1590","Yanacocha","04/06/2018","653",NA,NA,NA,NA,NA,NA,NA,NA,NA,NA,NA,"Coeligena lutetiae","heard",NA,NA,NA,NA,NA,NA,NA,NA,NA,NA,"June","2018",NA,-78.590629,-0.118952,"3513.200","2018-06-04T15:07:20Z",2018-06-04 15:07:20
"1591","Yanacocha","04/06/2018","659",NA,NA,NA,NA,NA,NA,NA,NA,NA,NA,NA,"Metallura tyrianthina","heard",NA,NA,NA,NA,NA,NA,NA,NA,NA,NA,"June","2018",NA,-78.590551,-0.119438,"3514.799","2018-06-04T15:28:53Z",2018-06-04 15:28:53
"1592","Yanacocha","04/06/2018","666","Maclaenia rupestris","Maclaenia rupestris","4","DC",25,NA,NA,NA,NA,NA,NA,"Eriocnemis luciani","perching",NA,NA,NA,NA,NA,NA,NA,NA,NA,"Macleania rupestris","June","2018","Macleania rupestris",-78.5903,-0.120239,"3520.510","2018-06-04T15:56:17Z",2018-06-04 15:56:17
"1593","Yanacocha","04/06/2018","675","Disterigma alaternoides","Disterigma noyesiae","2","DC",18,NA,NA,NA,NA,NA,NA,"Metallura tyrianthina","feeding",NA,NA,NA,NA,NA,NA,NA,NA,NA,"Disterigma noyesiae","June","2018","Disterigma noyesiae",-78.590375,-0.121032,"3517.237","2018-06-04T16:22:02Z",2018-06-04 16:22:02
"1594","Yanacocha","04/06/2018","677","Centropogon sp. 2","Centropogon dissectus","2","DC",10,NA,NA,NA,NA,NA,NA,"Eriocnemis luciani","feeding",NA,NA,NA,NA,NA,NA,NA,NA,NA,"Centropogon dissectus","June","2018","Centropogon dissectus",-78.59018,-0.121265,"3510.645","2018-06-04T16:31:45Z",2018-06-04 16:31:45
"1595","Yanacocha","04/06/2018","683",NA,NA,NA,NA,NA,NA,NA,NA,NA,NA,NA,"Metallura tyrianthina","heard",NA,NA,NA,NA,NA,NA,NA,NA,NA,NA,"June","2018",NA,-78.590019,-0.121823,"3504.487","2018-06-04T16:48:18Z",2018-06-04 16:48:18
"1596","Yanacocha","04/06/2018","685",NA,NA,NA,NA,NA,NA,NA,NA,NA,NA,NA,"Ramphomicron microrhynchum","heard",NA,NA,NA,NA,NA,NA,NA,NA,NA,NA,"June","2018",NA,-78.589927,-0.12196,"3504.416","2018-06-04T16:51:28Z",2018-06-04 16:51:28
"1597","Yanacocha","04/06/2018","692",NA,NA,NA,NA,NA,NA,NA,NA,NA,NA,NA,"Ramphomicron microrhynchum","heard",NA,NA,NA,NA,NA,NA,NA,NA,NA,NA,"June","2018",NA,-78.590136,-0.122462,"3504.979","2018-06-04T17:07:30Z",2018-06-04 17:07:30
"1598","Yanacocha","04/06/2018","708","Fuchsia cinerea","Fuchsia ayavacensis","5","DC",5,NA,NA,NA,NA,NA,NA,"Coeligena lutetiae","feeding",NA,NA,NA,NA,NA,NA,NA,NA,NA,"Fuchsia ayavacensis","June","2018","Fuchsia ayavacensis",-78.590655,-0.122691,"3482.309","2018-06-04T17:34:51Z",2018-06-04 17:34:51
"1599","Yanacocha","04/06/2018","723","Axinaea sp. 1","Miconia corymbiformis","7","DC",4,NA,NA,NA,NA,NA,NA,"Eriocnemis luciani","feeding, perching",NA,NA,NA,NA,NA,NA,NA,NA,NA,"Miconia corymbiformis","June","2018","Miconia corymbiformis",-78.590665,-0.12367,"3484.826","2018-06-04T17:58:38Z",2018-06-04 17:58:38
"1600","Yanacocha","04/06/2018","730",NA,NA,NA,NA,NA,NA,NA,NA,NA,NA,NA,"Coeligena lutetiae","heard",NA,NA,NA,NA,NA,NA,NA,NA,NA,NA,"June","2018",NA,-78.59058,-0.124261,"3484.078","2018-06-04T18:08:41Z",2018-06-04 18:08:41
"1601","Yanacocha","03/07/2018","224",NA,NA,NA,NA,NA,NA,NA,NA,NA,NA,NA,"Metallura tyrianthina","heard",NA,NA,NA,NA,NA,NA,NA,NA,NA,NA,"July","2018",NA,-78.589605,-0.116391,"3498.134","2018-07-03T12:58:31Z",2018-07-03 12:58:31
"1602","Yanacocha","03/07/2018","234",NA,NA,NA,NA,NA,NA,NA,NA,NA,NA,NA,"Coeligena lutetiae","heard",NA,NA,NA,NA,NA,NA,NA,NA,NA,NA,"July","2018",NA,-78.589809,-0.117179,"3511.282","2018-07-03T13:29:32Z",2018-07-03 13:29:32
"1603","Yanacocha","03/07/2018","237",NA,NA,NA,NA,NA,NA,NA,NA,NA,NA,NA,"Eriocnemis luciani","perching",NA,NA,NA,NA,NA,NA,NA,NA,NA,NA,"July","2018",NA,-78.589893,-0.117314,"3511.604","2018-07-03T13:36:49Z",2018-07-03 13:36:49
"1604","Yanacocha","03/07/2018","239",NA,NA,NA,NA,NA,NA,NA,NA,NA,NA,NA,"Metallura tyrianthina","heard",NA,NA,NA,NA,NA,NA,NA,NA,NA,NA,"July","2018",NA,-78.59002,-0.11743,"3512.320","2018-07-03T13:41:48Z",2018-07-03 13:41:48
"1605","Yanacocha","03/07/2018","244",NA,NA,NA,NA,NA,NA,NA,NA,NA,NA,NA,"Metallura tyrianthina","heard",NA,NA,NA,NA,NA,NA,NA,NA,NA,NA,"July","2018",NA,-78.590238,-0.117356,"3502.305","2018-07-03T13:50:38Z",2018-07-03 13:50:38
"1606","Yanacocha","03/07/2018","248",NA,NA,NA,NA,NA,NA,NA,NA,NA,NA,NA,"Eriocnemis luciani","heard",NA,NA,NA,NA,NA,NA,NA,NA,NA,NA,"July","2018",NA,-78.590272,-0.117836,"3495.894","2018-07-03T14:12:04Z",2018-07-03 14:12:04
"1607","Yanacocha","03/07/2018","268",NA,NA,NA,NA,NA,NA,NA,NA,NA,NA,NA,"Coeligena lutetiae","flying",NA,NA,NA,NA,NA,NA,NA,NA,NA,NA,"July","2018",NA,-78.590674,-0.118953,"3501.695","2018-07-03T14:54:01Z",2018-07-03 14:54:01
"1608","Yanacocha","03/07/2018","274",NA,NA,NA,NA,NA,NA,NA,NA,NA,NA,NA,"Coeligena lutetiae","seen",NA,NA,NA,NA,NA,NA,NA,NA,NA,NA,"July","2018",NA,-78.590577,-0.119705,"3507.396","2018-07-03T15:14:43Z",2018-07-03 15:14:43
"1609","Yanacocha","03/07/2018","284",NA,NA,NA,NA,NA,NA,NA,NA,NA,NA,NA,"Metallura tyrianthina","heard",NA,NA,NA,NA,NA,NA,NA,NA,NA,NA,"July","2018",NA,-78.590367,-0.120448,"3511.656","2018-07-03T15:36:29Z",2018-07-03 15:36:29
"1610","Yanacocha","03/07/2018","287",NA,NA,NA,NA,NA,NA,NA,NA,NA,NA,NA,"Eriocnemis luciani","heard",NA,NA,NA,NA,NA,NA,NA,NA,NA,NA,"July","2018",NA,-78.590569,-0.121049,"3516.560","2018-07-03T15:46:12Z",2018-07-03 15:46:12
"1611","Yanacocha","03/07/2018","302",NA,NA,NA,NA,NA,NA,NA,NA,NA,NA,NA,"Coeligena lutetiae","heard",NA,NA,NA,NA,NA,NA,NA,NA,NA,NA,"July","2018",NA,-78.589996,-0.122353,"3514.988","2018-07-03T16:16:14Z",2018-07-03 16:16:14
"1612","Yanacocha","03/07/2018","304",NA,NA,NA,NA,NA,NA,NA,NA,NA,NA,NA,"Lafresnaya lafresnayi","heard",NA,NA,NA,NA,NA,NA,NA,NA,NA,NA,"July","2018",NA,-78.590045,-0.122428,"3514.927","2018-07-03T16:18:34Z",2018-07-03 16:18:34
"1613","Yanacocha","03/07/2018","332",NA,NA,NA,NA,NA,NA,NA,NA,NA,NA,NA,"Metallura tyrianthina","heard",NA,NA,NA,NA,NA,NA,NA,NA,NA,NA,"July","2018",NA,-78.590492,-0.123545,"3476.674","2018-07-03T16:59:32Z",2018-07-03 16:59:32
"1614","Yanacocha","03/07/2018","349","Tropaeolum sp. 1","Tropaeolum tuberosum","4","DC",8,NA,NA,NA,NA,NA,NA,"Metallura tyrianthina","feeding",NA,NA,NA,NA,NA,NA,NA,NA,NA,"Tropaeolum tuberosum","July","2018","Tropaeolum tuberosum",-78.597706,-0.120674,"3374.154","2018-07-09T14:56:54Z",2018-07-09 14:56:54
"1615","Yanacocha","03/07/2018","351",NA,NA,NA,NA,NA,NA,NA,NA,NA,NA,NA,"Lafresnaya lafresnayi","heard",NA,NA,NA,NA,NA,NA,NA,NA,NA,NA,"July","2018",NA,-78.597801,-0.115526,"3417.181","2018-07-09T16:36:49Z",2018-07-09 16:36:49
"1616","Yanacocha","08/08/2018","521","Salvia pichinchensis","Salvia pichinchensis","1","DC",4,NA,NA,NA,NA,NA,NA,"Lafresnaya lafresnayi","feeding","hembra",NA,NA,NA,NA,NA,NA,NA,NA,"Salvia pichinchensis","August","2018","Salvia pichinchensis",-78.590211,-0.122435,"3514.375","2018-08-08T18:23:45Z",2018-08-08 18:23:45
"1617","Yanacocha","06/09/2018","612",NA,NA,NA,NA,NA,NA,NA,NA,NA,NA,NA,"Coeligena lutetiae","heard",NA,NA,NA,NA,NA,NA,NA,NA,NA,NA,"September","2018",NA,-78.589715,-0.11646,"3509.653","2018-09-06T13:04:55Z",2018-09-06 13:04:55
"1618","Yanacocha","06/09/2018","612",NA,NA,NA,NA,NA,NA,NA,NA,NA,NA,NA,"Metallura tyrianthina","seen",NA,NA,NA,NA,NA,NA,NA,NA,NA,NA,"September","2018",NA,-78.589715,-0.11646,"3509.653","2018-09-06T13:04:55Z",2018-09-06 13:04:55
"1619","Yanacocha","06/09/2018","614",NA,NA,NA,NA,NA,NA,NA,NA,NA,NA,NA,"Eriocnemis luciani","heard",NA,NA,NA,NA,NA,NA,NA,NA,NA,NA,"September","2018",NA,-78.589734,-0.11698,"3514.605","2018-09-06T13:15:22Z",2018-09-06 13:15:22
"1620","Yanacocha","06/09/2018","620",NA,NA,NA,NA,NA,NA,NA,NA,NA,NA,NA,"Eriocnemis luciani","perching,feeding insects",NA,NA,NA,NA,NA,NA,NA,NA,NA,NA,"September","2018",NA,-78.589888,-0.117249,"3517.410","2018-09-06T13:29:41Z",2018-09-06 13:29:41
"1621","Yanacocha","06/09/2018","622","Axinaea sp. 1","Miconia corymbiformis","8","DC",6,NA,NA,NA,NA,NA,NA,"Eriocnemis luciani","feeding",NA,NA,NA,NA,NA,NA,NA,NA,NA,"Miconia corymbiformis","September","2018","Miconia corymbiformis",-78.590031,-0.117389,"3515.639","2018-09-06T13:33:07Z",2018-09-06 13:33:07
"1622","Yanacocha","06/09/2018","626",NA,NA,NA,NA,NA,NA,NA,NA,NA,NA,NA,"Metallura tyrianthina","seen",NA,NA,NA,NA,NA,NA,NA,NA,NA,NA,"September","2018",NA,-78.59012,-0.11754,"3510.327","2018-09-06T13:40:10Z",2018-09-06 13:40:10
"1623","Yanacocha","06/09/2018","626",NA,NA,NA,NA,NA,NA,NA,NA,NA,NA,NA,"Coeligena lutetiae","flying",NA,NA,NA,NA,NA,NA,NA,NA,NA,NA,"September","2018",NA,-78.59012,-0.11754,"3510.327","2018-09-06T13:40:10Z",2018-09-06 13:40:10
"1624","Yanacocha","06/09/2018","631",NA,NA,NA,NA,NA,NA,NA,NA,NA,NA,NA,"Metallura tyrianthina","heard",NA,NA,NA,NA,NA,NA,NA,NA,NA,NA,"September","2018",NA,-78.590324,-0.118038,"3497.720","2018-09-06T14:11:08Z",2018-09-06 14:11:08
"1625","Yanacocha","06/09/2018","631",NA,NA,NA,NA,NA,NA,NA,NA,NA,NA,NA,"Eriocnemis luciani","heard",NA,NA,NA,NA,NA,NA,NA,NA,NA,NA,"September","2018",NA,-78.590324,-0.118038,"3497.720","2018-09-06T14:11:08Z",2018-09-06 14:11:08
"1626","Yanacocha","06/09/2018","655",NA,NA,NA,NA,NA,NA,NA,NA,NA,NA,NA,"Eriocnemis luciani","perching",NA,NA,NA,NA,NA,NA,NA,NA,NA,NA,"September","2018",NA,-78.590309,-0.120185,"3523.475","2018-09-06T15:23:15Z",2018-09-06 15:23:15
"1627","Yanacocha","06/09/2018","670",NA,NA,NA,NA,NA,NA,NA,NA,NA,NA,NA,"Metallura tyrianthina","heard",NA,NA,NA,NA,NA,NA,NA,NA,NA,NA,"September","2018",NA,-78.5902,-0.121406,"3515.361","2018-09-06T15:47:34Z",2018-09-06 15:47:34
"1628","Yanacocha","06/09/2018","675",NA,NA,NA,NA,NA,NA,NA,NA,NA,NA,NA,"Metallura tyrianthina","perching","male",NA,NA,NA,NA,NA,NA,NA,NA,NA,"September","2018",NA,-78.589834,-0.122067,"3516.134","2018-09-06T16:00:20Z",2018-09-06 16:00:20
"1629","Yanacocha","06/09/2018","708",NA,NA,NA,NA,NA,NA,NA,NA,NA,NA,NA,"Coeligena lutetiae","heard",NA,NA,NA,NA,NA,NA,NA,NA,NA,NA,"September","2018",NA,-78.590534,-0.124385,"3485.736","2018-09-06T17:05:37Z",2018-09-06 17:05:37
"1630","Yanacocha","06/09/2018","719",NA,NA,NA,NA,NA,NA,NA,NA,NA,NA,NA,"Coeligena lutetiae","heard",NA,NA,NA,NA,NA,NA,NA,NA,NA,NA,"September","2018",NA,-78.591054,-0.125252,"3486.207","2018-09-06T17:18:57Z",2018-09-06 17:18:57
"1631","Yanacocha","06/09/2018","724",NA,NA,NA,NA,NA,NA,NA,NA,NA,NA,NA,"Coeligena lutetiae","heard",NA,NA,NA,NA,NA,NA,NA,NA,NA,NA,"September","2018",NA,-78.591119,-0.125679,"3486.437","2018-09-06T17:35:46Z",2018-09-06 17:35:46
"1632","Yanacocha","06/09/2018","724",NA,NA,NA,NA,NA,NA,NA,NA,NA,NA,NA,"Eriocnemis luciani","heard",NA,NA,NA,NA,NA,NA,NA,NA,NA,NA,"September","2018",NA,-78.591119,-0.125679,"3486.437","2018-09-06T17:35:46Z",2018-09-06 17:35:46
"1633","Yanacocha","06/09/2018","726",NA,NA,NA,NA,NA,NA,NA,NA,NA,NA,NA,"Lafresnaya lafresnayi","heard",NA,NA,NA,NA,NA,NA,NA,NA,NA,NA,"September","2018",NA,-78.591274,-0.126008,"3488.279","2018-09-06T17:40:40Z",2018-09-06 17:40:40
"1634","Yanacocha","05/10/2018","1",NA,NA,NA,NA,NA,NA,NA,NA,NA,NA,NA,"Metallura tyrianthina","perching",NA,NA,NA,NA,NA,NA,NA,NA,NA,NA,"October","2018",NA,-78.589635,-0.116363,"3503.042","2018-10-05T13:34:31Z",2018-10-05 13:34:31
"1635","Yanacocha","05/10/2018","4",NA,NA,NA,NA,NA,NA,NA,NA,NA,NA,NA,"Eriocnemis luciani","heard",NA,NA,NA,NA,NA,NA,NA,NA,NA,NA,"October","2018",NA,-78.589744,-0.116655,"3521.126","2018-10-05T13:42:00Z",2018-10-05 13:42:00
"1636","Yanacocha","05/10/2018","4",NA,NA,NA,NA,NA,NA,NA,NA,NA,NA,NA,"Metallura tyrianthina","perching",NA,NA,NA,NA,NA,NA,NA,NA,NA,NA,"October","2018",NA,-78.589744,-0.116655,"3521.126","2018-10-05T13:42:00Z",2018-10-05 13:42:00
"1637","Yanacocha","05/10/2018","6",NA,NA,NA,NA,NA,NA,NA,NA,NA,NA,NA,"Coeligena lutetiae","heard",NA,NA,NA,NA,NA,NA,NA,NA,NA,NA,"October","2018",NA,-78.589716,-0.116799,"3522.847","2018-10-05T13:45:03Z",2018-10-05 13:45:03
"1638","Yanacocha","05/10/2018","7",NA,NA,NA,NA,NA,NA,NA,NA,NA,NA,NA,"Metallura tyrianthina","seen",NA,NA,NA,NA,NA,NA,NA,NA,NA,NA,"October","2018",NA,-78.589786,-0.116961,"3524.457","2018-10-05T13:46:33Z",2018-10-05 13:46:33
"1639","Yanacocha","05/10/2018","9",NA,NA,NA,NA,NA,NA,NA,NA,NA,NA,NA,"Metallura tyrianthina","heard",NA,NA,NA,NA,NA,NA,NA,NA,NA,NA,"October","2018",NA,-78.589898,-0.117149,"3528.404","2018-10-05T13:51:02Z",2018-10-05 13:51:02
"1640","Yanacocha","05/10/2018","15",NA,NA,NA,NA,NA,NA,NA,NA,NA,NA,NA,"Coeligena lutetiae","heard",NA,NA,NA,NA,NA,NA,NA,NA,NA,NA,"October","2018",NA,-78.590132,-0.117498,"3523.208","2018-10-05T14:01:21Z",2018-10-05 14:01:21
"1641","Yanacocha","05/10/2018","17",NA,NA,NA,NA,NA,NA,NA,NA,NA,NA,NA,"Metallura tyrianthina","perching",NA,NA,NA,NA,NA,NA,NA,NA,NA,NA,"October","2018",NA,-78.590166,-0.117302,"3515.130","2018-10-05T14:27:03Z",2018-10-05 14:27:03
"1642","Yanacocha","05/10/2018","20",NA,NA,NA,NA,NA,NA,NA,NA,NA,NA,NA,"Metallura tyrianthina","heard","3 ind",NA,NA,NA,NA,NA,NA,NA,NA,NA,"October","2018",NA,-78.590317,-0.117915,"3506.433","2018-10-05T14:34:10Z",2018-10-05 14:34:10
"1643","Yanacocha","05/10/2018","22",NA,NA,NA,NA,NA,NA,NA,NA,NA,NA,NA,"Coeligena lutetiae","heard",NA,NA,NA,NA,NA,NA,NA,NA,NA,NA,"October","2018",NA,-78.590313,-0.118072,"3504.656","2018-10-05T14:37:17Z",2018-10-05 14:37:17
"1644","Yanacocha","05/10/2018","23","Heppiella repens","Heppiella repens","4","DC",69,NA,NA,NA,NA,NA,NA,"Eriocnemis luciani","feeding",NA,NA,NA,NA,NA,NA,NA,NA,NA,"Heppiella repens","October","2018","Heppiella repens",-78.590292,-0.118221,"3505.209","2018-10-05T14:41:24Z",2018-10-05 14:41:24
"1645","Yanacocha","05/10/2018","29",NA,NA,NA,NA,NA,NA,NA,NA,NA,NA,NA,"Eriocnemis luciani","seen",NA,NA,NA,NA,NA,NA,NA,NA,NA,NA,"October","2018",NA,-78.590592,-0.118856,"3507.399","2018-10-05T14:58:12Z",2018-10-05 14:58:12
"1646","Yanacocha","05/10/2018",NA,NA,NA,NA,NA,NA,NA,NA,NA,NA,NA,NA,"Coeligena lutetiae","seen",NA,NA,NA,NA,NA,NA,NA,NA,NA,NA,"October","2018",NA,NA,NA,NA,NA,NA
"1647","Yanacocha","05/10/2018","37",NA,NA,NA,NA,NA,NA,NA,NA,NA,NA,NA,"Coeligena lutetiae","perching",NA,NA,NA,NA,NA,NA,NA,NA,NA,NA,"October","2018",NA,-78.590543,-0.119624,"3511.044","2018-10-05T15:47:52Z",2018-10-05 15:47:52
"1648","Yanacocha","05/10/2018","37",NA,NA,NA,NA,NA,NA,NA,NA,NA,NA,NA,"Metallura tyrianthina","heard",NA,NA,NA,NA,NA,NA,NA,NA,NA,NA,"October","2018",NA,-78.590543,-0.119624,"3511.044","2018-10-05T15:47:52Z",2018-10-05 15:47:52
"1649","Yanacocha","05/10/2018","48",NA,NA,NA,NA,NA,NA,NA,NA,NA,NA,NA,"Pterophanes cyanopterus","seen","male",NA,NA,NA,NA,NA,NA,NA,NA,NA,"October","2018",NA,-78.590233,-0.121114,"3516.620","2018-10-05T16:18:44Z",2018-10-05 16:18:44
"1650","Yanacocha","05/10/2018","53",NA,NA,NA,NA,NA,NA,NA,NA,NA,NA,NA,"Metallura tyrianthina","heard",NA,NA,NA,NA,NA,NA,NA,NA,NA,NA,"October","2018",NA,-78.589859,-0.12207,"3513.711","2018-10-05T16:30:26Z",2018-10-05 16:30:26
"1651","Yanacocha","05/10/2018","60",NA,NA,NA,NA,NA,NA,NA,NA,NA,NA,NA,"Metallura tyrianthina","seen",NA,NA,NA,NA,NA,NA,NA,NA,NA,NA,"October","2018",NA,-78.590242,-0.122522,"3505.476","2018-10-05T16:45:45Z",2018-10-05 16:45:45
"1652","Yanacocha","05/10/2018","63",NA,NA,NA,NA,NA,NA,NA,NA,NA,NA,NA,"Metallura tyrianthina","seen","feeing insects and also M.corymbiformis",NA,NA,NA,NA,NA,NA,NA,NA,NA,"October","2018",NA,-78.590399,-0.12241,"3491.843","2018-10-05T16:52:07Z",2018-10-05 16:52:07
"1653","Yanacocha","05/10/2018","74",NA,NA,NA,NA,NA,NA,NA,NA,NA,NA,NA,"Eriocnemis luciani","heard",NA,NA,NA,NA,NA,NA,NA,NA,NA,NA,"October","2018",NA,-78.590602,-0.123364,"3496.311","2018-10-05T17:12:05Z",2018-10-05 17:12:05
"1654","Yanacocha","05/10/2018","79","Axinaea sp. 1","Miconia corymbiformis","9","DC",14,NA,NA,NA,NA,NA,NA,"Metallura tyrianthina","feeding",NA,NA,NA,NA,NA,NA,NA,NA,NA,"Miconia corymbiformis","October","2018","Miconia corymbiformis",-78.590543,-0.123943,"3492.404","2018-10-05T17:20:52Z",2018-10-05 17:20:52
"1655","Yanacocha","8/11/2018","156",NA,NA,NA,NA,NA,NA,NA,NA,NA,NA,NA,"Metallura tyrianthina","heard",NA,NA,NA,NA,NA,NA,NA,NA,NA,NA,"November","2018",NA,-78.589685,-0.116226,"3351.968","2018-11-08T12:43:03Z",2018-11-08 12:43:03
"1656","Yanacocha","8/11/2018","160",NA,NA,NA,NA,NA,NA,NA,NA,NA,NA,NA,"Metallura tyrianthina","perching","1perch+1fliying",NA,NA,NA,NA,NA,NA,NA,NA,NA,"November","2018",NA,-78.589776,-0.116875,"3407.852","2018-11-08T12:52:10Z",2018-11-08 12:52:10
"1657","Yanacocha","8/11/2018","163",NA,NA,NA,NA,NA,NA,NA,NA,NA,NA,NA,"Coeligena lutetiae","heard",NA,NA,NA,NA,NA,NA,NA,NA,NA,NA,"November","2018",NA,-78.590033,-0.117527,"3440.743","2018-11-08T13:01:19Z",2018-11-08 13:01:19
"1658","Yanacocha","8/11/2018","165","Heppiella repens","Heppiella repens","3","DC",136,NA,NA,NA,NA,NA,NA,"Coeligena lutetiae","feeding",NA,NA,NA,NA,NA,NA,NA,NA,NA,"Heppiella repens","November","2018","Heppiella repens",-78.590092,-0.117615,"3444.427","2018-11-08T13:03:16Z",2018-11-08 13:03:16
"1659","Yanacocha","8/11/2018","168",NA,NA,NA,NA,NA,NA,NA,NA,NA,NA,NA,"Coeligena lutetiae","heard",NA,NA,NA,NA,NA,NA,NA,NA,NA,NA,"November","2018",NA,-78.590206,-0.117575,"3451.448","2018-11-08T13:11:48Z",2018-11-08 13:11:48
"1660","Yanacocha","8/11/2018","170",NA,NA,NA,NA,NA,NA,NA,NA,NA,NA,NA,"Eriocnemis luciani","heard",NA,NA,NA,NA,NA,NA,NA,NA,NA,NA,"November","2018",NA,-78.590329,-0.117846,"3454.818","2018-11-08T13:15:11Z",2018-11-08 13:15:11
"1661","Yanacocha","8/11/2018","177",NA,NA,NA,NA,NA,NA,NA,NA,NA,NA,NA,"Metallura tyrianthina","heard",NA,NA,NA,NA,NA,NA,NA,NA,NA,NA,"November","2018",NA,-78.590538,-0.118882,"3483.283","2018-11-08T13:34:33Z",2018-11-08 13:34:33
"1662","Yanacocha","8/11/2018","178","Axinaea sp. 1","Miconia corymbiformis","10","DC",12,NA,NA,NA,NA,NA,NA,"Eriocnemis luciani","feeding",NA,NA,NA,NA,NA,NA,NA,NA,NA,"Miconia corymbiformis","November","2018","Miconia corymbiformis",-78.590585,-0.11888,"3487.524","2018-11-08T13:37:48Z",2018-11-08 13:37:48
"1663","Yanacocha","8/11/2018","186","Maclaenia rupestris","Maclaenia rupestris","5","DC",6,NA,NA,NA,NA,NA,NA,"Coeligena lutetiae","feeding",NA,NA,NA,NA,NA,NA,NA,NA,NA,"Macleania rupestris","November","2018","Macleania rupestris",-78.590542,-0.119646,"3514.666","2018-11-08T14:20:52Z",2018-11-08 14:20:52
"1664","Yanacocha","8/11/2018","187",NA,NA,NA,NA,NA,NA,NA,NA,NA,NA,NA,"Eriocnemis luciani","heard",NA,NA,NA,NA,NA,NA,NA,NA,NA,NA,"November","2018",NA,-78.590515,-0.119849,"3515.575","2018-11-08T14:26:31Z",2018-11-08 14:26:31
"1665","Yanacocha","8/11/2018","193",NA,NA,NA,NA,NA,NA,NA,NA,NA,NA,NA,"Coeligena lutetiae","heard",NA,NA,NA,NA,NA,NA,NA,NA,NA,NA,"November","2018",NA,-78.590379,-0.120521,"3524.105","2018-11-08T14:38:36Z",2018-11-08 14:38:36
"1666","Yanacocha","8/11/2018","193",NA,NA,NA,NA,NA,NA,NA,NA,NA,NA,NA,"Metallura tyrianthina","perching",NA,NA,NA,NA,NA,NA,NA,NA,NA,NA,"November","2018",NA,-78.590379,-0.120521,"3524.105","2018-11-08T14:38:36Z",2018-11-08 14:38:36
"1667","Yanacocha","8/11/2018","198",NA,NA,NA,NA,NA,NA,NA,NA,NA,NA,NA,"Coeligena lutetiae","heard",NA,NA,NA,NA,NA,NA,NA,NA,NA,NA,"November","2018",NA,-78.590684,-0.120872,"3523.881","2018-11-08T14:46:52Z",2018-11-08 14:46:52
"1668","Yanacocha","8/11/2018","204",NA,NA,NA,NA,NA,NA,NA,NA,NA,NA,NA,"Coeligena lutetiae","perching",NA,NA,NA,NA,NA,NA,NA,NA,NA,NA,"November","2018",NA,-78.58984,-0.122164,"3517.969","2018-11-08T15:09:47Z",2018-11-08 15:09:47
"1669","Yanacocha","8/11/2018","206","Maclaenia rupestris","Maclaenia rupestris","5","DC",5,NA,NA,NA,NA,NA,NA,"Eriocnemis luciani","feeding",NA,NA,NA,NA,NA,NA,NA,NA,NA,"Macleania rupestris","November","2018","Macleania rupestris",-78.589975,-0.122345,"3518.964","2018-11-08T15:14:06Z",2018-11-08 15:14:06
"1670","Yanacocha","8/11/2018","228",NA,NA,NA,NA,NA,NA,NA,NA,NA,NA,NA,"Coeligena lutetiae","heard",NA,NA,NA,NA,NA,NA,NA,NA,NA,NA,"November","2018",NA,-78.591172,-0.125799,"3482.523","2018-11-08T16:14:27Z",2018-11-08 16:14:27
"1671","Yanacocha","3/12/2018","271",NA,NA,NA,NA,NA,NA,NA,NA,NA,NA,NA,"Metallura tyrianthina","heard",NA,NA,NA,NA,NA,NA,NA,NA,NA,NA,"December","2018",NA,-78.589564,-0.116341,"3401.961","2018-12-03T12:47:59Z",2018-12-03 12:47:59
"1672","Yanacocha","3/12/2018","272","Axinaea sp. 1","Miconia corymbiformis","8","DC",10,NA,NA,NA,NA,NA,NA,"Coeligena lutetiae","feeding","female",NA,NA,NA,NA,NA,NA,NA,NA,"Miconia corymbiformis","December","2018","Miconia corymbiformis",-78.589669,-0.11652,"3508.182","2018-12-03T12:53:09Z",2018-12-03 12:53:09
"1673","Yanacocha","3/12/2018","274",NA,NA,NA,NA,NA,NA,NA,NA,NA,NA,NA,"Metallura tyrianthina","heard","3 ind",NA,NA,NA,NA,NA,NA,NA,NA,NA,"December","2018",NA,-78.589728,-0.11699,"3516.148","2018-12-03T13:00:39Z",2018-12-03 13:00:39
"1674","Yanacocha","3/12/2018","277","Axinaea sp. 1","Miconia corymbiformis","8","DC",17,NA,NA,NA,NA,NA,NA,"Coeligena lutetiae","feeding",NA,NA,NA,NA,NA,NA,NA,NA,NA,"Miconia corymbiformis","December","2018","Miconia corymbiformis",-78.589893,-0.117275,"3521.807","2018-12-03T13:07:26Z",2018-12-03 13:07:26
"1675","Yanacocha","3/12/2018","283",NA,NA,NA,NA,NA,NA,NA,NA,NA,NA,NA,"Coeligena lutetiae","flying",NA,NA,NA,NA,NA,NA,NA,NA,NA,NA,"December","2018",NA,-78.590109,-0.117498,"3515.586","2018-12-03T13:18:12Z",2018-12-03 13:18:12
"1676","Yanacocha","3/12/2018","285",NA,NA,NA,NA,NA,NA,NA,NA,NA,NA,NA,"Coeligena lutetiae","perching",NA,NA,NA,NA,NA,NA,NA,NA,NA,NA,"December","2018",NA,-78.590277,-0.11765,"3506.146","2018-12-03T13:24:29Z",2018-12-03 13:24:29
"1677","Yanacocha","3/12/2018","286",NA,NA,NA,NA,NA,NA,NA,NA,NA,NA,NA,"Metallura tyrianthina","heard",NA,NA,NA,NA,NA,NA,NA,NA,NA,NA,"December","2018",NA,-78.590314,-0.117953,"3503.641","2018-12-03T13:28:23Z",2018-12-03 13:28:23
"1678","Yanacocha","3/12/2018","290",NA,NA,NA,NA,NA,NA,NA,NA,NA,NA,NA,"Coeligena lutetiae","fluing","2 ind",NA,NA,NA,NA,NA,NA,NA,NA,NA,"December","2018",NA,-78.590375,-0.118623,"3507.787","2018-12-03T13:42:03Z",2018-12-03 13:42:03
"1679","Yanacocha","3/12/2018","295",NA,NA,NA,NA,NA,NA,NA,NA,NA,NA,NA,"Metallura tyrianthina","heard","3 ind",NA,NA,NA,NA,NA,NA,NA,NA,NA,"December","2018",NA,-78.590657,-0.118931,"3508.932","2018-12-03T13:55:17Z",2018-12-03 13:55:17
"1680","Yanacocha","3/12/2018","301","Columnea dielsii","Columnea dielsii","4","DC",3,NA,NA,NA,NA,NA,NA,"Coeligena lutetiae","feeding",NA,NA,NA,NA,NA,NA,NA,NA,NA,"Columnea dielsii","December","2018","Columnea dielsii",-78.590433,-0.119329,"3507.968","2018-12-03T14:07:33Z",2018-12-03 14:07:33
"1681","Yanacocha","3/12/2018","304",NA,NA,NA,NA,NA,NA,NA,NA,NA,NA,NA,"Coeligena lutetiae","perching",NA,NA,NA,NA,NA,NA,NA,NA,NA,NA,"December","2018",NA,-78.590544,-0.119714,"3511.671","2018-12-03T14:14:49Z",2018-12-03 14:14:49
"1682","Yanacocha","3/12/2018","306",NA,NA,NA,NA,NA,NA,NA,NA,NA,NA,NA,"Coeligena lutetiae","heard",NA,NA,NA,NA,NA,NA,NA,NA,NA,NA,"December","2018",NA,-78.590403,-0.119962,"3509.302","2018-12-03T14:18:29Z",2018-12-03 14:18:29
"1683","Yanacocha","3/12/2018","311",NA,NA,NA,NA,NA,NA,NA,NA,NA,NA,NA,"Metallura tyrianthina","perching",NA,NA,NA,NA,NA,NA,NA,NA,NA,NA,"December","2018",NA,-78.590487,-0.1205,"3518.114","2018-12-03T14:27:23Z",2018-12-03 14:27:23
"1684","Yanacocha","3/12/2018","312","Columnea dielsii","Columnea dielsii","3","DC",2,NA,NA,NA,NA,NA,NA,"Coeligena lutetiae","feeding","female",NA,NA,NA,NA,NA,NA,NA,NA,"Columnea dielsii","December","2018","Columnea dielsii",-78.590517,-0.120543,"3519.711","2018-12-03T14:28:53Z",2018-12-03 14:28:53
"1685","Yanacocha","3/12/2018","328","Axinaea sp. 1","Miconia corymbiformis","11","DC",7,NA,NA,NA,NA,NA,NA,"Coeligena lutetiae","feeding",NA,NA,NA,NA,NA,NA,NA,NA,NA,"Miconia corymbiformis","December","2018","Miconia corymbiformis",-78.59014,-0.1224,"3507.178","2018-12-03T15:05:10Z",2018-12-03 15:05:10
"1686","Yanacocha","3/12/2018","331",NA,NA,NA,NA,NA,NA,NA,NA,NA,NA,NA,"Metallura tyrianthina","heard",NA,NA,NA,NA,NA,NA,NA,NA,NA,NA,"December","2018",NA,-78.590622,-0.122515,"3484.133","2018-12-03T15:13:32Z",2018-12-03 15:13:32
"1687","Yanacocha","3/12/2018","334","Heppiella repens","Heppiella repens","6","DC",35,NA,NA,NA,NA,NA,NA,"Metallura tyrianthina","feeding","perching",NA,NA,NA,NA,NA,NA,NA,NA,"Heppiella repens","December","2018","Heppiella repens",-78.590655,-0.122915,"3482.895","2018-12-03T15:20:27Z",2018-12-03 15:20:27
"1688","Yanacocha","3/12/2018","338",NA,NA,NA,NA,NA,NA,NA,NA,NA,NA,NA,"Coeligena lutetiae","flying",NA,NA,NA,NA,NA,NA,NA,NA,NA,NA,"December","2018",NA,-78.590576,-0.124255,"3485.043","2018-12-03T15:37:07Z",2018-12-03 15:37:07
"1689","Yanacocha","3/12/2018","345",NA,NA,NA,NA,NA,NA,NA,NA,NA,NA,NA,"Coeligena lutetiae","perching",NA,NA,NA,NA,NA,NA,NA,NA,NA,NA,"December","2018",NA,-78.591119,-0.125463,"3486.566","2018-12-03T15:51:52Z",2018-12-03 15:51:52
"1690","Yanacocha","3/01/2019","453",NA,NA,NA,NA,NA,NA,NA,NA,NA,NA,NA,"Metallura tyrianthina","heard",NA,NA,NA,NA,NA,NA,NA,NA,NA,NA,"January","2019",NA,-78.589806,-0.116018,"3350.850","2019-01-03T13:02:33Z",2019-01-03 13:02:33
"1691","Yanacocha","3/01/2019","456","Axinaea sp. 1","Miconia corymbiformis","7","DC",10,NA,NA,NA,NA,NA,NA,"Metallura tyrianthina","feeding",NA,NA,NA,NA,NA,NA,NA,NA,NA,"Miconia corymbiformis","January","2019","Miconia corymbiformis",-78.58973,-0.116484,"3503.477","2019-01-03T13:07:05Z",2019-01-03 13:07:05
"1692","Yanacocha","3/01/2019","458",NA,NA,NA,NA,NA,NA,NA,NA,NA,NA,NA,"Metallura tyrianthina","fighting","2 ind",NA,NA,NA,NA,NA,NA,NA,NA,NA,"January","2019",NA,-78.589756,-0.116997,"3513.515","2019-01-03T13:14:25Z",2019-01-03 13:14:25
"1693","Yanacocha","3/01/2019","467",NA,NA,NA,NA,NA,NA,NA,NA,NA,NA,NA,"Coeligena lutetiae","perching",NA,NA,NA,NA,NA,NA,NA,NA,NA,NA,"January","2019",NA,-78.590293,-0.117568,"3503.843","2019-01-03T13:34:38Z",2019-01-03 13:34:38
"1694","Yanacocha","3/01/2019","471",NA,NA,NA,NA,NA,NA,NA,NA,NA,NA,NA,"Metallura tyrianthina","heard","2 ind",NA,NA,NA,NA,NA,NA,NA,NA,NA,"January","2019",NA,-78.590313,-0.117909,"3504.279","2019-01-03T13:42:19Z",2019-01-03 13:42:19
"1695","Yanacocha","3/01/2019","477",NA,NA,NA,NA,NA,NA,NA,NA,NA,NA,NA,"Coeligena lutetiae","flying",NA,NA,NA,NA,NA,NA,NA,NA,NA,NA,"January","2019",NA,-78.590489,-0.118784,"3510.191","2019-01-03T14:01:51Z",2019-01-03 14:01:51
"1696","Yanacocha","3/01/2019","493",NA,NA,NA,NA,NA,NA,NA,NA,NA,NA,NA,"Metallura tyrianthina","heard",NA,NA,NA,NA,NA,NA,NA,NA,NA,NA,"January","2019",NA,-78.590397,-0.12037,"3521.515","2019-01-03T14:44:40Z",2019-01-03 14:44:40
"1697","Yanacocha","3/01/2019","502",NA,NA,NA,NA,NA,NA,NA,NA,NA,NA,NA,"Metallura tyrianthina","heard",NA,NA,NA,NA,NA,NA,NA,NA,NA,NA,"January","2019",NA,-78.5902,-0.12155,"3509.743","2019-01-03T15:10:37Z",2019-01-03 15:10:37
"1698","Yanacocha","3/01/2019","506",NA,NA,NA,NA,NA,NA,NA,NA,NA,NA,NA,"Metallura tyrianthina","heard","2 ind",NA,NA,NA,NA,NA,NA,NA,NA,NA,"January","2019",NA,-78.589887,-0.122056,"3517.214","2019-01-03T15:23:47Z",2019-01-03 15:23:47
"1699","Yanacocha","3/01/2019","509",NA,NA,NA,NA,NA,NA,NA,NA,NA,NA,NA,"Coeligena lutetiae","perching","male",NA,NA,NA,NA,NA,NA,NA,NA,NA,"January","2019",NA,-78.590034,-0.122301,"3521.240","2019-01-03T15:27:53Z",2019-01-03 15:27:53
"1700","Yanacocha","3/01/2019","512","Axinaea sp. 1","Miconia corymbiformis","11","DC",4,NA,NA,NA,NA,NA,NA,"Metallura tyrianthina","feeding","also a fight between 2 ind",NA,NA,NA,NA,NA,NA,NA,NA,"Miconia corymbiformis","January","2019","Miconia corymbiformis",-78.590208,-0.122419,"3511.511","2019-01-03T15:35:11Z",2019-01-03 15:35:11
"1701","Yanacocha","3/01/2019","512",NA,NA,NA,NA,NA,NA,NA,NA,NA,NA,NA,"Metallura tyrianthina","heard",NA,NA,NA,NA,NA,NA,NA,NA,NA,NA,"January","2019",NA,-78.590208,-0.122419,"3511.511","2019-01-03T15:35:11Z",2019-01-03 15:35:11
"1702","Yanacocha","3/01/2019","513","Axinaea sp. 1","Miconia corymbiformis","9","DC",4,NA,NA,NA,NA,NA,NA,"Eriocnemis luciani","feeding",NA,NA,NA,NA,NA,NA,NA,NA,NA,"Miconia corymbiformis","January","2019","Miconia corymbiformis",-78.590274,-0.122416,"3501.646","2019-01-03T15:42:25Z",2019-01-03 15:42:25
"1703","Yanacocha","3/01/2019","513","Axinaea sp. 1","Miconia corymbiformis",NA,NA,NA,NA,NA,NA,NA,NA,NA,"Metallura tyrianthina","feeding","same tree as before",NA,NA,NA,NA,NA,NA,NA,NA,"Miconia corymbiformis","January","2019","Miconia corymbiformis",-78.590274,-0.122416,"3501.646","2019-01-03T15:42:25Z",2019-01-03 15:42:25
"1704","Yanacocha","3/01/2019","513",NA,NA,NA,NA,NA,NA,NA,NA,NA,NA,NA,"Lesbia nuna","fighting","with M. tyrianthina, 2 ind heard. 6 Racimos",NA,NA,NA,NA,NA,NA,NA,NA,NA,"January","2019",NA,-78.590274,-0.122416,"3501.646","2019-01-03T15:42:25Z",2019-01-03 15:42:25
"1705","Yanacocha","3/01/2019","522",NA,NA,NA,NA,NA,NA,NA,NA,NA,NA,NA,"Coeligena lutetiae","perching","also feeding",NA,NA,NA,NA,NA,NA,NA,NA,NA,"January","2019",NA,-78.590574,-0.122952,"3488.152","2019-01-03T16:05:10Z",2019-01-03 16:05:10
"1706","Yanacocha","3/01/2019","524",NA,NA,NA,NA,NA,NA,NA,NA,NA,NA,NA,"Coeligena lutetiae","perching","male",NA,NA,NA,NA,NA,NA,NA,NA,NA,"January","2019",NA,-78.590636,-0.123388,"3485.937","2019-01-03T16:13:23Z",2019-01-03 16:13:23
"1707","Yanacocha","3/01/2019","529",NA,NA,NA,NA,NA,NA,NA,NA,NA,NA,NA,"Coeligena lutetiae","perching",NA,NA,NA,NA,NA,NA,NA,NA,NA,NA,"January","2019",NA,-78.590549,-0.124302,"3482.777","2019-01-03T16:24:41Z",2019-01-03 16:24:41
"1708","Yanacocha","3/01/2019","534",NA,NA,NA,NA,NA,NA,NA,NA,NA,NA,NA,"Coeligena lutetiae","flying",NA,NA,NA,NA,NA,NA,NA,NA,NA,NA,"January","2019",NA,-78.590902,-0.125042,"3480.961","2019-01-03T16:36:25Z",2019-01-03 16:36:25
"1709","Yanacocha","3/01/2019","542","Axinaea sp. 1","Miconia corymbiformis","7","DC",6,NA,NA,NA,NA,NA,NA,"Metallura tyrianthina","feeding",NA,NA,NA,NA,NA,NA,NA,NA,NA,"Miconia corymbiformis","January","2019","Miconia corymbiformis",-78.591146,-0.125717,"3479.770","2019-01-03T16:51:28Z",2019-01-03 16:51:28
"1710","Yanacocha","7/02/2019","110",NA,NA,NA,NA,NA,NA,NA,NA,NA,NA,NA,"Coeligena lutetiae","flying",NA,NA,NA,NA,NA,NA,NA,NA,NA,NA,"February","2019",NA,-78.589626,-0.116433,"3509.683","2019-02-07T13:47:46Z",2019-02-07 13:47:46
"1711","Yanacocha","7/02/2019","117",NA,NA,NA,NA,NA,NA,NA,NA,NA,NA,NA,"Metallura tyrianthina","heard",NA,NA,NA,NA,NA,NA,NA,NA,NA,NA,"February","2019",NA,-78.590033,-0.117501,"3520.009","2019-02-07T14:06:21Z",2019-02-07 14:06:21
"1712","Yanacocha","7/02/2019","122",NA,NA,NA,NA,NA,NA,NA,NA,NA,NA,NA,"Coeligena lutetiae","perching","2 ind heard",NA,NA,NA,NA,NA,NA,NA,NA,NA,"February","2019",NA,-78.590318,-0.117605,"3506.799","2019-02-07T14:16:36Z",2019-02-07 14:16:36
"1713","Yanacocha","7/02/2019","126",NA,NA,NA,NA,NA,NA,NA,NA,NA,NA,NA,"Coeligena lutetiae","heard",NA,NA,NA,NA,NA,NA,NA,NA,NA,NA,"February","2019",NA,-78.590367,-0.118244,"3510.846","2019-02-07T14:28:48Z",2019-02-07 14:28:48
"1714","Yanacocha","7/02/2019","144",NA,NA,NA,NA,NA,NA,NA,NA,NA,NA,NA,"Coeligena lutetiae","heard",NA,NA,NA,NA,NA,NA,NA,NA,NA,NA,"February","2019",NA,-78.590621,-0.119676,"3519.804","2019-02-07T15:17:04Z",2019-02-07 15:17:04
"1715","Yanacocha","7/02/2019","152",NA,NA,NA,NA,NA,NA,NA,NA,NA,NA,NA,"Coeligena lutetiae","heard",NA,NA,NA,NA,NA,NA,NA,NA,NA,NA,"February","2019",NA,-78.590345,-0.120042,"3516.145","2019-02-07T15:29:12Z",2019-02-07 15:29:12
"1716","Yanacocha","7/02/2019","160",NA,NA,NA,NA,NA,NA,NA,NA,NA,NA,NA,"Eriocnemis mosquera","perching",NA,NA,NA,NA,NA,NA,NA,NA,NA,NA,"February","2019",NA,-78.590481,-0.121072,"3523.147","2019-02-07T15:52:38Z",2019-02-07 15:52:38
"1717","Yanacocha","7/02/2019","178","Maclaenia rupestris","Maclaenia rupestris","7","DC",13,NA,NA,NA,NA,NA,NA,"Coeligena lutetiae","feeding","same ind",NA,NA,NA,NA,NA,NA,NA,NA,"Macleania rupestris","February","2019","Macleania rupestris",-78.59015,-0.122367,"3504.298","2019-02-07T16:23:17Z",2019-02-07 16:23:17
"1718","Yanacocha","7/02/2019","178","Columnea dielsii","Columnea dielsii","7","DC",5,NA,NA,NA,NA,NA,NA,"Coeligena lutetiae","feeding",NA,NA,NA,NA,NA,NA,NA,NA,NA,"Columnea dielsii","February","2019","Columnea dielsii",-78.59015,-0.122367,"3504.298","2019-02-07T16:23:17Z",2019-02-07 16:23:17
"1719","Yanacocha","7/02/2019","191",NA,NA,NA,NA,NA,NA,NA,NA,NA,NA,NA,"Coeligena lutetiae","heard",NA,NA,NA,NA,NA,NA,NA,NA,NA,NA,"February","2019",NA,-78.590661,-0.123169,"3480.475","2019-02-07T16:43:41Z",2019-02-07 16:43:41
"1720","Yanacocha","7/02/2019","213",NA,NA,NA,NA,NA,NA,NA,NA,NA,NA,NA,"Coeligena lutetiae","seen",NA,NA,NA,NA,NA,NA,NA,NA,NA,NA,"February","2019",NA,-78.591107,-0.125559,"3470.971","2019-02-07T17:20:48Z",2019-02-07 17:20:48
"1721","Yanacocha","7/03/2019","1",NA,NA,NA,NA,NA,NA,NA,NA,NA,NA,NA,"Metallura tyrianthina","heard","2 ind",NA,NA,NA,NA,NA,NA,NA,NA,NA,"March","2019",NA,-78.589636,-0.116392,"3509.275","2019-03-07T13:00:09Z",2019-03-07 13:00:09
"1722","Yanacocha","7/03/2019",NA,NA,NA,NA,NA,NA,NA,NA,NA,NA,NA,NA,"Coeligena lutetiae","flying",NA,NA,NA,NA,NA,NA,NA,NA,NA,NA,"March","2019",NA,NA,NA,NA,NA,NA
"1723","Yanacocha","7/03/2019","6",NA,NA,NA,NA,NA,NA,NA,NA,NA,NA,NA,"Eriocnemis luciani","perching",NA,NA,NA,NA,NA,NA,NA,NA,NA,NA,"March","2019",NA,-78.589786,-0.116862,"3517.764","2019-03-07T13:10:49Z",2019-03-07 13:10:49
"1724","Yanacocha","7/03/2019","9",NA,NA,NA,NA,NA,NA,NA,NA,NA,NA,NA,"Metallura tyrianthina","heard",NA,NA,NA,NA,NA,NA,NA,NA,NA,NA,"March","2019",NA,-78.590009,-0.117316,"3523.112","2019-03-07T13:18:29Z",2019-03-07 13:18:29
"1725","Yanacocha","7/03/2019","14",NA,NA,NA,NA,NA,NA,NA,NA,NA,NA,NA,"Metallura tyrianthina","heard",NA,NA,NA,NA,NA,NA,NA,NA,NA,NA,"March","2019",NA,-78.590304,-0.11748,"3506.364","2019-03-07T13:28:34Z",2019-03-07 13:28:34
"1726","Yanacocha","7/03/2019","15",NA,NA,NA,NA,NA,NA,NA,NA,NA,NA,NA,"Coeligena lutetiae","heard",NA,NA,NA,NA,NA,NA,NA,NA,NA,NA,"March","2019",NA,-78.590272,-0.117584,"3505.847","2019-03-07T13:30:42Z",2019-03-07 13:30:42
"1727","Yanacocha","7/03/2019","20","Axinaea sp. 1","Miconia corymbiformis","10","DC",4,NA,NA,NA,NA,NA,NA,"Metallura tyrianthina","feeding",NA,NA,NA,NA,NA,NA,NA,NA,NA,"Miconia corymbiformis","March","2019","Miconia corymbiformis",-78.590401,-0.118127,"3504.047","2019-03-07T13:41:59Z",2019-03-07 13:41:59
"1728","Yanacocha","7/03/2019","23",NA,NA,NA,NA,NA,NA,NA,NA,NA,NA,NA,"Metallura tyrianthina","perching","female",NA,NA,NA,NA,NA,NA,NA,NA,NA,"March","2019",NA,-78.590429,-0.118371,"3504.414","2019-03-07T14:01:21Z",2019-03-07 14:01:21
"1729","Yanacocha","7/03/2019","24",NA,NA,NA,NA,NA,NA,NA,NA,NA,NA,NA,"Eriocnemis luciani","heard",NA,NA,NA,NA,NA,NA,NA,NA,NA,NA,"March","2019",NA,-78.590415,-0.118418,"3505.827","2019-03-07T14:03:18Z",2019-03-07 14:03:18
"1730","Yanacocha","7/03/2019","25","Maclaenia rupestris","Maclaenia rupestris","8","DC",8,NA,NA,NA,NA,NA,NA,"Metallura tyrianthina","feeding","female",NA,NA,NA,NA,NA,NA,NA,NA,"Macleania rupestris","March","2019","Macleania rupestris",-78.590376,-0.118555,"3505.186","2019-03-07T14:06:43Z",2019-03-07 14:06:43
"1731","Yanacocha","7/03/2019","26","Columnea dielsii","Columnea dielsii","5","DC",10,NA,NA,NA,NA,NA,NA,"Coeligena lutetiae","feeding","Grallaria squamigera juvenil",NA,NA,NA,NA,NA,NA,NA,NA,"Columnea dielsii","March","2019","Columnea dielsii",-78.590474,-0.118597,"3507.489","2019-03-07T14:09:19Z",2019-03-07 14:09:19
"1732","Yanacocha","7/03/2019","35",NA,NA,NA,NA,NA,NA,NA,NA,NA,NA,NA,"Metallura tyrianthina","heard",NA,NA,NA,NA,NA,NA,NA,NA,NA,NA,"March","2019",NA,-78.590567,-0.11914,"3505.184","2019-03-07T14:28:01Z",2019-03-07 14:28:01
"1733","Yanacocha","7/03/2019","38",NA,NA,NA,NA,NA,NA,NA,NA,NA,NA,NA,"Metallura tyrianthina","heard",NA,NA,NA,NA,NA,NA,NA,NA,NA,NA,"March","2019",NA,-78.590524,-0.119438,"3504.115","2019-03-07T14:36:33Z",2019-03-07 14:36:33
"1734","Yanacocha","7/03/2019","42","Maclaenia rupestris","Maclaenia rupestris","6","DC",14,NA,NA,NA,NA,NA,NA,"Metallura tyrianthina","feeding","female",NA,NA,NA,NA,NA,NA,NA,NA,"Macleania rupestris","March","2019","Macleania rupestris",-78.590615,-0.11962,"3507.037","2019-03-07T14:43:10Z",2019-03-07 14:43:10
"1735","Yanacocha","7/03/2019","43","Maclaenia rupestris","Maclaenia rupestris","6","DC",17,NA,NA,NA,NA,NA,NA,"Coeligena lutetiae","feeding",NA,NA,NA,NA,NA,NA,NA,NA,NA,"Macleania rupestris","March","2019","Macleania rupestris",-78.590576,-0.11972,"3507.829","2019-03-07T14:46:05Z",2019-03-07 14:46:05
"1736","Yanacocha","7/03/2019","43","Maclaenia rupestris","Maclaenia rupestris",NA,NA,NA,NA,NA,NA,NA,NA,NA,"Metallura tyrianthina","feeding","same macleania as C.lutetiae",NA,NA,NA,NA,NA,NA,NA,NA,"Macleania rupestris","March","2019","Macleania rupestris",-78.590576,-0.11972,"3507.829","2019-03-07T14:46:05Z",2019-03-07 14:46:05
"1737","Yanacocha","7/03/2019","43",NA,NA,NA,NA,NA,NA,NA,NA,NA,NA,NA,"Coeligena lutetiae","perching","female",NA,NA,NA,NA,NA,NA,NA,NA,NA,"March","2019",NA,-78.590576,-0.11972,"3507.829","2019-03-07T14:46:05Z",2019-03-07 14:46:05
"1738","Yanacocha","7/03/2019","53",NA,NA,NA,NA,NA,NA,NA,NA,NA,NA,NA,"Metallura tyrianthina","heard",NA,NA,NA,NA,NA,NA,NA,NA,NA,NA,"March","2019",NA,-78.590393,-0.120396,"3507.845","2019-03-07T15:04:09Z",2019-03-07 15:04:09
"1739","Yanacocha","7/03/2019","55",NA,NA,NA,NA,NA,NA,NA,NA,NA,NA,NA,"Coeligena lutetiae","heard",NA,NA,NA,NA,NA,NA,NA,NA,NA,NA,"March","2019",NA,-78.590521,-0.12056,"3512.368","2019-03-07T15:09:58Z",2019-03-07 15:09:58
"1740","Yanacocha","7/03/2019","58",NA,NA,NA,NA,NA,NA,NA,NA,NA,NA,NA,"Metallura tyrianthina","fighting","3 ind",NA,NA,NA,NA,NA,NA,NA,NA,NA,"March","2019",NA,-78.590755,-0.120751,"3514.770","2019-03-07T15:14:43Z",2019-03-07 15:14:43
"1741","Yanacocha","7/03/2019","72",NA,NA,NA,NA,NA,NA,NA,NA,NA,NA,NA,"Metallura tyrianthina","fighting",NA,NA,NA,NA,NA,NA,NA,NA,NA,NA,"March","2019",NA,-78.590148,-0.121716,"3501.256","2019-03-07T15:33:04Z",2019-03-07 15:33:04
"1742","Yanacocha","7/03/2019","84",NA,NA,NA,NA,NA,NA,NA,NA,NA,NA,NA,"Coeligena lutetiae","seen","it get close to a blackberry flower",NA,NA,NA,NA,NA,NA,NA,NA,NA,"March","2019",NA,-78.590142,-0.122411,"3504.685","2019-03-07T15:49:43Z",2019-03-07 15:49:43
"1743","Yanacocha","7/03/2019","88",NA,NA,NA,NA,NA,NA,NA,NA,NA,NA,NA,"Coeligena lutetiae","heard",NA,NA,NA,NA,NA,NA,NA,NA,NA,NA,"March","2019",NA,-78.590276,-0.122537,"3497.481","2019-03-07T15:54:53Z",2019-03-07 15:54:53
"1744","Yanacocha","7/03/2019","92","Maclaenia rupestris","Maclaenia rupestris","11","DC",36,NA,NA,NA,NA,NA,NA,"Eriocnemis luciani","feeding",NA,NA,NA,NA,NA,NA,NA,NA,NA,"Macleania rupestris","March","2019","Macleania rupestris",-78.590327,-0.122292,"3488.749","2019-03-07T16:01:07Z",2019-03-07 16:01:07
"1745","Yanacocha","7/03/2019","94",NA,NA,NA,NA,NA,NA,NA,NA,NA,NA,NA,"Coeligena lutetiae","heard",NA,NA,NA,NA,NA,NA,NA,NA,NA,NA,"March","2019",NA,-78.590404,-0.122406,"3484.937","2019-03-07T16:04:06Z",2019-03-07 16:04:06
"1746","Yanacocha","7/03/2019","121",NA,NA,NA,NA,NA,NA,NA,NA,NA,NA,NA,"Metallura tyrianthina","heard",NA,NA,NA,NA,NA,NA,NA,NA,NA,NA,"March","2019",NA,-78.591126,-0.125403,"3483.972","2019-03-07T16:57:28Z",2019-03-07 16:57:28
"1747","Yanacocha","7/03/2019","123",NA,NA,NA,NA,NA,NA,NA,NA,NA,NA,NA,"Coeligena lutetiae","perching","male",NA,NA,NA,NA,NA,NA,NA,NA,NA,"March","2019",NA,-78.591183,-0.125586,"3484.350","2019-03-07T17:01:14Z",2019-03-07 17:01:14
"1748","Yanacocha","7/03/2019","127",NA,NA,NA,NA,NA,NA,NA,NA,NA,NA,NA,"Lafresnaya lafresnayi","heard",NA,NA,NA,NA,NA,NA,NA,NA,NA,NA,"March","2019",NA,-78.591291,-0.125986,"3485.727","2019-03-07T17:08:20Z",2019-03-07 17:08:20
